id,name,one_line_profile,detailed_description,domains,subtask_category,application_level,primary_language,repo_url,help_website,license,tags
626,ProLIF,Interaction Fingerprints generator for protein-ligand complexes and MD trajectories,"A library designed to generate interaction fingerprints for protein-ligand complexes, capable of analyzing molecular dynamics trajectories to capture dynamic interaction profiles.",M2;M2-04,trajectory_analysis;interaction_fingerprinting,library,Python,https://github.com/chemosim-lab/ProLIF,https://prolif.readthedocs.io/,Apache-2.0,molecular-dynamics;protein-ligand;fingerprints
627,moldr,Manifold optimization for linear dimensionality reduction of MD trajectories,A tool for performing linear dimensionality reduction on molecular dynamics trajectories using manifold optimization techniques to extract essential dynamics.,M2;M2-04,dimensionality_reduction;trajectory_analysis,library,Python,https://github.com/choderalab/moldr,,MIT,molecular-dynamics;dimensionality-reduction;manifold-optimization
628,ipymd,Interactive analysis of Molecular Dynamics output in Jupyter Notebooks,A tool enabling the visualization and analysis of molecular dynamics simulation outputs directly within the IPython/Jupyter Notebook environment.,M2;M2-04,visualization;trajectory_analysis,library,Jupyter Notebook,https://github.com/chrisjsewell/ipymd,,GPL-3.0,molecular-dynamics;jupyter;visualization
629,Radial_Distribution_Function_rdf,Calculation of Radial Distribution Functions (RDF) for molecular systems,"A script/tool for calculating the Radial Distribution Function (RDF) from molecular simulation data, a key metric for understanding structural properties.",M2;M2-04,statistical_analysis;structure_characterization,solver,Python,https://github.com/cndaqiang/Radial_Distribution_Function_rdf,,None,rdf;molecular-dynamics;statistics
630,PyMOL4Win,Open source binary distribution of PyMOL for Windows,Provides pre-compiled open-source versions of the PyMOL molecular visualization system specifically for Windows users.,M2;M2-04,visualization,platform,,https://github.com/cnpem/PyMOL4Win,,None,pymol;visualization;windows
631,PyMOLfold,PyMOL plugin for protein sequence folding prediction,A plugin for PyMOL that allows users to predict and fold protein sequences directly within the visualization environment.,M2;M2-04,structure_prediction;visualization,library,Jupyter Notebook,https://github.com/colbyford/PyMOLfold,,GPL-3.0,protein-folding;pymol-plugin;structure-prediction
632,amof,Analysis of Molecular Dynamics trajectories for amorphous MOFs,A Python package specifically designed to analyze molecular dynamics trajectories of amorphous Metal-Organic Frameworks (MOFs).,M2;M2-04,trajectory_analysis;materials_characterization,library,Python,https://github.com/coudertlab/amof,,MIT,mofs;molecular-dynamics;amorphous-materials
633,AHoJ-project,Search tool for APO/HOLO protein structure pairs,A webserver and command-line tool for identifying and aligning APO (unbound) protein structures with their corresponding HOLO (bound) forms.,M2;M2-04,structure_alignment;database_search,solver,,https://github.com/cusbg/AHoJ-project,http://apoholo.cz,None,protein-structure;apo-holo;structural-biology
634,MolArt,Molecular structure annotator and visualizer,"A JavaScript-based tool for annotating and visualizing molecular structures, often used for web-based structural biology applications.",M2;M2-04,visualization;annotation,library,JavaScript,https://github.com/cusbg/MolArt,,None,molecular-visualization;annotation;web-viewer
635,ipymol,Control PyMOL sessions via IPython/Jupyter,A Python library that acts as a bridge to control PyMOL visualization sessions programmatically from an IPython or Jupyter environment.,M2;M2-04,visualization;automation,library,Python,https://github.com/cxhernandez/ipymol,,MIT,pymol;jupyter;visualization-control
636,deepmd-kit,Deep learning package for many-body potential energy representation and MD,A deep learning package designed to generate accurate many-body potential energy surfaces and perform molecular dynamics simulations using neural networks.,M2,molecular_dynamics;potential_learning,solver,Python,https://github.com/deepmodeling/deepmd-kit,http://www.deepmd.org/,LGPL-3.0,deep-learning;molecular-dynamics;force-field
637,dftd4,Atomic-Charge Dependent London Dispersion Correction,A generally applicable implementation of the D4 London dispersion correction for density functional theory (DFT) calculations.,M2,quantum_chemistry;energy_correction,solver,Fortran,https://github.com/dftd4/dftd4,https://dftd4.readthedocs.io/,LGPL-3.0,dft;dispersion-correction;quantum-chemistry
638,hotspot3d,3D hotspot mutation proximity analysis tool,A tool for analyzing the spatial proximity of mutations in 3D protein structures to identify mutational hotspots.,Bioinformatics,mutation_analysis;structural_biology,solver,Perl,https://github.com/ding-lab/hotspot3d,,GPL-3.0,cancer-genomics;protein-structure;mutation-hotspots
639,md-davis,Analysis and visualization of protein MD trajectories,"A Python package for analyzing molecular dynamics trajectories of proteins, offering various metrics and visualization capabilities.",M2;M2-04,trajectory_analysis;visualization,library,Python,https://github.com/djmaity/md-davis,https://md-davis.readthedocs.io/,MIT,molecular-dynamics;protein-analysis;visualization
640,show_contacts,PyMOL Plugin for displaying polar contacts,A plugin for PyMOL that enhances the visualization of polar contacts and interactions within molecular structures.,M2;M2-04,visualization;interaction_analysis,library,Python,https://github.com/dkoes/show_contacts,,MIT,pymol-plugin;molecular-interactions;visualization
641,funnel_maker,Setup scripts for funnel metadynamics simulations,A set of scripts to set up funnel metadynamics simulations for protein-ligand binding studies using PLUMED and OpenMM.,M2,simulation_setup;metadynamics,workflow,Jupyter Notebook,https://github.com/dlukauskis/funnel_maker,,None,metadynamics;plumed;openmm
642,WHAM,Efficient Weighted Histogram Analysis Method (WHAM) implementation,A multithreaded Rust implementation of the Weighted Histogram Analysis Method (WHAM) for post-processing umbrella sampling MD simulations to calculate free energy profiles.,M2;M2-04,free_energy_calculation;statistical_analysis,solver,Rust,https://github.com/dnlbauer/WHAM,,GPL-3.0,wham;free-energy;molecular-dynamics
643,OrbitalTrajectories.jl,Orbital trajectory design and analysis library,"A Julia library for designing, optimizing, and analyzing spacecraft orbits and transfers using high-performance astrodynamical simulations.",Physics;Astronomy,trajectory_optimization;orbital_mechanics,library,Julia,https://github.com/dpad/OrbitalTrajectories.jl,,Apache-2.0,astrodynamics;trajectory-optimization;spacecraft
644,LANLGeoMag,Library for magnetic-field models and coordinate transforms,"A C-based library providing magnetic field models and tools for geophysical research, including coordinate conversions and field line tracing.",Geophysics,magnetic_field_modeling;coordinate_transformation,library,C,https://github.com/drsteve/LANLGeoMag,,NOASSERTION,geophysics;geomagnetism;coordinate-systems
645,contact_map,Contact map analysis for biomolecules,A Python tool based on MDTraj for calculating and analyzing contact maps of biomolecules from molecular dynamics trajectories.,M2;M2-04,trajectory_analysis;contact_map_calculation,library,Python,https://github.com/dwhswenson/contact_map,http://contact-map.readthedocs.io/,LGPL-2.1,molecular-dynamics;contact-map;mdtraj
646,FUSCA,Framework for Unified Single-Cell Analysis,"A software package for single-cell data analysis, including modules for reconstructing cell trajectories and inferring intercellular communication networks.",Bioinformatics,single_cell_analysis;trajectory_inference,library,Jupyter Notebook,https://github.com/edroaldo/fusca,,MIT,single-cell;rna-seq;trajectory-inference
647,gmx-vmd-mcp,MCP service for controlling GROMACS and VMD,A Model Context Protocol (MCP) service that enables AI agents to interact with and control GROMACS simulations and VMD visualization sessions.,M2,workflow_automation;ai_agent_interface,service,Python,https://github.com/egtai/gmx-vmd-mcp,,MIT,ai4s;gromacs;vmd;mcp
648,DistFlow,Distribution power flow equation solver,"A MATLAB function that solves distribution power flow equations for radial, single-phase distribution networks.",Engineering,power_flow_analysis;simulation,solver,MATLAB,https://github.com/eminucer/DistFlow,,None,power-systems;distribution-network;simulation
649,encore,Ensemble comparison and analysis for MDAnalysis,"An extension to the MDAnalysis library for analyzing structural ensembles, including covariance matrices, similarity metrics, and PCA.",M2;M2-04,ensemble_analysis;dimensionality_reduction,library,Python,https://github.com/encore-similarity/encore,http://www.mdanalysis.org/encore/,GPL-3.0,molecular-dynamics;ensemble-analysis;pca
650,interfacemd,Analysis tools for MD simulations of aqueous systems,"A toolkit for analyzing molecular dynamics data, specializing in aqueous systems and interfaces, with support for Amber, Gromacs, and CP2K.",M2;M2-04,trajectory_analysis;interface_analysis,library,C++,https://github.com/eshamay/interfacemd,,None,molecular-dynamics;water;interface
651,matlab_trajectory_tools,Robotics trajectory analysis and transformation tools,"A MATLAB toolkit for the display, analysis, and transformation of trajectories, primarily used in robotics and navigation research.",Robotics,trajectory_analysis;navigation,library,MATLAB,https://github.com/ethz-asl/matlab_trajectory_tools,,None,robotics;trajectory;matlab
652,plotpal,Post-processing plotting tools for Dedalus simulations,"A Python package for visualizing and plotting results from Dedalus, a framework for solving partial differential equations in fluid dynamics.",Physics;Fluid Dynamics,visualization;postprocessing,library,Python,https://github.com/evanhanders/plotpal,,GPL-3.0,dedalus;fluid-dynamics;visualization
653,my_roms_tools,Pre/post-processing toolkit for ROMS ocean modeling,A MATLAB-based toolkit for pre-processing and post-processing data for the Regional Ocean Modeling System (ROMS).,Earth Science;Oceanography,preprocessing;postprocessing;ocean_modeling,library,MATLAB,https://github.com/f-shake/my_roms_tools,,GPL-2.0,roms;oceanography;matlab
654,PoincareMaps,Hyperbolic geometry method for single-cell trajectory discovery,A computational method using Poincar maps and hyperbolic geometry to discover hierarchies and trajectories in single-cell RNA-seq data.,Bioinformatics,single_cell_analysis;trajectory_inference,library,HTML,https://github.com/facebookresearch/PoincareMaps,,NOASSERTION,single-cell;hyperbolic-geometry;trajectory
655,qc_pymol,Scripts for visualizing quantum chemistry results in PyMOL,A collection of scripts to facilitate the visualization of quantum chemistry calculation results using PyMOL.,M2;M2-04,visualization;quantum_chemistry,library,Python,https://github.com/felixplasser/qc_pymol,,GPL-3.0,pymol;quantum-chemistry;visualization
656,ferritin,Protein utilities library in Rust,"A Rust library providing utilities for working with protein structures and data, suitable for bioinformatics applications.",Bioinformatics,structure_analysis;bioinformatics_utils,library,Rust,https://github.com/ferritin-bio/ferritin,,None,rust;protein;bioinformatics
657,confined-water-analysis,Analysis of confined water MD trajectories,"Scripts to analyze molecular dynamics trajectories of water confined in nanotubes or between flat sheets (graphene, hBN).",M2;M2-04,trajectory_analysis;nanofluidics,library,Python,https://github.com/flt17/confined-water-analysis,,None,molecular-dynamics;water;confinement
658,structurework,Scripts for molecular structure analysis,"A collection of programs and scripts for analyzing molecular structures, useful for structural biology tasks.",M2;M2-04,structure_analysis,library,Python,https://github.com/fomightez/structurework,,None,structural-biology;molecular-structure;analysis
659,MD_ligand_receptor,Pipeline for analyzing ligand-receptor interactions from MD,A bioinformatics pipeline for analyzing non-covalent ligand-receptor interactions in 3D structures derived from molecular dynamics trajectories.,M2;M2-04,interaction_analysis;trajectory_analysis,workflow,Python,https://github.com/fraMade/MD_ligand_receptor,,MIT,molecular-dynamics;ligand-receptor;interaction-analysis
660,vmd_density_profile,VMD tool for computing 1-D atomic densities,A VMD plugin/script for computing 1-D atomic density profiles from macromolecular simulations.,M2;M2-04,trajectory_analysis;density_calculation,library,Tcl,https://github.com/giorginolab/vmd_density_profile,https://github.com/giorginolab/vmd_density_profile,None,vmd;molecular-dynamics;density-profile
661,vmd_diffusion_coefficient,VMD tool for computing diffusion coefficients,A VMD plugin/script for calculating diffusion coefficients from macromolecular simulation trajectories.,M2;M2-04,trajectory_analysis;diffusion_calculation,library,Tcl,https://github.com/giorginolab/vmd_diffusion_coefficient,https://github.com/giorginolab/vmd_diffusion_coefficient,BSD-3-Clause,vmd;molecular-dynamics;diffusion
662,vmd_plumed,PLUMED-GUI plugin for VMD to visualize free energy surfaces,"A plugin for the Visual Molecular Dynamics (VMD) software that provides a graphical user interface for PLUMED, enabling the visualization and analysis of free energy surfaces and collective variables directly within VMD.",Materials;Chemistry,visualization;analysis,library,Tcl,https://github.com/giorginolab/vmd_plumed,,None,vmd;plumed;visualization;free-energy
663,freud,Powerful and efficient particle trajectory analysis library,"A Python library for analyzing molecular dynamics and particle simulation trajectories. It provides efficient, parallelized implementations of standard analysis methods such as correlation functions, order parameters, and clustering, designed for high-performance scientific computing.",Materials;Physics,analysis;statistics,library,C++,https://github.com/glotzerlab/freud,https://freud.readthedocs.io/,BSD-3-Clause,trajectory-analysis;molecular-dynamics;particle-simulation;python
664,mdciao,Accessible analysis and visualization of molecular dynamics data,"A Python tool for the analysis and visualization of molecular dynamics simulations, focusing on residue-residue interactions, contact maps, and other structural properties, with a user-friendly interface.",Materials;Biochemistry,analysis;visualization,solver,Python,https://github.com/gph82/mdciao,https://mdciao.readthedocs.io/,LGPL-3.0,molecular-dynamics;visualization;contact-maps;residue-interaction
665,md-analysis-tools,Scripts for analyzing molecular dynamics trajectories using VMD,"A collection of Python and Tcl scripts for analyzing molecular dynamics trajectories, specifically designed to work with VMD. It includes tools for calculating various structural and dynamic properties.",Materials;Biochemistry,analysis,library,Python,https://github.com/harmsm/md-analysis-tools,,Unlicense,vmd;molecular-dynamics;trajectory-analysis
666,aselektriskbureau,Extensions and tools for the Atomic Simulation Environment (ASE),"A collection of software tools and scripts built around the Atomic Simulation Environment (ASE) and VASP, providing enhanced functionality for setting up, running, and analyzing atomistic simulations.",Materials;Physics,simulation;analysis,library,Python,https://github.com/hnesland/aselektriskbureau,,Apache-2.0,ase;vasp;atomistic-simulation;dft
667,esigen,Generator for computational chemistry supporting information documents,"A tool that automates the generation of supporting information (SI) documents for computational chemistry publications, extracting data from output files of various quantum chemistry packages.",Chemistry;Materials,workflow;reporting,utility,JavaScript,https://github.com/insilichem/esigen,https://esigen.readthedocs.io,Apache-2.0,computational-chemistry;reporting;automation;supporting-information
668,matterviz,Interactive browser visualizations for materials science,"A web-based visualization library for materials science data, including periodic tables, 3D crystal structures, molecular dynamics trajectories, and various statistical plots (heatmaps, scatter plots).",Materials,visualization,library,TypeScript,https://github.com/janosh/matterviz,,MIT,visualization;materials-science;crystal-structure;web-based
669,pymolprobity,MolProbity-style visualization plugin for PyMOL,A plugin for PyMOL that allows users to visualize MolProbity structural validation data (such as clash scores and geometry issues) directly on the protein structure within the PyMOL interface.,Biochemistry;Materials,visualization;quality_control,plugin,Python,https://github.com/jaredsampson/pymolprobity,,MIT,pymol;molprobity;structural-validation;visualization
670,vasp-interactive,ASE compliant Python interface to VASP,"A Python library that provides an ASE-compliant interface to the VASP (Vienna Ab initio Simulation Package) code, enabling users to drive VASP calculations and analyze results programmatically within the ASE framework.",Materials;Physics,simulation;interface,library,Python,https://github.com/jkitchin/vasp,,None,vasp;ase;dft;materials-modeling
671,transport-coefficients-MSD,Compute Onsager transport coefficients from MD simulations,"A code repository for calculating Onsager transport coefficients from molecular dynamics simulation data using mean-square displacements (MSD), useful for studying diffusion and transport in materials.",Materials;Physics,analysis;inference,solver,Jupyter Notebook,https://github.com/kdfong/transport-coefficients-MSD,,None,transport-coefficients;molecular-dynamics;msd;diffusion
672,nMOLDYN3,Analysis of Molecular Dynamics trajectories (Legacy),"A classic software package for the analysis of molecular dynamics trajectories, particularly focusing on neutron scattering observables and other time-dependent correlation functions.",Materials;Physics,analysis,application,HTML,https://github.com/khinsen/nMOLDYN3,http://dirac.cnrs-orleans.fr/nMOLDYN/,NOASSERTION,molecular-dynamics;neutron-scattering;trajectory-analysis
673,AtomisticReverseMonteCarlo,OVITO Python modifier for Reverse Monte Carlo generation,A Python modifier for the OVITO visualization software that generates bulk crystal structures with target Warren-Cowley parameters using an Atomistic Reverse Monte Carlo (RMC) algorithm.,Materials,modeling;simulation,plugin,Python,https://github.com/killiansheriff/AtomisticReverseMonteCarlo,,None,ovito;reverse-monte-carlo;crystal-structure;warren-cowley
674,WarrenCowleyParameters,OVITO Python modifier to compute Warren-Cowley parameters for alloy analysis,"A Python modifier for the OVITO visualization software that calculates Warren-Cowley parameters, which are used to quantify short-range order and chemical ordering in multi-component alloys from atomistic simulation data.",Materials;M2;M2-04,structure_analysis;post_processing,library,Python,https://github.com/killiansheriff/WarrenCowleyParameters,,None,ovito;alloys;warren-cowley;molecular-dynamics
675,helinoise,Rotor noise prediction framework using PSU-WOPWOP and CAMRAD II,A post-processing framework designed to predict helicopter rotor noise by interfacing CAMRAD II simulation results with the PSU-WOPWOP acoustic prediction code.,Acoustics;Aerodynamics,simulation_post_processing;noise_prediction,workflow,Python,https://github.com/kumar-sumeet/helinoise,,MIT,acoustics;rotorcraft;noise-prediction;camrad-ii
676,chemkit,"C++ library for molecular modelling, cheminformatics and visualization","A comprehensive C++ library designed for molecular modeling, cheminformatics, and molecular visualization, providing algorithms and data structures for chemical data processing.",Chemistry;M2,molecular_modeling;visualization;cheminformatics,library,C++,https://github.com/kylelutz/chemkit,,BSD-3-Clause,cheminformatics;molecular-modeling;visualization;cpp
677,ase_exploration,Robotic exploration planning based on forward simulation,A framework for robotic exploration planning that utilizes forward simulation to optimize trajectories and sensor placement for autonomous mapping and navigation.,Robotics,simulation;path_planning,solver,C++,https://github.com/laurimi/ase_exploration,,BSD-3-Clause,robotics;exploration;simulation;path-planning
678,molecular_data_explorer,Web app generator for visualizing molecular data and geometries,"A Python tool that creates Dash-based web applications for the interactive visualization of molecular data and geometries, facilitating the exploration of chemical datasets.",Chemistry;M2;M2-04,visualization;data_exploration,application,Python,https://github.com/lcmd-epfl/molecular_data_explorer,,MIT,visualization;dash;molecular-data;web-app
679,vitruvio,Framework for rapid leg design analysis and optimization for legged robots,"A simulation framework for the early-stage design, analysis, and optimization of legged robots, computing necessary joint speeds, torques, and energy for trajectory tracking.",Robotics,simulation;design_optimization,framework,MATLAB,https://github.com/leggedrobotics/vitruvio,,None,robotics;legged-robots;optimization;simulation
680,mol-draw,Lightweight 3D molecular viewer for web applications,"A lightweight JavaScript/PureScript library for rendering 3D molecular structures in web applications, suitable for embedding molecular visualizations.",Chemistry;M2;M2-04,visualization,library,PureScript,https://github.com/lukasturcani/mol-draw,,NOASSERTION,visualization;molecular-viewer;web;3d
681,stk-vis,Cross-platform application for visualization of molecular databases,"A desktop application designed for the visualization and exploration of large molecular databases, supporting the analysis of generated chemical structures.",Chemistry;M2;M2-04,visualization;database_exploration,application,PureScript,https://github.com/lukasturcani/stk-vis,,MIT,visualization;molecular-databases;cheminformatics
682,VASP_MD_XDAT,Analysis tool for VASP MD trajectories (XDATCAR),"A Fortran code for analyzing molecular dynamics trajectories from VASP (XDATCAR files), calculating lattice parameters, RMSD, coordination numbers, and converting formats.",Materials;M2;M2-04,trajectory_analysis;structure_analysis,solver,Fortran,https://github.com/lyg-ucl/VASP_MD_XDAT,,GPL-3.0,vasp;molecular-dynamics;trajectory-analysis;rmsd
683,MolSimToolkit.jl,Julia toolkit for analyzing molecular dynamics simulations,"A set of tools written in Julia for the analysis of molecular dynamics simulations, providing efficient routines for trajectory processing and structural analysis.",Materials;M2;M2-04,trajectory_analysis,library,Julia,https://github.com/m3g/MolSimToolkit.jl,,MIT,julia;molecular-dynamics;analysis;simulation
684,maicos,Analysis of molecular dynamics simulations for interfacial and confined systems,"A Python library for analyzing molecular dynamics simulations specifically focusing on interfacial and confined systems, offering tools for density profiles, dielectric constants, and more.",Materials;M2;M2-04,trajectory_analysis;interface_analysis,library,Python,https://github.com/maicos-devel/maicos,https://maicos-devel.github.io/maicos/,GPL-3.0,molecular-dynamics;interfaces;confinement;analysis
685,Dynamics,PyMOL plugin for molecular dynamics visualization,"A plugin for the PyMOL molecular visualization system that facilitates the loading, viewing, and analysis of molecular dynamics trajectories directly within PyMOL.",Materials;Bioinformatics;M2;M2-04,visualization;trajectory_viewing,plugin,Python,https://github.com/makson96/Dynamics,,GPL-3.0,pymol;plugin;molecular-dynamics;visualization
686,mcse,Molecular Crystal Simulation Library for structure manipulation and analysis,"An open-source Python package for manipulating and analyzing molecular crystal structures, useful for crystallography and materials science simulations.",Materials;Crystallography;M2,structure_analysis;crystal_modeling,library,Python,https://github.com/manny405/mcse,,Apache-2.0,molecular-crystals;crystallography;structure-analysis;python
687,pywindow,Structural analysis of discrete molecules with voids and windows,"A Python package for the structural analysis of porous molecular cages and discrete molecules with voids, capable of characterizing pore sizes and windows in static structures and MD trajectories.",Materials;Chemistry;M2;M2-04,structure_analysis;pore_analysis,library,Python,https://github.com/marcinmiklitz/pywindow,,MIT,porous-materials;molecular-cages;structure-analysis;voids
688,molPX,Visualization of MD trajectories along projected coordinates in Jupyter,"An IPython/Jupyter API for visualizing molecular dynamics trajectories projected onto low-dimensional reaction coordinates or order parameters, facilitating the analysis of conformational changes.",Materials;Bioinformatics;M2;M2-04,visualization;dimensionality_reduction,library,Python,https://github.com/markovmodel/molPX,,LGPL-3.0,molecular-dynamics;visualization;jupyter;projection
689,MDVoxelSegmentation,Voxel-based dynamic cluster analysis of MD trajectories,"A tool for analyzing molecular dynamics trajectories using a voxel-based approach to perform dynamic cluster analysis, useful for studying aggregation and phase separation.",Materials;M2;M2-04,trajectory_analysis;clustering,solver,HTML,https://github.com/marrink-lab/MDVoxelSegmentation,,NOASSERTION,molecular-dynamics;voxel-analysis;clustering;aggregation
