id,name,one_line_profile,detailed_description,domains,subtask_category,application_level,primary_language,repo_url,help_website,license,tags
238,ProtoCaller,Automation of relative protein-ligand binding free energy calculations,"A Python library for the full automation of relative protein-ligand binding free energy calculations using GROMACS, streamlining the FEP workflow.",M2;Biotech,free_energy_calculation;workflow_automation,workflow,Python,https://github.com/protocaller/ProtoCaller,,GPL-3.0,free-energy;gromacs;protein-ligand;automation
239,cgdms,Differentiable molecular simulation of proteins with coarse-grained potential,"A library for differentiable molecular simulation of proteins using a coarse-grained potential, enabling gradient-based optimization of molecular properties.",M2;Biotech,simulation;differentiable_physics,library,Python,https://github.com/psipred/cgdms,,MIT,differentiable-simulation;coarse-grained;protein-folding
240,pyiron,Integrated development environment for computational materials science,An integrated development environment (IDE) for computational materials science that provides a workflow framework for running complex simulation protocols.,M2;Materials,workflow_management;simulation_environment,platform,Jupyter Notebook,https://github.com/pyiron/pyiron,https://pyiron.org,BSD-3-Clause,materials-science;workflow;ide;simulation
241,pyiron_atomistics,IDE for atomistic simulation in computational materials science,"A specialized module of the pyiron project focused on atomistic simulations, providing tools for setting up and analyzing atomic-scale calculations.",M2;Materials,simulation_setup;atomistic_simulation,library,Python,https://github.com/pyiron/pyiron_atomistics,,BSD-3-Clause,atomistics;materials-science;pyiron
242,pylammpsmpi,Parallel LAMMPS Python interface,A Python interface to control MPI-parallel LAMMPS instances from a serial Python process or Jupyter notebook.,M2;Materials,interface;parallel_computing,library,Python,https://github.com/pyiron/pylammpsmpi,,BSD-3-Clause,lammps;mpi;python-interface
243,pyscal,Library for calculation of local atomic structural environment,A Python library written in C++ for the calculation of local atomic structural environments and order parameters in atomistic simulations.,M2;Materials,structure_analysis;post_processing,library,C++,https://github.com/pyscal/pyscal,https://pyscal.org,BSD-3-Clause,structure-analysis;atomistics;order-parameters
244,Dock-MD-FEP,Automated workflow for binding free energy calculation,An all-in-one automated workflow for calculating protein-ligand binding free energy using OpenMM and free energy perturbation (FEP) methods.,M2;Biotech,free_energy_calculation;workflow,workflow,Jupyter Notebook,https://github.com/quantaosun/Dock-MD-FEP,,MIT,fep;openmm;binding-affinity;workflow
245,NAMD-FEP,Cloud GPU supported NAMD3-based binding free energy workflow,A workflow for performing binding free energy difference calculations using NAMD3 on cloud GPU hardware.,M2;Biotech,free_energy_calculation;workflow,workflow,Jupyter Notebook,https://github.com/quantaosun/NAMD-FEP,,MIT,namd;fep;gpu;cloud-computing
246,simba-ps,Fast deterministic all-Python Lennard-Jones particle simulator,"A fast, deterministic particle simulator for Lennard-Jones systems written in Python, utilizing Numba for GPU acceleration.",M2;Physics,simulation;particle_dynamics,solver,Python,https://github.com/r-aristov/simba-ps,,MIT,lennard-jones;particle-simulation;numba;gpu
247,pynamd,Python Tools for NAMD,A collection of Python tools and utilities for working with NAMD molecular dynamics simulations.,M2;Materials,simulation_utils;data_processing,library,Python,https://github.com/radakb/pynamd,,MIT,namd;python;molecular-dynamics
248,schrodinger_utils,Integrations and analysis tools for the Schrodinger ecosystem,"A collection of utilities and integrations for the Schrodinger software suite, with a focus on analyzing Molecular Dynamics simulations run with Desmond.",M2;Biotech,analysis;post_processing,library,Python,https://github.com/rebelot/schrodinger_utils,,MIT,schrodinger;desmond;molecular-dynamics;analysis
249,GNNImplicitSolvent,Implicit Solvent Approach using Graph Neural Networks for MD,An implementation of an implicit solvent approach for molecular dynamics simulations based on Generalised Born models and Transferable Graph Neural Networks.,M2;Materials,simulation_method;modeling,library,Jupyter Notebook,https://github.com/rinikerlab/GNNImplicitSolvent,,MIT-0,gnn;implicit-solvent;molecular-dynamics;machine-learning
250,do_x3dna,Tool to analyze DNA/RNA structure fluctuations in MD trajectories,A tool designed to analyze structural fluctuations in DNA or RNA molecules from molecular dynamics simulation trajectories.,M2;Biotech,trajectory_analysis;structure_analysis,solver,Python,https://github.com/rjdkmr/do_x3dna,,GPL-3.0,dna;rna;trajectory-analysis;molecular-dynamics
251,cp2kdata,Post-processing tools for CP2K,A Python library providing tools for post-processing data generated by the CP2K quantum chemistry and solid state physics software package.,M2;Materials,post_processing;data_analysis,library,Python,https://github.com/robinzyb/cp2kdata,,LGPL-3.0,cp2k;post-processing;quantum-chemistry
252,ba-mdslam,Photometric SLAM and Bundle Adjustment for RGB-D and LiDAR,"A CUDA-accelerated system for Photometric Simultaneous Localization and Mapping (SLAM) and Bundle Adjustment, supporting RGB-D and LiDAR data.",Robotics;Computer Vision,slam;localization,solver,C++,https://github.com/rvp-group/ba-mdslam,,BSD-3-Clause,slam;cuda;lidar;rgb-d
253,OpenMMS,Open-Source Mobile Mapping System Software,"An open-source software project for Mobile Mapping Systems (MMS), facilitating the collection and processing of geospatial data.",Geomatics;Remote Sensing,mapping;data_collection,platform,Python,https://github.com/ryan-brazeal-ufl/OpenMMS,,GPL-3.0,mobile-mapping;geospatial;mms
254,gromacs_py,Python library for simplified GROMACS usage,"A Python library that simplifies the use of GROMACS MD software by providing interfaces for topology building, system creation, and simulation execution.",M2;Materials,simulation_setup;workflow,library,Python,https://github.com/samuelmurail/gromacs_py,,GPL-2.0,gromacs;python-wrapper;molecular-dynamics
255,viamd,Visual Interactive Analysis of Molecular Dynamics,"A tool for the visual interactive analysis of molecular dynamics simulations, enabling users to explore and analyze trajectory data.",M2;Materials,visualization;analysis,solver,C++,https://github.com/scanberg/viamd,,MIT,visualization;molecular-dynamics;analysis
256,SEEKR2,Simulation-Enabled Estimation of Kinetic Rates for molecular dynamics,A software suite for calculating kinetics and thermodynamics of molecular systems using molecular dynamics and milestoning theory.,M2;M2-01,molecular_dynamics;kinetics_estimation,solver,Python,https://github.com/seekrcentral/seekr2,https://seekr2.readthedocs.io,MIT,molecular-dynamics;kinetics;milestoning;simulation
257,SHARC,Ab initio molecular dynamics software for excited-state dynamics,"A molecular dynamics program suite developed to study the excited-state dynamics of molecules, capable of handling non-adiabatic effects.",M2;M2-01,molecular_dynamics;excited_state_dynamics,solver,Python,https://github.com/sharc-md/sharc,https://sharc-md.org,GPL-3.0,ab-initio-md;excited-states;photochemistry;molecular-dynamics
258,SHARC4,Version 4 of the SHARC ab initio molecular dynamics suite,A version of the SHARC molecular dynamics program suite for excited-state dynamics simulations.,M2;M2-01,molecular_dynamics;excited_state_dynamics,solver,Python,https://github.com/sharc-md/sharc4,https://sharc-md.org,NOASSERTION,ab-initio-md;excited-states;molecular-dynamics
259,InterMol,Conversion tool for molecular simulation file formats,"A conversion tool to translate molecular simulation input files between different formats such as GROMACS, LAMMPS, Desmond, and Amber.",M2;M2-01,format_conversion;simulation_setup,utility,Python,https://github.com/shirtsgroup/InterMol,,MIT,molecular-dynamics;file-conversion;gromacs;lammps
260,physical_validation,Physical validation suite for molecular simulations,"A Python package to validate the physical consistency of molecular dynamics simulation results, checking ensemble properties and trajectory validity.",M2;M2-01,validation;quality_control,library,Python,https://github.com/shirtsgroup/physical_validation,https://physical-validation.readthedocs.io,MIT,molecular-dynamics;validation;statistical-mechanics
261,PyParticles,Particle simulation library in Python,"A Python simulation suite for particle physics, supporting various integrators and force models like gravity and springs.",M2;M2-01,particle_simulation;physics_modeling,library,Python,https://github.com/simon-r/PyParticles,,MIT,particle-simulation;physics;n-body
262,PEGgenerator,Topology generator for PEG molecules,A tool to generate molecular topology files for Polyethylene Glycol (PEG) for use in GROMACS and LAMMPS simulations.,M2;M2-01,topology_generation;simulation_setup,utility,Jupyter Notebook,https://github.com/simongravelle/PEGgenerator,,GPL-3.0,molecular-dynamics;topology;gromacs;lammps;peg
263,NMRforMD,NMR relaxation time calculator from MD trajectories,A Python script to calculate NMR relaxation times (T1 and T2) from molecular dynamics trajectory files.,M2;M2-01,trajectory_analysis;property_calculation,utility,Python,https://github.com/simongravelle/nmrformd,,GPL-3.0,molecular-dynamics;nmr;analysis;relaxation-time
264,postpic,Post-processor for Particle-in-Cell simulations,An open-source Python package for post-processing and analyzing data from Particle-in-Cell (PIC) simulations.,M2;M2-01,simulation_analysis;post_processing,library,Python,https://github.com/skuschel/postpic,https://postpic.readthedocs.io,GPL-3.0,particle-in-cell;plasma-physics;data-analysis
265,Lane-Change-Simulation,Simulation of lane change decision making for autonomous driving,A C++ implementation of lane change decision making algorithms using Markov Decision Processes and Particle Filters for autonomous driving research.,M2,autonomous_driving_simulation;decision_making_modeling,solver,C++,https://github.com/snmnmin12/Lane-Change-Simulation,,None,autonomous-driving;simulation;markov-decision-process;particle-filter
266,mpmc,Monte Carlo molecular simulation software,"A Monte Carlo molecular simulation software package designed for materials simulations, particularly suited for polarizable models.",M2;M2-01,molecular_simulation;monte_carlo,solver,C,https://github.com/space-group-research/mpmc,,GPL-3.0,monte-carlo;molecular-simulation;materials-science
267,SPH-EXA,Parallel SPH hydrodynamics simulation code,"A C++20 simulation code for performing hydrodynamics simulations using Smoothed Particle Hydrodynamics (SPH), optimized for HPC with MPI, OpenMP, CUDA, and HIP.",M2;M2-01,hydrodynamics_simulation;hpc,solver,C++,https://github.com/sphexa-org/sphexa,,MIT,sph;hydrodynamics;hpc;cuda;mpi
268,lammps-USER-CONP2,Constant potential plugin for LAMMPS,"An updated constant potential plugin for the LAMMPS molecular dynamics simulator, enabling electrochemical simulations.",M2;M2-01,molecular_dynamics;electrochemical_simulation,library,C++,https://github.com/srtee/lammps-USER-CONP2,,GPL-3.0,lammps;plugin;constant-potential;molecular-dynamics
269,NAMD-replica,Replica-exchange tools for NAMD,A set of tools and scripts to facilitate replica-exchange molecular dynamics simulations using the NAMD engine.,M2;M2-01,molecular_dynamics;enhanced_sampling,utility,Python,https://github.com/sunhwan/NAMD-replica,,BSD-2-Clause,namd;replica-exchange;molecular-dynamics
270,MolecularDynamicsIntegrators.jl,Integration algorithms for molecular dynamics in Julia,A Julia library providing various integration algorithms for molecular dynamics simulations.,M2;M2-01,molecular_dynamics;numerical_integration,library,Julia,https://github.com/sunoru/MolecularDynamicsIntegrators.jl,,MIT,julia;molecular-dynamics;integrators
271,xcp2k,ASE interface for CP2K,A Python module to interface the CP2K quantum chemistry package with the Atomic Simulation Environment (ASE).,M2;M2-01,interface;simulation_setup,library,Python,https://github.com/superstar54/xcp2k,,None,ase;cp2k;interface;molecular-dynamics
272,mdml,Deep Learning library for Molecular Simulations,"A library for applying deep learning techniques to molecular simulations, facilitating AI-driven molecular dynamics.",M2;M2-01,ai4s;molecular_dynamics,library,Python,https://github.com/svats73/mdml,,LGPL-2.1,deep-learning;molecular-dynamics;ai4s
273,avogadrolibs-cp2k,CP2K input generator for Avogadro 2,A plugin for Avogadro 2 to generate input files for the CP2K quantum chemistry and solid state physics software package.,M2;M2-01,input_generation;simulation_setup,utility,C++,https://github.com/svedruziclab/avogadrolibs-cp2k,,BSD-3-Clause,avogadro;cp2k;input-generator
274,reax_tools,ReaxFF/AIMD trajectory analysis tool,A high-performance tool based on graph theory for analyzing trajectories from ReaxFF and Ab Initio Molecular Dynamics (AIMD) simulations.,M2;M2-01,trajectory_analysis;reaction_analysis,utility,Python,https://github.com/tgraphite/reax_tools,,None,reaxff;aimd;trajectory-analysis;graph-theory
275,ClayFF,ClayFF force field implementation for GROMACS,"A GROMACS implementation of the ClayFF force field, enabling molecular dynamics simulations of clay minerals and related systems.",M2;M2-01,force_field;molecular_modeling,dataset,,https://github.com/thomasunderwood/ClayFF,,None,force-field;gromacs;clayff;molecular-dynamics
276,LifeBrush,Interactive painting toolkit for mesoscale molecular simulations,A toolkit for interactively painting and designing agent-based mesoscale molecular simulations and illustrations.,M2;M2-01,molecular_modeling;visualization,solver,C++,https://github.com/timdecode/LifeBrush,,MIT,mesoscale-simulation;molecular-modeling;interactive-design
277,AIMD Fragmentation,Automated fragmentation method for Ab Initio Molecular Dynamics (AIMD) simulations,"A Python-based tool implementing an automated fragmentation method specifically designed for Ab Initio Molecular Dynamics (AIMD), facilitating the handling of large systems in quantum chemistry simulations.",Materials;Chemistry,simulation;ab_initio_md,solver,Python,https://github.com/tongzhugroup/aimdfragmentation,,None,aimd;fragmentation;molecular-dynamics
278,MD Dataset Builder,Tool to build reference datasets for training neural network potentials from LAMMPS trajectories,"A script designed to process LAMMPS trajectories and construct reference datasets suitable for training neural network interatomic potentials, streamlining the data preparation phase in machine learning force field development.",Materials;Chemistry,data_processing;dataset_generation,dataset,Python,https://github.com/tongzhugroup/mddatasetbuilder,,LGPL-3.0,lammps;neural-network-potentials;machine-learning
279,mdgrad,PyTorch-based differentiable molecular dynamics library,"A library enabling differentiable molecular dynamics simulations within the PyTorch framework, allowing for gradient-based optimization of force field parameters and molecular structures.",Materials;Chemistry,simulation;modeling,library,Python,https://github.com/torchmd/mdgrad,,MIT,differentiable-programming;molecular-dynamics;pytorch
280,TorchMD,End-to-end molecular dynamics engine built on PyTorch,"A molecular dynamics engine implemented using PyTorch, designed to facilitate machine learning integration with physical simulations, supporting end-to-end training and research in AI for Science.",Materials;Chemistry,simulation;molecular_dynamics,solver,Python,https://github.com/torchmd/torchmd,,MIT,molecular-dynamics;pytorch;gpu-acceleration
281,TTClust,Tool for clustering molecular dynamics trajectories,"A Python program to clusterize molecular dynamics trajectories from various engines (Amber, Gromacs, Charmm, NAMD, PDB), aiding in the analysis of conformational states and structural variations.",Materials;Chemistry,analysis;clustering,solver,Python,https://github.com/tubiana/TTClust,,NOASSERTION,molecular-dynamics;clustering;trajectory-analysis
282,protocolGromacs,Automated GROMACS protocol from preparation to production,"A shell-based workflow automation tool for GROMACS simulations, handling steps from system preparation and ligand parametrization to production runs, simplifying the simulation pipeline.",Materials;Chemistry,workflow;simulation_setup,workflow,Shell,https://github.com/tubiana/protocolGromacs,,MIT,gromacs;automation;molecular-dynamics
283,GDyNet,Unsupervised learning of atomic scale dynamics from molecular dynamics,"A machine learning framework for the unsupervised learning of atomic-scale dynamics directly from molecular dynamics simulation data, useful for extracting kinetic information and reduced-order models.",Materials;Chemistry,analysis;modeling,solver,Jupyter Notebook,https://github.com/txie-93/gdynet,,MIT,machine-learning;molecular-dynamics;unsupervised-learning
284,MDCrow,LLM agent for automating molecular dynamics simulations,"A tool that integrates Large Language Models (LLMs) to act as agents for setting up, running, and analyzing molecular dynamics simulations, enabling natural language interaction with MD workflows.",Materials;Chemistry,workflow;simulation_setup,workflow,Jupyter Notebook,https://github.com/ur-whitelab/MDCrow,,MIT,llm;agent;molecular-dynamics
285,hoomd-tf,TensorFlow plugin for HOOMD-blue MD engine,"A plugin that enables the integration of TensorFlow machine learning models within the HOOMD-blue molecular dynamics engine, allowing for online inference and ML-driven force fields during simulations.",Materials;Chemistry,simulation;modeling,library,Python,https://github.com/ur-whitelab/hoomd-tf,,MIT,tensorflow;hoomd-blue;machine-learning-md
286,JARVIS-Tools,Open-source software package for data-driven atomistic materials design,"A comprehensive toolkit for data-driven materials design, including modules for density functional theory (DFT), molecular dynamics, and machine learning, supporting the JARVIS database ecosystem.",Materials;Physics,modeling;simulation;analysis,platform,Python,https://github.com/usnistgov/jarvis,https://jarvis-tools.readthedocs.io,NOASSERTION,materials-design;dft;molecular-dynamics
287,MAST-ML,Materials Simulation Toolkit for Machine Learning,"A Python toolkit designed to facilitate the application of machine learning to materials science research, providing pipelines for data cleaning, feature engineering, model training, and analysis.",Materials,analysis;modeling,workflow,Jupyter Notebook,https://github.com/uw-cmg/MAST-ML,https://mast-ml.readthedocs.io,MIT,materials-informatics;machine-learning;workflow
288,TaichiMD,"Interactive, GPU-accelerated Molecular Dynamics using Taichi","A molecular dynamics engine implemented in the Taichi programming language, leveraging GPU acceleration for high-performance and interactive simulations of atomic systems.",Materials;Physics,simulation;molecular_dynamics,solver,Python,https://github.com/victoriacity/taichimd,,GPL-3.0,taichi;gpu;molecular-dynamics
289,VOTCA,Coarse-grained modeling and electronic structure analysis package,"A software suite for coarse-grained modeling (VOTCA-CSG) and electronic structure analysis (VOTCA-XTP), focusing on the simulation of soft matter and charge transport in organic semiconductors.",Materials;Chemistry,simulation;modeling,solver,C++,https://github.com/votca/votca,https://www.votca.org,Apache-2.0,coarse-graining;molecular-dynamics;electronic-structure
290,drMD,Molecular Dynamics tool for experimentalists,"A user-friendly wrapper and toolkit designed to make molecular dynamics simulations more accessible to experimentalists, simplifying setup and analysis tasks.",Chemistry;Biology,simulation;workflow,workflow,Python,https://github.com/wells-wood-research/drMD,,MIT,molecular-dynamics;openmm;simulation-setup
291,symd,N-Dimensional MD engine with symmetry group constraints,"A specialized molecular dynamics engine written in C that supports N-dimensional simulations and enforces symmetry group constraints, useful for theoretical physics and crystallography studies.",Physics;Materials,simulation;molecular_dynamics,solver,Jupyter Notebook,https://github.com/whitead/symd,,MIT,molecular-dynamics;symmetry;n-dimensional
292,OpenMMDL,Interface to OpenMM for protein-ligand complex simulations,"A setup and workflow interface for the OpenMM molecular dynamics engine, specifically optimized for preparing and running simulations of protein-ligand complexes.",Biology;Chemistry,simulation;workflow,workflow,Python,https://github.com/wolberlab/OpenMMDL,,MIT,openmm;protein-ligand;molecular-dynamics
293,PyRod,Tool for tracing water molecules in molecular dynamics simulations,A Python tool for analyzing molecular dynamics trajectories to trace and characterize the behavior of water molecules within protein structures or binding sites.,Biology;Chemistry,analysis;trajectory_analysis,solver,Python,https://github.com/wolberlab/pyrod,,GPL-2.0,water-tracing;molecular-dynamics;pharmacophore
294,OpenCafeMol,Multi-platform coarse-grained molecular dynamics simulator on GPU,"A GPU-accelerated implementation of the CafeMol coarse-grained molecular dynamics simulator, designed for simulating large-scale biomolecular systems.",Biology;Chemistry,simulation;coarse_grained_md,solver,C++,https://github.com/yutakasi634/OpenCafeMol,,MIT,coarse-grained;molecular-dynamics;gpu
295,TCCL-Code,Computational chemistry scripts from Tsinghua TCCL lab,"A collection of scripts and tools for theoretical and computational chemistry, developed by the TCCL lab at Tsinghua University, for processing outputs from various quantum chemistry packages (Gaussian, CP2K, etc.).",Chemistry;Materials,data_processing;analysis,library,Perl,https://github.com/zevanzhao/TCCL-Code,,GPL-3.0,computational-chemistry;post-processing;scripts
296,JADE-NAMD,Package for on-the-fly nonadiabatic molecular dynamics simulation,"A software package designed to perform on-the-fly nonadiabatic molecular dynamics simulations, interfacing with NAMD to study excited state dynamics.",Chemistry;Physics,simulation;nonadiabatic_md,solver,Python,https://github.com/zglan/JADE-NAMD,,GPL-3.0,namd;nonadiabatic-dynamics;molecular-dynamics
297,lammps-conp,Constant potential method implementation for LAMMPS,"An implementation of the constant potential method for the LAMMPS molecular dynamics simulator, enabling simulations of electrode-electrolyte interfaces under applied voltage.",Materials;Chemistry,simulation;method_implementation,solver,C++,https://github.com/zhenxingwang/lammps-conp,,None,lammps;constant-potential;electrochemistry
298,MDSuite,Post-processing engine for particle simulations,"A Python-based post-processing engine designed for analyzing data from particle-based simulations (like MD), providing a modular framework for calculating structural and dynamical properties.",Materials;Physics,analysis;post_processing,library,Python,https://github.com/zincware/MDSuite,https://mdsuite.readthedocs.io,EPL-2.0,molecular-dynamics;analysis;particle-simulation
299,AMBER (Biological Evidence),Automated Modelling for Biological Evidence-based Research,"A Python tool for automated modelling in the context of biological evidence-based research, likely facilitating systematic reviews or meta-analyses (Note: Distinct from the AMBER molecular dynamics package).",Biology,analysis;modeling,solver,Python,https://github.com/zj-zhang/AMBER,,GPL-3.0,evidence-based-research;modeling;biology
300,MACE,Fast and accurate machine learning interatomic potentials with higher order equivariant message passing,"MACE provides a unified framework for fast and accurate machine learning interatomic potentials. It utilizes higher order equivariant message passing to capture complex atomic interactions, suitable for molecular dynamics simulations and materials modeling.",M2;M2-02,force_field_training;molecular_dynamics,solver,Python,https://github.com/ACEsuit/mace,https://mace-docs.readthedocs.io,NOASSERTION,machine-learning;interatomic-potential;molecular-dynamics;equivariant-neural-networks
301,StABlE-Training,Stability-Aware Training of Machine Learning Force Fields,Implementation of a stability-aware training method for machine learning force fields using differentiable Boltzmann estimators. It addresses the issue of simulation stability in ML-driven molecular dynamics.,M2;M2-02,force_field_training;stability_optimization,solver,Python,https://github.com/ASK-Berkeley/StABlE-Training,,None,machine-learning;force-field;molecular-dynamics;training-stability
302,GA4AMOEBA,Genetic Algorithm for optimizing AMOEBA force field parameters,"A Fortran-based Genetic Algorithm program designed to optimize the parameters of the polarizable AMOEBA force field, facilitating accurate molecular modeling.",M2;M2-02,parameterization;optimization,solver,Fortran,https://github.com/AmYingLi/GA4AMOEBA,,None,genetic-algorithm;force-field;parameter-optimization;amoeba
303,Enerzyme,Machine learning force field for enzymatic catalysis,"A next-generation machine learning force field specifically designed for modeling enzymatic catalysis, enabling accurate simulations of biochemical reactions.",M2;Biochemistry,force_field_modeling;catalysis_simulation,solver,Python,https://github.com/Benzoin96485/Enerzyme,,None,machine-learning;force-field;enzymes;catalysis
304,TiO2-Water-Dataset,Training data for TiO2-Water interface Deep Neural Network Potential,"A dataset repository containing training data used to develop a Deep Neural Network Potential for the Titanium Dioxide-Water interface, essential for training ML potentials in materials science.",M2;M2-02,dataset;force_field_training,dataset,Fortran,https://github.com/CSIprinceton/TiO2-Water,,None,dataset;deep-neural-network;potential;materials-science
