id,name,one_line_profile,detailed_description,domains,subtask_category,application_level,primary_language,repo_url,help_website,license,tags
431,SchNetPack,Deep Neural Networks for Atomistic Systems,SchNetPack is a toolbox for the development and application of deep neural networks to the prediction of potential energy surfaces and other quantum-chemical properties of molecules and materials.,M2;M2-03,model_training;property_prediction;molecular_dynamics,library,Python,https://github.com/atomistic-machine-learning/schnetpack,https://schnetpack.readthedocs.io,MIT,deep-learning;atomistic-simulation;force-field;schnet
432,G-SchNet,Generative neural networks for 3D molecular structures,"An extension for SchNetPack that implements G-SchNet, a generative model for sampling 3D molecular structures.",M2;M2-03,molecule_generation;generative_model,library,Python,https://github.com/atomistic-machine-learning/schnetpack-gschnet,,MIT,generative-models;drug-design;molecular-generation
433,ANI-1xnr,Machine learning potential for reactive chemistry,Implementation of the ANI-1xnr machine learning interatomic potential designed for condensed-phase reactive chemistry simulations.,M2;M2-03,molecular_dynamics;chemical_reaction_simulation,solver,Python,https://github.com/atomistic-ml/ani-1xnr,,None,reactive-chemistry;ani-potential;molecular-dynamics
434,aenet,Atomic Energy NETwork - ANN potentials for atomistic simulations,The Atomic Energy NETwork (net) package is a collection of tools for the construction and application of atomic interaction potentials based on artificial neural networks (ANNs).,M2;M2-03,model_training;potential_generation;molecular_dynamics,solver,Fortran,https://github.com/atomisticnet/aenet,http://ann.atomistic.net/,MPL-2.0,neural-network-potentials;fortran;atomistic-simulation
435,aenet-PyTorch,PyTorch implementation of the aenet package,"A GPU-supported PyTorch implementation for training machine learning atomic potentials, compatible with the original aenet framework.",M2;M2-03,model_training;potential_generation,library,Fortran,https://github.com/atomisticnet/aenet-PyTorch,,MIT,pytorch;gpu-acceleration;neural-network-potentials
436,uMLIP-Interactive,GUI for universal machine learning interatomic potentials,"A graphical user interface for running and visualizing simulations with various universal machine learning interatomic potentials like MACE, CHGNet, and SevenNet.",M2;M2-03,simulation_gui;visualization;molecular_dynamics,platform,Python,https://github.com/bracerino/uMLIP-Interactive,,MIT,gui;molecular-dynamics;universal-potentials;visualization
437,Cairn.jl,Enhanced sampling algorithms for active learning of ML-IPs,A Julia package implementing enhanced sampling algorithms specifically designed for the active learning of machine learning interatomic potentials (ML-IPs).,M2;M2-03,active_learning;sampling,library,Julia,https://github.com/cesmix-mit/Cairn.jl,,MIT,active-learning;sampling;mlip;julia
438,IANN,Equivariant interatomic neural network potential framework,IANN (InterAtomic Neural Network Framework) is a package for creating and training equivariant interatomic neural network potentials.,M2;M2-03,potential_training;modeling,library,Python,https://github.com/changzhiai/IANN,,MIT,neural-network-potential;equivariant-nn;force-field
439,muse,Builder for amorphous solids and liquid mixtures using MLIPs,A Python package for fast building of amorphous solids and liquid mixtures structures using Materials Project data and machine learning interatomic potentials.,M2;M2-03,structure_generation;simulation_setup,library,Python,https://github.com/chiang-yuan/muse,,MIT,structure-building;amorphous-solids;mlip
440,modelforge,Infrastructure to implement and train Neural Network Potentials,"A library providing infrastructure to implement, train, and deploy neural network potentials (NNPs) for molecular simulation.",M2;M2-03,potential_training;modeling,library,Python,https://github.com/choderalab/modelforge,,MIT,nnp;molecular-simulation;training-infrastructure
441,ART-SM,Backmapping framework from Coarse-Grained to Atomistic resolution,A fragment-based machine learning framework for backmapping coarse-grained (CG) structures to atomistic resolution.,M2;M2-04,backmapping;multiscale_modeling,library,Python,https://github.com/chrispfae/ART-SM,,MIT,backmapping;coarse-grained;machine-learning
442,mlip-cleavage-benchmark,Benchmark for MLIPs on surface stability and cleavage energy,A benchmarking suite for evaluating Machine Learning Interatomic Potentials (MLIPs) specifically on surface stability and cleavage energy predictions.,M2;M2-03,benchmarking;validation,dataset,Python,https://github.com/d2r2group/mlip-cleavage-benchmark,,None,benchmark;mlip;surface-energy
443,DP-GEN,Deep potential generator workflow tool,A workflow tool designed to generate deep-learning based models of interatomic potential energy and force fields using active learning strategies.,M2;M2-03,workflow_automation;active_learning,workflow,Python,https://github.com/deepmodeling/dpgen,,LGPL-3.0,active-learning;workflow;deep-potential
444,ReactBench,Benchmark for ML-enhanced transition state search,A benchmarking tool and source code for harnessing machine learning to enhance transition state search with interatomic potentials and generative models.,M2;M2-03;Chemistry,benchmarking;transition_state_search,library,Python,https://github.com/deepprinciple/ReactBench,,None,transition-state;benchmark;generative-models
445,OMNI-P2x,Universal neural network potential for excited states,A universal neural network potential designed specifically for modeling excited states in atomistic systems.,M2;M2-03,potential_model;excited_states,solver,Jupyter Notebook,https://github.com/dralgroup/omni-p2x,,MIT,excited-states;neural-network-potential;universal-potential
446,curator,Tool for building robust machine learning potentials,A tool designed to assist in the curation of data and building of robust machine learning potentials for atomistic simulations.,M2;M2-03,data_curation;potential_training,library,Python,https://github.com/dtu-energy/curator,,MIT,mlip;data-curation;atomistic-simulation
447,phi-module,Electrostatics from Laplacian Eigenbasis for NNIPs,A module implementing electrostatics from Laplacian Eigenbasis for Neural Network Interatomic Potentials (NNIPs).,M2;M2-03,potential_component;electrostatics,library,Python,https://github.com/dunnolab/phi-module,,None,electrostatics;nnip;laplacian-eigenbasis
448,qcnn-hep,Quantum CNN for HEP event classification,A package demonstrating and implementing Quantum Convolutional Neural Networks (QCNN) for classifying High Energy Physics (HEP) events from particle image data.,Physics;HEP,classification;quantum_machine_learning,library,Jupyter Notebook,https://github.com/ericardomuten/qcnn-hep,,MIT,hep;qcnn;quantum-machine-learning
449,neural-optimiser,Batched optimisation algorithms for NNP driven MD,A library providing batched optimization algorithms specifically tailored for molecular dynamics simulations driven by neural network potentials.,M2;M2-03,optimization;molecular_dynamics,library,Python,https://github.com/erwallace/neural-optimiser,,Apache-2.0,optimization;nnp;molecular-dynamics
450,PnP-MACE,PnP algorithm and MACE framework for image reconstruction,Utilities and methods to use the Plug-and-Play (PnP) algorithm and Multi-Agent Consensus Equilibrium (MACE) framework for image reconstruction problems like CT.,Medical Physics;Imaging,image_reconstruction;inverse_problems,library,Python,https://github.com/gbuzzard/PnP-MACE,,None,image-reconstruction;ct;pnp-algorithm
451,painn-jax,JAX implementation of PaiNN model,An implementation of the PaiNN (Polarizable Atom Interaction Neural Network) model using the JAX framework.,M2;M2-03,potential_implementation;modeling,library,Python,https://github.com/gerkone/painn-jax,,MIT,painn;jax;neural-network-potential
452,grappa,Machine learned Molecular Mechanics force field,A machine learned Molecular Mechanics force field integrated into GROMACS and OpenMM for molecular simulations.,M2;M2-03,force_field;molecular_dynamics,solver,Python,https://github.com/graeter-group/grappa,,GPL-3.0,force-field;gromacs;openmm;molecular-mechanics
453,OpenMACE,Open-source C++ implementation of the MACE machine learning force field architecture,"OpenMACE is an open-source C++ implementation of the MACE (Multi-Atomic Cluster Expansion) architecture, designed for efficient and accurate molecular dynamics simulations using equivariant message passing neural networks.",M2;M2-03,simulation;training,solver,C++,https://github.com/heronsystems/OpenMACE,,GPL-3.0,mace;force-field;molecular-dynamics;cpp
454,pantea,JAX-based Python library for developing machine learning interatomic potentials,"Pantea is a library built on JAX for creating and training machine learning interatomic potentials, leveraging JAX's automatic differentiation and compilation features for efficient potential development.",M2;M2-03,training;modeling,library,Python,https://github.com/hghcomphys/pantea,,NOASSERTION,jax;interatomic-potential;machine-learning
455,DAS,Dual Adaptive Sampling method for training machine learning interatomic potentials,"DAS (Dual Adaptive Sampling) provides a strategy for active learning in the construction of machine learning interatomic potentials, helping to select the most informative configurations for training.",M2;M2-03,active_learning;training,library,Python,https://github.com/hlyang1992/das,,None,active-learning;sampling;interatomic-potential
456,DAC-SIM,Molecular simulation package integrating MLFFs for Direct Air Capture in MOFs,DAC-SIM is a molecular simulation package designed to integrate machine learning force fields (MLFFs) specifically for studying Metal-Organic Frameworks (MOFs) in the context of Direct Air Capture (DAC) applications.,M2;M2-03,simulation;modeling,workflow,Python,https://github.com/hspark1212/DAC-SIM,,MIT,mof;direct-air-capture;mlff;molecular-simulation
457,mlipaudit,Benchmarking and validation toolkit for Machine Learning Interatomic Potentials,"mlipaudit provides tools for benchmarking, validating, and auditing the performance and accuracy of Machine Learning Interatomic Potentials (MLIPs).",M2;M2-03,validation;quality_control,library,Python,https://github.com/instadeepai/mlipaudit,,None,benchmarking;validation;mlip
458,ASE_ANI,ASE interface for the ANI-1 neural network potential,"ASE_ANI provides a Python interface integrating the ANI-1 neural network potential with the Atomic Simulation Environment (ASE), enabling molecular dynamics and optimization using ANI potentials.",M2;M2-03,simulation;modeling,library,Python,https://github.com/isayev/ASE_ANI,,MIT,ani;ase;neural-network-potential
459,amaceing_toolkit,Toolkit for input generation and post-processing of ML potential simulations,"A Python package designed to facilitate the creation of input files for various simulation codes (CP2K, MACE-torch, MatterSim, etc.) and to handle the post-processing and evaluation of simulation results.",M2;M2-03,data_processing;workflow_management,workflow,Python,https://github.com/jhaens/amaceing_toolkit,,NOASSERTION,pre-processing;post-processing;mace;cp2k
460,augment-atoms,Dataset augmentation library for atomistic machine learning,"A Python library specifically designed for performing data augmentation on atomistic datasets, enhancing the training of machine learning interatomic potentials.",M2;M2-03,data_processing;augmentation,library,Python,https://github.com/jla-gardner/augment-atoms,,MIT,data-augmentation;atomistic-data;machine-learning
461,MDsim,Simulator for training and running MD with ML force fields,"A package for training machine learning force fields and performing molecular dynamics simulations, associated with a TMLR 2023 publication.",M2;M2-03,simulation;training,solver,Python,https://github.com/kyonofx/MDsim,,MIT,molecular-dynamics;mlff;simulator
462,catalyticLAM,Universal Catalytic Large Atomic Model for catalysis simulations,"A machine-learning-based interatomic potential tool specifically designed for catalysis applications, aiming to provide a universal large atomic model.",M2;M2-03,simulation;modeling,solver,Python,https://github.com/lalaheihaihei/catalyticLAM,,GPL-3.0,catalysis;large-atomic-model;interatomic-potential
463,ALF,Active Learning Framework for machine-learned interatomic potentials,ALF is a framework developed at LANL for performing active learning to efficiently train machine-learned interatomic potentials by automatically selecting training configurations.,M2;M2-03,active_learning;training,workflow,Python,https://github.com/lanl/ALF,,NOASSERTION,active-learning;lanl;interatomic-potential
464,hippynn,Python library for atomistic machine learning and neural networks,"Hippynn is a modular library for building and training atomistic machine learning models, particularly neural network potentials, developed at LANL.",M2;M2-03,training;modeling,library,Python,https://github.com/lanl/hippynn,,NOASSERTION,atomistic-ml;neural-networks;lanl
465,alchemical-mlip,Alchemical machine learning interatomic potentials,"A tool for developing and using alchemical machine learning interatomic potentials, enabling exploration of chemical space through alchemical changes.",M2;M2-03,modeling;simulation,library,Jupyter Notebook,https://github.com/learningmatter-mit/alchemical-mlip,,MIT,alchemy;mlip;chemical-space
466,phonon_uMLIP,Phonon property calculation using universal MLIPs,A tool to calculate phonon properties of materials by leveraging multiple universal machine learning interatomic potentials.,M2;M2-03,property_prediction;analysis,library,Python,https://github.com/maplewen4/phonon_uMLIP,,MIT,phonon;mlip;material-properties
467,deeptime,Python library for analysis of time-series data and molecular dynamics,"Deeptime is a Python library for the analysis of time-series data, specifically focused on molecular dynamics, offering tools for dimensionality reduction, clustering, and Markov state modeling.",M2;M2-03,analysis;dimensionality_reduction,library,Jupyter Notebook,https://github.com/markovmodel/deeptime,,LGPL-3.0,molecular-dynamics;time-series;markov-models
468,HDNNP,Implementation of High Dimensional Neural Network Potentials,A Python implementation of High Dimensional Neural Network Potentials (HDNNP) for atomistic simulations.,M2;M2-03,modeling;training,library,Python,https://github.com/masayoshi-ogura/HDNNP,,MIT,hdnnp;neural-network-potential;atomistic-simulation
469,mlearn,Benchmark suite for machine learning interatomic potentials,"A benchmarking suite designed to evaluate and compare machine learning interatomic potentials for materials, facilitating the assessment of model performance and accuracy.",Materials;M2;M2-03,benchmarking;validation,library,Python,https://github.com/materialyzeai/mlearn,,BSD-3-Clause,benchmark;interatomic-potentials;machine-learning
470,MACE-H,GNN for predicting electronic Hamiltonians in atomic orbital representation,"A Graph Neural Network (GNN) based model for predicting electronic Hamiltonians in atomic orbital representation, incorporating many-body messages for accurate electronic structure prediction.",Materials;M2;M2-03,electronic_structure_prediction;modeling,solver,Jupyter Notebook,https://github.com/maurergroup/MACE-H,,MIT,hamiltonian;gnn;electronic-structure
471,featomic,Library for computing representations for atomistic machine learning,"A library dedicated to computing atomic representations (descriptors) for atomistic machine learning, serving as a core component in ML potential workflows.",Materials;M2;M2-03,feature_extraction;representation_learning,library,Rust,https://github.com/metatensor/featomic,,BSD-3-Clause,atomistic-representations;descriptors;rust
472,metatensor,Sparse tensor data format for atomistic machine learning,"A self-describing sparse tensor data format and library designed to handle data for atomistic machine learning and other scientific computing tasks, ensuring interoperability and efficiency.",Materials;M2;M2-03,data_processing;infrastructure,library,Python,https://github.com/metatensor/metatensor,,BSD-3-Clause,tensor-format;atomistic-ml;data-structure
473,metatomic,Portable atomistic machine learning models library,"A library enabling the use of atomistic machine learning models across different environments and applications, focusing on portability and deployment of trained potentials.",Materials;M2;M2-03,inference;deployment,library,C,https://github.com/metatensor/metatomic,,BSD-3-Clause,inference;portability;atomistic-models
474,metatrain,Training and fine-tuning toolkit for atomistic ML models,"A toolkit to train, fine-tune, and manipulate machine learning models for atomistic systems, streamlining the model development workflow in materials science.",Materials;M2;M2-03,training;model_optimization,workflow,Python,https://github.com/metatensor/metatrain,,BSD-3-Clause,training-pipeline;fine-tuning;atomistic-ml
475,MatterSim,"Deep learning atomistic model across elements, temperatures and pressures","A deep learning-based atomistic model capable of simulating materials across a wide range of elements, temperatures, and pressures, designed for broad applicability in materials simulation.",Materials;M2;M2-03,simulation;modeling,solver,Jupyter Notebook,https://github.com/microsoft/mattersim,,MIT,deep-learning;molecular-dynamics;universal-potential
476,Allegro,Scalable equivariant deep learning interatomic potentials,"An open-source code for building highly scalable and accurate E(3)-equivariant deep learning interatomic potentials, designed for efficient molecular dynamics simulations.",Materials;M2;M2-03,modeling;potential_generation,solver,Python,https://github.com/mir-group/allegro,,MIT,equivariant-gnn;interatomic-potential;molecular-dynamics
477,lineshape_tools,Tools for evaluating electron-phonon coupling effects on optical properties,"Python software implementing the formulation for evaluating the effects of electron-phonon coupling on the optical properties of defects, designed to interface with the MACE machine learning interatomic potential.",Materials;M2;M2-03,analysis;property_prediction,library,Python,https://github.com/mturiansky/lineshape_tools,,MIT,electron-phonon;optical-properties;mace-interface
478,pesnet,Ab-Initio Potential Energy Surfaces by Pairing GNNs with Neural Wave Functions,"Implementation of PESNet for generating ab-initio potential energy surfaces by combining Graph Neural Networks with Neural Wave Functions, enabling sampling-free inference.",Materials;M2;M2-03,modeling;potential_energy_surface,solver,Python,https://github.com/n-gao/pesnet,,NOASSERTION,potential-energy-surface;neural-wave-functions;gnn
479,alebrew,Uncertainty-biased molecular dynamics for learning interatomic potentials,"A tool implementing uncertainty-biased molecular dynamics to facilitate the learning of uniformly accurate interatomic potentials, improving the robustness of ML potentials.",Materials;M2;M2-03,training;active_learning,workflow,Python,https://github.com/nec-research/alebrew,,NOASSERTION,uncertainty-quantification;active-learning;molecular-dynamics
480,PaiNN-model,Implementation of PaiNN model for ML interatomic potentials,An efficient implementation of the PaiNN (Polarizable Atom Interaction Neural Network) model for constructing machine learning interatomic potentials.,Materials;M2;M2-03,modeling;potential_generation,solver,Python,https://github.com/nityasagarjena/PaiNN-model,,None,painn;interatomic-potential;representation-learning
481,NNPOps,High-performance operations for neural network potentials,"A library providing high-performance implementations of operations commonly used in neural network potentials, optimized for efficiency in atomistic simulations.",Materials;M2;M2-03,simulation;acceleration,library,C++,https://github.com/openmm/NNPOps,,NOASSERTION,optimization;neural-network-potentials;cuda
482,charge_transfer_nnp,Graph neural network potential incorporating charge transfer effects,A graph neural network-based interatomic potential that explicitly models charge transfer phenomena. This tool is designed to improve the accuracy of atomistic simulations where charge redistribution plays a critical role.,Materials;Chemistry,potential_learning;molecular_dynamics,model,Python,https://github.com/pfnet-research/charge_transfer_nnp,,MIT,gnn;charge-transfer;neural-network-potential;atomistic-simulation
483,BOMLIP-CSP,Framework integrating MLIPs with batched optimization for crystal structure prediction,An open-source framework that combines machine learning interatomic potentials (MLIPs) with a tailored batched optimization strategy. It enables rapid and unbiased crystal structure prediction (CSP) across a full density range.,Materials,crystal_structure_prediction;optimization,workflow,Python,https://github.com/pic-ai-robotic-chemistry/BOMLIP-CSP,,MIT,crystal-structure-prediction;mlip;optimization;materials-discovery
484,lpNNPS4SPH,Low-precision nearest neighbor particle searching for SPH simulations,"A CUDA-based implementation of a nearest neighboring particle searching algorithm optimized for Smoothed Particle Hydrodynamics (SPH) simulations, utilizing low-precision arithmetic for performance acceleration.",Physics,particle_search;sph_simulation,library,Cuda,https://github.com/pnnl/lpNNPS4SPH,,NOASSERTION,sph;cuda;particle-search;simulation
485,VERTEX,Virtual Electrode Recording Tool for EXtracellular potentials,A MATLAB simulator for spatially realistic Local Field Potential (LFP) simulation in spiking neural networks. It allows researchers to model extracellular potentials generated by large populations of neurons.,Neuroscience,electrophysiology_simulation;neural_network_simulation,solver,MATLAB,https://github.com/richardtomsett/vertexsimulator,http://vertexsimulator.org,NOASSERTION,neuroscience;simulation;lfp;spiking-neural-networks
486,EquivariantMultipoleGNN,Equivariant GNN for atomic multipole prediction,An implementation of an equivariant Graph Neural Network designed to predict atomic multipoles up to quadrupoles. This tool is useful for modeling electrostatic interactions in molecular systems.,Chemistry;Materials,property_prediction;electrostatics,model,Jupyter Notebook,https://github.com/rinikerlab/EquivariantMultipoleGNN,,MIT,gnn;multipoles;equivariance;molecular-modeling
487,GNNParametrizedFF,Graph Neural Network Parametrized Potentials,Models and tools for 'Regularized by Physics: Graph Neural Network Parametrized Potentials for the Description of Intermolecular Interactions'. It provides a method to parametrize force fields using GNNs.,Chemistry;Materials,force_field_parametrization;interaction_modeling,model,Python,https://github.com/rinikerlab/GNNParametrizedFF,,MIT,gnn;force-field;intermolecular-interactions;physics-informed
488,torchani-amber,Interface for using ANI-style NN potentials in Amber MD,An interface that enables the use of ANI-style and other neural network interatomic potentials (NN-IPs) within the Amber molecular dynamics software suite. It supports both sander and pmemd engines.,Chemistry;Materials,molecular_dynamics;interface,library,Fortran,https://github.com/roitberg-group/torchani-amber,,MIT,amber;torchani;molecular-dynamics;interface
489,atomate2_ffforge,Active-learning workflow for building MLIPs using atomate2,"A DIRECT-driven, active-learning workflow integrated with the atomate2/jobflow ecosystem. It autonomously builds machine-learning interatomic potentials (MLIPs) for various materials such as batteries and catalysts.",Materials,workflow_automation;potential_training,workflow,Python,https://github.com/rsilvabuarque/atomate2_ffforge,,None,atomate2;active-learning;mlip;workflow
490,cuda-mace,CUDA implementations of MACE models,"Provides CUDA-accelerated implementations of MACE (Machine Learning Atomic Cluster Expansion) models, enabling faster inference and simulation for atomistic systems on GPU hardware.",Materials;Physics,inference_acceleration;molecular_dynamics,library,C++,https://github.com/rubber-duck-debug/cuda-mace,,NOASSERTION,cuda;mace;acceleration;atomistic-simulation
491,ParetoCSP,Crystal structure prediction using NN potential and Pareto genetic algorithm,A tool for crystal structure prediction that utilizes a neural network potential combined with an age-fitness Pareto genetic algorithm to explore and optimize crystal structures.,Materials,crystal_structure_prediction;optimization,solver,Python,https://github.com/sadmanomee/ParetoCSP,,None,crystal-structure-prediction;genetic-algorithm;neural-network-potential
492,GAIA,Automated generation of reactive MLIP datasets,"GAIA automates the process of generating datasets for reactive machine learning interatomic potentials (MLIPs), facilitating the training of robust potentials for atomistic simulations.",Materials;Chemistry,dataset_generation;potential_training,workflow,Python,https://github.com/samsungDS-PoCs/GAIA,,NOASSERTION,dataset-generation;mlip;reactive-potentials;automation
493,openmm_constV,OpenMM plugin for constant potential molecular dynamics,A plugin for the OpenMM simulation toolkit that enables running molecular dynamics simulations under constant electrical potential conditions using the Image Charge method.,Chemistry;Materials,molecular_dynamics;electrochemistry,library,C++,https://github.com/scychon/openmm_constV,,None,openmm;constant-potential;molecular-dynamics;plugin
494,sGDML,Reference implementation of the Symmetric Gradient Domain Machine Learning model,"The reference implementation for the Symmetric Gradient Domain Machine Learning (sGDML) model, a machine learning method for constructing accurate and data-efficient force fields for molecules and materials.",Chemistry;Materials,force_field_learning;molecular_dynamics,solver,Python,https://github.com/stefanch/sGDML,http://www.sgdml.org/,MIT,sgdml;force-field;machine-learning;molecular-dynamics
