id,name,one_line_profile,detailed_description,domains,subtask_category,application_level,primary_language,repo_url,help_website,license,tags
317,SGCNN,Slab graph convolutional neural networks for surface properties,A specialized Graph Convolutional Neural Network designed for slab structures to predict surface-related material properties.,M3;M3-03,property_prediction;surface_science,solver,Python,https://github.com/myungjoon/SGCNN,,None,surface-properties;gnn;slab-structures
318,FragNet,Graph Neural Network for molecular property prediction,"A Graph Neural Network model designed for molecular property prediction, featuring interpretability capabilities.",M3;M3-03,property_prediction;interpretability,solver,Python,https://github.com/pnnl/FragNet,,NOASSERTION,gnn;molecular-property;interpretability
319,GNN-materials,Graph Neural Networks for computational materials science,A codebase implementing Graph Neural Networks specifically for applications in computational materials science.,M3;M3-03,property_prediction;materials_modeling,solver,Python,https://github.com/polbeni/GNN-materials,,MIT,gnn;computational-materials-science
320,combined-gnn,GNN for predicting energy of crystal structures,A graph neural network implementation for predicting the energy of both known and hypothetical crystal structures.,M3;M3-03,energy_prediction;crystal_structure,solver,Python,https://github.com/prashungorai/combined-gnn,,None,gnn;energy-prediction;crystals
321,deepKNet,PointNet-based 3D deep learning for crystalline materials,"A 3D deep learning model based on PointNet, designed to decode structure-property relationships for generic crystalline materials.",M3;M3-03,property_prediction;structure_property_relationship,solver,Python,https://github.com/raymond-yiqunwang/deepKNet,,MIT,pointnet;3d-deep-learning;crystals
322,pGNN,Featurizer using pretrained GNNs for materials,A utility that uses pretrained graph neural networks to extract features from materials structures for downstream tasks.,M3;M3-03,feature_extraction;materials_informatics,library,Jupyter Notebook,https://github.com/rogeriog/pGNN,,MIT,featurizer;gnn;materials-structure
323,MOF-CGCNN,CGCNN variant for predicting MOF methane uptake,A modified Crystal Graph Convolutional Neural Network (CGCNN) designed to efficiently and accurately predict methane volumetric uptakes in Metal-Organic Frameworks (MOFs).,M3;M3-03,property_prediction;mofs;gas_uptake,solver,Python,https://github.com/ruihwang/MOF-CGCNN,,MIT,mof;cgcnn;methane-uptake
324,OOD_Materials_Benchmark,Benchmark for out-of-distribution material property prediction,A benchmark study and codebase for evaluating structure-based out-of-distribution (OOD) material property prediction models.,M3;M3-03,benchmarking;ood_detection,dataset,,https://github.com/sadmanomee/OOD_Materials_Benchmark,,None,benchmark;out-of-distribution;materials-property
325,ACANet,Activity-Cliff Awareness Graph Learning for Molecular Properties,A graph learning model that incorporates activity-cliff awareness to enable robust molecular property prediction.,M3;M3-03,property_prediction;molecular_modeling,solver,Jupyter Notebook,https://github.com/shenwanxiang/ACANet,,GPL-3.0,graph-learning;molecular-property;activity-cliff
326,mt-cgcnn,Multitask CGCNN for material property prediction,An integration of Crystal Graph Convolutional Neural Network (CGCNN) with multitask learning techniques for predicting multiple material properties simultaneously.,M3;M3-03,property_prediction;multitask_learning,solver,Python,https://github.com/soumyasanyal/mt-cgcnn,,NOASSERTION,cgcnn;multitask-learning;materials-science
327,matbench-genmetrics,Generative materials benchmarking metrics,"A Python library providing metrics for benchmarking generative models in materials science, inspired by Guacamol and CDVAE.",M3;M3-03,benchmarking;generative_models,library,Jupyter Notebook,https://github.com/sparks-baird/matbench-genmetrics,,MIT,generative-models;metrics;benchmarking
328,GATGNN,Graph convolutional neural networks with global attention for materials property prediction,A PyTorch implementation of Graph Convolutional Neural Networks with Global Attention (GATGNN) designed for improved prediction of materials properties from crystal structures.,M3;M3-03,property_prediction;structure_property_relationship,solver,Python,https://github.com/superlouis/GATGNN,,MIT,materials-science;gnn;property-prediction;deep-learning
329,PAR,Property-Aware Relation Networks for few-shot molecular property prediction,"Implementation of Property-Aware Relation Networks (PAR) for few-shot molecular property prediction, as presented at NeurIPS 2021. It addresses the data scarcity issue in molecular discovery.",M3;M3-03,property_prediction;few_shot_learning,solver,Python,https://github.com/tata1661/PAR-NeurIPS21,,None,molecular-property-prediction;few-shot-learning;relation-networks;neurips
330,deeperGATGNN,Scalable graph neural networks for materials property prediction,An advanced implementation of Graph Neural Networks (GATGNN) designed for scalability and improved accuracy in predicting materials properties from crystal structures.,M3;M3-03,property_prediction;structure_property_relationship,solver,Python,https://github.com/usccolumbia/deeperGATGNN,,MIT,materials-science;gnn;deep-learning;property-prediction
331,ALIGNN,Atomistic Line Graph Neural Network for materials property prediction,"The Atomistic Line Graph Neural Network (ALIGNN) is a model that performs message passing on both the interatomic bond graph and its corresponding line graph, capturing many-body interactions for accurate materials property prediction.",M3;M3-03,property_prediction;force_field_learning,solver,Python,https://github.com/usnistgov/alignn,https://jarvis.nist.gov/,None,materials-science;gnn;line-graph;atomistic-modeling
332,soapgp,Molecular Property Prediction using Gaussian Processes with SOAP kernel,"A library for molecular property prediction utilizing Gaussian Processes (GP) combined with the Smooth Overlap of Atomic Positions (SOAP) kernel, enabling accurate predictions based on atomic environments.",M3;M3-03,property_prediction;molecular_modeling,library,Python,https://github.com/wjm41/soapgp,,MIT,gaussian-processes;soap-kernel;molecular-properties;machine-learning
333,K-BERT,Knowledge-based BERT for molecular property prediction,"Implementation of K-BERT (Knowledge-enabled BERT) adapted for molecular property prediction, leveraging pre-trained language models and domain knowledge for chemical tasks.",M3;M3-03,property_prediction;molecular_representation,solver,Python,https://github.com/wzxxxx/Knowledge-based-BERT,,None,bert;nlp-for-science;molecular-properties;deep-learning
334,GLAM,Adaptive graph learning for molecular interactions and properties,Implementation of the GLAM (Graph Learning with Adaptive Mechanisms) method for automated prediction of molecular interactions and properties.,M3;M3-03,property_prediction;interaction_prediction,solver,Python,https://github.com/yvquanli/GLAM,,MIT,graph-learning;molecular-interactions;deep-learning
335,MGSSL,Motif-based Graph Self-Supervised Learning for Molecular Property Prediction,A framework for molecular property prediction that utilizes motif-based graph self-supervised learning to learn molecular representations.,M3;M3-03,property_prediction;representation_learning,solver,Python,https://github.com/zaixizhang/MGSSL,,Apache-2.0,self-supervised-learning;gnn;molecular-properties;motif-based
336,Molecular-graph-BERT,Semi-supervised learning for molecular property prediction using Graph BERT,A model combining Graph Neural Networks and BERT architecture for semi-supervised learning on molecular graphs to predict molecular properties.,M3;M3-03,property_prediction;semi_supervised_learning,solver,Jupyter Notebook,https://github.com/zhang-xuan1314/Molecular-graph-BERT,,None,bert;molecular-graphs;semi-supervised;deep-learning
337,Meta-MGNN,Few-Shot Graph Learning for Molecular Property Prediction,A meta-learning framework based on Graph Neural Networks designed for few-shot molecular property prediction tasks.,M3;M3-03,property_prediction;few_shot_learning,solver,Python,https://github.com/zhichunguo/Meta-MGNN,,None,meta-learning;few-shot;molecular-properties;gnn
338,Bgolearn,Bayesian global optimization framework for materials design,"Bgolearn is a Python package for Bayesian global optimization, specifically designed for materials discovery and design. It provides an efficient framework for finding optimal material compositions or processing parameters with uncertainty quantification.",M3;M3-04,bayesian_optimization;materials_design;uncertainty_quantification,library,Python,https://github.com/Bin-Cao/Bgolearn,,MIT,bayesian-optimization;materials-science;active-learning
339,DeepMol,Machine and Deep Learning Framework for Computational Chemistry,"DeepMol is a Python framework that simplifies the machine learning pipeline for drug discovery and computational chemistry. It offers tools for data processing, feature engineering, model training (including deep learning), and hyperparameter optimization.",M3;M3-04,molecular_property_prediction;drug_discovery;feature_engineering,library,Python,https://github.com/BioSystemsUM/DeepMol,,BSD-2-Clause,computational-chemistry;drug-discovery;machine-learning
340,conformalpredictor,Conformal prediction for machine learning accelerated docking screens,"A Python package implementing conformal prediction frameworks to calibrate machine learning models used in virtual screening and docking. It provides statistically valid confidence intervals for predictions, enhancing the reliability of drug discovery pipelines.",M3;M3-04,uncertainty_quantification;virtual_screening;docking,library,Python,https://github.com/Carlssonlab/conformalpredictor,,MIT,conformal-prediction;docking;drug-discovery
341,Emukit,Toolbox for decision making and uncertainty quantification,"Emukit is a highly adaptable Python toolkit for enriching decision-making processes with uncertainty quantification. It supports multi-fidelity modeling, Bayesian optimization, experimental design, and sensitivity analysis, applicable to various scientific simulation tasks.",M3;M3-04,uncertainty_quantification;bayesian_optimization;experimental_design,library,Python,https://github.com/EmuKit/emukit,https://emukit.github.io/,Apache-2.0,uncertainty-quantification;bayesian-optimization;emulation
342,astartes,Rigorous data splitting and sampling for scientific machine learning,astartes is a Python package designed to provide rigorous and reproducible data splitting and sampling algorithms for chemical and materials science datasets. It addresses the challenge of out-of-distribution generalization by offering various structural and property-based splitting methods.,M3;M3-04,data_splitting;sampling;validation,library,Python,https://github.com/JacksonBurns/astartes,https://jacksonburns.github.io/astartes/,MIT,data-splitting;cheminformatics;machine-learning
343,DeepDelta,Pairwise deep learning for molecular property difference prediction,DeepDelta is a deep learning approach based on Chemprop that predicts the difference in properties between two molecules (delta learning). It is particularly useful for optimization tasks where the relative improvement between molecular analogs is of interest.,M3;M3-04,property_prediction;delta_learning;molecular_optimization,library,Python,https://github.com/RekerLab/DeepDelta,,NOASSERTION,deep-learning;molecular-property;chemprop
344,UQpy,General purpose toolbox for uncertainty quantification in physical systems,"UQpy (Uncertainty Quantification with python) is a comprehensive toolbox for modeling uncertainty in physical and mathematical systems. It includes modules for uncertainty propagation, reliability analysis, stochastic process generation, and inference.",M3;M3-04,uncertainty_quantification;reliability_analysis;stochastic_modeling,library,Python,https://github.com/SURGroup/UQpy,https://uqpy.readthedocs.io/,MIT,uncertainty-quantification;stochastic-processes;reliability
345,PolymerAssembler,Tool for constructing atomistic 3D polymer models for MD simulations,"A Python-based tool designed for the quick construction of atomistic 3D polymer models based on a probabilistic Markov model, facilitating molecular mechanics force field simulations.",M3,structure_generation;molecular_modeling,solver,Python,https://github.com/VedatDurmaz/PolymerAssembler,,LGPL-3.0,polymers;molecular-dynamics;structure-building
346,MUBen,Benchmark suite for uncertainty quantification in molecular representation models,"A benchmarking tool designed to evaluate the uncertainty quantification capabilities of various molecular representation models, aiding in the development of reliable AI4Science models.",M3;M3-04,benchmarking;uncertainty_quantification,dataset,Python,https://github.com/Yinghao-Li/MUBen,,Apache-2.0,uncertainty-quantification;molecular-representation;benchmark
347,chemprop (UQ fork),Molecular property prediction with fast uncertainty quantification,"A version of Chemprop focused on fast and scalable uncertainty quantification for neural molecular property prediction, enabling guided virtual screening and accelerated optimization.",M3;M3-04,property_prediction;uncertainty_quantification,solver,Python,https://github.com/aamini/chemprop,,MIT,molecular-property-prediction;uncertainty-quantification;deep-learning
348,dionysus,Analysis tool for calibration and generalizability of probabilistic molecular models,"A library for analyzing the calibration, performance, and generalizability of probabilistic models, specifically tailored for small molecular datasets in materials informatics.",M3;M3-04,uncertainty_quantification;model_calibration,library,Python,https://github.com/aspuru-guzik-group/dionysus,,MIT,calibration;uncertainty;small-data
349,WebPlotDigitizer,Tool to extract numerical data from plot images,"A computer vision assisted tool widely used in scientific research to extract underlying numerical data from images of plots, charts, and graphs found in publications.",M3,data_extraction;digitization,application,JavaScript,https://github.com/automeris-io/WebPlotDigitizer,https://automeris.io/WebPlotDigitizer/,AGPL-3.0,data-extraction;digitization;computer-vision
350,OpenGeoSysUncertaintyQuantification.jl,Uncertainty quantification toolbox for OpenGeoSys 6,"A Julia-based toolbox designed to perform uncertainty quantification specifically for OpenGeoSys 6 simulations, aiding in geological and hydrological modeling.",M3;M3-04,uncertainty_quantification;simulation_analysis,library,Julia,https://github.com/baxmittens/OpenGeoSysUncertaintyQuantification.jl,,MIT,opengeosys;uncertainty-quantification;julia
351,chemprop-contrib,Community extensions for Chemprop,A collection of community-contributed extensions and additional features for the Chemprop machine learning package.,M3,property_prediction,library,Python,https://github.com/chemprop/chemprop-contrib,,None,extensions;chemprop
352,GrainLearning,Bayesian uncertainty quantification toolbox for granular materials modeling,"A Bayesian uncertainty quantification toolbox designed for discrete and continuum models of granular materials, facilitating parameter estimation and model validation.",M3;M3-04,uncertainty_quantification;parameter_estimation;granular_mechanics,library,Python,https://github.com/chyalexcheng/grainLearning,https://github.com/GrainLearning/grainLearning,GPL-2.0,uncertainty-quantification;granular-materials;bayesian-inference
353,OpenCossan,Toolbox for uncertainty quantification and management,"An open and free toolbox for uncertainty quantification, reliability analysis, and risk management, offering advanced algorithms for simulation and sensitivity analysis.",M3;M3-04,uncertainty_quantification;reliability_analysis;sensitivity_analysis,library,MATLAB,https://github.com/cossan-working-group/OpenCossan,,None,uncertainty-quantification;reliability-analysis;matlab
354,DIG,Library for graph deep learning research with interpretability focus,"Dive into Graphs (DIG) is a library for graph deep learning research, providing unified implementations for graph generation, self-supervised learning, and interpretability (explainability) of GNNs.",M3;M3-04,graph_learning;interpretability;graph_generation,library,Python,https://github.com/divelab/DIG,,GPL-3.0,graph-neural-networks;interpretability;explainable-ai
355,graphpatch,Library for activation patching on PyTorch neural networks,A library for performing activation patching (causal tracing) on PyTorch models to interpret model behavior and internal representations.,M3;M3-04,interpretability;activation_patching;model_analysis,library,Python,https://github.com/evan-lloyd/graphpatch,,MIT,interpretability;pytorch;mechanistic-interpretability
356,DimeNet,Directional Message Passing for Molecular Graphs,"Implementation of DimeNet and DimeNet++ models for molecular property prediction, utilizing directional message passing to capture 3D structural information.",M3,property_prediction;molecular_representation,library,Python,https://github.com/gasteigerjo/dimenet,,NOASSERTION,gnn;molecular-graphs;deep-learning
357,pyg_chemprop,PyTorch Geometric implementation of ChemProp,"A concise and customizable reimplementation of the ChemProp message passing neural network using PyTorch Geometric, facilitating molecular property prediction.",M3,property_prediction;molecular_representation,library,Python,https://github.com/itakigawa/pyg_chemprop,,MIT,chemprop;pytorch-geometric;gnn
358,chaospy,Toolbox for uncertainty quantification using polynomial chaos expansions,A numerical toolbox for performing uncertainty quantification using polynomial chaos expansions and Monte Carlo integration methods.,M3;M3-04,uncertainty_quantification;sensitivity_analysis;numerical_methods,library,Python,https://github.com/jonathf/chaospy,https://chaospy.readthedocs.io/,MIT,uncertainty-quantification;polynomial-chaos;monte-carlo
359,Robert,Automated machine learning protocols for chemistry,A tool for automated machine learning in chemistry that streamlines the process from descriptors or SMILES to publication-quality results.,M3,automl;property_prediction;cheminformatics,workflow,Python,https://github.com/jvalegre/robert,,MIT,automl;chemistry;machine-learning
360,GEOM,Energy-annotated molecular conformations dataset and utilities,"A large-scale dataset of molecular conformations with energy annotations, essential for training machine learning models in chemistry and materials science to predict 3D structures and energetic properties.",M3;Chemistry,molecular_conformation;dataset_access,dataset,Jupyter Notebook,https://github.com/learningmatter-mit/geom,,None,molecular-conformations;dataset;chemistry
361,Gauche,Gaussian Process library for chemistry,"A library designed for applying Gaussian Processes to chemical data, providing uncertainty quantification and interpretability for molecular property predictions.",M3;M3-04;Chemistry,uncertainty_quantification;property_prediction,library,Jupyter Notebook,https://github.com/leojklarner/gauche,https://gauche.readthedocs.io,MIT,gaussian-processes;uncertainty-quantification;chemistry
362,RL-GraphINVENT,Graph-based molecular generation platform using RL,"A platform for graph-based targeted molecular generation using graph neural networks and reinforcement learning, designed to probabilistically generate new molecules with desired property profiles.",M3;Chemistry,molecular_generation;structure_design,platform,Python,https://github.com/olsson-group/RL-GraphINVENT,,MIT,molecular-generation;reinforcement-learning;graph-neural-networks
363,PyTorch Geometric,Graph Neural Network Library for PyTorch,"A geometric deep learning extension library for PyTorch, widely used in scientific domains for modeling molecular graphs, crystal structures, and other structured scientific data.",M3;General Science,graph_learning;geometric_deep_learning,library,Python,https://github.com/pyg-team/pytorch_geometric,https://pytorch-geometric.readthedocs.io,MIT,gnn;graph-neural-networks;geometric-deep-learning
364,pygpc,Sensitivity and uncertainty analysis toolbox,"A toolbox for sensitivity and uncertainty analysis based on Generalized Polynomial Chaos (gPC), enabling efficient quantification of uncertainties in scientific models and simulations.",M3-04;General Science,uncertainty_quantification;sensitivity_analysis,library,Jupyter Notebook,https://github.com/pygpc-polynomial-chaos/pygpc,https://pygpc.readthedocs.io,GPL-3.0,uncertainty-analysis;polynomial-chaos;sensitivity-analysis
365,ChemBench,Molecular benchmark datasets and utilities,"A repository containing benchmark datasets (MoleculeNet, MolMapNet) and utilities for evaluating molecular property prediction models, facilitating standardized comparison of algorithms.",M3;Chemistry,benchmarking;dataset_access,dataset,HTML,https://github.com/shenwanxiang/ChemBench,,NOASSERTION,benchmark;moleculenet;chemistry
366,Uncertainpy,Uncertainty quantification and sensitivity analysis toolbox for computational neuroscience,"A Python toolbox tailored for performing uncertainty quantification and sensitivity analysis on computational neuroscience models, enabling the analysis of how model parameters affect outputs.",Neuroscience;M3-04,uncertainty_quantification;sensitivity_analysis,library,Python,https://github.com/simetenn/uncertainpy,https://uncertainpy.readthedocs.io,GPL-3.0,neuroscience;uncertainty-quantification;sensitivity-analysis
367,Smart-UQ,C++ toolbox for uncertainty quantification,"A C++ library designed for uncertainty quantification tasks, developed by the Advanced Composites Group at the University of Strathclyde.",M3-04,uncertainty_quantification,library,C++,https://github.com/strath-ace/smart-uq,,MPL-2.0,uncertainty-quantification;cpp
368,ADMET-AI,ADMET property prediction using Chemprop models,"A tool providing training and prediction scripts for Chemprop models specifically trained on ADMET (Absorption, Distribution, Metabolism, Excretion, and Toxicity) datasets for drug discovery.",M3;Drug Discovery,property_prediction;admet_prediction,solver,Python,https://github.com/swansonk14/admet_ai,https://admet.ai,MIT,admet;chemprop;drug-discovery
369,Tridesclous,Offline and online spike sorting toolkit,"A Python toolkit for spike sorting of extracellular recordings, offering both offline and online processing capabilities for neuroscience research.",Neuroscience,spike_sorting;signal_processing,solver,Python,https://github.com/tridesclous/tridesclous,https://tridesclous.readthedocs.io,MIT,spike-sorting;neuroscience;electrophysiology
370,CGCNN,Crystal Graph Convolutional Neural Networks for materials,Implementation of Crystal Graph Convolutional Neural Networks (CGCNN) for predicting material properties directly from the crystal structure.,M3,property_prediction;structure_encoding,solver,Python,https://github.com/txie-93/cgcnn,,MIT,gnn;materials-science;crystal-structure
371,Uncertainty Toolbox,Toolbox for predictive uncertainty quantification and calibration,"A Python toolbox designed for predictive uncertainty quantification, providing methods for calibration, metrics calculation, and visualization of uncertainty in machine learning models.",M3-04;General AI4S,uncertainty_quantification;calibration;model_evaluation,library,Python,https://github.com/uncertainty-toolbox/uncertainty-toolbox,https://uncertainty-toolbox.github.io,MIT,uncertainty-quantification;calibration;metrics
372,OptBayesExpt,Optimal Bayesian Experiment Design package,"A Python package for Optimal Bayesian Experiment Design, facilitating adaptive experimentation and efficient data acquisition in scientific experiments.",M3-04;Experimental Physics,experiment_design;active_learning,library,Python,https://github.com/usnistgov/optbayesexpt,,NOASSERTION,bayesian-optimization;experiment-design;nist
373,LibBEEF,Bayesian Error Estimation Functionals library for DFT,A library implementing Bayesian Error Estimation Functionals (BEEF) for use in density functional theory (DFT) codes to estimate computational errors.,M3;M3-04,error_estimation;dft_calculation,library,C,https://github.com/vossjo/libbeef,,LGPL-3.0,dft;error-estimation;bayesian
374,InvDesFlow-AL,Active learning framework for inverse materials design,An active learning-based generative framework for inverse materials design that iteratively optimizes material generation towards desired properties.,M3,inverse_design;generative_modeling;active_learning,workflow,Python,https://github.com/xqh19970407/InvDesFlow-AL,,None,inverse-design;active-learning;materials-discovery
375,MACE,Fast and accurate machine learning interatomic potentials with higher order equivariant message passing,"MACE provides fast and accurate machine learning interatomic potentials using higher order equivariant message passing neural networks. It is designed for atomistic simulations in materials science and chemistry, offering high fidelity force and energy predictions.",Materials;Chemistry;Physics,interatomic_potential_learning;molecular_dynamics;property_prediction,solver,Python,https://github.com/ACEsuit/mace,,NOASSERTION,machine-learning;interatomic-potentials;molecular-dynamics;equivariant-neural-networks
376,nablaDFT,Large-Scale Conformational Energy and Hamiltonian Prediction benchmark suite,nablaDFT is a benchmark suite and dataset for evaluating machine learning models on large-scale conformational energy and Hamiltonian predictions. It provides tools and data to assess the accuracy of DFT surrogates.,Materials;Chemistry,benchmark;energy_prediction;hamiltonian_prediction,dataset,Python,https://github.com/AIRI-Institute/nablaDFT,,MIT,benchmark;dft;quantum-chemistry;machine-learning
