id,name,one_line_profile,detailed_description,domains,subtask_category,application_level,primary_language,repo_url,help_website,license,tags
262,voe,Virtual Observatory Events for Fast Radio Bursts,"A Python library for handling Virtual Observatory Events (VOEvents) specifically tailored for Fast Radio Burst (FRB) detection and alerts, developed by the CHIME/FRB collaboration.",Astronomy;A1,data_management;alert_processing,library,Python,https://github.com/CHIMEFRB/voe,,GPL-3.0,astronomy;frb;voevent;chime
263,Firefly (IPAC),Web-based UI library for astronomical data archive access and visualization,Firefly is a web framework for building astronomical data access and visualization applications. It is used by IPAC for archives like IRSA and LSST.,Astronomy;A1;A1-04,visualization;data_access;archive_interface,library,JavaScript,https://github.com/Caltech-IPAC/firefly,https://github.com/Caltech-IPAC/firefly,NOASSERTION,astronomy;visualization;fits;archive
264,ASTAP,Astrometric Stacking Program and Plate Solver,"ASTAP is a free astrometric solver, stacking program, and FITS viewer. It is widely used for plate solving in astrophotography to determine the precise celestial coordinates of an image.",Astronomy;A1,plate_solving;image_stacking;astrometry,solver,Pascal,https://github.com/CanardConfit/ASTAP,https://www.hnsky.org/astap.htm,MPL-2.0,astronomy;plate-solving;stacking;fits
265,toasty,Pipeline for creating WWT TOAST data tiles,A Python library to generate TOAST (Tessellated Octahedral Adaptive Subdivision Transform) tiles from astronomical images for visualization in the WorldWide Telescope (WWT) ecosystem.,Astronomy;A1;A1-04,visualization;image_processing;tiling,library,Python,https://github.com/ChrisBeaumont/toasty,https://toasty.readthedocs.io/,MIT,astronomy;visualization;wwt;toast
266,HORAYZON,Terrain parameter and shadow map computation tool,"A package to efficiently compute terrain parameters (horizon, sky view factor, slope) and shadow maps from high-resolution digital elevation models (DEM), useful for meteorology and earth science.",Earth Science;Geography,modeling;spatial_analysis;solar_radiation,library,Cython,https://github.com/ChristianSteger/HORAYZON,,MIT,earth-science;dem;shadow-mapping;terrain-analysis
267,whampy,Analysis and visualization tool for WHAM Sky Survey,"A Python package designed to interact with, visualize, and analyze data from the Wisconsin H-Alpha Mapper (WHAM) Sky Survey.",Astronomy;A1,visualization;data_analysis;spectroscopy,library,Python,https://github.com/Deech08/whampy,https://whampy.readthedocs.io/,BSD-3-Clause,astronomy;wham;h-alpha;visualization
268,stac-finder,API for browsing SpatioTemporal Asset Catalogs (STAC),"A STAC-compliant API implementation for browsing and searching SpatioTemporal Asset Catalogs, facilitating the discovery of geospatial and earth observation data.",Earth Science;Geospatial,data_management;data_discovery,service,JavaScript,https://github.com/GeoStack-Solutions/stac-finder,,Apache-2.0,stac;geospatial;earth-observation;catalog
269,fitsgeo,PHITS geometry development and visualization tool,A Python package for developing and visualizing geometries for the PHITS (Particle and Heavy Ion Transport code System) Monte Carlo transport code.,Physics;Nuclear Physics,modeling;visualization;geometry_setup,library,Python,https://github.com/GordoNice/fitsgeo,https://pypi.org/project/fitsgeo/,MIT,phits;monte-carlo;geometry;visualization
270,dustmaps3d,3D dust map based on Gaia and LAMOST data,"A tool/library to access and visualize an all-sky 3D dust map derived from Gaia and LAMOST survey data, useful for studying interstellar medium extinction.",Astronomy;A1,visualization;data_access;extinction_correction,library,Python,https://github.com/Grapeknight/dustmaps3d,,MIT,astronomy;dust-map;gaia;lamost
271,swarmlib,Library implementing swarm optimization algorithms for scientific computing,"A Python library that implements and visualizes various swarm intelligence optimization algorithms (PSO, ACO, GWO, etc.), which are commonly used in scientific modeling and parameter estimation tasks.",General Science;Optimization,optimization;modeling,library,Python,https://github.com/HaaLeo/swarmlib,,BSD-3-Clause,optimization;swarm-intelligence;pso;scientific-computing
272,gw_sky,Gravitational wave sky map visualization tool,"A Python project designed for generating sky maps and animations specifically for gravitational wave astronomy, aiding in the visualization of source localization.",Astronomy;Gravitational Waves,visualization;sky_mapping,library,Python,https://github.com/Hazboun6/gw_sky,,MIT,gravitational-waves;astronomy;visualization;sky-maps
273,gleamvo-client,Client API for GLEAM Virtual Observatory access,"A Python client library for accessing the GLEAM (GaLactic and Extragalactic All-sky MWA) Virtual Observatory, facilitating astronomical data retrieval and query.",Astronomy;Radio Astronomy,data_access;virtual_observatory,library,Python,https://github.com/ICRAR/gleamvo-client,,None,virtual-observatory;astronomy;data-access;gleam
274,CartAGen (Java),Cartographic generalisation plugin for GeOxygene,"A Java-based plugin for the GeOxygene platform dedicated to cartographic generalisation, a process in GIS and geography for deriving smaller scale maps from larger scale data.",Geography;GIS,cartography;generalization,library,Java,https://github.com/IGNF/CartAGen,,NOASSERTION,gis;cartography;generalization;geoxygene
275,ImagePy,Extensible image processing framework for scientific imaging,"An open-source image processing framework written in Python, designed to be extensible like ImageJ. It integrates with Scipy, Scikit-image, and OpenCV to provide a platform for scientific image analysis.",General Science;Bioimaging,image_processing;analysis,platform,Python,https://github.com/Image-Py/imagepy,http://imagepy.org,BSD-4-Clause,image-processing;scientific-imaging;microscopy;framework
276,AstroImages.jl,Astronomical image visualization library for Julia,"A Julia library dedicated to the visualization of astronomical images, providing tools to handle and display FITS data and other astronomical formats within the Julia ecosystem.",Astronomy,visualization;image_processing,library,Julia,https://github.com/JuliaAstro/AstroImages.jl,,NOASSERTION,julia;astronomy;visualization;fits
277,SAOImageDS9.jl,Julia interface to SAOImage DS9,A Julia package that provides an interface to the SAOImage DS9 astronomical imaging and data visualization application via the XPA messaging system.,Astronomy,visualization;interface,library,Julia,https://github.com/JuliaAstro/SAOImageDS9.jl,,NOASSERTION,julia;ds9;astronomy;visualization
278,FIt-SNE,Fast Fourier Transform-accelerated Interpolation-based t-SNE,"A highly optimized implementation of t-SNE using FFT acceleration, widely used in bioinformatics (e.g., single-cell RNA-seq) and data science for visualizing high-dimensional datasets.",Bioinformatics;Data Science,dimensionality_reduction;visualization,solver,C++,https://github.com/KlugerLab/FIt-SNE,,NOASSERTION,t-sne;dimensionality-reduction;visualization;bioinformatics
279,auto_stretch,Automated contrast stretching for FITS image visualization,"A Python tool developed by LCOGT to automatically determine optimal contrast stretch parameters for astronomical FITS images, facilitating quick visualization.",Astronomy,visualization;image_processing,library,Python,https://github.com/LCOGT/auto_stretch,,MIT,fits;visualization;astronomy;image-processing
280,skyproj,Astronomical sky mapping with Matplotlib and PROJ,"A Python library from LSST DESC for creating publication-quality sky maps using Matplotlib and PROJ, supporting various cartographic projections relevant to astronomy.",Astronomy,visualization;sky_mapping,library,Jupyter Notebook,https://github.com/LSSTDESC/skyproj,,BSD-3-Clause,astronomy;visualization;sky-maps;matplotlib
281,X-LoVoCCS-Data,Data processing workflow for LoVoCCS X-ray survey,A repository containing the code and pipelines used to create the multi-mission X-ray data archive for the Local Volume Complete Cluster Survey (LoVoCCS).,Astronomy,data_processing;pipeline,workflow,Jupyter Notebook,https://github.com/LoVoCCS/X-LoVoCCS-Data,,None,x-ray;astronomy;pipeline;survey-data
282,cartagen (Python),Python library for cartographic generalisation,"An open-source Python library for cartographic generalisation, providing algorithms to simplify map data while preserving essential topological and geographic characteristics.",Geography;GIS,cartography;generalization,library,Python,https://github.com/LostInZoom/cartagen,,EUPL-1.2,cartography;gis;generalization;python
283,OpenSpace,Open-source astrovisualization software,"A comprehensive open-source software platform for visualizing the entire known universe, portraying ongoing efforts to investigate the cosmos. It supports interactive data visualization for astronomy and space science.",Astronomy;Space Science,visualization;simulation,platform,C++,https://github.com/OpenSpace/OpenSpace,http://docs.openspaceproject.com,NOASSERTION,visualization;astronomy;space-science;rendering
284,SAOImageDS9,Astronomical imaging and data visualization application,"SAOImage DS9 is a visualization application for astronomical imaging and data analysis. It supports FITS images and binary tables, multiple frame buffers, region manipulation, and arbitrary scale algorithms and colormaps.",Astronomy,visualization;image_processing,platform,C,https://github.com/SAOImageDS9/SAOImageDS9,https://ds9.si.edu/site/Home.html,GPL-3.0,astronomy;fits;visualization;imaging
285,BAStag,Data processing for British Antarctic Survey archival tags,A package for processing light-level geolocation data from British Antarctic Survey archival tags. It provides functions to detect twilight events and estimate locations for tracking marine animals.,Ecology;Geoscience,data_processing;geolocation,library,R,https://github.com/SWotherspoon/BAStag,,None,geolocation;tracking;ecology;antarctic
286,FITS-Rating-Tool,Tool for viewing and automatically grading FITS files,A tool designed to view and automatically grade (quality control) astronomical images in FITS format. It helps astronomers sort and filter images based on quality metrics.,Astronomy,quality_control;image_processing,solver,C#,https://github.com/TheCyberBrick/FITS-Rating-Tool,,GPL-3.0,fits;astronomy;quality-control;imaging
287,pywwt,Python interface to WorldWide Telescope,"The Python interface to WorldWide Telescope (WWT), allowing users to control the WWT visualization engine, load data, and create visualizations directly from Python environments like Jupyter notebooks.",Astronomy,visualization;data_exploration,library,Python,https://github.com/WorldWideTelescope/pywwt,https://pywwt.readthedocs.io/,BSD-3-Clause,astronomy;visualization;jupyter;wwt
288,wwt-excel-plugin,Excel Plugin for WorldWide Telescope,An add-in for Microsoft Excel that enables the visualization of astronomical data stored in spreadsheets directly within the WorldWide Telescope environment.,Astronomy,visualization;data_integration,solver,C#,https://github.com/WorldWideTelescope/wwt-excel-plugin,,MIT,excel;visualization;astronomy;plugin
289,wwt-jupyterlab,WorldWide Telescope JupyterLab extension,"A JupyterLab extension that embeds the WorldWide Telescope visualization engine as a widget, enabling interactive astronomical visualization within the JupyterLab interface.",Astronomy,visualization;interactive_analysis,platform,TypeScript,https://github.com/WorldWideTelescope/wwt-jupyterlab,,MIT,jupyterlab;visualization;astronomy;extension
290,wwt-remote,Cluster Controller for WorldWide Telescope,"A cluster controller for WorldWide Telescope designed for multi-channel domes, power walls, and other multi-machine visualization environments used in planetariums and research labs.",Astronomy,visualization;infrastructure,platform,C#,https://github.com/WorldWideTelescope/wwt-remote,,MIT,visualization;cluster-control;planetarium;astronomy
291,wwt-web-client,WorldWide Telescope Web Client,"The web-based client for WorldWide Telescope, allowing users to explore the universe, visualize astronomical data, and tour the sky directly in a web browser.",Astronomy,visualization;education,platform,JavaScript,https://github.com/WorldWideTelescope/wwt-web-client,http://worldwidetelescope.org/webclient/,MIT,web-client;visualization;astronomy;webgl
292,wwt-webgl-engine,WorldWide Telescope WebGL rendering engine,"The core JavaScript/WebGL rendering engine that powers the WorldWide Telescope web client, providing high-performance astronomical visualization capabilities for web applications.",Astronomy,visualization;rendering,library,JavaScript,https://github.com/WorldWideTelescope/wwt-webgl-engine,,MIT,webgl;rendering;astronomy;engine
293,wwt-windows-client,WorldWide Telescope Windows Application,"The native Windows desktop application for WorldWide Telescope, providing a comprehensive environment for astronomical data visualization and exploration.",Astronomy,visualization;data_exploration,platform,C#,https://github.com/WorldWideTelescope/wwt-windows-client,http://worldwidetelescope.org/,NOASSERTION,windows;visualization;astronomy;desktop-app
294,Firefly (ageller),WebGL interactive particle viewer for astronomy,"A WebGL-based interactive viewer designed for visualizing particle data from astronomical simulations (e.g., star clusters, galaxies). It allows users to explore 3D datasets in a browser.",Astronomy;Astrophysics,visualization;simulation_analysis,platform,Jupyter Notebook,https://github.com/ageller/Firefly,https://ageller.github.io/Firefly/,AGPL-3.0,visualization;particles;webgl;astronomy
295,fink-client,Client for Fink broker alerts,"A light-weight Python client to manipulate and retrieve astronomical alerts from the Fink broker, which processes data from surveys like ZTF and LSST.",Astronomy,data_access;alert_processing,library,Jupyter Notebook,https://github.com/astrolabsoftware/fink-client,https://fink-broker.readthedocs.io/en/latest/,Apache-2.0,astronomy;alerts;broker;ztf
296,STIFF,FITS to TIFF converter for visualization,"STIFF is a program that converts scientific FITS images to the TIFF format for visualization and illustration purposes, handling high dynamic range data effectively.",Astronomy,visualization;image_processing,solver,,https://github.com/astromatic/stiff,https://www.astromatic.net/software/stiff,GPL-3.0,fits;tiff;visualization;astromatic
297,lenspyx,Curved-sky CMB lensing simulation and processing package,"A Python package for curved-sky Cosmic Microwave Background (CMB) lensing simulation and analysis, providing tools for generating lensed maps and processing spherical harmonic transforms.",Astronomy;Cosmology,simulation;data_generation,library,Python,https://github.com/carronj/lenspyx,,NOASSERTION,cmb;lensing;cosmology;simulation
298,Aladin Desktop,Interactive software sky atlas for astronomical data visualization and exploration,"The desktop application of the CDS Aladin Sky Atlas project, allowing users to visualize digitized astronomical images, superimpose entries from astronomical catalogs, and interactively access related data and information from the Simbad database, the VizieR service, and other archives.",Astronomy;A1-04,visualization;data_exploration,platform,Java,https://github.com/cds-astro/aladin,https://aladin.cds.unistra.fr/,GPL-3.0,sky-atlas;visualization;fits;virtual-observatory
299,Aladin Lite,Lightweight astronomical HiPS visualizer for web browsers,"A lightweight version of the Aladin Sky Atlas running in the browser, enabling visualization of HiPS (Hierarchical Progressive Surveys) based sky maps and overlay of catalogs.",Astronomy;A1-04,visualization,library,JavaScript,https://github.com/cds-astro/aladin-lite,https://aladin.cds.unistra.fr/AladinLite/,GPL-3.0,hips;visualization;web-component;astronomy
300,ipyaladin,Jupyter widget for the Aladin Lite sky viewer,"A Python library enabling the use of Aladin Lite within Jupyter notebooks, allowing interactive visualization of astronomical images and catalogs directly in a research workflow.",Astronomy;A1-04,visualization;interactive_analysis,library,Python,https://github.com/cds-astro/ipyaladin,,BSD-3-Clause,jupyter;visualization;aladin;python
301,Virtual Language Observatory,Platform for exploring linguistic resources and data,"A browser-based virtual observatory developed by CLARIN ERIC for searching and exploring linguistic resources, tools, and data across various repositories.",Linguistics;Humanities,data_exploration;data_access,platform,Java,https://github.com/clarin-eric/VLO,https://vlo.clarin.eu/,GPL-3.0,linguistics;virtual-observatory;clarin;data-portal
302,SemBERT,Semantics-aware BERT model for natural language understanding,"An implementation of SemBERT, a model that incorporates explicit contextual semantics (Semantic Role Labeling) into BERT for improved natural language understanding tasks.",Computer Science;NLP,inference;modeling,solver,Python,https://github.com/cooelf/SemBERT,,MIT,bert;nlp;semantics;deep-learning
303,HERMES,Framework for line-of-sight integration of galactic radiative processes,"A computational framework designed to generate sky maps in HEALPix format by performing line-of-sight integration over galactic radiative processes, useful for astrophysical simulations.",Astronomy;Astrophysics,simulation;data_generation,workflow,C++,https://github.com/cosmicrays/hermes,,GPL-3.0,radiative-processes;sky-maps;healpix;simulation
304,CASDA VO Tools,Implementation of Virtual Observatory protocols for ASKAP data,"A set of tools implementing Virtual Observatory (VO) protocols such as TAP, Cone Search, DataLink, and SIAP, specifically for the CSIRO ASKAP Science Data Archive.",Astronomy;A1-04,data_access;data_management,service,Java,https://github.com/csiro-rds/casda_vo_tools,,NOASSERTION,virtual-observatory;tap;askap;csiro
305,GlueStick,Deep matcher for joint points and lines in images,"A deep learning model for joint matching of points and lines in images, improving upon local feature matching tasks in computer vision.",Computer Vision,image_matching;feature_extraction,solver,Jupyter Notebook,https://github.com/cvg/GlueStick,,MIT,feature-matching;deep-learning;computer-vision
306,LightGlue,Lightweight local feature matching model,"A deep network for local feature matching that is faster and more memory-efficient than SuperGlue, designed for high-performance computer vision tasks.",Computer Vision,image_matching;inference,solver,Python,https://github.com/cvg/LightGlue,,Apache-2.0,feature-matching;deep-learning;computer-vision
307,glue-factory,Training library for local feature detection and matching models,"A library for training and evaluating local feature detection and matching pipelines, supporting research in geometric computer vision.",Computer Vision,training;modeling,library,Python,https://github.com/cvg/glue-factory,,Apache-2.0,training;feature-detection;computer-vision
308,jupyterlab_thredds,JupyterLab extension for browsing THREDDS data catalogs,"A JupyterLab extension that allows users to browse and access datasets served by THREDDS Data Servers (TDS), commonly used in Earth science and astronomy.",Earth Science;Astronomy;A1-04,data_access;visualization,library,Python,https://github.com/eWaterCycle/jupyterlab_thredds,,Apache-2.0,jupyterlab;thredds;data-catalog;opendap
309,Ginga,A toolkit for building scientific image viewers and a full-featured FITS viewer,"Ginga is a toolkit designed for building viewers for scientific image data in Python, visualizing 2D numpy arrays. It also includes a reference FITS file viewer with a plugin architecture for astronomical data analysis.",A1;A1-04,visualization;image_processing,platform,Python,https://github.com/ejeschke/ginga,https://ginga.readthedocs.io/,BSD-3-Clause,fits-viewer;astronomy;visualization;python-toolkit
310,JS9,Web-based astronomical image display and analysis,"JS9 is a JavaScript-based astronomical image display that allows users to view and analyze FITS images directly in the browser, supporting region analysis, scaling, and colormaps.",A1;A1-04,visualization;image_analysis,solver,JavaScript,https://github.com/ericmandel/js9,https://js9.si.edu/,NOASSERTION,fits;web-viewer;astronomy
311,pyds9,Python connection to SAOimage DS9 via XPA,"pyds9 provides a Python interface to the DS9 astronomical image viewer, allowing users to control DS9 and interact with data via the XPA messaging system.",A1;A1-04,visualization;interoperability,library,C,https://github.com/ericmandel/pyds9,,None,ds9;python-binding;xpa;astronomy
312,pyjs9,Python connection to JS9,"pyjs9 provides a Python interface to communicate with the JS9 web-based astronomical image viewer, enabling server-side scripting and control of the client-side display.",A1;A1-04,visualization;interoperability,library,Python,https://github.com/ericmandel/pyjs9,https://js9.si.edu/,NOASSERTION,js9;python-binding;astronomy
313,OITOOLS.jl,Tools for optical interferometry data processing and modeling,"A collection of Julia tools to load, visualize, model-fit, and image optical interferometry data from observatories like CHARA, NPOI, and VLTI.",A1,image_reconstruction;model_fitting;visualization,library,Julia,https://github.com/fabienbaron/OITOOLS.jl,,LGPL-3.0,interferometry;optical-astronomy;julia
314,GLUE (Omics),Graph-linked unified embedding for single-cell multi-omics data integration,GLUE is a deep learning framework for integrating single-cell multi-omics data by learning a unified embedding space using graph constraints.,Bioinformatics,data_integration;embedding;multi_omics,library,Python,https://github.com/gao-lab/GLUE,https://glue-genomics.readthedocs.io/,MIT,single-cell;multi-omics;deep-learning
315,Glue Viz,Multi-dimensional linked data visualization tool,Glue is a Python library to explore relationships within and between related datasets. It is widely used in astronomy (and other fields) for interactive visualization of high-dimensional data.,A1;A1-04,visualization;data_exploration,application,Python,https://github.com/glue-viz/glue,http://glueviz.org/,NOASSERTION,visualization;interactive;astronomy;data-science
316,AstronomicAL,Interactive dashboard for astronomical data classification using Active Learning,"AstronomicAL is a software tool for visualizing, integrating, and classifying astronomical data, specifically designed to use active learning to optimize human-in-the-loop classification tasks.",A1;A1-04,classification;visualization;active_learning,application,Python,https://github.com/grant-m-s/AstronomicAL,https://astronomical.readthedocs.io/,GPL-3.0,active-learning;classification;dashboard;astronomy
317,milkyway_plot,Plotting face-on and all-sky maps of the Milky Way,"A Python package for generating face-on and all-sky maps of the Milky Way galaxy using Matplotlib and Bokeh, useful for visualizing galactic structures.",A1,visualization;mapping,library,Python,https://github.com/henrysky/milkyway_plot,,MIT,milky-way;plotting;astronomy
318,iDaVIE,Immersive Data Visualisation Interactive Explorer for VR,"iDaVIE is a virtual reality software designed for the immersive visualization and interrogation of 3D astronomical data (spectral cubes), enabling researchers to explore structures in 3D space.",A1;A1-04,visualization;vr_exploration,application,C#,https://github.com/idia-astro/iDaVIE,https://idavie.readthedocs.io/,NOASSERTION,vr;visualization;astronomy;3d-data
319,NADA,National Data Archive cataloging system for research data,"NADA is an open-source data cataloging system used by researchers to browse, search, and access census or survey datasets. It serves as a portal for research data management.",Social Science;A1-04,data_management;cataloging,platform,PHP,https://github.com/ihsn/nada,https://nada.ihsn.org/,MIT,data-catalog;research-data;portal
320,gdr2_completeness,Tool for downloading Gaia DR2 data and generating completeness maps,"A Python package designed to assist astronomers in downloading Gaia Data Release 2 (DR2) data. It provides functionality to generate approximate completeness maps over the sky and per G magnitude bin, and includes functions to query the GDR2 Radial Velocity Spectrometer (RVS) sample selection function.",A1;A1-01,data_retrieval;quality_control;completeness_analysis,library,Jupyter Notebook,https://github.com/jan-rybizki/gdr2_completeness,,NOASSERTION,astronomy;gaia;completeness-map;data-processing
321,AstroView,Browser-based FITS viewer and analysis tool,A web-based tool for viewing and analyzing astronomical data in the FITS (Flexible Image Transport System) format directly within a web browser. It enables astronomers to visualize observational data without requiring local software installation.,A1;A1-04,visualization;image_analysis,platform,TypeScript,https://github.com/jonyardley/AstroView,,None,astronomy;fits-viewer;web-based;visualization
322,DNASkittle,Web-based interactive genome browser,"A web-based genome browser that provides interactive visualization of raw DNA sequences. It utilizes signal processing techniques to extract and visualize tandem repeats and other genomic elements, capable of fitting 10Kbp of nucleotide data on a single screen.",Bioinformatics;Genomics,visualization;sequence_analysis,platform,Python,https://github.com/josiahseaman/skittle,,GPL-2.0,genomics;genome-browser;visualization;dna-sequence
323,Luminosity,Web application for visualizing astronomical FITS data,"A web application designed for visualizing astronomical data stored in the FITS format. It supports the rendering of images, tabular data, and data cubes, providing a portal for astronomers to inspect observational data.",A1;A1-04,visualization;data_inspection,platform,CSS,https://github.com/kapadia/Luminosity,,None,astronomy;fits;visualization;web-app
