id,name,one_line_profile,detailed_description,domains,subtask_category,application_level,primary_language,repo_url,help_website,license,tags
133,DIA,Difference Image Analysis for Wide-Field Surveys,"A C implementation of Difference Image Analysis (DIA) algorithms, designed for detecting transient astronomical events in wide-field survey data by subtracting reference images from new observations.",Astronomy,data_processing;image_subtraction,solver,C,https://github.com/ryanoelkers/DIA,,MIT,difference-imaging;transient-detection;astronomy;image-processing
134,Kowalski,Multi-survey data archive and alert broker for time-domain astronomy,"Kowalski is a system for archiving and accessing astronomical data from multiple surveys, specifically designed to handle the high-volume data streams and alert brokering required for time-domain astronomy.",Astronomy;Time-Domain Astronomy,alert_brokering;data_archiving;transient_management,platform,Python,https://github.com/skyportal/kowalski,,MIT,astronomy;alert-broker;time-domain;data-archive
135,Sherlock,The QUB Transient Classifier for astronomical sources,"Sherlock is a transient classifier package designed to cross-match and classify astronomical transients against a massive library of historical catalogs, aiding in the rapid identification of new sources.",Astronomy;Time-Domain Astronomy,transient_classification;source_cross_matching,solver,Python,https://github.com/thespacedoctor/sherlock,https://sherlock.readthedocs.io/,GPL-3.0,transient-detection;classification;astronomy;catalogs
136,SFFT,Saccadic Fast Fourier Transform algorithm for image subtraction,"SFFT (Saccadic Fast Fourier Transform) is an algorithm and python tool for efficient image subtraction in Fourier space, a critical step in detecting transient astronomical events by comparing new observations with reference images.",Astronomy;Image Processing,image_subtraction;transient_detection,solver,Jupyter Notebook,https://github.com/thomasvrussell/sfft,,MIT,image-subtraction;fourier-transform;astronomy;transients
137,ggwd,Generator for synthetic gravitational-wave data,"ggwd is a tool that utilizes PyCBC and LALSuite to generate synthetic gravitational-wave data, facilitating the training and testing of machine learning models for gravitational wave detection.",Astronomy;Gravitational Waves,data_generation;simulation,library,Python,https://github.com/timothygebhard/ggwd,,GPL-3.0,gravitational-waves;synthetic-data;simulation;pycbc
138,voevent-parse,Library for parsing and manipulating VOEvent packets,"voevent-parse is a Python library built on lxml.objectify for parsing, manipulating, and creating VOEvent packets, which are the standard format for reporting astronomical transient events.",Astronomy;Time-Domain Astronomy,data_parsing;alert_handling,library,Python,https://github.com/timstaley/voevent-parse,https://voevent-parse.readthedocs.io/,BSD-2-Clause,voevent;astronomy;parsing;alerts
139,Multi-SConES,Multi-task feature selection for selecting connected explanatory SNPs in GWAS,"An R package implementing Multi-SConES, a method for multi-task feature selection coupled with multiple network regularizers, primarily used in bioinformatics for Genome-Wide Association Studies (GWAS) to identify significant SNPs.",Bioinformatics;Genetics,feature_selection;statistical_analysis,library,R,https://github.com/BorgwardtLab/Multi-SConES,,GPL-2.0,gwas;feature-selection;bioinformatics;snps
140,RESSPECT,Recommendation system for telescope resource allocation in supernova cosmology,A Python package developed by the Cosmostatistics Initiative (COIN) and LSST DESC to optimize photometric supernova cosmology analysis through an active learning-based recommendation system for telescope resource allocation.,A2;Astronomy,resource_allocation;active_learning;cosmology,solver,Python,https://github.com/COINtoolbox/RESSPECT,,MIT,supernova;cosmology;active-learning;lsst
141,SCONE,Stochastic Calculator Of Neutron transport Equation,"A Fortran-based stochastic calculator for solving the neutron transport equation, used in nuclear physics and engineering for simulating neutron behavior.",Nuclear Physics,simulation;neutron_transport,solver,Fortran,https://github.com/CambridgeNuclear/SCONE,,NOASSERTION,neutron-transport;monte-carlo;nuclear-physics
142,HOPS,Software for single-object photometry and exoplanet light-curve modelling,"A user-friendly software package designed for analyzing astronomical data, specifically for single-object photometry and modelling the light curves of exoplanets.",A2;Astronomy,photometry;light_curve_modelling;exoplanets,platform,Python,https://github.com/ExoWorldsSpies/hops,,MIT,exoplanets;photometry;light-curves
143,MUTIS,Analysis of correlations of light curves and their statistical significance,"A Python package from IAA-CSIC for analyzing correlations in astronomical light curves and determining their statistical significance, useful for multi-wavelength studies.",A2;Astronomy,correlation_analysis;time_series_analysis,library,Python,https://github.com/IAA-CSIC/MUTIS,,BSD-3-Clause,light-curves;correlation;astronomy
144,pyzdcf,Estimation of cross-correlation function of astronomical time-series using ZDCF,"A Python module for estimating the cross-correlation function of sparse, unevenly sampled astronomical time-series data based on the Z-Transformed Discrete Correlation Function (ZDCF) method.",A2;Astronomy,time_series_analysis;cross_correlation,library,Jupyter Notebook,https://github.com/LSST-sersag/pyzdcf,,MIT,zdcf;cross-correlation;time-series
145,elasticc,Infrastructure and metrics for the ELAsTiCC astronomical classification challenge,"A repository containing settings, configuration, and metric implementations for the Extended LSST Astronomical Time Series Classification Challenge (ELAsTiCC), used for evaluating transient classifiers.",A2;A2-03;Astronomy,metrics;validation;classification_challenge,library,Jupyter Notebook,https://github.com/LSSTDESC/elasticc,,None,lsst;elasticc;classification;metrics
146,parsnip,Deep generative modeling of astronomical transient light curves,"A Python package for deep generative modeling of astronomical transient light curves. It learns a low-dimensional representation of transients that can be used for classification, augmentation, and other analysis tasks.",A2;A2-03;Astronomy,generative_modeling;classification;light_curve_analysis,library,Python,https://github.com/LSSTDESC/parsnip,,MIT,deep-learning;generative-models;transients;light-curves
147,plasticc-kit,Starter Kit for the Photometric LSST Astronomical Time-series Classification Challenge,"A toolkit providing data loaders, metrics, and example notebooks for the Photometric LSST Astronomical Time-series Classification Challenge (PLAsTiCC), facilitating the development of classification models for astronomical transients.",A2;A2-03;Astronomy,data_loading;metrics;classification_challenge,dataset,Jupyter Notebook,https://github.com/LSSTDESC/plasticc-kit,,MIT,plasticc;lsst;classification;time-series
148,snmachine,Machine learning code for photometric supernova classification,"A Python library developed by LSST DESC for photometric supernova classification using various machine learning techniques, designed to process light curves and extract features for classification.",A2;A2-03;Astronomy,classification;supernova;machine_learning,library,Python,https://github.com/LSSTDESC/snmachine,,BSD-3-Clause,supernova;classification;machine-learning;photometry
149,Spacetimeformer,Long-Range Transformers for Dynamic Spatiotemporal Forecasting,"A multivariate time series forecasting framework using efficient Transformers, specifically designed to learn long-range dependencies in spatiotemporal data. While general-purpose, it is highly relevant for scientific modeling tasks involving space and time dynamics.",Computer Science;General Science,time_series_forecasting;spatiotemporal_modeling,library,Jupyter Notebook,https://github.com/QData/spacetimeformer,,MIT,transformer;time-series;forecasting;deep-learning
150,VegasAfterglow,High-performance C++ framework for GRB afterglow modeling,"A C++ framework with Python bindings for modeling Gamma-Ray Burst (GRB) afterglows. It features fast multi-wavelength light curve generation, MCMC parameter inference, and advanced physics models including shock dynamics and structured jets.",Astronomy;A2,afterglow_modeling;light_curve_generation;parameter_inference,solver,C++,https://github.com/YihanWangAstro/VegasAfterglow,,BSD-3-Clause,grb;afterglow;mcmc;astrophysics
151,SCoPe-ML,Machine learning classification pipeline for ZTF sources,The SCoPe (ZTF Source Classification Project) repository contains the machine learning pipeline used for classifying astronomical sources detected by the Zwicky Transient Facility (ZTF).,Astronomy;A2;A2-03,source_classification;transient_detection,workflow,Jupyter Notebook,https://github.com/ZwickyTransientFacility/scope-ml,,MIT,ztf;classification;machine-learning;transients
152,ATAT,Astronomical Transformer for Time Series and Tabular Data,"ATAT is a Transformer-based model designed for processing astronomical time series and tabular data, developed as part of the ALeRCE broker ecosystem for classification and analysis tasks.",Astronomy;A2;A2-03,time_series_classification;embedding_learning,library,Jupyter Notebook,https://github.com/alercebroker/ATAT,,None,transformer;time-series;alerce;classification
153,LC Classifier,Light Curve Classifier for the ALeRCE Broker,The Light Curve Classifier used by the ALeRCE broker system to classify astronomical alerts based on their photometric time-series data. It includes feature extraction and machine learning classification models.,Astronomy;A2;A2-03,light_curve_classification;transient_classification,library,Jupyter Notebook,https://github.com/alercebroker/lc_classifier,,NOASSERTION,classification;light-curves;alerce;machine-learning
154,mind_the_gaps,Gaussian Process analysis tool for irregularly-sampled astronomical time series,"A Python library for performing Gaussian Process time series analysis, specifically focused on period detection in irregularly-sampled and stochastically-varying astronomical light curves.",A2;A2-03,time_series_analysis;period_detection,library,Python,https://github.com/andresgur/mind_the_gaps,,MIT,astronomy;gaussian-processes;time-series;period-finding
155,gatspy,General tools for astronomical time series analysis,"A library for astronomical time series analysis in Python, providing tools for periodogram analysis (Lomb-Scargle, Supersmoother) and Gaussian Process modeling of light curves.",A2;A2-03,time_series_analysis;periodogram,library,Python,https://github.com/astroML/gatspy,http://www.astroml.org/gatspy/,BSD-2-Clause,astronomy;time-series;lomb-scargle;light-curves
156,keplersplinev2,Robust B-spline fitting tool for astronomical light curves,"A Python code for robustly fitting a basis spline to data, particularly useful for detrending and analyzing astronomical light curves (e.g., Kepler/K2 data).",A2,data_processing;detrending,solver,Jupyter Notebook,https://github.com/avanderburg/keplersplinev2,,MIT,astronomy;light-curves;spline-fitting;detrending
157,deepSIP,Deep learning tool for Supernova Ia parameter estimation,A deep learning framework for estimating parameters of Type Ia Supernovae from optical spectra and light curves.,A2;A2-03,parameter_estimation;inference,solver,Python,https://github.com/benstahl92/deepSIP,,GPL-3.0,astronomy;supernovae;deep-learning;spectroscopy
158,Avocado (Genomics),Distributed variant caller for genomics,"A distributed variant caller built on top of the ADAM genomics processing engine, designed for calling variants from high-throughput sequencing data.",Bioinformatics,variant_calling,solver,Scala,https://github.com/bigdatagenomics/avocado,,Apache-2.0,genomics;variant-calling;bioinformatics;distributed-computing
159,Icarus,Stellar binary light curve synthesis tool,"A tool for synthesizing light curves of stellar binary systems, used for modeling and analyzing binary star data.",A2,simulation;modeling,solver,Python,https://github.com/bretonr/Icarus,,None,astronomy;binary-stars;light-curve-synthesis
160,Astro R-CNN,Instance segmentation for astronomical images using Mask R-CNN,An implementation of Mask R-CNN adapted for instance segmentation and detection of sources in astronomical images.,A2,image_analysis;segmentation,solver,Jupyter Notebook,https://github.com/burke86/astro_rcnn,,MIT,astronomy;computer-vision;deep-learning;segmentation
161,Deep-LC,General astrophysical light curve classification package,A Python package designed for the classification of general astrophysical light curves using deep learning techniques.,A2;A2-03,classification,library,Python,https://github.com/ckm3/Deep-LC,,NOASSERTION,astronomy;light-curves;classification;deep-learning
162,astrodash,Deep learning for automated spectral classification of supernovae,DASH (Deep Automated Supernova cHaracterization) is a deep learning software for the automated spectral classification of supernovae.,A2,classification;spectroscopy,solver,Python,https://github.com/daniel-muthukrishna/astrodash,,MIT,astronomy;supernovae;spectroscopy;deep-learning
163,SCONES,Self-Consistent Neural Network for Protein Stability Prediction,"A neural network based tool for predicting protein stability changes upon mutations, utilizing a self-consistent representation of the protein environment.",Biology;Bioinformatics,structure_prediction;stability_prediction,solver,Python,https://github.com/devalab/SCONES,,MIT,protein-stability;deep-learning;mutation
164,AVOCADO,Adaptive Optimal Collision Avoidance driven by Opinion,"A robotics navigation framework implementing an adaptive optimal collision avoidance algorithm driven by opinion dynamics, as presented in IEEE Transactions on Robotics.",Robotics;Control_Systems,motion_planning;collision_avoidance,solver,Python,https://github.com/dmartinezbaselga/AVOCADO,,NOASSERTION,robotics;navigation;collision-avoidance
165,braai,Real-bogus astrophysical event classification for ZTF,A deep learning based tool for separating real astrophysical events from bogus detections (artifacts) in Zwicky Transient Facility (ZTF) data.,Astronomy;A2;A2-03,classification;transient_detection;quality_control,solver,Jupyter Notebook,https://github.com/dmitryduev/braai,,MIT,ztf;deep-learning;transient-detection
166,tails,Deep learning based comet detection for ZTF,A deep learning pipeline designed to identify and chase comets within the Zwicky Transient Facility (ZTF) data stream.,Astronomy;A2,object_detection;classification,solver,Python,https://github.com/dmitryduev/tails,,MIT,comets;deep-learning;ztf
167,lightcurver,Pipeline for light curve extraction from astronomical images,A pipeline designed for the precise extraction of light curves through forward modelling of regions from time-series wide-field astronomical images.,Astronomy;A2,photometry;data_processing,workflow,Python,https://github.com/duxfrederic/lightcurver,,GPL-3.0,light-curves;photometry;image-processing
168,upsilon,Automated Classification of Periodic Variable Stars,A machine learning library for the automated classification of periodic variable stars using light curve features.,Astronomy;A2;A2-03,classification;time_series_analysis,library,Python,https://github.com/dwkim78/upsilon,,MIT,variable-stars;random-forest;classification
169,AltaiPony,Flare finding in Kepler and TESS light curves,"A Python package for de-trending light curves and finding stellar flares in Kepler, K2, and TESS mission data.",Astronomy;A2,event_detection;detrending,library,Jupyter Notebook,https://github.com/ekaterinailin/AltaiPony,https://altaipony.readthedocs.io,MIT,stellar-flares;kepler;tess;time-series
170,jaxoplanet,Astronomical time series analysis with JAX,A library for probabilistic inference and analysis of astronomical time series (specifically exoplanets) built on top of JAX.,Astronomy;A2,inference;modeling;time_series_analysis,library,Python,https://github.com/exoplanet-dev/jaxoplanet,,MIT,jax;exoplanets;inference
171,kantime,R bindings for NeuralForecast KAN models,"Provides R bindings for Nixtla's neuralforecast library, specifically enabling the use of Kolmogorov-Arnold Networks (KANs) for time series forecasting within the R ecosystem.",Time_Series;A2,forecasting;modeling,library,R,https://github.com/frankiethull/kantime,,NOASSERTION,time-series;kan;neural-networks;forecasting
172,cosmogrb,Cosmological GRB light curve simulator,"A simulator for generating synthetic light curves of Gamma-Ray Bursts (GRBs) in a cosmological context, useful for testing analysis pipelines.",Astronomy;A2,simulation;data_generation,solver,Python,https://github.com/grburgess/cosmogrb,,BSD-2-Clause,grb;simulation;light-curves
173,lightcurve_fitting,Tools to fit analytical models to multiband light curves,"A toolkit for fitting analytical models to multiband light curves of astronomical transients, supporting parameter estimation.",Astronomy;A2,fitting;parameter_estimation,library,Python,https://github.com/griffin-h/lightcurve_fitting,,GPL-3.0,light-curves;fitting;transients
174,grtrace,General Relativity Raytracer,"A raytracing tool that simulates light bending in curved spacetimes, allowing for visualization and analysis of general relativity effects.",Physics;Astronomy,simulation;visualization,solver,D,https://github.com/grtrace/grtrace,,MIT,general-relativity;raytracing;simulation
175,magic-microlensing,Microlensing Analysis Guided by Intelligent Computation,A PyTorch-based framework for the automatic analysis and modeling of realistic microlensing light curves using neural networks.,Astronomy;A2,analysis;modeling;microlensing,workflow,Jupyter Notebook,https://github.com/haimengzhao/magic-microlensing,,None,microlensing;pytorch;light-curves
176,astroNN,Deep Learning for Astronomers with Keras,"A python package containing deep learning tools and models specifically designed for astronomical applications, including spectroscopy and photometry analysis.",Astronomy;A2;A2-03,analysis;modeling;classification,library,Python,https://github.com/henrysky/astroNN,https://astronn.readthedocs.io/,MIT,deep-learning;keras;spectroscopy;photometry
177,PyTransit,Fast and easy exoplanet transit light curve modelling,"A Python package for creating exoplanet transit light curves, offering optimized performance for modelling and analysis of photometric data.",Astronomy;Exoplanets,light_curve_modelling;transit_detection,library,Python,https://github.com/hpparvi/PyTransit,https://github.com/hpparvi/PyTransit,GPL-2.0,exoplanets;light-curves;modelling
178,Fulu,Supernova light curve approximation library,"A Python library providing machine learning-based methods for approximating and augmenting supernova light curves, useful for handling sparse astronomical time-series data.",Astronomy;Time-Domain,light_curve_approximation;data_augmentation,library,Python,https://github.com/hse-cs/fulu,https://github.com/hse-cs/fulu,MIT,supernova;light-curves;approximation;machine-learning
179,Avocado (Epigenomics),Deep tensor factorization for epigenome imputation,A multi-scale deep tensor factorization model that learns latent representations of the human epigenome to impute missing experiments and analyze epigenomic data.,Biology;Genomics,imputation;representation_learning,solver,Python,https://github.com/jmschrei/avocado,https://github.com/jmschrei/avocado,NOASSERTION,epigenomics;tensor-factorization;imputation
180,VARTOOLS,Command line tool for astronomical time series analysis,"A program for processing and analyzing astronomical time series data, providing tools for period search, light curve manipulation, and statistics.",Astronomy;Time-Domain,time_series_analysis;period_finding,solver,C,https://github.com/joeldhartman/vartools,https://www.astro.princeton.edu/~jhartman/vartools/,GPL-3.0,time-series;astronomy;period-detection
181,FATS-2.0,Feature Analysis for Time Series in Astronomy,A Python library for extracting features from astronomical light curves to facilitate machine learning classification and variability analysis.,Astronomy;Time-Domain,feature_extraction;time_series_analysis,library,Python,https://github.com/jonwihl/FATS-2.0,https://github.com/jonwihl/FATS-2.0,MIT,feature-extraction;light-curves;time-series
182,xSAGA,Deep learning extension for SAGA galaxy survey,A tool extending the SAGA survey to wide-field regimes using deep learning to identify satellite galaxies around Milky Way analogs.,Astronomy;Galactic,object_detection;classification,workflow,Jupyter Notebook,https://github.com/jwuphysics/xSAGA,https://github.com/jwuphysics/xSAGA,GPL-3.0,galaxy-survey;deep-learning;satellite-galaxies
183,Avocado (Astronomy),Photometric classification of astronomical transients,"A package for the photometric classification of astronomical transients and variables, featuring data augmentation techniques (Gaussian Process) to handle biased spectroscopic samples.",Astronomy;Time-Domain,classification;data_augmentation;transient_detection,library,Python,https://github.com/kboone/avocado,https://avocado-classifier.readthedocs.io/,MIT,transients;classification;light-curves;augmentation
184,Pyriod,Period detection and fitting for astronomical time series,A Python tool for identifying periods in astronomical time series data and fitting models to the variability.,Astronomy;Time-Domain,period_finding;time_series_fitting,library,Python,https://github.com/keatonb/Pyriod,https://github.com/keatonb/Pyriod,GPL-3.0,periodogram;time-series;astronomy
185,light-curve,High-performance time-series feature extraction in Rust,"A Rust library for fast and efficient feature extraction from time-series data, specifically designed for astronomical light curves.",Astronomy;Time-Domain,feature_extraction;time_series_analysis,library,Rust,https://github.com/light-curve/light-curve,https://docs.rs/light-curve/,GPL-3.0,rust;feature-extraction;light-curves
186,light-curve-python,Python bindings for light-curve feature extraction,"Python bindings for the 'light-curve' Rust library, enabling fast feature extraction from astronomical light curves within Python workflows.",Astronomy;Time-Domain,feature_extraction,library,Python,https://github.com/light-curve/light-curve-python,https://pypi.org/project/light-curve/,GPL-3.0,python-binding;feature-extraction;light-curves
187,batman,Fast transit light curve models,"A Python package for the calculation of exoplanet transit light curves, known for its speed and flexibility in modelling transit events.",Astronomy;Exoplanets,light_curve_modelling;transit_simulation,library,Python,https://github.com/lkreidberg/batman,https://www.cfa.harvard.edu/~lkreidberg/batman/,GPL-3.0,exoplanets;transit-modelling;light-curves
188,LLCaps,Low-light enhancement for capsule endoscopy,A deep learning model for illuminating low-light capsule endoscopy images using curved wavelet attention and reverse diffusion.,Medicine;Imaging,image_enhancement;medical_imaging,solver,Python,https://github.com/longbai1006/LLCaps,https://github.com/longbai1006/LLCaps,MIT,medical-imaging;endoscopy;image-enhancement
189,lightcurves,R code for light curve analysis,"A collection of R scripts and functions for analyzing light curves, including classification, noisification, and outlier detection.",Astronomy;Time-Domain,classification;outlier_detection,library,R,https://github.com/longjp/lightcurves,https://github.com/longjp/lightcurves,None,R;light-curves;analysis
190,LightCurvesClassifier,Machine learning classifier for astronomical light curves,A Python package designed for the machine learning-based classification of astronomical objects using their light curve data.,Astronomy;Time-Domain,classification,library,Python,https://github.com/mavrix93/LightCurvesClassifier,https://github.com/mavrix93/LightCurvesClassifier,MIT,classification;machine-learning;light-curves
191,ELISa,Eclipsing binary Learning and Interactive System,"A Python-based tool for efficient modeling of light and radial velocity curves of eclipsing binaries, including optimization methods like MCMC.",Astronomy;Stellar,light_curve_modelling;parameter_estimation,solver,Python,https://github.com/mikecokina/elisa,https://github.com/mikecokina/elisa,GPL-3.0,eclipsing-binaries;modelling;radial-velocity
192,MiraPy,Deep Learning library for Astronomy,"A Python package facilitating the application of deep learning techniques to astronomical data, including light curves and images.",Astronomy;AI4S,deep_learning;classification;analysis,library,Python,https://github.com/mirapy-org/mirapy,https://mirapy.readthedocs.io/,MIT,deep-learning;astronomy;python
193,AnomalyALeRCE,Anomaly Detector for ALeRCE broker,A tool for detecting anomalies in astronomical data streams processed by the ALeRCE broker.,Astronomy;Time-Domain,anomaly_detection;stream_processing,solver,Jupyter Notebook,https://github.com/mperezcarrasco/AnomalyALeRCE,https://github.com/mperezcarrasco/AnomalyALeRCE,None,anomaly-detection;alerce;astronomy
194,BTSbot,Automated supernova identification bot,A multi-modal deep learning system for the automated identification and classification of supernovae from survey data.,Astronomy;Time-Domain,classification;object_identification,solver,Python,https://github.com/nabeelre/BTSbot,https://github.com/nabeelre/BTSbot,MIT,supernova;deep-learning;automation
195,ExoMiner,Deep learning for exoplanet validation,A deep learning-based tool for automating the vetting and validation of exoplanet candidates from Kepler and TESS photometry missions.,Astronomy;Exoplanets,validation;classification,solver,Python,https://github.com/nasa/ExoMiner,https://github.com/nasa/ExoMiner,None,exoplanets;deep-learning;validation
