id,name,one_line_profile,detailed_description,domains,subtask_category,application_level,primary_language,repo_url,help_website,license,tags
67,GaTector,Unified framework for gaze object prediction,A framework for gaze object prediction that utilizes a specific-general-specific (SGS) feature extractor to handle scene and head images for gaze estimation and object detection.,Computer Vision;Human-Computer Interaction,gaze_prediction;object_detection,solver,Python,https://github.com/CodeMonsterPHD/GaTector-A-Unified-Framework-for-Gaze-Object-Prediction,,None,gaze-estimation;deep-learning;computer-vision
68,fink-mm,Multi-messenger astrophysics correlation for Fink broker,A module for the Fink broker that correlates Fink alerts with the General Coordinates Network (GCN) to enable multi-messenger astrophysics analysis.,Astronomy;A2;A2-02,alert_correlation;multi-messenger;transient_analysis,library,Python,https://github.com/FusRoman/fink-mm,,Apache-2.0,fink;astronomy;multi-messenger;gcn
69,GWAS_tools,Pipeline for processing GWAS summary statistics,A shell-based pipeline for processing and quality controlling Genome-Wide Association Study (GWAS) summary statistic datasets.,Bioinformatics;Genetics,data_processing;quality_control;gwas,workflow,Shell,https://github.com/GRealesM/GWAS_tools,,None,gwas;bioinformatics;pipeline
70,pymser,Marginal Standard Error Rule for transient regime detection in simulations,A Python library applying the Marginal Standard Error Rule (MSER) to detect and truncate transient regimes in Grand Canonical Monte Carlo adsorption simulations.,Chemistry;Physics;Materials Science,simulation_analysis;transient_detection;statistics,library,Jupyter Notebook,https://github.com/IBM/pymser,,BSD-3-Clause,monte-carlo;simulation;mser;adsorption
71,gwIAS-HM,Gravitational wave search pipeline with higher harmonics,"A gravitational wave search pipeline that incorporates higher harmonics, developed by the IAS GW group.",Astronomy;Physics;A2,gravitational_waves;signal_search;pipeline,workflow,Jupyter Notebook,https://github.com/JayWadekar/gwIAS-HM,,MIT,gravitational-waves;ligo;higher-harmonics
72,GWAS-pipeline,GWAS analysis pipeline from QC to summary statistics,A pipeline for Genome-Wide Association Studies covering steps from quality control to generating summary statistics.,Bioinformatics;Genetics,gwas;quality_control;statistical_analysis,workflow,HTML,https://github.com/Jianhua-Wang/GWAS-pipeline,,None,gwas;pipeline;genetics
73,GWENA,Gene Co-expression Network Analysis pipeline,"A pipeline for performing Gene Co-expression Network Analysis (GCNA), facilitating the construction and analysis of gene networks.",Bioinformatics;Genomics,network_analysis;gene_expression,workflow,R,https://github.com/Kumquatum/GWENA,,GPL-3.0,gene-network;co-expression;bioinformatics
74,ztf-alert-server,Alert repository server for ZTF alerts,A server implementation for handling and storing alerts generated by the Zwicky Transient Facility (ZTF).,Astronomy;A2;A2-02,alert_management;data_storage,service,Python,https://github.com/LCOGT/ztf-alert-server,,GPL-3.0,ztf;alerts;astronomy
75,mwa_trigger,VOEvent handling and triggering for MWA telescope,A daemon and library for handling VOEvents and generating triggered observations for the Murchison Widefield Array (MWA) radio telescope.,Astronomy;A2;A2-02,telescope_triggering;voevent_handling,service,Python,https://github.com/MWATelescope/mwa_trigger,,MIT,radio-astronomy;mwa;voevent;trigger
76,BnsLib,Library for binary neutron star GW data analysis,"A PyCBC-based library for working with binary neutron star or binary black hole gravitational wave data, specifically in the context of machine learning applications.",Astronomy;Physics;A2,data_analysis;gravitational_waves;machine_learning,library,Python,https://github.com/MarlinSchaefer/BnsLib,,MIT,gravitational-waves;pycbc;machine-learning
77,Quinn2019_BurstHMM,Transient event detection using Hidden Markov Models,"Implementation of Hidden Markov Models (HMM) for detecting transient burst events in time-series data, likely for neuroscience or similar signal processing applications.",Neuroscience;Signal Processing,event_detection;time_series_analysis,solver,MATLAB,https://github.com/OHBA-analysis/Quinn2019_BurstHMM,,MIT,hmm;transient-detection;matlab
78,Water-Body-Detection-from-Satellite-Imagery,Water body detection using remote sensing indices,"A tool for detecting water bodies from satellite imagery using remote sensing techniques like NDWI, MNDWI, and supervised classification models.",Remote Sensing;Earth Science,image_classification;water_detection,solver,,https://github.com/Otutu11/Water-Body-Detection-from-Satellite-Imagery,,None,remote-sensing;satellite-imagery;ndwi
79,GWSpace,Multi-mission science data simulator for space-based gravitational wave detection,"A simulation tool designed for space-based gravitational wave detection missions (like TianQin), enabling the generation of simulated scientific data for mission planning and analysis.",A2;A2-02,simulation;data_generation,solver,C,https://github.com/TianQinSYSU/GWSpace,,GPL-3.0,gravitational-waves;simulation;space-mission
80,TransientViT,Real/bogus transient classifier using CNN-ViT hybrid model,A deep learning model combining CNN and Vision Transformers for classifying transient candidates (real vs bogus) in the Kilodegree Automatic Transient Survey (KATS).,A2;A2-02,classification;transient_detection,solver,Python,https://github.com/TimeDevBlocker/TransientViT,,GPL-3.0,transient-detection;deep-learning;vision-transformer
81,perl-modules-for-voevent,Perl modules for handling IVOA standard VOEvent messages,"A library for parsing and handling VOEvent messages, which are the standard for astronomical transient alerts in the Virtual Observatory infrastructure.",A2;A2-02,data_processing;alert_handling,library,Perl,https://github.com/aallan/perl-modules-for-voevent,,None,voevent;astronomy;transient-alerts
82,ALeRCE Client,Python client for the ALeRCE astronomical broker,"A client library to interact with the ALeRCE (Automatic Learning for the Rapid Classification of Events) broker, facilitating access to astronomical alerts and light curves.",A2;A2-02,data_access;alert_query,library,Python,https://github.com/alercebroker/alerce_client,https://alerce.readthedocs.io/,MIT,astronomy;broker;client
83,Light Curve Classifier,Machine learning classifier for astronomical light curves,A component of the ALeRCE broker system designed to classify astronomical objects based on their light curves using machine learning techniques.,A2;A2-02,classification;light_curve_analysis,solver,Jupyter Notebook,https://github.com/alercebroker/lc_classifier,,NOASSERTION,classification;light-curves;machine-learning
84,ALeRCE Pipeline,Processing pipeline for the ALeRCE astronomical broker,"The core processing pipeline for the ALeRCE broker, handling the ingestion, processing, and classification of astronomical alert streams.",A2;A2-02,pipeline;data_processing,workflow,Jupyter Notebook,https://github.com/alercebroker/pipeline,,None,pipeline;astronomy;alert-stream
85,ZTF Explorer,Visualization tool for ZTF data via ALeRCE,A web-based exploration tool for visualizing and analyzing ZTF (Zwicky Transient Facility) data provided by the ALeRCE broker.,A2;A2-02,visualization;data_exploration,platform,Vue,https://github.com/alercebroker/ztf_explorer,https://alerce.online,None,visualization;ztf;astronomy
86,VAST Pipeline,Radio transient detection pipeline for the VAST project,"The data processing pipeline for the VAST (Variables and Slow Transients) survey on the ASKAP telescope, designed to detect radio transients.",A2;A2-02,pipeline;transient_detection,workflow,Python,https://github.com/askap-vast/vast-pipeline,,MIT,radio-astronomy;transient-detection;pipeline
87,Fink Broker,Astronomy broker based on Apache Spark,"A scalable community broker for processing large streams of astronomical alerts (e.g., from ZTF, LSST) using Apache Spark, enabling real-time transient detection and classification.",A2;A2-02,alert_broker;data_processing,platform,Python,https://github.com/astrolabsoftware/fink-broker,https://fink-broker.readthedocs.io/,Apache-2.0,broker;spark;astronomy;transients
88,Fink Client,Client for manipulating Fink broker alerts,"A lightweight client library for users to interact with the Fink broker, query alerts, and retrieve data.",A2;A2-02,data_access;client,library,Jupyter Notebook,https://github.com/astrolabsoftware/fink-client,https://fink-broker.readthedocs.io/en/latest/client/,Apache-2.0,client;fink;astronomy
89,Fink Science,Science modules for Fink broker alerts,"A collection of science modules and algorithms used within the Fink broker to add value to alerts, such as classification scores and cross-matching.",A2;A2-02,analysis;classification,library,Jupyter Notebook,https://github.com/astrolabsoftware/fink-science,,Apache-2.0,science-modules;classification;astronomy
90,Fink Science Portal,Web portal for exploring Fink broker data,"The web interface and backend for the Fink Science Portal, allowing users to visualize, search, and analyze astronomical alerts processed by Fink.",A2;A2-02,visualization;data_exploration,platform,Python,https://github.com/astrolabsoftware/fink-science-portal,https://fink-portal.org/,Apache-2.0,web-portal;visualization;astronomy
91,Bilby,Unified framework for stochastic sampling and gravitational-wave inference,"A user-friendly Bayesian inference library for gravitational-wave astronomy, providing a unified interface to various stochastic samplers.",A2;A2-02,inference;parameter_estimation;gravitational_wave_analysis,library,Python,https://github.com/bilby-dev/bilby,https://lscsoft.docs.ligo.org/bilby/,MIT,gravitational-waves;bayesian-inference;astronomy
92,AMPEL,Modular and scalable platform for analyzing streaming data,"The Amazing Multipurpose Policy Engine (AMPEL) is a software framework designed for the analysis of high-throughput heterogeneous data streams, widely used in astronomy for transient alert processing (e.g., ZTF, LSST).",A2;A2-02,alert_processing;transient_detection;data_filtering,platform,Go,https://github.com/carabiner-dev/ampel,https://ampelproject.github.io/,Apache-2.0,astronomy;transients;alert-broker;streaming-data
93,rtpipe,Real-time fast transient detection pipeline for radio interferometric data,A pipeline designed for searching and detecting fast radio transients (like FRBs) in real-time using visibility data from radio interferometers such as the VLA.,A2;A2-02,transient_detection;pipeline;radio_astronomy,workflow,Python,https://github.com/caseyjlaw/rtpipe,,BSD-3-Clause,radio-astronomy;transients;frb;pipeline
94,DASH,Deep learning for automated spectral classification of supernovae,"Deep Automated Supernova Hostless (DASH) is a software package that automates the classification of supernova spectra using deep learning, capable of identifying type, age, and redshift.",A2;A2-02,spectral_classification;supernova_analysis;deep_learning,solver,Python,https://github.com/daniel-muthukrishna/astrodash,https://astrodash.readthedocs.io/,MIT,supernova;spectroscopy;classification;deep-learning
95,Dingo,Deep inference for gravitational-wave observations,"A deep learning library for performing rapid parameter estimation and inference on gravitational wave data, enabling fast analysis of compact binary coalescences.",A2;A2-02,inference;parameter_estimation;gravitational_wave_analysis,library,Python,https://github.com/dingo-gw/dingo,https://dingo-gw.readthedocs.io/,MIT,gravitational-waves;deep-learning;inference;astronomy
96,nf-gwas,Nextflow pipeline for genome-wide association studies (GWAS),"A comprehensive Nextflow pipeline to perform state-of-the-art genome-wide association studies, including quality control, phasing, imputation, and association testing.",Bioinformatics;Genomics,gwas;pipeline;genomics,workflow,Nextflow,https://github.com/genepi/nf-gwas,https://genepi.github.io/nf-gwas/,MIT,gwas;nextflow;bioinformatics;genomics
97,gwin,Bayesian inference package for gravitational-wave data,"A Python package designed for performing Bayesian inference on gravitational-wave data, facilitating parameter estimation and model selection.",A2;A2-02,inference;parameter_estimation;gravitational_waves,library,Python,https://github.com/gwastro/gwin,,GPL-3.0,gravitational-waves;bayesian-inference;astronomy
98,PyCBC,Core package for gravitational-wave data analysis and signal detection,"A comprehensive software package used to analyze gravitational-wave data, detect signals (such as compact binary mergers), and infer their parameters. It is a standard tool in the LIGO/Virgo collaboration.",A2;A2-02,signal_detection;parameter_estimation;data_analysis,solver,Python,https://github.com/gwastro/pycbc,http://pycbc.org/,GPL-3.0,gravitational-waves;ligo;virgo;signal-processing
99,SPANNER,Reconstruction algorithm for clinical photoacoustic imaging,"A robust algorithm called Superiorized Photo-Acoustic Non-NEgative Reconstruction (SPANNER) designed to reconstruct PA images in real-time, addressing limitations in viewing angles and imaging depth.",Medical Physics;Imaging,image_reconstruction;inverse_problem,solver,MATLAB,https://github.com/idanstei/Superiorized-Photo-Acoustic-Non-NEgative-Reconstruction-for-Clinical-Photoacoustic-Imaging,,None,photoacoustic-imaging;reconstruction-algorithm;medical-imaging
100,bilby (Genomics),Jax-based machine learning library for functional genomics,"A machine learning library implemented in Jax, specifically designed for functional genomics applications.",Genomics;Bioinformatics,machine_learning;functional_genomics,library,Python,https://github.com/ihh/bilby,,None,jax;genomics;machine-learning
101,IKMB GWAS Association,Pipeline for GWAS association testing,"The IKMB GWAS Association Testing Pipeline, designed to perform genome-wide association studies.",Genetics;Bioinformatics,gwas;association_testing,workflow,Python,https://github.com/ikmb/gwas-assoc,,MIT,gwas;pipeline;genetics
102,IKMB GWAS QC,Pipeline for GWAS quality control,"The IKMB GWAS Quality Control Pipeline, providing automated quality control steps for genome-wide association study data.",Genetics;Bioinformatics,quality_control;gwas,workflow,Python,https://github.com/ikmb/gwas-qc,,MIT,gwas;qc;bioinformatics
103,evo-mcts,Evolutionary Monte Carlo Tree Search for GW detection,Implementation of Automated Algorithmic Discovery for Gravitational-Wave Detection Guided by LLM-Informed Evolutionary Monte Carlo Tree Search.,Astronomy;Gravitational Waves,signal_detection;algorithm_discovery,solver,Python,https://github.com/iphysresearch/evo-mcts,,GPL-3.0,gravitational-waves;mcts;llm
104,TrioGWAS,Automated pipeline for GWAS on trios,An automated pipeline designed for performing Genome-Wide Association Studies (GWAS) specifically on trio data (parents and offspring).,Genetics;Bioinformatics,gwas;pipeline,workflow,Shell,https://github.com/isabellabadini/TrioGWAS,,MIT,gwas;trios;genetics
105,SAR Change Detection,Deep learning based change detection for SAR imagery,"Code for the paper 'Improved Difference Images for Change Detection Classifiers in SAR Imagery Using Deep Learning', implementing methods for analyzing Synthetic Aperture Radar images.",Remote Sensing;Computer Vision,change_detection;image_analysis,solver,Python,https://github.com/janne-alatalo/sar-change-detection,,MIT,sar;change-detection;deep-learning
106,Comet,VOEvent transport system for astronomical transients,A complete VOEvent transport system designed to receive and distribute astronomical event notifications (transients).,Astronomy;A2-02,alert_transport;voevent_handling,service,Python,https://github.com/jdswinbank/Comet,http://comet.transientskp.org/,BSD-2-Clause,voevent;transients;astronomy
107,time_to_detection,Time-to-detection simulations for PTA Gravitational Waves,A collection of scripts for performing time-to-detection simulations for Pulsar Timing Array (PTA) detection of Gravitational Waves.,Astronomy;Gravitational Waves,simulation;detection_analysis,solver,Python,https://github.com/jellis18/time_to_detection,,None,pulsar-timing-array;gravitational-waves;simulation
108,bacterialGWAS,GWAS pipeline for bacterial genomes,A pipeline for performing genome-wide association tests specifically tailored for bacterial genomes.,Microbiology;Genetics,gwas;bacterial_genomics,workflow,R,https://github.com/jessiewu/bacterialGWAS,,GPL-2.0,bacteria;gwas;genomics
109,SNEx2,Supernova Exchange built with TOM Toolkit,"The updated Supernova Exchange (SNEx), built with the TOM Toolkit and used by the Global Supernova Project collaboration for managing supernova observations.",Astronomy;A2,observation_management;transient_coordination,platform,Python,https://github.com/jfrostburke/snex2,,GPL-3.0,supernova;tom-toolkit;observation-management
110,gwas_gemma,Simple pipeline for GWAS with GEMMA,A pipeline to perform Genome-Wide Association Studies (GWAS) using the GEMMA software.,Genetics;Bioinformatics,gwas;pipeline,workflow,Shell,https://github.com/johanzi/gwas_gemma,,MIT,gemma;gwas;bioinformatics
111,hdrvdp,Visible Difference Metric for HDR images,"Implementation of HDR-VDP (High Dynamic Range Visible Difference Predictor), a metric for predicting visible differences in high dynamic range images, used in visual perception and image science research.",Image Science;Computer Vision,image_quality_assessment;visual_metric,solver,C++,https://github.com/jterrace/hdrvdp,,NOASSERTION,hdr;image-quality;metric
112,Repetitive-transient-impact-detector,Detector for repetitive transient impacts in bearing faults,"Code for the paper 'Repetitive transient impact detection and its application in cross-machine bearing fault detection', used for mechanical signal processing and fault diagnosis.",Mechanical Engineering;Signal Processing,fault_detection;signal_analysis,solver,Python,https://github.com/kangxin8/Repetitive-transient-impact-detector,,None,bearing-fault;transient-detection;signal-processing
113,stdpipe,Simple Transient Detection Pipeline,A set of tools and routines for processing astronomical images and detecting transient objects.,Astronomy;A2-02,transient_detection;image_processing,workflow,Jupyter Notebook,https://github.com/karpov-sv/stdpipe,,MIT,transients;astronomy;pipeline
114,stdweb,Web interface for Simple Transient Detection Pipeline,"A web-based platform for the Simple Transient Detection Pipeline (stdpipe), allowing users to interact with transient detection workflows.",Astronomy;A2-02,transient_detection;web_interface,platform,Python,https://github.com/karpov-sv/stdweb,,GPL-3.0,transients;web-interface;astronomy
115,Dedisp.jl,Brute-force dedispersion for radio transient detection,"A Julia library for brute-force dedispersion, a key step in detecting radio transients (like FRBs or pulsars) in radio astronomy data.",Astronomy;Radio Astronomy,dedispersion;transient_detection,library,Julia,https://github.com/kiranshila/Dedisp.jl,,MIT,radio-astronomy;dedispersion;julia
116,relativebilbying,Relative binning for Bilby GW inference,Code to include relative binning techniques in the Bilby library for faster gravitational wave parameter estimation.,Astronomy;Gravitational Waves,parameter_estimation;inference,library,Python,https://github.com/lemnis12/relativebilbying,,MIT,gravitational-waves;bilby;inference
117,Lifebit GWAS,GWAS pipeline using SAIGE,"A Genome-Wide Association Study (GWAS) pipeline implemented using SAIGE, designed for scalable analysis of genetic data.",Genetics;Bioinformatics,gwas;pipeline,workflow,R,https://github.com/lifebit-ai/gwas,,None,gwas;saige;bioinformatics
118,EdgRec,Surface anomaly detection via edge reconstruction,Reconstruction from edge image combined with color and gradient difference for industrial surface anomaly detection.,Computer Vision;Industrial Engineering,anomaly_detection;image_reconstruction,solver,Python,https://github.com/liutongkun/EdgRec,,None,anomaly-detection;reconstruction;industrial-inspection
119,nrutils_dev,Python API for Numerical Relativity data analysis,"Python API for low-level analysis of Numerical Relativity (NR) data, including Psi4, strain, modeling, and interfaces to LAL/PyCBC.",Astronomy;Physics,data_analysis;numerical_relativity,library,Jupyter Notebook,https://github.com/llondon6/nrutils_dev,,MIT,numerical-relativity;gravitational-waves;analysis
120,Lasair Project Management,Event handling platform for LSST:UK (Lasair),"The event handling site and project management code for Lasair, the LSST:UK alert broker, used for processing and filtering astronomical transients.",Astronomy;A2-02,alert_broker;event_handling,platform,,https://github.com/lsst-uk/lasair-project-management,https://lasair.roe.ac.uk/,Apache-2.0,lsst;alert-broker;transients
121,TOM (Toolkit for OOM),Toolkit for Observable Operator Modeling,"A toolkit for Observable Operator Models (OOMs), which are used for modeling stochastic processes and sequence data.",Mathematics;Statistics,stochastic_modeling;sequence_analysis,library,C++,https://github.com/m7thon/tom,,MIT,observable-operator-models;stochastic-processes;modeling
122,witsGWAS,Pipeline for Human GWAS analysis,A pipeline for Human GWAS analysis that accommodates both Affymetrix (raw .CEL files) and Illumina (Plink binaries) data.,Genetics;Bioinformatics,gwas;pipeline,workflow,Python,https://github.com/magosil86/witsGWAS,,MIT,gwas;bioinformatics;pipeline
123,TheFaultEngine,Engine for transient alarm detection and root cause analysis,"A fault analysis engine consisting of modules for transient alarm detection, root cause analysis, and correlated clusters, likely for industrial or systems engineering.",Systems Engineering;Industrial Engineering,fault_detection;root_cause_analysis,solver,Python,https://github.com/majumderb/TheFaultEngine,,None,fault-detection;root-cause-analysis;transients
124,ephemeris,"JavaScript library for calculating solar, planetary, and stellar ephemerides","A pure JavaScript implementation for performing astronomical ephemeris calculations, including positions of the sun, planets, comets, asteroids, and stars, suitable for web-based astronomical applications.",Astronomy,calculation;astrometry,library,JavaScript,https://github.com/mivion/ephemeris,,None,ephemeris;astronomy;solar-system;javascript
125,nessai,Nested Sampling with Artificial Intelligence for Bayesian inference,"A Python package that implements nested sampling algorithms accelerated by normalizing flows, designed for Bayesian inference tasks in physics and astronomy, particularly for gravitational wave data analysis.",Physics;Astronomy,inference;sampling,solver,Python,https://github.com/mj-will/nessai,https://nessai.readthedocs.io/,MIT,nested-sampling;bayesian-inference;normalizing-flows;gravitational-waves
126,nf-gwas-pipeline,Nextflow pipeline for Genome-Wide Association Studies (GWAS),"A bioinformatics pipeline built with Nextflow for performing Genome-Wide Association Studies, automating the workflow from data processing to association analysis.",Bioinformatics,workflow;gwas_analysis,workflow,R,https://github.com/montilab/nf-gwas-pipeline,,GPL-3.0,gwas;nextflow;bioinformatics;pipeline
127,pygcn,Python package for processing NASA GCN notices,"A Python library provided by NASA-GCN for parsing and processing Gamma-ray Coordinates Network (GCN) notices, enabling automated handling of astronomical alerts.",Astronomy,data_processing;alert_handling,library,Python,https://github.com/nasa-gcn/pygcn,,GPL-3.0,gcn;gamma-ray;astronomy;alerts
128,nf-core/gwas,Portable pipeline for Genome-Wide Association Studies using Nextflow,"A community-curated Nextflow pipeline for performing Genome-Wide Association Studies (GWAS), ensuring reproducibility and portability across different computing environments.",Bioinformatics,workflow;gwas_analysis,workflow,Nextflow,https://github.com/nf-core/gwas,https://nf-co.re/gwas,MIT,gwas;nf-core;nextflow;bioinformatics
129,antaresEditObject,R package to edit Antares Simulator study parameters,"An R package developed by RTE for editing the input data and parameters of Antares Simulator studies, facilitating the configuration of large-scale power system simulations.",Energy;Engineering,simulation_setup;data_manipulation,library,R,https://github.com/rte-antares-rpackage/antaresEditObject,https://rte-antares-rpackage.github.io/antaresEditObject/,GPL-2.0,antares;power-systems;simulation;r-package
130,antaresProcessing,R package for processing Antares Simulator output data,"An R package for processing and aggregating the output data from Antares Simulator, enabling efficient analysis of power system simulation results.",Energy;Engineering,data_processing;post_processing,library,R,https://github.com/rte-antares-rpackage/antaresProcessing,https://rte-antares-rpackage.github.io/antaresProcessing/,GPL-3.0,antares;power-systems;data-processing;r-package
131,antaresRead,R package to import and explore Antares Simulator results,"An R package designed to import, manipulate, and explore simulation results generated by the Antares Simulator, serving as a bridge between the simulator and R's data analysis ecosystem.",Energy;Engineering,data_analysis;data_import,library,R,https://github.com/rte-antares-rpackage/antaresRead,https://rte-antares-rpackage.github.io/antaresRead/,None,antares;power-systems;data-analysis;r-package
132,antaresViz,Visualization package for Antares Simulator data,"An R package for generating interactive visualizations of data from Antares Simulator studies, helping researchers and engineers analyze power system dynamics.",Energy;Engineering,visualization;data_analysis,library,R,https://github.com/rte-antares-rpackage/antaresViz,https://rte-antares-rpackage.github.io/antaresViz/,GPL-3.0,antares;visualization;power-systems;r-package
