id,name,one_line_profile,detailed_description,domains,subtask_category,application_level,primary_language,repo_url,help_website,license,tags
198,HAL,Hardware Abstraction Layer library for robotics,"A hardware abstraction layer library developed by the Autonomous Robotics Perception Group, providing a unified interface for interacting with various robotic sensors and actuators.",M5-02;Robotics,hardware_interface;robotics_control,library,C,https://github.com/arpg/HAL,,NOASSERTION,robotics;hal;hardware-abstraction
199,keyoscacquire,Data acquisition from Keysight InfiniiVision oscilloscopes,"A Python package for acquiring and saving traces from Keysight InfiniiVision oscilloscopes via a VISA interface, simplifying data collection in physics and engineering labs.",M5-02;Physics;Electrical_Engineering,data_acquisition;instrument_control,library,Python,https://github.com/asvela/keyoscacquire,https://keyoscacquire.readthedocs.io/,MIT,oscilloscope;visa;data-acquisition
200,tektronix-func-gen,Python control for Tektronix arbitrary function generators,"A Python library for controlling Tektronix AFG1000 and AFG3000 series arbitrary function generators via PyVISA, enabling automated signal generation.",M5-02;Physics;Electrical_Engineering,instrument_control;signal_generation,library,Python,https://github.com/asvela/tektronix-func-gen,,MIT,function-generator;tektronix;visa
201,Coupling_ABAQUS_MATLAB,Framework for coupling ABAQUS FEM with MATLAB,"A framework for Software-in-the-Loop (SiL) simulation, enabling the coupling of ABAQUS Finite Element analysis with MATLAB for tasks like structural optimization and control system analysis.",Engineering;Materials;Simulation,simulation_coupling;optimization,workflow,Python,https://github.com/attaoveisi/Coupling_ABAQUS_MATLAB,,BSD-2-Clause,abaqus;matlab;fem
202,autolab,Python package for scientific experiment automation,"A Python package designed for controlling laboratory instruments and automating scientific experiments, providing a unified interface for various hardware devices.",M5-02;Lab_Automation,instrument_control;workflow_automation,library,Python,https://github.com/autolab-project/autolab,,GPL-3.0,lab-automation;instrument-control;python
203,flowchem,Instrument control application for flow chemistry labs,"An application to simplify the control of instruments and devices commonly found in chemistry labs, particularly for flow chemistry automation.",M5-02;Chemistry;Lab_Automation,instrument_control;chemistry_automation,platform,Python,https://github.com/automatedchemistry/flowchem,,MIT,flow-chemistry;automation;instrument-control
204,pyTEM,Control and automation library for Transmission Electron Microscopes (TEM),"A Python library developed by BASF for the control and automation of Transmission Electron Microscopes (TEM), enabling scripted experiments and data acquisition for materials science.",M5;M5-02,microscope_control;data_acquisition,library,Python,https://github.com/basf/pyTEM,,MIT,tem;microscopy;automation;materials-science
205,easy-scpi,Python library for controlling SCPI-compliant laboratory instruments,"A Python library designed to simplify the control of test and measurement instruments that communicate via the SCPI (Standard Commands for Programmable Instruments) protocol, commonly used in physics and electronics labs.",M5;M5-02,instrument_control;scpi_communication,library,Python,https://github.com/bicarlsen/easy-scpi,,Apache-2.0,scpi;instrument-control;lab-automation;visa
206,visa_serial_port_redirect_over_socket,Tunnel RS-232 VISA instrument interfaces over TCP/IP,Scripts to enable network access to legacy laboratory instruments that only possess RS-232 serial interfaces by tunneling the VISA interface over a TCP/IP socket.,M5;M5-02,instrument_connectivity;legacy_hardware_support,solver,Shell,https://github.com/bkuschak/visa_serial_port_redirect_over_socket,,MIT,visa;rs232;instrument-control;tcp-ip
207,Bluesky,Experiment orchestration and data acquisition system for synchrotrons,"A library for experiment orchestration and data acquisition, developed by Brookhaven National Laboratory (NSLS-II). It provides a high-level interface for controlling hardware, sequencing experiments, and collecting data in a structured way.",M5;M5-02,experiment_orchestration;data_acquisition,workflow,Python,https://github.com/bluesky/bluesky,https://blueskyproject.io/bluesky,BSD-3-Clause,data-acquisition;experiment-control;synchrotron;nsls-ii
208,Ophyd,Hardware abstraction layer for experimental equipment,"A hardware abstraction library that provides a consistent interface for controlling a wide variety of laboratory hardware (motors, detectors, etc.), primarily using EPICS, as part of the Bluesky ecosystem.",M5;M5-02,hardware_abstraction;device_control,library,Python,https://github.com/bluesky/ophyd,https://blueskyproject.io/ophyd,BSD-3-Clause,epics;hardware-control;abstraction-layer;bluesky
209,ophyd-async,Asynchronous hardware abstraction for Bluesky,"The next-generation hardware abstraction library for the Bluesky ecosystem, written using Python's asyncio to support asynchronous device communication and control.",M5;M5-02,hardware_abstraction;device_control,library,Python,https://github.com/bluesky/ophyd-async,,BSD-3-Clause,asyncio;hardware-control;bluesky
210,pyvisa-proxy,Remote server and client for PyVISA instrument control,"A tool that enables remote control of laboratory hardware by acting as a proxy server and client for PyVISA, allowing instruments connected to one machine to be controlled from another over a network.",M5;M5-02,instrument_connectivity;remote_control,solver,Python,https://github.com/casabre/pyvisa-proxy,,MIT,pyvisa;remote-control;lab-automation;proxy
211,pyseq2501,Controller to repurpose Illumina HiSeq as a microscope,A Python controller that allows repurposing the Illumina HiSeq 2000/2500 sequencing platforms as epifluorescence microscopes with integrated fluidics control for custom experimental setups.,M5;M5-02,microscope_control;fluidics_control;hardware_repurposing,solver,Python,https://github.com/chaichontat/pyseq2501,,GPL-3.0,illumina;microscopy;fluidics;hardware-hacking
212,eakins-camera,Socket-based control for Eakins microscope cameras,"A tool for controlling Eakins microscope cameras via network sockets, enabling automated image capture and settings adjustment for microscopy workflows.",M5;M5-02,camera_control;microscopy,solver,C,https://github.com/charlie-x/eakins-camera,,Unlicense,microscope;camera-control;automation
213,Pycrafter6500,Controller for TI DLP LightCrafter 6500,"A Python controller for the Texas Instruments DLPLCR6500EVM evaluation module, enabling 'pattern on the fly' mode for structured light applications in optics and microscopy.",M5;M5-02,dlp_control;pattern_projection;optics_control,library,Python,https://github.com/csi-dcsc/Pycrafter6500,,GPL-3.0,dlp;texas-instruments;structured-light;optics
214,coPylot,Microscope control software,"A microscope control software package developed by CZ Biohub SF, designed to automate and orchestrate microscopy experiments.",M5;M5-02,microscope_control;automation,solver,Python,https://github.com/czbiohub-sf/coPylot,,BSD-3-Clause,microscopy;automation;biohub
215,octave-instrument-control,Instrument control package for GNU Octave,"A package for GNU Octave that provides interfaces for controlling laboratory instruments via GPIB, USBTMC, VXI11, and VISA protocols.",M5;M5-02,instrument_control;data_acquisition,library,C++,https://github.com/dac922/octave-instrument-control,https://gnu-octave.github.io/packages/instrument-control/,NOASSERTION,octave;gpib;visa;instrument-control
216,pyhamilton,Python interface for Hamilton liquid handling robots,"A Python library for controlling Hamilton liquid handling robots (e.g., Microlab STAR), enabling automated biological and chemical workflows directly from Python scripts.",M5;M5-02,liquid_handling;robotics_control;lab_automation,library,Python,https://github.com/dgretton/pyhamilton,,MIT,hamilton;liquid-handling;automation;robotics
217,Uni-Lab-OS,Integrated operating system platform for laboratory automation and device control,"A comprehensive platform designed for laboratory automation, providing interfaces for controlling various lab equipment and orchestrating experimental workflows. Developed by DP Technology, it aims to standardize the interaction between software and hardware in scientific laboratories.",M5;M5-02,lab_automation;device_control;workflow_orchestration,platform,Python,https://github.com/dptech-corp/Uni-Lab-OS,,GPL-3.0,lab-automation;robotics;device-control
218,CARBS,Command and control framework for autonomous swarm robotics based on Random Finite Sets,"A Python package for Command, Control, and Information (C2I) of autonomous swarms, utilizing Random Finite Set (RFS) theory. Developed by the Laboratory for Autonomy, GNC, and Estimation Research (LAGER), it facilitates the management of robotic swarms in research environments.",M5-02,robotics_control;swarm_intelligence,library,Python,https://github.com/drjdlarson/carbs,,MIT,swarm-robotics;control-theory;rfs
219,GASUR,"Guidance, Navigation, and Control library for autonomous swarms","A Python package focused on Guidance, Navigation, and Control (GNC) for autonomous swarms using Random Finite Sets (RFS). Like CARBS, it is developed by the LAGER lab and provides algorithms for coordinating multiple autonomous agents.",M5-02,robotics_gnc;swarm_control,library,Python,https://github.com/drjdlarson/gasur,,MIT,gnc;swarm-robotics;autonomous-systems
220,Dagger,Experiment orchestration platform for reproducible research,"A tool for orchestrating experiments, likely focused on machine learning or computational research workflows. Developed by Facebook Research, it aids in managing the execution and reproducibility of scientific experiments.",M5,experiment_orchestration;workflow_management,workflow,Jupyter Notebook,https://github.com/facebookresearch/dagger,,MIT,experiment-tracking;reproducibility;orchestration
221,BEMCom,Communication framework for building energy management hardware abstraction,"A tool for the rapid implementation of hardware abstraction layers (HAL) in the context of Building Energy Management (BEM). Developed by FZI Research Center for Information Technology, it allows unified communication with diverse hardware devices in energy research.",M5-02,device_control;hardware_abstraction,library,Python,https://github.com/fzi-forschungszentrum-informatik/BEMCom,,MIT,energy-management;hardware-abstraction;iot
222,overreact,Tool for creating and analyzing chemical microkinetic models,"A library to create and analyze chemical microkinetic models derived from computational chemistry data. Developed at the GEEM lab, it automates the generation of kinetic models for chemical reaction networks.",M5,microkinetic_modeling;chemical_kinetics,library,Python,https://github.com/geem-lab/overreact,,MIT,computational-chemistry;kinetics;modeling
223,Open Cezeri Library (OCL),Matrix and computer vision library for robotic applications,"A Java-based library providing matrix operations, machine learning, and computer vision capabilities, designed for rapid development of robotic applications. Developed at Al-Jazari Laboratory, Siirt University.",M5-02,computer_vision;robotics_control;matrix_computation,library,Java,https://github.com/hakmesyo/open-cezeri-library,,NOASSERTION,computer-vision;robotics;matrix-library
224,OpenLH,Open source liquid handling system based on robotic arms,"An open-source liquid handling system built upon the uARM swift Pro robotic arm platform. Developed by IDC-milab, it enables biological experimentation and exploration through accessible robotic automation.",M5-02,liquid_handling;lab_automation,platform,JavaScript,https://github.com/idc-milab/openlh,,NOASSERTION,liquid-handling;diy-bio;robotics
225,htSMLM,Micro-Manager plugin for unsupervised localization microscopy imaging,"An EMU plugin designed to control localization microscopes within the Micro-Manager environment, enabling unsupervised imaging workflows for Single Molecule Localization Microscopy (SMLM).",M5;M5-02,imaging;device_control,solver,Java,https://github.com/jdeschamps/htSMLM,,NOASSERTION,microscopy;smlm;micro-manager;automation
226,PlatePlan,Planning software for high-throughput liquid handling,"Software designed to assist in planning high-throughput, combinatorial liquid handling dispenses, facilitating the design of experiments for automated laboratory robots.",M5;M5-02,experiment_planning;liquid_handling,solver,Python,https://github.com/jensenlab/PlatePlan,,None,lab-automation;liquid-handling;experiment-design
227,labscript-suite,Experiment control and automation system for quantum physics,"A metapackage for the labscript suite, a comprehensive system for experiment control, automation, and data acquisition, primarily used in quantum physics and atomic/molecular optics laboratories.",M5;M5-02,experiment_control;data_acquisition,platform,Python,https://github.com/labscript-suite/labscript-suite,http://labscriptsuite.org,BSD-2-Clause,experiment-control;quantum-physics;lab-automation
228,python-labthings,Framework for creating RESTful lab hardware interfaces,"A Python implementation of the LabThings framework, allowing researchers to create RESTful APIs for laboratory hardware to facilitate device control and automation integration.",M5;M5-02,device_control;iot_integration,library,Python,https://github.com/labthings/python-labthings,,GPL-3.0,iot;lab-automation;flask;hardware-interface
229,YouScope,Open-source microscope control software,"A microscope control software designed to automate imaging tasks, synchronize hardware components, and facilitate complex microscopy experiments.",M5;M5-02,microscope_control;imaging,solver,Java,https://github.com/langmo/youscope,http://www.youscope.org,GPL-2.0,microscopy;automation;imaging
230,pyTecanFluent,Python interface for TECAN Fluent liquid handling robots,"A Python library providing an interface to control TECAN Fluent liquid handling robots, enabling automation of liquid dispensing tasks in laboratory workflows.",M5;M5-02,liquid_handling;robotics_control,library,Python,https://github.com/leylabmpi/pyTecanFluent,,MIT,tecan;liquid-handling;automation;lab-robotics
231,mahi-daq,HAL for commercial Data Acquisition (DAQ) interfaces,"A Hardware Abstraction Layer (HAL) designed to interface with various commercial Data Acquisition (DAQ) cards, providing a unified C interface for reading and writing analog/digital signals in research setups.",M5;M5-02,data_acquisition;hardware_interface,library,C,https://github.com/mahilab/mahi-daq,,MIT,daq;data-acquisition;hardware-abstraction
232,camera-controller,Microscope camera control interface,"A user interface and control software for digital cameras attached to microscopes, developed for data acquisition in microscopy experiments.",M5;M5-02,imaging;device_control,solver,Python,https://github.com/manoharan-lab/camera-controller,,None,microscopy;camera-control;imaging
233,atomate2,Computational materials science workflows library,"A library of computational materials science workflows (e.g., for VASP, Amber) designed to run on high-performance computing resources using FireWorks or similar workflow managers.",M5,workflow_management;simulation,library,Python,https://github.com/materialsproject/atomate2,https://materialsproject.github.io/atomate2/,NOASSERTION,materials-science;workflows;vasp;high-throughput
234,Contrast,Lightweight data acquisition framework for beamline experiments,"A Python-based framework designed for orchestrating experiments and data acquisition at the MAX IV Laboratory beamlines, handling hardware communication and scan logic.",M5;M5-02,data_acquisition;experiment_orchestration,framework,Python,https://github.com/maxiv-science/contrast,,MIT,beamline;synchrotron;data-acquisition;max-iv
235,Test_Equipment_Control,Control library for lab test equipment like battery testers,"A Python library for controlling various laboratory test equipment, specifically focused on battery testing and DC-DC converter testing automation.",M5;M5-02,instrument_control;lab_automation,library,Python,https://github.com/mbA2D/Test_Equipment_Control,,GPL-3.0,battery-testing;instrument-control;lab-automation
236,rssd,Rohde & Schwarz SCPI Driver,A Python library providing a driver interface for Rohde & Schwarz test and measurement instruments using SCPI commands.,M5;M5-02,instrument_control;driver,library,Python,https://github.com/mclim9/rssd,,MIT,scpi;rohde-schwarz;instrument-driver
237,photonmover,Instrument control for optics and photonics labs,"A Python package for controlling scientific instruments commonly used in optics, photonics, and electronics laboratories.",M5;M5-02,instrument_control;photonics,library,Python,https://github.com/mdecea/photonmover,,MIT,optics;photonics;lab-automation
238,mesoSPIM-control,Acquisition software for mesoSPIM light-sheet microscopes,Software for controlling hardware and acquiring images with mesoSPIM (mesoscale Selective Plane Illumination Microscopy) light-sheet microscopes.,M5;M5-02,microscope_control;image_acquisition,application,Jupyter Notebook,https://github.com/mesoSPIM/mesoSPIM-control,http://mesospim.org,GPL-3.0,microscopy;light-sheet;mesospim;imaging
239,ExEngine,Execution engine for microscope control,"The execution engine component for Micro-Manager, handling the logic and sequencing of microscope control operations.",M5;M5-02,microscope_control;automation_logic,library,Python,https://github.com/micro-manager/ExEngine,,BSD-3-Clause,micro-manager;microscopy;automation
240,Micro-Manager,Open source software for microscope control and image acquisition,"A widely used open-source software package for controlling automated microscopes and imaging devices, integrated with ImageJ.",M5;M5-02,microscope_control;image_acquisition,platform,Java,https://github.com/micro-manager/micro-manager,https://micro-manager.org/,None,microscopy;imagej;hardware-control
241,QCoDeS,Modular data acquisition framework for physics experiments,"A Python-based data acquisition framework developed by Microsoft, primarily used for quantum computing and condensed matter physics experiments to control instruments and manage data.",M5;M5-02,data_acquisition;instrument_control,framework,Python,https://github.com/microsoft/Qcodes,https://qcodes.github.io/Qcodes/,MIT,quantum-computing;physics;data-acquisition
242,CloudLab Automation,Automation scripts for Cloud Lab environments,A repository hosting automation scripts and tools for managing and operating Cloud Labs (remote-controlled laboratory environments).,M5;M5-02,lab_automation;infrastructure_control,workflow,PowerShell,https://github.com/microsoft/cloudlab,,MIT,cloud-lab;automation;remote-lab
243,PyVISA-mock,Testing framework for VISA-based instruments,"A library that allows mocking of VISA instruments, enabling the development and testing of instrument control software without physical hardware.",M5;M5-02,instrument_control;simulation,library,Python,https://github.com/microsoft/pyvisa-mock,,MIT,visa;testing;simulation;instrument-control
244,dinolite_uvc_led_control,Control LEDs and UVC features for Dino Lite microscopes,"A Python module to control LEDs, auto-exposure, and other UVC controls specifically for Dino Lite USB microscopes.",M5;M5-02,microscope_control;hardware_driver,library,Python,https://github.com/miked63017/dinolite_uvc_led_control,,None,dino-lite;microscopy;uvc;led-control
245,NICOS,Networked Instrument Control System,"A control system software used for controlling scientific instruments, particularly at neutron sources like MLZ.",M5;M5-02,instrument_control;experiment_orchestration,platform,Python,https://github.com/mlz-ictrl/nicos,https://nicos-controls.org/,NOASSERTION,neutron-scattering;instrument-control;mlz
246,MicroFPGA,FPGA-based electronic control for microscope elements,"A platform using affordable FPGAs to control microscope hardware such as cameras, lasers, and servos, integrated with Micro-Manager.",M5;M5-02,microscope_control;hardware_interface,solver,Verilog,https://github.com/mufpga/MicroFPGA,https://mufpga.github.io/,MIT,fpga;microscopy;hardware-control
247,MicroFPGA-compatibility,Compatibility layer for MicroFPGA with Mojo FPGA,Provides compatibility for controlling microscope elements using the Mojo FPGA board within the MicroFPGA ecosystem.,M5;M5-02,microscope_control;hardware_interface,library,C++,https://github.com/mufpga/MicroFPGA-compatibility,,NOASSERTION,fpga;microscopy;mojo
248,MicroFPGA-py,Python communication package for MicroFPGA,The Python interface for communicating with MicroFPGA-based microscope control hardware.,M5;M5-02,microscope_control;driver,library,Python,https://github.com/mufpga/MicroFPGA-py,,BSD-3-Clause,python;microscopy;fpga-control
249,DeepThought,Next-generation microscope control software framework,"A top-level repository for a microscope control software suite, designed to manage complex imaging experiments.",M5;M5-02,microscope_control;experiment_orchestration,framework,Python,https://github.com/ndsystems/deepthought,,NOASSERTION,microscopy;control-software
250,uScopeControl,Hub for microscope control software,A repository serving as a hub or framework for developing microscope control software.,M5;M5-02,microscope_control,framework,,https://github.com/nicost/uScopeControl,,NOASSERTION,microscopy;control-software
251,kekse,Rapid GUI building for instrument control,A Python library based on PyQt5 for rapidly building Graphical User Interfaces for scientific instrument control.,M5;M5-02,instrument_control;gui_generation,library,Python,https://github.com/nvladimus/kekse,,GPL-3.0,gui;instrument-control;pyqt
252,jds6600_python,Python library for JDS6600 signal generator control,A Python library to remote-control Junce-Instruments JDS6600 signal generators over USB.,M5;M5-02,instrument_control;driver,library,Python,https://github.com/on1arf/jds6600_python,,MIT,signal-generator;instrument-control;jds6600
253,UC2-Hi2,Automated multiwell plate imaging for UC2 microscopes,Tools and scripts to control a GRBL-based Arduino Shield for automated multiwell plate imaging using the openUC2 microscope platform.,M5;M5-02,microscope_control;lab_automation,solver,Jupyter Notebook,https://github.com/openUC2/UC2-Hi2,,NOASSERTION,openuc2;microscopy;automation;high-throughput
254,slave,Lightweight instrument control package,A lightweight Python package designed to simplify the process of controlling scientific instruments.,M5;M5-02,instrument_control,library,Python,https://github.com/p3trus/slave,,GPL-3.0,instrument-control;lab-automation
255,pcdsdevices,Ophyd device subclasses for LCLS PCDS,A collection of Ophyd device subclasses specifically designed for the Photon Controls and Data Systems (PCDS) at the LCLS synchrotron facility.,M5;M5-02,instrument_control;device_driver,library,Python,https://github.com/pcdshub/pcdsdevices,,NOASSERTION,lcls;ophyd;synchrotron;controls
256,typhos,Automatic GUI generation for Ophyd devices,"A tool for automatically generating customizable Graphical User Interfaces for Ophyd-based scientific devices, used in synchrotron control systems.",M5;M5-02,gui_generation;instrument_control,application,Python,https://github.com/pcdshub/typhos,https://pcdshub.github.io/typhos/,NOASSERTION,gui;ophyd;synchrotron;controls
257,prpy,Python utilities and libraries for robotics control and integration in research labs,"A collection of Python utilities and libraries developed and used by the Personal Robotics Laboratory (CMU) for robot control, planning, and integration, supporting various hardware interfaces and robotics frameworks.",M5;M5-02,robotics_integration;device_control,library,Python,https://github.com/personalrobotics/prpy,,BSD-3-Clause,robotics;lab-automation;motion-planning;hardware-control
258,AROS,Open Automated Robotic System for Biological Laboratories,"An open-source automated robotic system designed specifically for biological laboratories to orchestrate and control various lab instruments and workflows, developed by the Pharmaceutical Bioinformatics group at Uppsala University.",M5;M5-02,lab_automation;workflow_orchestration,platform,Python,https://github.com/pharmbio/aros,,None,lab-automation;robotics;biology;workflow-control
259,pyinstruments,Python library for controlling laboratory instruments,"A Python library providing drivers and interfaces for controlling various laboratory instruments, facilitating data acquisition and experiment automation.",M5;M5-02,device_control;data_acquisition,library,Python,https://github.com/pyinstruments/pyinstruments,,MIT,instrument-control;drivers;lab-automation;hardware-interface
260,PyMeasure,"Scientific measurement library for instruments, experiments, and live-plotting","A comprehensive Python library for scientific measurements, offering a framework for controlling instruments, running experiments, and performing live data plotting and analysis.",M5;M5-02,device_control;data_acquisition;experiment_management,library,Python,https://github.com/pymeasure/pymeasure,https://pymeasure.readthedocs.io/,MIT,measurement;instrument-control;visa;experiment-automation
261,python-usbtmc,USBTMC driver for controlling instruments over USB,"A Python driver implementation of the USB Test and Measurement Class (USBTMC) protocol, enabling control of scientific instruments via USB interfaces without proprietary drivers.",M5;M5-02,device_control;driver_implementation,library,Python,https://github.com/python-ivi/python-usbtmc,,MIT,usbtmc;usb-control;instrument-driver;lab-automation
