id,name,one_line_profile,detailed_description,domains,subtask_category,application_level,primary_language,repo_url,help_website,license,tags
556,SPIDER,Image processing system for electron microscopy,SPIDER (System for Processing Image Data from Electron microscopy and Related fields) is a long-standing software package for single-particle reconstruction and image processing in electron microscopy.,Biology;Materials;M5-04,image_processing;reconstruction;cryo-em,solver,Fortran,https://github.com/spider-em/SPIDER,https://spider.wadsworth.org/spider_doc/spider/docs/spider.html,Custom,cryo-em;image-processing;reconstruction
557,gwyfile,Python interface for Gwyddion file format,"A pure Python library for reading and writing files in the Gwyddion format (.gwy), which is the standard for scanning probe microscopy (SPM) data analysis.",Materials;M5-04,data_io;spm_analysis,library,Python,https://github.com/tuxu/gwyfile,,MIT,gwyddion;spm;afm
558,MATS,Multi-spectrum Analysis Tool for Spectroscopy,"A software tool developed by NIST for the analysis of spectroscopic data. It supports processing and analysis of multi-spectrum datasets, aiding in material characterization.",Materials;Chemistry;M5-04,spectral_analysis;data_processing,solver,Python,https://github.com/usnistgov/MATS,,Public Domain,spectroscopy;nist;analysis
559,etspy,Electron Tomography tools for HyperSpy,"A HyperSpy extension package developed by NIST for processing and reconstructing electron tomography data. It provides tools for alignment, reconstruction, and visualization of tilt series data.",Materials;M5-04,tomography_reconstruction;image_processing;electron_microscopy,library,Python,https://github.com/usnistgov/etspy,https://etspy.readthedocs.io/,MIT,electron-tomography;hyperspy;reconstruction
560,grain-size-analysis-tools,Automated grain size measurement tools,"A set of Python tools from NIST for automating the segmentation of metallic grain boundaries in optical/SEM images and measuring grain sizes using intercept methods, adhering to ASTM standards.",Materials;M5-04,microstructure_analysis;segmentation;grain_sizing,solver,Python,https://github.com/usnistgov/grain-size-analysis-tools,,Public Domain,metallography;grain-size;microscopy
561,hyperspectralpy,Python tools and GUI for hyperspectral image analysis and material identification,"A Python package providing tools and a Graphical User Interface (GUI) for the analysis of spectral images. It includes functionalities for target detection, Principal Component Analysis (PCA), material identification, and spectral library management, specifically tailored for hyperspectral data.",M5;M5-04,spectral_analysis;material_identification;target_detection,library,Python,https://github.com/wbasener/hyperspectralpy,,MIT,hyperspectral-imaging;spectral-analysis;gui;material-science
562,xia2,Expert system for automated reduction of macromolecular crystallography data,"An automated system for the reduction of X-ray diffraction data from macromolecular crystals. It integrates with other crystallographic software (like DIALS, XDS) to process raw diffraction images into reduced data suitable for structure solution.",M5;M5-04,data_reduction;diffraction_analysis;crystallography,solver,Python,https://github.com/xia2/xia2,https://xia2.github.io/,BSD-3-Clause,x-ray-diffraction;crystallography;automation;data-reduction
563,mzkit,Comprehensive toolkit for mass spectrometry and metabolomics data processing,"A toolkit designed for processing various types of spectral data including NMR, MALDI MSI, Raman Spectroscopy, LC-MS, and GC-MS. It provides functionalities for raw data processing, chemoinformatics analysis, and data visualization.",M5;M5-04,mass_spectrometry;spectral_processing;chemoinformatics,library,Visual Basic .NET,https://github.com/xieguigang/mzkit,https://mzkit.org/,MIT,mass-spectrometry;metabolomics;maldi-imaging;raman-spectroscopy
564,AutoFP,Automated tool for FullProf Rietveld refinement,An automation tool designed to assist with Rietveld refinement using the FullProf suite. It employs an expert system algorithm to streamline the refinement process for X-ray diffraction data analysis.,M5;M5-04,rietveld_refinement;structure_analysis;xrd,solver,Python,https://github.com/xpclove/autofp,,GPL-3.0,rietveld-refinement;fullprof;crystallography;automation
565,Larch,Analysis library and applications for X-ray absorption and fluorescence spectroscopy,"A Python library and set of applications for processing and analyzing X-ray Absorption Spectroscopy (XAS, EXAFS, XANES) and X-ray Fluorescence (XRF) data. It supports data visualization, fitting, and processing for synchrotron data analysis.",M5;M5-04,spectroscopy_analysis;xas;xrf,library,Python,https://github.com/xraypy/xraylarch,https://xraypy.github.io/xraylarch/,NOASSERTION,x-ray-spectroscopy;exafs;xanes;synchrotron
566,SIDAM,Analysis tools for spectroscopic imaging STM/STS in IGOR Pro,"A set of analysis tools developed for Spectroscopic Imaging Scanning Tunneling Microscopy (SI-STM) and Spectroscopy (STS). It runs within the IGOR Pro environment, facilitating the processing and visualization of multidimensional microscopy data.",M5;M5-04,microscopy_analysis;stm;spectroscopy,library,IGOR Pro,https://github.com/yuksk/SIDAM,,MIT,stm;igor-pro;microscopy;spectroscopy
567,GPim,Gaussian processes and Bayesian optimization for microscopy and hyperspectral data,A Python library applying Gaussian Processes (GP) and Bayesian Optimization to imaging and hyperspectral data. It is designed to assist in the analysis of sparse data and automated experiments in microscopy.,M5;M5-04,image_analysis;bayesian_optimization;hyperspectral_analysis,library,Python,https://github.com/ziatdinovmax/GPim,,MIT,gaussian-processes;bayesian-optimization;microscopy;machine-learning
568,SciLink,LLM-powered agents connecting experimental materials science with modeling,A framework that utilizes Large Language Model (LLM) agents to bridge experimental materials science with computational modeling and literature analysis. It automates workflows involving data interpretation and simulation setup.,M5;M5-04,workflow_automation;literature_analysis;scientific_inference,workflow,Python,https://github.com/ziatdinovmax/SciLink,,None,llm-agents;materials-science;automation;workflow
569,MADSci,Modular Autonomous Discovery for Science Framework,"A framework designed to facilitate modular autonomous discovery in scientific laboratories, enabling the orchestration of hardware and software components for self-driving labs.",Materials;Lab_Automation;M5-05,orchestration;experiment_automation,platform,Python,https://github.com/AD-SDL/MADSci,,MIT,autonomous-discovery;self-driving-lab;orchestration
570,Gremlin,Active learning for high-throughput synthesis of metal oxides,"A tool for active learning guided high-throughput synthesis and characterization, specifically applied to mixed metal oxides discovery.",Materials;Chemistry;M5,active_learning;synthesis_planning;characterization,workflow,Jupyter Notebook,https://github.com/AccelerationConsortium/gremlin,,None,active-learning;metal-oxides;high-throughput
571,StrideLengthEstimation,Pedestrian stride length estimation benchmark and software,"A benchmark dataset and sampling software for estimating pedestrian stride length using smartphone sensors and FM-INS modules, useful for biomechanics and navigation research.",Biomechanics;Signal_Processing,gait_analysis;estimation,solver,Java,https://github.com/Archeries/StrideLengthEstimation,,None,stride-length;imu;dead-reckoning
572,AutoRA,Automated Research Assistant framework,"A framework for automating the scientific research process, including experimental design, data collection, and model discovery, enabling closed-loop scientific inquiry.",Metascience;M5-05,experimental_design;scientific_discovery;automation,framework,TeX,https://github.com/AutoResearch/autora,,MIT,automated-research;closed-loop;scientific-discovery
573,MAPz_at_BAM,Materials Acceleration Platform configuration for BAM,"Software and configuration resources for the Materials Acceleration Platform (MAP) at the Bundesanstalt fr Materialforschung und -prfung (BAM), supporting automated materials research.",Materials;Lab_Automation;M5-05,lab_automation;platform_configuration,platform,Python,https://github.com/BAMresearch/MAPz_at_BAM,,None,materials-acceleration-platform;bam;automation
574,Hyperion,Unattended data collection for synchrotrons using BlueSky,"A tool for unattended data collection at Diamond Light Source, built upon the BlueSky and Ophyd frameworks for experimental control.",Physics;Materials;M5-05,data_collection;experiment_control,workflow,Python,https://github.com/DiamondLightSource/hyperion,,BSD-3-Clause,bluesky;synchrotron;data-collection
575,LLMatDesign,Autonomous materials discovery using LLMs,"A framework leveraging Large Language Models for autonomous materials discovery and design, enabling AI-driven exploration of material spaces.",Materials;M5-05,materials_design;discovery;generative_model,solver,Python,https://github.com/Fung-Lab/LLMatDesign,,MIT,llm;materials-discovery;autonomous-design
576,AI-Researcher,Autonomous agent for scientific innovation and research,"An autonomous AI agent designed to conduct scientific research, capable of formulating hypotheses, planning experiments, and analyzing results to drive scientific innovation.",General_Science;M5-05,scientific_reasoning;research_automation,service,Python,https://github.com/HKUDS/AI-Researcher,https://novix.science/chat,None,autonomous-agent;scientific-discovery;ai-scientist
577,ADO,Framework for executing computational experiments and benchmarks,"An extendible framework developed by IBM for executing benchmarks and computational experiments at scale, supporting optimization and discovery workflows.",Computational_Science;M5-05,experiment_execution;benchmarking;workflow,framework,Python,https://github.com/IBM/ado,,MIT,benchmarking;computational-experiments;ibm
578,Chemosensitivity,Predicting chemosensitivity from gene expression data,"A tool for predicting the chemosensitivity of cells based on gene expression profiles, aiding in pharmacogenomics and personalized medicine research.",Biology;Pharmacology,prediction;gene_expression_analysis,solver,R,https://github.com/JWellsBio/Chemosensitivity,,None,chemosensitivity;gene-expression;pharmacogenomics
579,MechWolf,Python library for robotic flow chemistry and lab automation,MechWolf is designed to make robotic chemistry accessible by providing a software interface for controlling flow chemistry apparatus and automating experiments.,M5;Chemistry,lab_automation;experiment_control,library,Python,https://github.com/MechWolf/MechWolf,,GPL-3.0,chemistry;robotics;automation
580,Achilles,Descriptive statistics and characterization for OMOP CDM databases,"Achilles provides automated characterization of health information for large-scale longitudinal evidence systems, generating descriptive statistics and data quality reports for OMOP Common Data Model databases.",Health_Informatics;Bioinformatics,data_characterization;statistics,tool,R,https://github.com/OHDSI/Achilles,https://ohdsi.github.io/Achilles/,Apache-2.0,omop;health-data;statistics
581,PLACE,"Python package for laboratory automation, control, and experimentation",PLACE (Python Laboratory Automation Control and Experimentation) is a package designed to streamline the automation of laboratory instruments and the orchestration of experimental workflows.,M5;Lab_Automation,instrument_control;experiment_orchestration,library,JavaScript,https://github.com/PALab/place,,LGPL-3.0,lab-automation;instrument-control
582,PyMoDAQ,Modular Data Acquisition framework for experimental setups,"PyMoDAQ (Python Modular Data Acquisition) is a framework designed to interface with various laboratory instruments for data acquisition and experiment control, featuring a modular plugin architecture.",M5;Physics,data_acquisition;instrument_control,framework,Python,https://github.com/PyMoDAQ/PyMoDAQ,http://pymodaq.cnrs.fr/,MIT,data-acquisition;instrument-control;gui
583,pymodaq_femto,PyMoDAQ extension for femtosecond laser pulse characterization,A specialized extension for the PyMoDAQ framework focused on the characterization and measurement of femtosecond laser pulses in optical experiments.,M5;Optics,pulse_characterization;data_acquisition,plugin,Python,https://github.com/PyMoDAQ/pymodaq_femto,,MIT,optics;laser;femtosecond
584,pymodaq_gui,GUI components for the PyMoDAQ data acquisition ecosystem,Provides the graphical user interface widgets and components used by PyMoDAQ to create interactive dashboards for instrument control and data visualization.,M5,gui;visualization,library,Python,https://github.com/PyMoDAQ/pymodaq_gui,,MIT,gui;qt;pymodaq
585,pymodaq_plugin_manager,Plugin manager for the PyMoDAQ ecosystem,"A utility tool to manage, install, and list hardware plugins for the PyMoDAQ framework, facilitating the integration of new instruments.",M5,package_management,tool,Python,https://github.com/PyMoDAQ/pymodaq_plugin_manager,,MIT,plugin-manager;pymodaq
586,quacc,Platform for computational materials science and quantum chemistry workflows,"quacc is a flexible workflow platform for running computational materials science and quantum chemistry calculations, built on top of ASE and Pymatgen, designed for high-throughput computing.",M1;M5;Materials_Science,workflow_orchestration;high_throughput_computing,platform,Python,https://github.com/Quantum-Accelerators/quacc,https://quacc.readthedocs.io/,BSD-3-Clause,materials-science;quantum-chemistry;workflow
587,rapid-earthquake-dynamics,Automated generation of dynamic earthquake rupture scenarios,"A tool for the automated generation of dynamic rupture scenarios based on earthquake kinematic models, facilitating rapid source characterization in seismology.",Geophysics;Seismology,simulation;modeling,solver,Python,https://github.com/Thomas-Ulrich/rapid-earthquake-dynamics,,MIT,earthquake;seismology;rupture-dynamics
588,EOS (Experiment Orchestration System),Comprehensive software framework and runtime for laboratory automation and experiment orchestration,"The Experiment Orchestration System (EOS) is a framework designed to automate laboratory experiments. It manages the execution of experimental protocols, integrates with hardware, and handles data flow, enabling autonomous or semi-autonomous scientific experimentation.",M5;M5-05,experiment_orchestration;lab_automation,platform,Python,https://github.com/UNC-Robotics/eos,,BSD-3-Clause,lab-automation;orchestration;robotics;experiment-control
589,Galaxy Workflow for Genomic Analysis,Automated Galaxy workflow for complete characterization of bacterial genomes,"A structured workflow designed for the Galaxy platform to perform automated genomic analysis. It handles tasks such as assembly, annotation, and characterization of bacterial genomes, streamlining the bioinformatics pipeline for microbiologists.",Bioinformatics;Genomics,genomic_analysis;genome_characterization,workflow,Galaxy,https://github.com/aatxaerandio/Galaxy_Workflow_for_Genomic_Analysis,,GPL-3.0,galaxy;genomics;bacteria;bioinformatics-workflow
590,MatAgent,Physics-aware multi-agent LLM framework for material science discovery,A framework leveraging Large Language Models (LLMs) in a multi-agent setup to accelerate material science discovery and optimization. It integrates physics-aware reasoning to guide the generation and evaluation of potential material candidates.,M5;Materials Science,material_discovery;optimization,framework,Python,https://github.com/adibgpt/MatAgent,,MIT,llm;multi-agent;materials-science;generative-ai
591,Coupling ABAQUS MATLAB,Framework for Software-in-the-Loop coupling of ABAQUS and MATLAB,"A framework enabling the interconnection of Finite Element Analysis (FEA) packages (specifically ABAQUS) with MATLAB. It facilitates closed-loop simulations where MATLAB controls the FEA parameters, useful for structural optimization, vibration control, and multi-physical simulations.",Mechanical Engineering;Materials,simulation;finite_element_analysis,framework,Python,https://github.com/attaoveisi/Coupling_ABAQUS_MATLAB,,BSD-2-Clause,abaqus;matlab;fea;simulation-coupling
592,aimmd,AI for Molecular Mechanism Discovery in molecular dynamics,"aimmd is a tool that autonomously steers molecular dynamics simulations to efficiently sample and understand rare transition events. It uses AI to guide the simulation towards states of interest, enhancing the exploration of molecular mechanisms.",Biophysics;Chemistry,molecular_dynamics;sampling,solver,Python,https://github.com/bio-phys/aimmd,,GPL-3.0,molecular-dynamics;rare-events;ai4science;sampling
593,BioAgents,AI scientist framework for autonomous biological research,"A multi-agent AI framework designed to automate deep research in biological sciences. It combines literature analysis agents with data scientist agents to perform iterative scientific discovery, hypothesis generation, and data analysis.",Biology;Bioinformatics,literature_analysis;hypothesis_generation,platform,TypeScript,https://github.com/bio-xyz/BioAgents,,None,autonomous-agents;biology;research-automation;ai-scientist
594,Ophyd Async,Asynchronous hardware abstraction for Bluesky,"A modern implementation of the Ophyd hardware abstraction layer using Python's asyncio. It is designed to provide non-blocking hardware control for the Bluesky data acquisition system, improving performance and responsiveness in complex experimental setups.",M5;M5-05;Physics,hardware_control;data_acquisition,library,Python,https://github.com/bluesky/ophyd-async,https://blueskyproject.io/ophyd-async/,BSD-3-Clause,asyncio;hardware-abstraction;experiment-control
595,S4ACS,Acquisition Control System for SPARC4 instrument,A LabVIEW-based software system for controlling scientific cameras and data acquisition for the SPARC4 instrument at Laboratrio Nacional de Astrofsica.,M5;Astronomy,instrument_control;data_acquisition,solver,LabVIEW,https://github.com/dev-LNA/S4ACS,,MIT,labview;instrument-control;astronomy;data-acquisition
596,Bacting,Scriptable platform for chemo- and bioinformatics,"An open-source platform based on Bioclipse that provides a toolkit-independent, scriptable solution to handle data from the life sciences, supporting chemoinformatics and bioinformatics tasks.",M5;Cheminformatics;Bioinformatics,data_processing;molecular_modeling;scripting,platform,Java,https://github.com/egonw/bacting,,NOASSERTION,bioclipse;chemoinformatics;bioinformatics;scripting
597,ClosedLoop,Framework for building a closed loop neurofeedback system,"A framework designed for building closed-loop neurofeedback systems, enabling real-time processing and feedback for neuroscience experiments.",M5-05;Neuroscience,experiment_control;data_acquisition,framework,Python,https://github.com/gretatuckute/ClosedLoop,,None,neuroscience;closed-loop;neurofeedback
598,helao-pub,Hierarchical automation platform for natural sciences,"A software platform for the hierarchical automation of natural sciences, specifically designed for orchestrating experimental synthesis and characterization.",M5-05;Materials,lab_automation;orchestration,platform,Python,https://github.com/helgestein/helao-pub,,MIT,automation;orchestration;materials-science
599,nuclei.io,Human-in-the-loop active learning framework for pathology image analysis,"A web-based framework for human-in-the-loop active learning, specifically tailored for pathology image analysis and segmentation tasks.",M5-05;Biomedical,image_analysis;active_learning,platform,Python,https://github.com/huangzhii/nuclei.io,,MIT,pathology;active-learning;image-segmentation
600,HexSimInstrument,Instrument control for HexSIM microscopy system,"Instrument control software for the HexSIM system, built on the ScopeFoundry framework, enabling hardware control for structured illumination microscopy.",M5-05;Physics/Optics,instrument_control;data_acquisition,solver,Python,https://github.com/imperial-photonics/HexSimInstrument,,None,microscopy;instrument-control;scopefoundry
601,Kosmos,AI Scientist agent for autonomous discovery,"An implementation of an AI Scientist agent for autonomous discovery, designed to be driven by LLMs (e.g., Claude) to perform scientific reasoning and planning.",M5-05;AI4S,autonomous_discovery;reasoning,solver,Python,https://github.com/jimmc414/Kosmos,,None,ai-scientist;autonomous-discovery;llm-agent
602,novel-materials-screening,Workflow for screening novel materials for autonomous synthesis,A computational workflow for screening the Materials Project database to identify novel materials suitable for synthesis by the A-Lab (Autonomous Laboratory).,M5-05;Materials,materials_screening;workflow_orchestration,workflow,Jupyter Notebook,https://github.com/mattmcdermott/novel-materials-screening,,None,materials-project;autonomous-lab;screening
603,DeepStrain,Deep learning workflow for automated characterization of cardiac mechanics,"A deep learning-based workflow designed to automate the characterization of cardiac mechanics from medical imaging data, facilitating the analysis of heart strain and function.",Life Sciences/Medical Physics;M5,image_analysis;characterization;biomechanics_modeling,workflow,Jupyter Notebook,https://github.com/moralesq/DeepStrain,,MIT,cardiac-mechanics;deep-learning;medical-imaging
604,BatteryModeling,2D chemo-electro-mechanical phase field simulations for battery electrodes,"A C++ simulation code for performing 2D chemo-electro-mechanical phase field simulations of battery electrode particles, aiding in the understanding of material degradation and performance.",M5;Materials/Batteries,simulation;modeling,solver,C++,https://github.com/neelnadkarni/batterymodeling,,NOASSERTION,phase-field;battery;simulation;electrochemistry
605,Skeletor,Lightweight module for machine learning experiment orchestration,"A minimal Python module designed to orchestrate machine learning experiments, handling configuration management, logging, and experiment tracking to streamline the research workflow.",Computer Science/AI;M5-05,experiment_tracking;orchestration,library,Python,https://github.com/noahgolmant/skeletor,,MIT,mlops;experiment-management;reproducibility
606,PCDS Devices,Ophyd device subclasses for LCLS PCDS instrument control,A collection of Ophyd device subclasses tailored for the Photon Controls and Data Systems (PCDS) at the Linac Coherent Light Source (LCLS). It provides hardware abstraction for controlling beamline devices in Python.,M5;M5-05;Physics/Synchrotron,instrument_control;hardware_abstraction,library,Python,https://github.com/pcdshub/pcdsdevices,,NOASSERTION,ophyd;epics;lcls;hardware-control
607,Typhos,Automatic GUI generation for Ophyd devices in experiments,A tool that automatically generates PyDM-based Graphical User Interfaces (GUIs) for Ophyd devices. It is used in experimental control systems to provide user-friendly interfaces for hardware interaction without manual coding.,M5;M5-05;Physics/Synchrotron,visualization;instrument_control;gui_generation,library,Python,https://github.com/pcdshub/typhos,https://pcdshub.github.io/typhos/,NOASSERTION,gui;pydm;ophyd;experiment-control
608,PyTorch Active Learning,Active learning library for human-in-the-loop machine learning,"A PyTorch-based library implementing active learning strategies, designed to optimize data annotation and model training processes. It is widely used in creating efficient machine learning workflows for scientific data.",Computer Science/AI;M5-05,active_learning;experimental_design,library,Python,https://github.com/rmunro/pytorch_active_learning,,MIT,active-learning;pytorch;human-in-the-loop
609,AutoDMRI,Automated characterization of noise distributions in diffusion MRI,A Python tool for the automated characterization of noise distributions in diffusion MRI data. It helps in denoising and improving the quality of MRI analysis pipelines.,Life Sciences/Neuroscience;M5,noise_estimation;image_processing;quality_control,solver,Python,https://github.com/samuelstjean/autodmri,,MIT,mri;diffusion-mri;noise-estimation
610,Firewheel,Orchestration tool for distributed network system experiments,An experiment orchestration tool developed by Sandia National Laboratories for building and controlling repeatable experiments of distributed network systems at scale. It facilitates rigorous testing and validation in network science research.,Computer Science/Networks;M5-05,experiment_orchestration;simulation;network_modeling,platform,Python,https://github.com/sandialabs/firewheel,,NOASSERTION,orchestration;network-simulation;distributed-systems
611,OpenAlpha_Evolve,Framework for autonomous coding agents and evolutionary algorithms,"An open-source Python framework inspired by AlphaEvolve, designed for research in autonomous coding agents and evolutionary algorithms. It provides a platform for developing and testing self-evolving code and agents.",Computer Science/AI;M5-05,evolutionary_algorithms;autonomous_agents;code_generation,framework,Python,https://github.com/shyamsaktawat/OpenAlpha_Evolve,,MIT,evolutionary-algorithms;automl;autonomous-agents
612,Self-Driving Lab Demo,Software stack for autonomous experimentation demos,"A software platform and instruction set for setting up and running self-driving labs (autonomous experimentation), integrating hardware control (LEDs, spectrophotometers) with adaptive design algorithms.",M5;M5-05,autonomous_experimentation;hardware_orchestration;closed_loop_optimization,platform,Jupyter Notebook,https://github.com/sparks-baird/self-driving-lab-demo,,MIT,self-driving-lab;autonomous-experimentation;hardware-control
