id,name,one_line_profile,detailed_description,domains,subtask_category,application_level,primary_language,repo_url,help_website,license,tags
1,loupeR,Converter for Seurat objects to 10x Genomics Loupe Browser files,"A lightweight R package designed to convert Seurat objects into .cloupe files, enabling visualization and analysis of single-cell data within the 10x Genomics Loupe Browser.",B3;B3-01,data_conversion;visualization_prep,library,R,https://github.com/10XGenomics/loupeR,,NOASSERTION,seurat;loupe-browser;file-conversion;single-cell
2,AnnSQL,SQL-based query interface for AnnData objects,"A Python package that enables SQL-based querying directly on AnnData objects, facilitating complex data filtering and retrieval operations for single-cell datasets.",B3;B3-01,data_querying;data_filtering,library,Python,https://github.com/ArpiarSaundersLab/annsql,,MIT,anndata;sql;query;single-cell
3,PiGx scRNAseq,Pipeline for analysis of Drop-seq single cell RNA-seq data,"A comprehensive pipeline for processing Drop-seq single-cell RNA-seq data, handling steps from raw reads to expression matrices and quality control reports.",B3;B3-01,pipeline;preprocessing;quality_control,workflow,Python,https://github.com/BIMSBbioinfo/pigx_scrnaseq,http://bioinformatics.mdc-berlin.de/pigx/,GPL-3.0,drop-seq;pipeline;scrnaseq;preprocessing
4,scVIDR,Variational inference model for predicting dose responses in single cells,A Variational Autoencoder (VAE) tool designed to predict gene expression changes in response to chemical perturbations across different cell types in single-cell data.,B3,modeling;perturbation_prediction,solver,Jupyter Notebook,https://github.com/BhattacharyaLab/scVIDR,,MIT,vae;perturbation;dose-response;single-cell
5,MiCV,"Web-application for scRNA-seq filtering, analysis, and annotation","A Python Dash-based web application that allows researchers to upload raw scRNA-seq data for interactive filtering, analysis, and manual annotation without requiring extensive coding skills.",B3;B3-01,visualization;analysis_platform;annotation,platform,Python,https://github.com/Cai-Lab-at-University-of-Michigan/MiCV,,Apache-2.0,dash;web-app;scrnaseq;interactive
6,ceLLama,Local LLM-based cell type annotation tool,"A tool leveraging local Large Language Models (LLMs) for automated cell type annotation in single-cell RNA-seq data, emphasizing privacy and speed.",B3,cell_type_annotation,solver,R,https://github.com/CelVoxes/ceLLama,,None,llm;annotation;single-cell;nlp
7,scrna_seurat_pipeline,Comprehensive Seurat-based analysis pipeline for scRNA-seq,"A structured pipeline utilizing the Seurat framework for the comprehensive analysis of single-cell transcriptomics data, covering preprocessing to downstream analysis.",B3;B3-01,pipeline;analysis,workflow,R,https://github.com/CostaLab/scrna_seurat_pipeline,,None,seurat;pipeline;scrnaseq
8,ASAP,Automated Single-cell Analysis Pipeline,"A web-based platform and pipeline for the automated analysis of single-cell RNA-seq data, providing a user-friendly interface for processing and visualization.",B3;B3-01,pipeline;analysis_platform,platform,Java,https://github.com/DeplanckeLab/ASAP,https://asap.epfl.ch/,GPL-3.0,pipeline;web-server;scrnaseq;automation
9,Interactive-3D-Plotting-in-Seurat,3D visualization tool for Seurat objects,R code and utilities to generate interactive 3D UMAP and tSNE plots from Seurat-analyzed single-cell RNA-seq data.,B3,visualization,library,R,https://github.com/Dragonmasterx87/Interactive-3D-Plotting-in-Seurat-3.0.0,,GPL-3.0,visualization;3d;seurat;umap
10,gssnng,Gene Set Scoring on the Nearest Neighbor Graph,A tool for performing gene set scoring on single-cell RNA-seq data using the nearest neighbor graph structure within AnnData objects.,B3,scoring;analysis,library,Jupyter Notebook,https://github.com/IlyaLab/gssnng,,MIT,gene-set-scoring;anndata;single-cell;graph
11,sc-atacseq-explorer,Preprocessing tool for single cell ATAC-Seq data,"A preprocessing utility for single-cell ATAC-Seq data, designed to prepare data for visualization and analysis in single cell explorer tools.",B3;B3-01,preprocessing;atac-seq,library,Jupyter Notebook,https://github.com/JetBrains-Research/sc-atacseq-explorer,,None,atac-seq;preprocessing;single-cell
12,DoubletDetection,Doublet detection in single-cell RNA-seq data,A Python package for detecting doublets (technical artifacts where two cells are sequenced as one) in single-cell RNA-seq data.,B3;B3-01,quality_control;doublet_detection,library,Python,https://github.com/JonathanShor/DoubletDetection,,MIT,doublet-detection;qc;scrnaseq
13,ALRA,Adaptively-thresholded Low-Rank Approximation for scRNA-seq,"A method for imputation of missing values in single-cell RNA-seq data using low-rank approximation, helping to recover true biological signals from sparse data.",B3;B3-01,imputation;denoising,library,R,https://github.com/KlugerLab/ALRA,,MIT,imputation;scrnaseq;low-rank-approximation
14,MAGIC,Markov Affinity-based Graph Imputation of Cells,"An algorithm for imputing missing values in high-dimensional data, particularly single-cell RNA-seq, by sharing information across similar cells to restore data structure.",B3;B3-01,imputation;denoising,library,Python,https://github.com/KrishnaswamyLab/MAGIC,https://magic.readthedocs.io/,GPL-2.0,imputation;scrnaseq;graph-diffusion
15,FastCAR,Fast Correction of Ambient RNA,"An R package designed to remove ambient RNA contamination from droplet-based single-cell sequencing data, improving the accuracy of downstream analysis.",B3;B3-01,quality_control;ambient_rna_removal,library,R,https://github.com/LungCellAtlas/FastCAR,,None,ambient-rna;decontamination;scrnaseq
16,Scasat,Single cell ATAC-seq preprocessing and analysis pipeline,"A complete pipeline for the preprocessing and analysis of single-cell ATAC-seq data, facilitating the study of chromatin accessibility at the single-cell level.",B3;B3-01,pipeline;preprocessing;atac-seq,workflow,Jupyter Notebook,https://github.com/ManchesterBioinference/Scasat,,None,atac-seq;pipeline;single-cell
17,alphapepttools,Biological interpretation tools for proteomics data,"A library for the biological interpretation of proteomics data, designed to be agnostic to the search and quantification engine used.",B3,analysis;proteomics,library,Python,https://github.com/MannLabs/alphapepttools,,Apache-2.0,proteomics;data-interpretation;mass-spectrometry
18,DropletUtils,Utilities for handling droplet-based single-cell data,"A comprehensive R package providing utilities for handling, processing, and analyzing droplet-based single-cell data, including empty droplet detection and barcode swapping correction.",B3;B3-01,preprocessing;quality_control;io,library,R,https://github.com/MarioniLab/DropletUtils,https://bioconductor.org/packages/DropletUtils,GPL-3.0,droplet-sequencing;qc;bioconductor
19,EmptyDropsMultiome,Empty droplet detection for multiome datasets,An extension of the EmptyDrops method specifically tailored for detecting and removing empty droplets in multi-omics (RNA + ATAC) single-cell datasets.,B3;B3-01,quality_control;cell_calling,library,R,https://github.com/MarioniLab/EmptyDropsMultiome,,NOASSERTION,multiome;qc;empty-droplets
20,sobolev_alignment,Sobolev alignment of deep probabilistic models for single cell profiles,"A method for aligning single-cell profiles using Sobolev alignment of deep probabilistic models, facilitating the comparison and integration of datasets.",B3;B3-01,integration;alignment,solver,Python,https://github.com/NKI-CCB/sobolev_alignment,,MIT,alignment;integration;deep-learning;single-cell
21,scMiko,R package for scRNA-seq analysis workflows,An R package built on the Seurat framework offering a collection of analytic workflows and visualization tools for single-cell RNA-seq data.,B3;B3-01,analysis;visualization,library,R,https://github.com/NMikolajewicz/scMiko,,NOASSERTION,seurat;workflow;scrnaseq
22,scAR,Deep learning model for ambient signal removal,"scAR (single-cell Ambient Remover) uses deep learning to model and remove ambient RNA signals in droplet-based single-cell omics data, distinguishing real signals from background noise.",B3;B3-01,quality_control;ambient_rna_removal;denoising,solver,Python,https://github.com/Novartis/scar,https://scar-tutorials.readthedocs.io/,None,ambient-rna;deep-learning;denoising;scrnaseq
23,CyteType,Multi-agent LLM driven cell type annotation,A Python tool utilizing multi-agent Large Language Models (LLMs) to perform automated cell type annotation on single-cell RNA-seq data.,B3,cell_type_annotation,solver,Python,https://github.com/NygenAnalytics/CyteType,,NOASSERTION,llm;annotation;single-cell
24,CyteTypeR,R interface for CyteType cell annotation,"The R implementation/interface for the CyteType tool, enabling multi-agent LLM-driven cell type annotation within R workflows.",B3,cell_type_annotation,solver,R,https://github.com/NygenAnalytics/CyteTypeR,,NOASSERTION,llm;annotation;single-cell;r
25,MuDataSeurat,Interface for .h5mu files in Seurat,"An R package providing an interface to read and write .h5mu (MuData) files directly into Seurat objects, facilitating multi-omics data interoperability.",B3;B3-01,data_io;format_conversion,library,R,https://github.com/PMBio/MuDataSeurat,,None,mudata;seurat;h5mu;multi-omics
26,APackOfTheClones,Visualization of clonal expansion via circle-packing,"An R package extending scRepertoire to visualize clonal expansion in single-cell data using circle-packing layouts, providing an intuitive view of clone sizes.",B3,visualization;clonal_analysis,library,R,https://github.com/Qile0317/APackOfTheClones,https://qile0317.github.io/APackOfTheClones/,NOASSERTION,visualization;clonal-expansion;tcr-seq;circle-packing
27,DoubleThreshold,Double Threshold algorithm for brain connectivity,"A MATLAB implementation of the Double Threshold (DDT) algorithm for identifying significant functional connections in neuronal networks, filtering out noise in connectivity matrices.",B3,network_analysis;filtering,solver,MATLAB,https://github.com/ScreenNeuroPharm/DoubleThreshold,,MIT,neuroscience;connectivity;network-analysis
28,ACTINN-PyTorch,PyTorch implementation of ACTINN for cell type identification,A PyTorch implementation of the ACTINN (Automatic Cell-Types Identification using Neural Networks) method for classifying cell types in single-cell RNA-seq data.,B3,cell_type_annotation,solver,Python,https://github.com/SindiLab/ACTINN-PyTorch,,MIT,deep-learning;annotation;scrnaseq;pytorch
29,drug2cell,Gene group activity utility functions for Scanpy,"A Python utility for Scanpy that facilitates the analysis of drug targets or other gene groups within single-cell data, mapping drug interactions to cell types.",B3,analysis;drug_discovery,library,Jupyter Notebook,https://github.com/Teichlab/drug2cell,,NOASSERTION,scanpy;drug-targets;single-cell
30,scanpy_recipes,Aggregated analysis functions for Scanpy,"A collection of generalized and aggregated analysis recipes and functions for working with AnnData and Scanpy, standardizing common workflows.",B3;B3-01,workflow;analysis,library,Python,https://github.com/TheJacksonLaboratory/scanpy_recipes,,BSD-3-Clause,scanpy;recipes;workflow;anndata
31,scImpute,Accurate and robust imputation method for scRNA-seq data,A statistical method to accurately and robustly impute the dropout values in scRNA-seq data.,Bioinfo;B3;B3-01,imputation;denoising,solver,R,https://github.com/Vivianstats/scImpute,,None,scRNA-seq;imputation;dropout
32,bayNorm,Bayesian normalization for single-cell RNA-seq data,bayNorm is an R package for normalizing single-cell RNA-seq data using a Bayesian approach to infer true counts.,Bioinfo;B3;B3-01,normalization;preprocessing,solver,R,https://github.com/WT215/bayNorm,,None,normalization;bayesian;scRNA-seq
33,scIBD,Doublet detection tool for scCAS data,A tool designed for detecting doublets in single-cell chromatin accessibility sequencing (scCAS) data.,Bioinfo;B3;B3-01,doublet_detection;quality_control,solver,Python,https://github.com/Ying-Lab/scIBD,,MIT,scCAS;doublet-detection;atac-seq
34,treedata,AnnData extension for tree-structured data,"A Python package that extends the AnnData format to support tree-structured data, facilitating hierarchical analysis in single-cell genomics.",Bioinfo;B3;B3-01,data_structure;data_handling,library,Python,https://github.com/YosefLab/treedata,,BSD-3-Clause,anndata;hierarchy;tree
35,scCATCH,Automatic annotation of cell types for scRNA-seq clusters,An R package for automatic annotation of cell types of clusters from single-cell RNA sequencing data based on evidence-based score.,Bioinfo;B3,cell_annotation;clustering,solver,R,https://github.com/ZJUFanLab/scCATCH,,GPL-3.0,cell-annotation;scRNA-seq;clustering
36,SCopeLoomR,R interface for Loom files compatible with SCope,"R package to create generic .loom files and extend them with other data such as SCENIC regulons, Seurat clusters and markers, compatible with the SCope viewer.",Bioinfo;B3;B3-01,data_conversion;file_io,library,R,https://github.com/aertslab/SCopeLoomR,,MIT,loom;file-format;visualization
37,SpatialNF,Nextflow pipelines for spatial transcriptomics,A collection of Nextflow pipelines for processing spatial transcriptomics data.,Bioinfo;B3,workflow;pipeline,workflow,Python,https://github.com/aertslab/SpatialNF,,GPL-3.0,spatial-transcriptomics;nextflow;pipeline
38,dropseqRunner,Pipeline for processing droplet-based scRNA-seq data,"A lightweight pipeline for processing droplet-based single-cell RNA-seq data, handling alignment and quantification.",Bioinfo;B3;B3-01,pipeline;preprocessing,workflow,Python,https://github.com/aselewa/dropseqRunner,,None,drop-seq;pipeline;scRNA-seq
39,ddqc,Data-driven quality control for scRNA-seq,"An unsupervised, data-driven quality control method for single-cell RNA-seq that retains cell types that might be lost by standard fixed-threshold filtering.",Bioinfo;B3;B3-01,quality_control;filtering,solver,Jupyter Notebook,https://github.com/ayshwaryas/ddqc,,BSD-3-Clause,quality-control;scRNA-seq;filtering
40,CpG_Me,WGBS pipeline for alignment and QC of DNA methylation,"A whole genome bisulfite sequencing (WGBS) pipeline that processes raw reads (FastQ) to CpG count matrices, including alignment and QC.",Bioinfo,pipeline;alignment;methylation_calling,workflow,Shell,https://github.com/ben-laufer/CpG_Me,,MIT,wgbs;methylation;pipeline
41,SCeptre,Scanpy extension for multiplexed single-cell proteomics,"A Python package extending Scanpy to analyze multiplexed single-cell proteomics data, handling specific normalization and QC needs.",Bioinfo;B3,proteomics;analysis,library,Jupyter Notebook,https://github.com/bfurtwa/SCeptre,,MIT,proteomics;scanpy;single-cell
42,SgsAnnDataV2,Converter for Seurat/Giotto/Signac/ArchR to AnnData,"An R package designed to convert analysis objects from Seurat, Giotto, Signac, and ArchR into the AnnData format for interoperability.",Bioinfo;B3;B3-01,data_conversion;interoperability,library,R,https://github.com/bio-xtt/SgsAnnDataV2,,None,anndata;seurat;conversion
43,anndata-mcp,MCP interface for AnnData objects,"A tool allowing retrieval of information about AnnData objects via the Model Context Protocol (MCP), facilitating integration with LLMs or other MCP-compliant systems.",Bioinfo;B3;B3-01,data_access;interface,library,Python,https://github.com/biocontext-ai/anndata-mcp,,MIT,anndata;mcp;llm
44,CellBender,Deep learning tool for removing technical artifacts from scRNA-seq,A software package for eliminating technical artifacts (like ambient RNA/background noise) from high-throughput single-cell RNA sequencing data using deep generative models.,Bioinfo;B3;B3-01,denoising;quality_control;ambient_rna_removal,solver,Python,https://github.com/broadinstitute/CellBender,https://cellbender.readthedocs.io,BSD-3-Clause,denoising;deep-learning;scRNA-seq
45,pytometry_legacy,Scanpy extension for flow and mass cytometry,Extends the Scanpy framework to handle preprocessing and analysis of flow and mass cytometry data.,Bioinfo;B3,cytometry;analysis,library,Jupyter Notebook,https://github.com/buettnerlab/pytometry_legacy,,None,cytometry;scanpy;flow-cytometry
46,mLLMCelltype,Multi-LLM consensus framework for cell annotation,A framework leveraging multiple Large Language Models (LLMs) to perform accurate consensus-based cell type annotation for single-cell data.,Bioinfo;B3,cell_annotation;llm,solver,Python,https://github.com/cafferychen777/mLLMCelltype,,MIT,llm;cell-annotation;consensus
47,proatac,Preprocessing pipeline for scATAC-seq data,A preprocessing pipeline designed for processing single-cell ATAC-seq data.,Bioinfo;B3;B3-01,pipeline;preprocessing,workflow,Python,https://github.com/caleblareau/proatac,,MIT,scATAC-seq;pipeline;preprocessing
48,solo,Doublet detection for scRNA-seq using neural networks,"A tool for detecting doublets in single-cell RNA-seq data, often used in conjunction with scVI.",Bioinfo;B3;B3-01,doublet_detection;quality_control,solver,Python,https://github.com/calico/solo,,MIT,doublet-detection;scvi;neural-network
49,scruff,Single Cell RNA-seq UMI Filtering Facilitator,"An R package for processing single-cell RNA-seq FASTQ files, performing alignment, UMI filtering, and generating count matrices.",Bioinfo;B3;B3-01,pipeline;preprocessing;filtering,workflow,R,https://github.com/campbio/scruff,,NOASSERTION,scRNA-seq;umi;pipeline
50,Circe,Co-accessibility network inference from scATAC-seq,"A Python tool for inferring co-accessibility networks from single-cell ATAC-seq data, based on the Cicero algorithm but implemented for AnnData.",Bioinfo;B3,network_inference;scATAC-seq,solver,Python,https://github.com/cantinilab/Circe,,NOASSERTION,scATAC-seq;network;cicero
51,GRnnData,Gene Regulatory Network enhanced AnnData toolkit,A toolkit for handling and analyzing Gene Regulatory Networks (GRNs) within the AnnData framework.,Bioinfo;B3,grn;network_analysis,library,Jupyter Notebook,https://github.com/cantinilab/GRnnData,,MIT,grn;anndata;regulatory-network
52,Seurat-Integrate,Wrapper for Seurat integration methods,An R package expanding integrative analysis capabilities of Seurat by providing seamless access to popular integration methods and benchmarking tools.,Bioinfo;B3,integration;benchmarking,library,R,https://github.com/cbib/Seurat-Integrate,,NOASSERTION,seurat;integration;benchmarking
53,sceasy,Converter for single-cell data formats,"A package to facilitate conversion between different single-cell data formats (e.g., Seurat, AnnData, Loom, SingleCellExperiment).",Bioinfo;B3;B3-01,data_conversion;interoperability,library,R,https://github.com/cellgeni/sceasy,,GPL-3.0,conversion;seurat;anndata;loom
54,DoubletFinder,Doublet detection in scRNA-seq data,An R package for predicting doublets in single-cell RNA sequencing data using artificial nearest neighbors.,Bioinfo;B3;B3-01,doublet_detection;quality_control,solver,R,https://github.com/chris-mcginnis-ucsf/DoubletFinder,,None,doublet-detection;scRNA-seq;qc
55,bollito,Single-cell RNA-seq analysis pipeline,A comprehensive pipeline for single-cell RNA-seq data analysis.,Bioinfo;B3;B3-01,pipeline;analysis,workflow,R,https://github.com/cnio-bu/bollito,,MIT,pipeline;scRNA-seq;analysis
56,epiScanpy,Epigenomics Single Cell Analysis in Python,"A Python toolkit for the analysis of single-cell epigenomics data (scATAC-seq, scDNA methylation), built on top of Scanpy.",Bioinfo;B3,epigenomics;analysis,library,Python,https://github.com/colomemaria/epiScanpy,https://episcanpy.readthedocs.io,BSD-3-Clause,epigenomics;scATAC-seq;scanpy
57,pytximport,Python implementation of tximport for gene count estimation,"A Python implementation of the R tximport package, used for summarizing transcript-level estimates for gene-level analysis.",Bioinfo;B3;B3-01,quantification;preprocessing,library,Python,https://github.com/complextissue/pytximport,,GPL-3.0,tximport;quantification;rna-seq
58,SoupX,Removal of cell-free mRNA from droplet scRNA-seq,An R package to quantify and remove ambient RNA (soup) contamination from droplet-based single-cell RNA-seq data.,Bioinfo;B3;B3-01,ambient_rna_removal;quality_control;denoising,solver,R,https://github.com/constantAmateur/SoupX,,None,ambient-rna;contamination;scRNA-seq
59,Seurat (CV),3D reconstruction from moving points to depth,"Official implementation of 'Seurat: From Moving Points to Depth', a computer vision tool for depth estimation. (Note: Name collision with bioinformatics tool Seurat).",Computer Vision,depth_estimation;3d_reconstruction,solver,Python,https://github.com/cvlab-kaist/Seurat,,None,computer-vision;depth-estimation;cvpr
60,grassp,Graph-based Analysis of Subcellular/Spatial Proteomics,A Python package for graph-based analysis of subcellular and spatial proteomics data.,Bioinfo;B3,spatial_proteomics;graph_analysis,library,Python,https://github.com/czbiohub-sf/grassp,,BSD-3-Clause,spatial-proteomics;graph;analysis
61,protdata,Proteomics data loader for AnnData,A dataloader tool to convert common proteomics search engine outputs into the AnnData format for downstream analysis.,Bioinfo;B3;B3-01,data_loading;file_io,library,Python,https://github.com/czbiohub-sf/protdata,,BSD-3-Clause,proteomics;anndata;dataloader
62,gficf,Gene Frequency - Inverse Cell Frequency normalization,"An R implementation of the GF-ICF method for normalizing single-cell data, analogous to TF-IDF in text processing.",Bioinfo;B3;B3-01,normalization;preprocessing,solver,C++,https://github.com/dibbelab/gficf,,GPL-3.0,normalization;scRNA-seq;tfidf
63,rPanglaoDB,R interface for PanglaoDB single-cell data,An R package to download and merge labeled single-cell RNA-seq data from the PanglaoDB database directly into Seurat objects.,Bioinfo;B3;B3-01,data_access;database_interface,library,HTML,https://github.com/dosorio/rPanglaoDB,,None,panglaodb;seurat;data-access
64,anndata (R),R wrapper for the AnnData format,"An R package providing an interface to the Python AnnData package, allowing manipulation of annotated multivariate observation data in R.",Bioinfo;B3;B3-01,data_structure;interoperability,library,R,https://github.com/dynverse/anndata,,NOASSERTION,anndata;r;interoperability
65,r-seurat-scripts,CLI scripts for Seurat workflows,"A collection of scripts wrapping Seurat functionality for use in command-line workflows (e.g., Bioconda, Galaxy).",Bioinfo;B3,workflow_utils;cli,library,R,https://github.com/ebi-gene-expression-group/r-seurat-scripts,,Apache-2.0,seurat;cli;bioconda
66,scanpy-scripts,CLI scripts for Scanpy workflows,"Scripts for using Scanpy via command line, facilitating integration into workflow managers like Nextflow or Galaxy.",Bioinfo;B3,workflow_utils;cli,library,Python,https://github.com/ebi-gene-expression-group/scanpy-scripts,,Apache-2.0,scanpy;cli;workflow
67,scanpy-workflow,Nextflow workflow for Scanpy,A Nextflow workflow leveraging scanpy-scripts to run scalable single-cell analysis pipelines.,Bioinfo;B3,workflow;pipeline,workflow,Nextflow,https://github.com/ebi-gene-expression-group/scanpy-workflow,,None,nextflow;scanpy;pipeline
68,SCpubr,Publication-ready visualizations for scRNA-seq,"An R package to generate high-quality, publication-ready visualizations for single-cell transcriptomics data, streamlining plotting workflows.",Bioinfo;B3,visualization;plotting,library,R,https://github.com/enblacar/SCpubr,,GPL-3.0,visualization;scRNA-seq;plotting
69,dea_seurat,Snakemake workflow for differential expression with Seurat,A Snakemake workflow and MrBiomics module for performing differential expression analyses (DEA) on single-cell data using Seurat.,Bioinfo;B3,workflow;differential_expression,workflow,R,https://github.com/epigen/dea_seurat,,MIT,snakemake;seurat;differential-expression
70,mixscape_seurat,Snakemake workflow for CRISPR screen analysis with Seurat,A Snakemake workflow for performing perturbation analyses of pooled CRISPR screens with scRNA-seq readout using Seurat's Mixscape.,Bioinfo;B3,workflow;crispr_screen,workflow,R,https://github.com/epigen/mixscape_seurat,,MIT,snakemake;seurat;mixscape
71,scrnaseq_processing_seurat,Snakemake workflow for scRNA-seq processing with Seurat,A Snakemake workflow for processing and visualizing single-cell RNA-seq data (10X or MTX) using Seurat.,Bioinfo;B3;B3-01,workflow;preprocessing,workflow,R,https://github.com/epigen/scrnaseq_processing_seurat,,MIT,snakemake;seurat;preprocessing
72,SGS,User-friendly browser for visualizing single-cell and spatial multiomics data,"SGS is a collaborative and versatile browser designed for the visualization of single-cell and spatial multiomics data, facilitating interactive exploration of complex biological datasets.",B3;B3-01,visualization;spatial_analysis,platform,JavaScript,https://github.com/fanglu0411/sgs,https://github.com/fanglu0411/sgs,None,visualization;single-cell;spatial-omics;browser
73,anndictionary,Python package to conveniently process a dictionary of AnnData objects,"Anndictionary provides utilities to handle collections of AnnData objects, simplifying batch processing and management of multiple single-cell datasets in Python.",B3;B3-01,data_processing;data_management,library,Jupyter Notebook,https://github.com/ggit12/anndictionary,https://github.com/ggit12/anndictionary,BSD-3-Clause,anndata;python;single-cell;data-structure
74,miQC,"Flexible, probabilistic metrics for quality control of scRNA-seq data","miQC provides a data-driven approach to quality control for single-cell RNA-seq data, using probabilistic models to jointly model the proportion of mitochondrial reads and the number of detected genes.",B3;B3-01,quality_control,library,R,https://github.com/greenelab/miQC,https://greenelab.github.io/miQC/,BSD-3-Clause,qc;scRNA-seq;probabilistic-modeling;bioconductor
