id,name,one_line_profile,detailed_description,domains,subtask_category,application_level,primary_language,repo_url,help_website,license,tags
125,Neo4j-KGBuilder,Knowledge graph construction and visualization platform based on Neo4j,"A comprehensive system integrating Neo4j, SpringBoot, Vue, and D3.js to facilitate the construction, management, and visualization of knowledge graphs.",B6;B6-03,knowledge_graph_construction;visualization,platform,Vue,https://github.com/MiracleTanC/Neo4j-KGBuilder,,None,neo4j;visualization;knowledge-graph
126,AMG-RAG,Agentic Medical Graph-RAG framework,"A comprehensive framework that automates the construction and continuous updating of Medical Knowledge Graphs (MKGs), integrates reasoning, and retrieves external evidence for medical QA.",B6;B6-03,knowledge_graph_construction;question_answering;medical_informatics,workflow,Python,https://github.com/MrRezaeiUofT/AMG-RAG,,NOASSERTION,rag;medical-kg;agentic-framework
127,GraphDB Workbench,Web-based administration and visualization tool for GraphDB,"The web application interface for GraphDB, allowing users to manage repositories, execute SPARQL queries, and visualize RDF data.",B6;B6-03,visualization;database_management;querying,service,JavaScript,https://github.com/Ontotext-AD/graphdb-workbench,,None,graphdb;workbench;rdf
128,Harvester,OAI-PMH harvester transforming metadata to RDF,"An XForms-based tool that harvests metadata via OAI-PMH, transforms it into RDF format, and posts it into a triplestore for access.",B6;B6-03,data_transformation;rdf_generation;metadata_harvesting,solver,JavaScript,https://github.com/Orbis-Cascade-Alliance/harvester,,None,rdf;oai-pmh;metadata
129,ControlledVocabularyManager,RDF-based controlled vocabulary management system,"A Rails application utilizing Blazegraph to manage controlled vocabularies in RDF format, facilitating ontology management and semantic interoperability.",B6;B6-03,ontology_management;vocabulary_control,platform,Ruby,https://github.com/OregonDigital/ControlledVocabularyManager,,GPL-3.0,rdf;blazegraph;vocabulary
130,scGCN,Graph convolutional networks for single cell omics knowledge transfer,"A graph convolutional network algorithm designed for knowledge transfer in single-cell omics data analysis, enabling label transfer and integration.",B6;B6-03,single_cell_analysis;knowledge_transfer;graph_learning,solver,Python,https://github.com/QSong-github/scGCN,,MIT,single-cell;gcn;omics
131,PloverDB,In-memory database service for biomedical knowledge graphs,"An in-memory database service designed to host and serve biomedical knowledge graphs via TRAPI APIs, optimized for performance.",B6;B6-03,graph_storage;api_serving;biomedical_kg,service,Python,https://github.com/RTXteam/PloverDB,,MIT,biomedical-kg;database;trapi
132,RecallGraph,Versioning data store for time-variant graph data,"A graph database solution that supports versioning, allowing for the storage and retrieval of time-variant graph data.",B6;B6-03,graph_storage;temporal_graph_management,solver,JavaScript,https://github.com/RecallGraph/RecallGraph,,Apache-2.0,graph-database;versioning;temporal-data
133,RedisGraph,High-performance in-memory graph database,"A graph database implemented as a Redis module, leveraging sparse matrices and linear algebra for efficient graph operations.",B6;B6-03,graph_storage;querying,solver,C,https://github.com/RedisGraph/RedisGraph,,NOASSERTION,redis;graph-database;cypher
134,qstore,High-performance RDF Quadstore in Rust,"A barebones, high-performance RDF Quadstore written in Rust, providing interoperability bindings for Python RDFLib.",B6;B6-03,graph_storage;rdf_management,solver,Rust,https://github.com/Rust-Linked-Data/qstore,,MIT,rdf;quadstore;rust
135,SANSA-Stack,Big Data RDF Processing and Analytics Stack,"A stack built on Apache Spark and Apache Jena for scalable processing, querying, and analysis of large-scale RDF data.",B6;B6-03,rdf_processing;analytics;distributed_computing,platform,Scala,https://github.com/SANSA-Stack/SANSA-Stack,http://sansa-stack.github.io/SANSA-Stack/,Apache-2.0,rdf;spark;big-data
136,DeTrusty,Federated Query Engine over RDF Sources,"A federated query engine capable of executing queries across multiple RDF sources, enabling integrated data access.",B6;B6-03,federated_querying;rdf_integration,solver,Python,https://github.com/SDM-TIB/DeTrusty,,GPL-3.0,federated-query;rdf;sparql
137,Ontario,Federated SPARQL Query Processing Engine,"A federated SPARQL query processing engine designed for semantic data lakes, optimizing query execution over distributed sources.",B6;B6-03,federated_querying;sparql_processing,solver,Python,https://github.com/SDM-TIB/Ontario,,GPL-2.0,sparql;federated-query;semantic-data-lake
138,SDM-RDFizer,RML-Compliant Engine for Knowledge Graph Construction,An efficient engine for constructing knowledge graphs from heterogeneous data sources using the RML mapping language.,B6;B6-03,knowledge_graph_construction;data_mapping,solver,Python,https://github.com/SDM-TIB/SDM-RDFizer,,Apache-2.0,rml;kg-construction;rdf
139,GraphoPlex,Distributed graph database engine,A distributed graph database engine that includes a supported query language for managing and querying graph data.,B6;B6-03,graph_storage;querying,solver,Java,https://github.com/ShimaaBetah/GraphoPlex,,GPL-3.0,graph-database;distributed-systems
140,BioKEEN,Library for learning biological knowledge graph embeddings,A computational library designed for learning and evaluating embeddings specifically for biological knowledge graphs.,B6;B6-03,embedding_learning;bioinformatics,library,Jupyter Notebook,https://github.com/SmartDataAnalytics/BioKEEN,,MIT,knowledge-graph-embeddings;bioinformatics;machine-learning
141,knowledge-engine-SPARQL-endpoint,SPARQL endpoint for Knowledge Engine,An endpoint implementation that handles SPARQL queries and executes them on the Knowledge Engine infrastructure.,B6;B6-03,query_execution;sparql_endpoint,service,Python,https://github.com/TNO/knowledge-engine-SPARQL-endpoint,,None,sparql;knowledge-engine;endpoint
142,SHACL API,Java API for SHACL based on Apache Jena,"An implementation of the Shapes Constraint Language (SHACL) API using Apache Jena, used for validating RDF graphs against a set of conditions.",B6;B6-03,data_validation;rdf_constraint_checking,library,Java,https://github.com/TopQuadrant/shacl,,Apache-2.0,shacl;rdf;validation
143,Awesome-Text2GQL,Fine-tuning dataset auto-generation for Graph Query Languages,A tool for automatically generating fine-tuning datasets to train models for converting text to Graph Query Languages (GQL).,B6;B6-03,dataset_generation;nlp_for_graph,solver,Python,https://github.com/TuGraph-family/Awesome-Text2GQL,,Apache-2.0,text2gql;dataset-generation;graph-query-language
144,RaiseWikibase,Tool for fast inserts into Wikibase instances,A tool designed to facilitate knowledge graph construction by enabling fast data insertion into Wikibase instances.,B6;B6-03,knowledge_graph_construction;data_ingestion,solver,Python,https://github.com/UB-Mannheim/RaiseWikibase,,MIT,wikibase;knowledge-graph;data-import
145,VaLiK,Annotation-free multimodal knowledge graph construction,Implementation of 'Aligning Vision to Language' for constructing multimodal knowledge graphs without annotations to enhance LLM reasoning.,B6;B6-03,knowledge_graph_construction;multimodal_learning,solver,Python,https://github.com/Wings-Of-Disaster/VaLiK,,None,multimodal-kg;llm;vision-language
146,G6VP,Graph visualization and analysis platform,"G6VP is an online visual analysis tool for graphs and a low-code platform for building graph applications. It supports large-scale graph rendering, interactive exploration, and visual analysis, which are essential for interpreting complex knowledge graphs in scientific research.",B6;B6-03,visualization;network_analysis,platform,TypeScript,https://github.com/antvis/G6VP,,Apache-2.0,graph-visualization;visual-analysis;knowledge-graph
147,Apache AGE,Graph database extension for PostgreSQL,"Apache AGE is a PostgreSQL extension that provides graph database functionality. It enables users to store and analyze graph data (nodes and edges) alongside relational data, supporting the openCypher query language for complex graph queries and analysis.",B6;B6-03,graph_storage;query_processing,solver,C,https://github.com/apache/age,https://age.apache.org/,Apache-2.0,graph-database;postgresql;opencypher;knowledge-graph
148,Apache AGE Viewer,Web-based visualization tool for Apache AGE,"Apache AGE Viewer is a user interface and visualization tool designed specifically for Apache AGE. It allows researchers to execute queries and visualize graph data stored in PostgreSQL, facilitating the exploration of relationships and structures in scientific knowledge graphs.",B6;B6-03,visualization;query_interface,service,JavaScript,https://github.com/apache/age-viewer,https://age.apache.org/,Apache-2.0,graph-visualization;gui;postgresql
149,HugeGraph,Scalable distributed graph database,"HugeGraph is a fast, highly scalable, distributed graph database designed to store and query massive graph data (billions of vertices and edges). It supports the Apache TinkerPop Gremlin query language and is suitable for managing large-scale scientific knowledge graphs and biological networks.",B6;B6-03,graph_storage;query_processing,solver,Java,https://github.com/apache/incubator-hugegraph,https://hugegraph.apache.org/,Apache-2.0,graph-database;distributed-system;gremlin;oltp
150,Apache Jena,Framework for Semantic Web and Linked Data applications,"Apache Jena is an open-source Java framework for building Semantic Web and Linked Data applications. It provides a comprehensive API for RDF data processing, a SPARQL query engine (ARQ), and an inference engine for reasoning over ontologies (OWL/RDFS), making it a foundational tool for bioinformatics knowledge graphs.",B6;B6-03,knowledge_inference;query_processing;rdf_handling,library,Java,https://github.com/apache/jena,https://jena.apache.org/,Apache-2.0,rdf;sparql;ontology;inference;semantic-web
151,Apache TinkerPop,Graph computing framework,Apache TinkerPop is a graph computing framework that provides a standard interface (Gremlin) for graph databases (OLTP) and graph analytic systems (OLAP). It enables researchers to write complex graph traversals and algorithms that are portable across different graph systems.,B6;B6-03,graph_computing;query_processing,library,Java,https://github.com/apache/tinkerpop,https://tinkerpop.apache.org/,Apache-2.0,graph-framework;gremlin;graph-traversal;olap
152,ArangoDB,"Native multi-model database for graph, document, and key-value data","ArangoDB is a native multi-model database that supports graph, document, and key-value data models within a single engine. It provides a powerful query language (AQL) and built-in graph algorithms, making it highly effective for storing and analyzing heterogeneous scientific data and knowledge graphs.",B6;B6-03,graph_storage;query_processing,solver,C++,https://github.com/arangodb/arangodb,https://www.arangodb.com/docs/stable/,Apache-2.0,multi-model-database;graph-database;aql;nosql
153,ArangoPipe,Metadata layer for machine learning pipelines on ArangoDB,"ArangoPipe is a tool for managing machine learning metadata and pipelines. It allows researchers to capture, store, and analyze model parameters, performance metrics, and dataset information within a structured knowledge graph in ArangoDB, facilitating experiment tracking and reproducibility in scientific ML.",B6;B6-03,ml_pipeline_management;metadata_management,workflow,Python,https://github.com/arangoml/arangopipe,,Apache-2.0,mlops;metadata;graph-database;machine-learning
154,FastGraphML,Graph embeddings library for ArangoDB,"FastGraphML is a low-code framework that integrates ArangoDB with PyTorch Geometric (PyG). It enables researchers to easily generate graph embeddings and perform graph neural network (GNN) analysis directly on data stored in ArangoDB, streamlining the workflow from graph storage to ML inference.",B6;B6-03,graph_embedding;machine_learning,library,Python,https://github.com/arangoml/fastgraphml,,Apache-2.0,graph-neural-networks;embeddings;pytorch-geometric;arangodb
155,Bio4j,"Bioinformatics graph data platform mapping UniProt, GO, and other datasets to a graph model","Bio4j is a bioinformatics graph database and domain model that integrates data from UniProt, Gene Ontology (GO), NCBI Taxonomy, and Expasy Enzyme into a unified graph structure, enabling complex biological queries.",B6;B6-03,scientific_modeling;data_integration,library,Java,https://github.com/bio4j/bio4j,http://bio4j.com/,AGPL-3.0,bioinformatics;graph-database;uniprot;gene-ontology
156,Blazegraph,High-performance graph database supporting RDF/SPARQL and Tinkerpop,"Blazegraph is a scalable, high-performance graph database widely used in scientific applications (e.g., Wikidata, Semantic Web) for storing and querying large-scale RDF triples and property graphs.",B6;B6-03,data_storage;data_query,platform,Java,https://github.com/blazegraph/database,https://blazegraph.com/,GPL-2.0,graph-database;rdf;sparql;semantic-web
157,BioKG,A Knowledge Graph for Relational Learning On Biological Data,A benchmark dataset and Python library designed for relational learning on biological knowledge graphs. It integrates data from multiple biomedical databases to support tasks like link prediction and knowledge graph embedding in the biological domain.,B6;B6-03,dataset_construction;relational_learning,dataset,Python,https://github.com/dsi-bdi/biokg,,NOASSERTION,knowledge-graph;biological-data;benchmark;kge
158,automatic-KG-creation-with-LLM,Automatic Ontology and Knowledge Graph construction with LLM,"A pipeline for automating the construction of ontologies and knowledge graphs from unstructured text using Large Language Models (LLMs). It leverages LLMs to extract entities and relations, facilitating the creation of structured scientific knowledge bases.",B6;B6-03,knowledge_extraction;ontology_construction,workflow,Python,https://github.com/fusion-jena/automatic-KG-creation-with-LLM,,Apache-2.0,llm;knowledge-graph;ontology;nlp
159,SemTK,Semantics Toolkit for SPARQL query generation and data ingestion,"A toolkit designed to simplify the interaction with SPARQL endpoints (specifically Virtuoso) through a drag-and-drop interface for query generation and data ingestion, facilitating the management of semantic knowledge graphs.",B6;B6-03,data_ingestion;query_generation,platform,JavaScript,https://github.com/ge-semtk/semtk,,NOASSERTION,sparql;knowledge-graph;virtuoso;semantic-web
160,InteractiveGraph,Web-based interactive visualization framework for large graph data,"A framework for interactive visualization and analysis of large graph data, supporting data from GSON files or Neo4j databases, enabling researchers to explore complex relationships in knowledge graphs.",B6;B6-03,visualization;graph_analysis,platform,JavaScript,https://github.com/grapheco/InteractiveGraph,,BSD-2-Clause,graph-visualization;neo4j;knowledge-graph;interactive-analysis
161,PyGraphistry,GPU-accelerated library for big graph visualization and analysis,"A Python library that interfaces with the Graphistry visual graph analyzer to load, shape, embed, and explore large graphs using GPU acceleration, suitable for analyzing complex scientific networks.",B6;B6-03,graph_analysis;visualization;embedding,library,Python,https://github.com/graphistry/pygraphistry,https://github.com/graphistry/pygraphistry,BSD-3-Clause,gpu-acceleration;graph-visualization;network-analysis;python
162,HyperGraphQL,GraphQL interface for querying and serving linked data,"A middleware service that provides a GraphQL interface for querying and serving linked data (RDF) from various SPARQL endpoints, facilitating the integration of semantic web data into modern applications.",B6;B6-03,query_interface;data_integration,service,Java,https://github.com/hypergraphql/hypergraphql,,Apache-2.0,graphql;rdf;sparql;linked-data
163,Hypergraph-DB,Hypergraph Database with visualization capabilities,"A database system designed for storing and visualizing hypergraphs, which are essential for representing complex many-to-many relationships in scientific data such as biological networks.",B6;B6-03,data_storage;visualization,solver,Python,https://github.com/iMoonLab/Hypergraph-DB,,Apache-2.0,hypergraph;database;graph-visualization
164,rdf_fdw,PostgreSQL Foreign Data Wrapper for RDF Triplestores,"A PostgreSQL extension that allows SQL queries to access data stored in RDF triplestores (SPARQL endpoints), enabling data integration between relational and semantic scientific databases.",B6;B6-03,data_integration;query_interface,solver,C,https://github.com/jimjonesbr/rdf_fdw,,MIT,postgresql;rdf;sparql;data-integration
165,Kùzu,Embedded property graph database optimized for query speed and interoperability,"An embedded property graph database management system built for high-performance query processing. It integrates vector search and full-text search, implements the Cypher query language, and is designed to serve as a storage backend for knowledge graphs and graph analytics in scientific applications.",B6;B6-03,graph_storage;graph_query;vector_search,solver,C++,https://github.com/kuzudb/kuzu,https://kuzudb.com,MIT,graph-database;cypher;embedded-database;knowledge-graph
166,Pixy,Declarative vendor-independent graph query language on TinkerPop,"A declarative graph query language built on top of the TinkerPop software stack. It provides a vendor-independent way to query graph databases, facilitating the abstraction of graph query logic in knowledge graph applications.",B6;B6-03,graph_query;query_language,library,Java,https://github.com/lambdazen/pixy,,Apache-2.0,graph-query-language;tinkerpop;declarative-query
167,G-CORE Spark,Reference implementation of the G-CORE graph query language on Spark,"An implementation of the G-CORE graph query language, developed by the Linked Data Benchmark Council (LDBC), running on Apache Spark. It serves as a research tool for evaluating and utilizing advanced graph query features like path property graphs and composable graph queries.",B6;B6-03,graph_query;query_processing,solver,Scala,https://github.com/ldbc/gcore-spark,http://ldbcouncil.org,Apache-2.0,g-core;graph-query;spark;ldbc
168,LinkML-Store,Storage wrapper for LinkML data models,"A library that provides a unified interface for storing and retrieving data conforming to LinkML (Linked Data Modeling Language) schemas. It supports multiple backends, facilitating the management of scientific data models and knowledge graphs.",B6;B6-03,data_storage;data_modeling,library,Python,https://github.com/linkml/linkml-store,https://linkml.io/linkml-store/,MIT,linkml;storage-wrapper;knowledge-graph
169,LiteGraph,Lightweight graph database with vector and relational support,"A lightweight graph database designed for knowledge persistence and retrieval in AI applications. It supports relational data, vector embeddings, and integrates with the Model Context Protocol (MCP), making it suitable for hybrid AI/KG workflows.",B6;B6-03,graph_storage;vector_search,solver,C#,https://github.com/litegraphdb/litegraph,,None,graph-database;vector-database;ai-persistence
170,RDFSharp,".NET library for Semantic Web applications (RDF, SPARQL, SHACL)","A lightweight .NET library for building Semantic Web applications. It provides comprehensive support for RDF data modeling, SPARQL querying, and SHACL validation, enabling the development of knowledge graph applications in the .NET ecosystem.",B6;B6-03,rdf_processing;sparql_query;shacl_validation,library,C#,https://github.com/mdesalvo/RDFSharp,https://rdfsharp.codeplex.com/,Apache-2.0,rdf;sparql;shacl;semantic-web
171,openCypherTranspiler,Transpiler from openCypher to SQL,"A tool that transpiles openCypher graph query language into T-SQL (and potentially other relational query languages). It allows researchers to execute graph queries on top of existing relational database infrastructure, facilitating graph analysis on relational data.",B6;B6-03,query_translation;graph_query,library,C#,https://github.com/microsoft/openCypherTranspiler,,MIT,opencypher;transpiler;sql;graph-query
172,NebulaGraph-Bench,Benchmark suite for NebulaGraph,A collection of benchmark services and tools designed to evaluate the performance of NebulaGraph. It supports standard graph benchmarks (like LDBC) to assess query latency and throughput in large-scale graph scenarios.,B6;B6-03,benchmarking;performance_evaluation,solver,Python,https://github.com/nebula-contrib/NebulaGraph-Bench,,Apache-2.0,benchmark;nebulagraph;ldbc;performance
173,nebula-pyg,Connector between NebulaGraph and PyTorch Geometric,A Python library that facilitates the integration of NebulaGraph with PyTorch Geometric (PyG). It enables the loading of graph data stored in NebulaGraph directly into PyG datasets for training Graph Neural Networks (GNNs) in scientific AI workflows.,B6;B6-03,data_loading;gnn_integration,library,Python,https://github.com/nebula-contrib/nebula-pyg,,MIT,pytorch-geometric;gnn;nebulagraph;graph-learning
174,NebulaGraph Lite,"Lightweight, pip-installable distribution of NebulaGraph",A lightweight distribution of NebulaGraph that can be installed via pip. It is designed for quick setup in data science environments (like Colab or Jupyter Notebooks) to facilitate ad-hoc graph analysis and prototyping without complex deployment.,B6;B6-03,graph_storage;graph_analysis,platform,Python,https://github.com/nebula-contrib/nebulagraph-lite,,Apache-2.0,graph-database;nebulagraph;data-science;notebook-friendly
175,biochem4j,Integrated biochemical knowledge graph builder,"A Python library and framework for generating, integrating, and querying biochemical knowledge graphs (including metabolic pathways and chemical structures) using Neo4j.",B6;B6-03,knowledge_graph_construction;data_integration,library,Python,https://github.com/neilswainston/biochem4j,,MIT,biochemistry;knowledge-graph;neo4j;metabolism
176,gfe-db,Graph database for HLA sequence data,A graph database implementation and workflow for representing IPD-IMGT/HLA sequence data using the Gene Feature Enumeration (GFE) model for immunogenetics research.,B6;B6-03,data_modeling;sequence_analysis,solver,Makefile,https://github.com/nmdp-bioinformatics/gfe-db,,GPL-3.0,immunogenetics;hla;graph-database;bioinformatics
177,BioNetDB,Storage engine for biological networks,A storage engine and query interface designed to work with biological networks and systems biology data using a NoSQL graph database approach.,B6;B6-03,network_analysis;data_storage,platform,JavaScript,https://github.com/opencb/bionetdb,,Apache-2.0,systems-biology;biological-networks;nosql;graph-database
178,BioRuby-RDF,RDF plugin for BioRuby,"A BioRuby plugin for parsing, filtering, and interacting with biological data in RDF format, facilitating integration with triple-stores.",B6;B6-03,data_conversion;semantic_integration,library,Ruby,https://github.com/pjotrp/bioruby-rdf,,MIT,bioruby;rdf;bioinformatics;semantic-web
179,SPARQL-DL API,Query engine for SPARQL-DL to query OWL-DL ontologies,"A query engine implementation for SPARQL-DL, allowing users to execute SPARQL queries over OWL-DL ontologies, bridging the gap between Semantic Web standards and Description Logic reasoners.",B6;B6-03,query_engine;ontology_reasoning,library,Java,https://github.com/protegeproject/sparql-dl-api,,LGPL-3.0,sparql;owl;ontology;reasoning
180,qKnow,Enterprise-grade knowledge graph platform for construction and fusion,"An open-source knowledge graph platform providing capabilities for knowledge extraction, fusion, graph construction, and visualization, designed to build structured and queryable knowledge systems.",B6;B6-01;B6-03,knowledge_graph_construction;knowledge_fusion;visualization,platform,Java,https://github.com/qiantongtech/qKnow,,NOASSERTION,knowledge-graph;extraction;fusion;platform
181,Quadstore,LevelDB-backed graph database for JS runtimes,"A graph database backed by LevelDB that runs in Node.js, Deno, and browsers, supporting SPARQL queries and the RDF/JS interface for managing linked data.",B6;B6-03,graph_storage;query_engine,solver,TypeScript,https://github.com/quadstorejs/quadstore,,MIT,rdf;sparql;graph-database;leveldb
182,Mulgara,Scalable RDF Triple Store written in Java,"A scalable RDF Triple Store and database written in Java, designed for storing and querying large sets of RDF data using SPARQL and TQL.",B6;B6-03,graph_storage;query_engine,solver,Java,https://github.com/quoll/mulgara,,OSL-3.0,rdf;triplestore;database;java
183,RageDB,High-performance in-memory property graph database,"An in-memory property graph database server using a shared-nothing architecture, designed for high-performance graph traversals and queries.",B6;B6-03,graph_storage;graph_query,solver,C++,https://github.com/ragedb/ragedb,,Apache-2.0,graph-database;in-memory;property-graph;cpp
184,Ostrich,Versioned RDF triple store supporting changesets,A versioned RDF triple store (OffSet-enabled TRIple store for CHangesets) that allows efficient storage and querying of multiple versions of a dataset.,B6;B6-03,graph_storage;version_control,solver,C++,https://github.com/rdfostrich/ostrich,,NOASSERTION,rdf;triplestore;versioning;cpp
185,Sage,SPARQL query engine for public Linked Data with preemption,"A SPARQL query engine designed for public Linked Data providers, supporting preemptive query execution to ensure server stability and responsiveness.",B6;B6-03,query_engine;sparql_processing,solver,Python,https://github.com/sage-org/sage-engine,http://sage.univ-nantes.fr/,MIT,sparql;linked-data;query-engine;python
