id,name,one_line_profile,detailed_description,domains,subtask_category,application_level,primary_language,repo_url,help_website,license,tags
207,Semi-supervised-Cardiac-Image-Segmentation,Semi-supervised cardiac image segmentation model,"Implementation of a semi-supervised method for cardiac image segmentation using label propagation and style transfer, developed for the MICCAI 2020 M&Ms challenge.",Medical Imaging;Bioinfo,segmentation;image_analysis,solver,Python,https://github.com/YaoZhang93/Semi-supervised-Cardiac-Image-Segmentation-via-Label-Propagation-and-Style-Transfer,,None,medical-imaging;segmentation;cardiac;semi-supervised
208,scib-metrics,Accelerated metrics for single-cell integration benchmarking,"A Python library providing accelerated implementations of metrics used for benchmarking single-cell integration methods, facilitating rapid evaluation of integration quality.",Bioinfo;Single-cell,benchmarking;quality_control,library,Python,https://github.com/YosefLab/scib-metrics,,BSD-3-Clause,benchmarking;metrics;single-cell;integration
209,GCN-SC,Graph Convolutional Networks for single-cell multi-omics integration,"A universal framework utilizing Graph Convolutional Networks (GCN) to integrate single-cell multi-omics data, capturing complex relationships between cells and features.",Bioinfo;Single-cell,integration;graph_learning,solver,Python,https://github.com/YuBinLab-QUST/GCN-SC,,None,gcn;multi-omics;single-cell;integration
210,scDREAMER,Atlas-level integration of single-cell datasets,"A deep generative model paired with an adversarial classifier for the atlas-level integration of single-cell datasets, handling batch effects and biological heterogeneity.",Bioinfo;Single-cell,integration;atlas_building,solver,Jupyter Notebook,https://github.com/Zafar-Lab/scDREAMER,,NOASSERTION,single-cell;integration;generative-model;atlas
211,wgcca,Weighted Generalized Canonical Correlation Analysis,"A Python implementation of Weighted Generalized Canonical Correlation Analysis (WGCCA), a statistical method for analyzing relationships between multiple sets of variables, applicable to multi-omics integration.",Statistics;Bioinfo,analysis;correlation_analysis,library,Python,https://github.com/abenton/wgcca,,MIT,cca;statistics;multivariate-analysis;python
212,netOmics,Multi-omics multi-layered network integration,"An R package for multi-omics multi-layered network integration and interpretation, aiding in the systems biology analysis of complex biological interactions.",Bioinfo;Systems Biology,integration;network_analysis,library,R,https://github.com/abodein/netOmics,,GPL-3.0,multi-omics;network-analysis;integration;R
213,Pamona,Partial manifold alignment algorithm for single-cell multi-omics integration,"Pamona is a software implementing a partial manifold alignment algorithm designed to integrate heterogeneous single-cell multi-omics datasets, handling non-overlapping cells and features.",Bioinfo;B3-02,integration;alignment,solver,Jupyter Notebook,https://github.com/caokai1073/Pamona,,MIT,single-cell;manifold-alignment;multi-omics
214,uniPort,Unified single-cell data integration framework using optimal transport,uniPort is a framework for integrating single-cell data across different modalities and batches using optimal transport theory to align distributions.,Bioinfo;B3-02,integration;alignment,solver,Python,https://github.com/caokai1073/uniPort,,MIT,single-cell;optimal-transport;data-integration
215,STACAS,Semi-supervised integration of single-cell transcriptomics data,"STACAS is an R package for the integration of single-cell RNA-seq datasets, capable of identifying and preserving biological heterogeneity while correcting for batch effects using a semi-supervised approach.",Bioinfo;B3-02,integration;batch_correction,library,R,https://github.com/carmonalab/STACAS,,GPL-3.0,scRNA-seq;integration;semi-supervised
216,NetICS,Network-based integration of multi-omics data for cancer gene prioritization,NetICS is a computational method for integrating multi-omics data on a biological network to prioritize cancer genes by propagating signals across the network.,Bioinfo;B3-02,integration;prioritization,solver,MATLAB,https://github.com/cbg-ethz/netics,,GPL-3.0,multi-omics;network-analysis;cancer-genomics
217,TopicVelo,Integration of bursty transcriptional dynamics for RNA velocity analysis,"TopicVelo is a method for the dissection and integration of bursty transcriptional dynamics, enhancing RNA velocity analysis in complex biological systems.",Bioinfo;B3,dynamics_inference;integration,solver,Jupyter Notebook,https://github.com/chengfgao/TopicVelo,,BSD-3-Clause,rna-velocity;transcriptional-dynamics;single-cell
218,DeepIMV,Deep variational information bottleneck for multi-omics integration,DeepIMV is a deep learning framework based on the variational information bottleneck principle for the integration and analysis of multi-omics data.,Bioinfo;B3-02,integration;modeling,solver,Jupyter Notebook,https://github.com/chl8856/DeepIMV,,None,multi-omics;deep-learning;information-bottleneck
219,mnnpy,Python implementation of MNN batch correction,"mnnpy is a Python implementation of the Mutual Nearest Neighbors (MNN) batch effect correction method, originally developed in R.",Bioinfo;B3-02,batch_correction;integration,library,Python,https://github.com/chriscainx/mnnpy,,BSD-3-Clause,mnn;batch-correction;single-cell
220,irGSEA,Integration of rank-based gene set enrichment analysis for single-cell data,irGSEA integrates multiple rank-based gene set enrichment analysis methods to provide robust functional enrichment results for single-cell RNA-seq data.,Bioinfo;B3,enrichment_analysis;integration,library,R,https://github.com/chuiqin/irGSEA,,NOASSERTION,gsea;single-cell;enrichment
221,DataHarmonizer,Browser-based spreadsheet editor for data harmonization and validation,"DataHarmonizer is a standardized, browser-based spreadsheet editor and validator designed to harmonize data entry according to specific templates, widely used for pathogen genomics data.",Bioinfo;B3-02,data_harmonization;validation,platform,JavaScript,https://github.com/cidgoh/DataHarmonizer,,MIT,data-standardization;epidemiology;metadata
222,sentle,Large-scale Sentinel-1 & Sentinel-2 data cube processing and harmonization,"sentle is a Python tool for creating and processing large-scale Sentinel-1 and Sentinel-2 data cubes, featuring integrated cloud detection, snow masking, and data harmonization.",EarthScience,data_processing;harmonization,library,Python,https://github.com/cmosig/sentle,,MIT,remote-sensing;sentinel;data-cube
223,pyrcca,Regularized Kernel Canonical Correlation Analysis in Python,"A Python library for performing regularized kernel canonical correlation analysis (CCA), widely used in neuroscience for analyzing fMRI data and other multivariate datasets.",Neuroscience;Statistics,dimensionality_reduction;correlation_analysis,library,Python,https://github.com/gallantlab/pyrcca,,NOASSERTION,cca;kernel-methods;neuroscience;multivariate-analysis
224,GLUE,Graph-linked unified embedding for single-cell multi-omics integration,"A computational framework for integrating unpaired single-cell multi-omics data by learning a graph-linked unified embedding, enabling cross-modal alignment and regulatory inference.",B3;B3-02,integration;multi_omics;embedding,solver,Python,https://github.com/gao-lab/GLUE,,MIT,single-cell;multi-omics;integration;graph-neural-network
225,AMARETTO,Regulatory network inference and driver gene evaluation tool,An R package for integrating multi-omics data to infer regulatory networks and identify driver genes using penalized regression methods.,Bioinfo;Systems_Biology,network_inference;multi_omics,library,R,https://github.com/gevaertlab/AMARETTO,,Apache-2.0,regulatory-network;multi-omics;driver-genes;cancer-biology
226,mofaplus-shiny,Interactive Shiny application for MOFA+ models,A Shiny-based interactive tool for exploring and visualizing models generated by Multi-Omics Factor Analysis (MOFA+).,Bioinfo,visualization;exploration,application,R,https://github.com/gtca/mofaplus-shiny,,None,shiny;mofa;multi-omics;visualization
227,harmony,Data harmonization tool for psychology research,"A Python library designed for psychologists to harmonize data and questionnaire items across different studies, facilitating meta-analysis and data integration.",Psychology;Social_Science,data_harmonization;integration,library,Python,https://github.com/harmonydata/harmony,,MIT,psychology;harmonization;questionnaires;nlp
228,CCA-SSG,Deep learning method combining CCA and Graph Neural Networks for multi-view data learning,"Implementation of 'From Canonical Correlation Analysis to Self-supervised Graph Neural Networks', providing a solver for multi-view representation learning which is applicable to multi-omics integration.",B3;B3-02,integration;multi_modal_learning,solver,Python,https://github.com/hengruizhang98/CCA-SSG,https://arxiv.org/abs/2106.12484,Apache-2.0,cca;gnn;multi-view-learning
229,IntegratedLearner,Integrated Machine Learning framework for Multi-omics Classification and Prediction,A machine learning framework designed for the integration of multi-omics data to perform classification and prediction tasks.,B3;B3-02,multi_omics_integration;classification,library,R,https://github.com/himelmallick/IntegratedLearner,,MIT,multi-omics;machine-learning;integration
230,brainmapr,Spatial mapping of neuronal subpopulations by integrating scRNA-seq and in situ RNA patterns,An R package to infer the spatial location of neuronal subpopulations within the developing mouse brain by integrating single-cell RNA-seq data with in situ RNA patterns.,B3;B3-02,spatial_mapping;integration,library,R,https://github.com/hms-dbmi/brainmapr,,None,spatial-transcriptomics;scrna-seq;mapping
231,MOLI,Multi-Omics Late Integration with deep neural networks for drug response prediction,"A deep learning approach for integrating multi-omics data (somatic mutation, CNA, and gene expression) to predict drug response.",B3;B3-02,multi_omics_integration;drug_response_prediction,solver,Python,https://github.com/hosseinshn/MOLI,,None,multi-omics;deep-learning;drug-response
232,scanoncorr,Sparse canonical correlation analysis (SCCA) implementation,"A MATLAB implementation of Sparse Canonical Correlation Analysis, a statistical method used for integrating two sets of variables, commonly applied in multi-omics data integration.",B3;B3-02,integration;dimensionality_reduction,library,MATLAB,https://github.com/htpusa/scanoncorr,,MIT,scca;correlation-analysis;matlab
233,scanpy-mcp,Model Context Protocol (MCP) server for Scanpy,"An interface tool that exposes Scanpy's single-cell analysis capabilities via the Model Context Protocol, enabling AI agents to perform single-cell data analysis.",B3;B3-02,analysis_interface;automation,service,Python,https://github.com/huang-sh/scanpy-mcp,,BSD-3-Clause,scanpy;llm-agent;mcp
234,scETM,Generative topic model for integrative analysis of large-scale scRNA-seq data,"A generative topic model (single-cell Embedded Topic Model) designed to facilitate the integrative analysis of large-scale single-cell RNA sequencing data, handling batch effects and data integration.",B3;B3-02,integration;batch_correction;topic_modeling,solver,Python,https://github.com/hui2000ji/scETM,,BSD-3-Clause,scrna-seq;topic-model;integration
235,VegX,"R functions to import, integrate, and harmonize vegetation data","A set of functions to import, integrate, harmonize and export vegetation data using the VegX exchange standard, facilitating data interoperability in ecology.",B3;B3-02,data_harmonization;integration,library,R,https://github.com/iavs-org/VegX,,None,vegetation-data;standardization;ecology
236,Harmony,Fast and accurate integration of single-cell data,"An algorithm for projecting cells into a shared embedding in which cells group by cell type rather than dataset-specific conditions, widely used for batch correction and integration.",B3;B3-02,integration;batch_correction,library,R,https://github.com/immunogenomics/harmony,https://portals.broadinstitute.org/harmony/,NOASSERTION,scrna-seq;batch-correction;integration
237,Symphony,Efficient and precise single-cell reference atlas mapping,"A tool for mapping query single-cell data onto reference atlases constructed with Harmony, enabling rapid annotation and integration.",B3;B3-02,reference_mapping;integration,library,R,https://github.com/immunogenomics/symphony,,GPL-3.0,reference-mapping;scrna-seq;atlas
238,HyperTMO,Hypergraph convolutional network for multi-omics integration,A trusted multi-omics integration framework based on Hypergraph convolutional networks for patient classification and data integration.,B3;B3-02,multi_omics_integration;classification,solver,Python,https://github.com/ippousyuga/HyperTMO,,MIT,hypergraph;multi-omics;deep-learning
239,mixedCCA,Sparse CCA for mixed data types,"R package for sparse canonical correlation analysis designed to handle mixed data types (continuous, binary, zero-truncated), suitable for integrating diverse omics data.",B3;B3-02,integration;statistical_analysis,library,R,https://github.com/irinagain/mixedCCA,,None,cca;mixed-data;integration
240,cca_zoo,Comprehensive library for Canonical Correlation Analysis methods,"A collection of Regularized, Deep Learning based, Kernel, and Probabilistic CCA methods implemented in a scikit-learn style framework, facilitating multi-view data analysis.",B3;B3-02,integration;dimensionality_reduction,library,Python,https://github.com/jameschapman19/cca_zoo,https://cca-zoo.readthedocs.io/,MIT,cca;deep-learning;multi-view
241,autoencodix,Autoencoder framework for multi-omics data integration,"A framework utilizing autoencoders for the integration of multi-omics data, enabling dimensionality reduction and feature extraction across modalities.",B3;B3-02,multi_omics_integration;dimensionality_reduction,library,Python,https://github.com/jan-forest/autoencodix,,NOASSERTION,autoencoder;multi-omics;integration
242,longCombat,Longitudinal ComBat for batch effect correction,"An R package implementing longitudinal ComBat, a method for harmonizing multi-batch longitudinal data while preserving biological trends.",B3;B3-02,batch_correction;harmonization,library,R,https://github.com/jcbeer/longCombat,,Artistic-2.0,batch-effect;longitudinal-data;combat
243,ODG,Omics Database Generator integration toolkit,"A toolkit for integrating and managing omics data, facilitating the generation of databases for multi-omics analysis.",B3;B3-02,data_integration;database_management,workflow,Clojure,https://github.com/jguhlin/ODG,,GPL-3.0,omics;database;integration
244,scbean,Python package for single-cell data analysis,"A Python package providing tools for single-cell data analysis, including methods for integration and removal of batch effects.",B3;B3-02,analysis;integration,library,Python,https://github.com/jhu99/scbean,,MIT,scrna-seq;analysis;python
245,SCALEX,Online single-cell data integration via common cell-embedding space,"A deep learning method for online integration of single-cell data by projecting heterogeneous datasets into a common cell-embedding space, handling batch effects without retraining.",B3;B3-02,integration;embedding;online_learning,solver,Python,https://github.com/jsxlei/SCALEX,https://scalex.readthedocs.io/,BSD-3-Clause,scrna-seq;integration;deep-learning
246,BEER,Batch EffEct Remover for single-cell data,"An R package designed to remove batch effects from single-cell data, facilitating the integration of datasets from different sources.",B3;B3-02,batch_correction;integration,library,R,https://github.com/jumphone/BEER,,MIT,batch-effect;scrna-seq;integration
247,MATCHER,Manifold Alignment for integrating single cell transcriptomic and epigenomic data,A tool for integrating single-cell transcriptomic and epigenomic data using manifold alignment to characterize experimental relationships.,B3;B3-02,multi_omics_integration;manifold_alignment,solver,Python,https://github.com/jw156605/MATCHER,,MIT,multi-omics;manifold-alignment;integration
248,scgenetics,Identifying disease critical cell types and programs from scRNA-seq,A tool for analyzing single-cell RNA-seq data to identify disease-critical cell types and genetic programs.,B3;B3-02,analysis;disease_association,solver,Python,https://github.com/karthikj89/scgenetics,,None,scrna-seq;disease-genetics;analysis
249,conos,Joint analysis of multiple single-cell RNA-seq datasets,"An R package for the integration and joint analysis of multiple single-cell RNA-seq datasets, relying on graph-based connectivity.",B3;B3-02,integration;joint_analysis,library,R,https://github.com/kharchenkolab/conos,http://htmlpreview.github.io/?https://github.com/kharchenkolab/conos/blob/master/docs/index.html,GPL-3.0,scrna-seq;integration;graph-clustering
250,clonealign,Integrating scRNA-seq and scDNA-seq for clone-specific expression inference,A Bayesian method to infer clone-specific gene expression by integrating single-cell RNA-seq and single-cell DNA-seq data.,B3;B3-02,multi_omics_integration;clonal_analysis,solver,R,https://github.com/kieranrcampbell/clonealign,,Apache-2.0,multi-omics;bayesian;scdna-seq
251,MIDAS,Deep learning model for mosaic single-cell multimodal data integration,"A PyTorch implementation of the MIDAS algorithm (Nature Biotechnology 2024) for integrating single-cell multimodal data. It handles mosaic integration, imputation, and batch correction across different modalities.",B3;B3-02,integration;imputation;batch_correction,solver,Python,https://github.com/labomics/midas,,MIT,single-cell;multimodal;integration;deep-learning
252,DeepProg,Deep learning framework for multi-omic and survival data integration,"A deep learning framework designed to integrate multi-omics data with survival outcomes. It uses autoencoders to extract features and predict patient survival, facilitating biomarker discovery.",B3;B3-02,integration;survival_analysis;multi-omics,solver,Python,https://github.com/lanagarmire/DeepProg,,NOASSERTION,multi-omics;survival-analysis;deep-learning
253,Cirrocumulus,Interactive visualization platform for large-scale single-cell data,"A visualization tool that enables interactive exploration of large-scale single-cell datasets. It supports various data formats and provides a web-based interface for viewing embeddings, gene expression, and metadata.",B3,visualization;data_exploration,platform,JavaScript,https://github.com/lilab-bcb/cirrocumulus,https://cirrocumulus.readthedocs.io/,BSD-3-Clause,visualization;single-cell;interactive
254,BenchmarkST,Benchmarking suite for spatial transcriptomics analysis methods,"A comprehensive benchmarking framework for evaluating clustering, alignment, and integration methods in spatial transcriptomics. It provides metrics and datasets to assess the performance of various computational tools.",B3;B3-02,benchmarking;integration;clustering,library,Jupyter Notebook,https://github.com/maiziezhoulab/BenchmarkST,,MIT,spatial-transcriptomics;benchmarking;integration
255,FIRM,Flexible integration of single-cell RNA-sequencing data for large-scale multi-tissue cell atlas datasets,"FIRM is an algorithm designed for the integration of single-cell RNA-sequencing data, specifically optimized for large-scale multi-tissue cell atlas datasets to handle batch effects and align populations.",B3;B3-02,integration;batch_correction,solver,C++,https://github.com/mingjingsi/FIRM,,None,scRNA-seq;integration;multi-tissue
256,CLEAR,Self-supervised contrastive learning for integrative single-cell RNA-seq data analysis,"CLEAR leverages self-supervised contrastive learning to perform integrative analysis of single-cell RNA-seq data, aiming to overcome batch effects and learn robust representations.",B3;B3-02,integration;representation_learning,solver,Python,https://github.com/ml4bio/CLEAR,,None,contrastive-learning;scRNA-seq;integration
257,seuratv3wizard,Web-based interactive wizard for Seurat v3 single-cell analysis,"A version of the SeuratWizard specifically tailored for Seurat v3 workflows, enabling guided analysis and clustering of single-cell transcriptomics data.",B3,analysis_workflow;clustering,platform,R,https://github.com/nasqar/seuratv3wizard,,GPL-3.0,seurat-v3;shiny;gui
258,pyPARAGON,PAgeRAnk-flux on Graphlet-guided network for multi-Omic data integratioN,A tool for multi-omic data integration and network inference that utilizes PageRank-flux algorithms on graphlet-guided networks to uncover biological relationships.,B3;B3-02,network_inference;integration,solver,Jupyter Notebook,https://github.com/netlab-ku/pyPARAGON,,BSD-3-Clause,multi-omics;network-inference;pagerank
259,scdownstream,"A single cell transcriptomics pipeline for QC, integration and reporting","An nf-core pipeline designed for downstream analysis of single-cell transcriptomics data, covering quality control, data integration, and report generation.",B3;B3-02,pipeline;quality_control;integration,workflow,Nextflow,https://github.com/nf-core/scdownstream,,MIT,nf-core;nextflow;scRNA-seq;pipeline
260,knncmi,Estimation of conditional mutual information using nearest neighbors,"A Python library for estimating mutual information (MI) and conditional mutual information (CMI) using k-nearest neighbors, widely used in scientific data analysis for network inference and dependency detection.",B3,statistical_inference;network_inference,library,Python,https://github.com/omesner/knncmi,,GPL-3.0,mutual-information;knn;statistics
261,CGCCP_2023,scVI extension for unspliced RNA analysis,"Implementation of an extension to the scVI model specifically for handling unspliced RNA in single-cell sequencing data, enabling kinetic modeling and velocity analysis.",B3,modeling;rna_velocity,solver,Jupyter Notebook,https://github.com/pachterlab/CGCCP_2023,,BSD-2-Clause,scvi;unspliced-rna;scRNA-seq
262,amLDS,Aligned mixture of latent dynamical systems for manifold alignment,"Implements the 'Aligned mixture of latent dynamical systems' (amLDS) model for probabilistic manifold alignment, particularly useful for decoding stimuli and aligning neural dynamics across different subjects.",B3-02,alignment;modeling,solver,HTML,https://github.com/pedroherrerovidal/amLDS,,AGPL-3.0,manifold-alignment;dynamical-systems;neuroscience
263,ManifoldAlignment,Manifold Alignment algorithms implementation,"A MATLAB implementation of manifold alignment algorithms, which are techniques used to align datasets from different domains (e.g., different modalities or batches) into a shared low-dimensional space.",B3-02,alignment;dimensionality_reduction,library,MATLAB,https://github.com/perimosocordiae/ManifoldAlignment,,MIT,manifold-alignment;matlab;integration
264,FoF,Focus-oriented Representation Learning and Multi-view Cross-modal Alignment for Glioma Grading,A deep learning framework for glioma grading that employs focus-oriented representation learning and multi-view cross-modal alignment to integrate medical imaging data.,B3-02,alignment;classification;medical_imaging,solver,Python,https://github.com/peterlipan/FoF,,None,multi-view;cross-modal;medical-imaging
265,fscca,Fast Sparse Canonical Correlation Analysis implementation,"An implementation of Fast Sparse Canonical Correlation Analysis (fscca) using NIPALS SCCA and Rcpp, providing efficient multi-view data integration capabilities.",B3-02,integration;dimensionality_reduction,library,C++,https://github.com/pimentel/fscca,,MIT,cca;sparse-cca;integration
266,ennemi,Easy Nearest Neighbor Estimation of Mutual Information,"A Python package for fast and accurate estimation of mutual information between continuous variables using nearest neighbor methods, suitable for analyzing dependencies in scientific data.",B3,statistical_inference;dependency_analysis,library,Python,https://github.com/polsys/ennemi,https://polsys.github.io/ennemi/,MIT,mutual-information;entropy;statistics
267,symphonypy,Python port of the Symphony algorithm for single-cell reference mapping,"A Python implementation of the Symphony algorithm, enabling efficient mapping of query single-cell datasets onto integrated reference atlases.",B3-02,mapping;integration,library,Jupyter Notebook,https://github.com/potulabe/symphonypy,,GPL-3.0,symphony;reference-mapping;scRNA-seq
268,Banksy_py,Spatial clustering algorithm unifying cell-typing and tissue domain segmentation,BANKSY is a spatial clustering algorithm that unifies cell-typing and tissue domain segmentation for spatial transcriptomics analysis.,B3;B3-02,spatial_clustering;segmentation;cell_typing,library,Jupyter Notebook,https://github.com/prabhakarlab/Banksy_py,,GPL-3.0,spatial-transcriptomics;clustering;segmentation
269,scAlign,Deep learning-based tool for alignment and integration of single cell genomic data,"scAlign is a deep learning-based tool for alignment and integration of single cell genomic data across multiple datasets, species, conditions, and batches.",B3;B3-02,integration;alignment;batch_correction,library,R,https://github.com/quon-titative-biology/scAlign,,GPL-3.0,deep-learning;single-cell;integration
270,PASTE,Probabilistic Alignment of Spatial Transcriptomics Experiments,PASTE (Probabilistic Alignment of Spatial Transcriptomics Experiments) is a method for aligning and integrating spatial transcriptomics data.,B3;B3-02,spatial_alignment;integration,library,Python,https://github.com/raphael-group/paste,,BSD-3-Clause,spatial-transcriptomics;alignment;probabilistic-modeling
271,PASTE2,Probabilistic Alignment of Spatial Transcriptomics Experiments v.2,PASTE2 is the second version of the Probabilistic Alignment of Spatial Transcriptomics Experiments tool.,B3;B3-02,spatial_alignment;integration,library,Jupyter Notebook,https://github.com/raphael-group/paste2,,BSD-3-Clause,spatial-transcriptomics;alignment
