id,name,one_line_profile,detailed_description,domains,subtask_category,application_level,primary_language,repo_url,help_website,license,tags
399,s2-angs,Calculation of Sentinel-2 viewing and sun angles,"A Python script to calculate view zenith, view azimuth, sun zenith, and sun azimuth angles for Sentinel-2 satellite imagery.",Earth Science;Remote Sensing,data_processing;angle_calculation,solver,Python,https://github.com/brazil-data-cube/s2-angs,,GPL-3.0,sentinel-2;remote-sensing;satellite-imagery
400,Tangram,Spatial alignment of single cell transcriptomic data to spatial data,"A Python package for mapping single-cell gene expression data onto spatial transcriptomics data, enabling the reconstruction of spatial gene expression patterns.",B3;B3-04,spatial_mapping;integration;alignment,library,Jupyter Notebook,https://github.com/broadinstitute/Tangram,,BSD-3-Clause,spatial-transcriptomics;scRNA-seq;mapping
401,spSeudoMap,Cell type mapping of spatial transcriptomics using unmatched scRNA-seq data,A tool for mapping cell types in spatial transcriptomics data by leveraging unmatched single-cell RNA-seq references.,B3;B3-04,spatial_mapping;cell_type_annotation,solver,Jupyter Notebook,https://github.com/bsungwoo/spSeudoMap,,None,spatial-transcriptomics;scRNA-seq;mapping
402,scDiagnostics,Diagnostics for assessing cell type annotation quality in scRNA-seq,A set of diagnostic functions to evaluate and assess the quality and reliability of cell type annotations in single-cell RNA sequencing data.,B3;B3-04,quality_control;annotation_assessment,library,R,https://github.com/ccb-hms/scDiagnostics,,None,scRNA-seq;quality-control;annotation
403,SYMPHONY (Solver),Solver for mixed-integer linear programs (MILPs),"An open-source solver, callable library, and framework for solving mixed-integer linear programs (MILPs), widely used in operations research and scientific optimization.",Optimization;Operations Research,optimization;linear_programming,solver,C,https://github.com/coin-or/SYMPHONY,,NOASSERTION,milp;optimization;solver
404,garnett,Automated cell type classification for single-cell expression data,A software package that facilitates automated cell type classification from single-cell expression data using a marker file and a hierarchical classification algorithm.,B3;B3-04,cell_type_classification;annotation,library,R,https://github.com/cole-trapnell-lab/garnett,,MIT,scRNA-seq;cell-classification;bioconductor
405,HiCAT,Hierarchical cell-type annotation tool for scRNA-seq data,"A high-precision, marker-based, hierarchical cell-type annotation tool designed for single-cell RNA-seq data analysis.",B3;B3-04,cell_type_annotation;hierarchical_clustering,solver,Jupyter Notebook,https://github.com/combio-dku/HiCAT,,MIT,scRNA-seq;annotation;hierarchical
406,pysattracker,Satellite tracking and orbital calculation library,"A Python library for calculating azimuth, elevation, doppler shift, and other parameters for satellite overflights.",Astronomy;Space Science,orbital_calculation;tracking,library,Python,https://github.com/cubehub/pysattracker,,MIT,satellite;orbital-mechanics;tracking
407,CytoSPACE,Optimal mapping of scRNA-seq data to spatial transcriptomics,"A tool for the optimal mapping of single-cell RNA-seq data to spatial transcriptomics data, aiming to reconstruct single-cell resolution spatial maps.",B3;B3-04,spatial_mapping;integration,solver,Python,https://github.com/digitalcytometry/cytospace,,NOASSERTION,spatial-transcriptomics;scRNA-seq;mapping
408,XGBoost,Scalable and distributed gradient boosting library,"An optimized distributed gradient boosting library designed to be highly efficient, flexible and portable, widely used for scientific data analysis and machine learning tasks.",Machine Learning;Data Science,classification;regression;modeling,library,C++,https://github.com/dmlc/xgboost,https://xgboost.readthedocs.io/,Apache-2.0,gradient-boosting;machine-learning;gbdt
409,MMoCHi,MultiModal Classifier Hierarchy for cell classification,"A tool for multimodal classification of cell types, leveraging hierarchical structures to improve annotation accuracy.",B3;B3-04,cell_classification;multimodal_analysis,solver,Python,https://github.com/donnafarberlab/MMoCHi,,GPL-3.0,classification;multimodal;hierarchy
410,d2geo,Framework for computing seismic attributes,"A Python framework for computing seismic attributes, facilitating geophysical data analysis and interpretation.",Geophysics;Earth Science,seismic_analysis;attribute_computation,library,Python,https://github.com/dudley-fitzgerald/d2geo,,GPL-3.0,seismic;geophysics;attributes
411,Symphony MT,Machine translation framework,"A machine translation framework designed for research and production, supporting various translation models and tasks.",NLP;AI,machine_translation;nlp_modeling,framework,Scala,https://github.com/eaplatanios/symphony-mt,,Apache-2.0,machine-translation;nlp;scala
412,Northstar,Atlas-guided single-cell type annotation,A tool for single-cell type annotation that uses cell atlases as a reference while allowing for the discovery of novel cell types ('freedom to be queer').,B3;B3-04,cell_type_annotation;atlas_mapping,solver,Python,https://github.com/fabilab/northstar,,MIT,scRNA-seq;annotation;cell-atlas
413,VarGenius,Pipeline for genomic variants discovery and annotation,"A software pipeline for variants discovery and annotation that manages data and job submission on PBS clusters, integrating tools like Picard, Samtools, BWA, GATK, and Annovar, with results stored in PostgreSQL.",Bioinfo;Genomics,variant_calling;annotation;workflow_management,workflow,Perl,https://github.com/frankMusacchia/VarGenius,,NOASSERTION,genomics;variant-discovery;pipeline;gatk
414,DeepCAN,Deep learning system for automated cell counting and viability analysis,"A modular deep learning system for automated image cytometry that performs cell segmentation, cluster separation, and viability classification using CNN architectures (U-Net, LeNet-5 variants).",Bioinfo;Bioimage Analysis,cell_counting;segmentation;viability_analysis,solver,Python,https://github.com/frknrnn/DeepCAN,,None,image-cytometry;deep-learning;cell-counting;segmentation
415,prettyClusters,R package for annotation and illustration of gene clusters,"An R package designed for the annotation, analysis, and visualization of gene clusters, facilitating genomic data interpretation.",Bioinfo;Genomics,visualization;annotation;clustering,library,R,https://github.com/g-e-kenney/prettyClusters,,GPL-3.0,gene-clusters;visualization;genomics
416,COSG,Accurate and fast cell marker gene identification method,"A method for identifying marker genes in single-cell RNA sequencing data, prioritizing accuracy and speed.",Bioinfo;Single-cell,marker_discovery;feature_selection,library,Python,https://github.com/genecell/COSG,,BSD-3-Clause,scRNA-seq;marker-genes;single-cell
417,COSGR,R implementation of the COSG marker gene identification method,The R package implementation of COSG for fast and accurate cell marker gene identification in single-cell data.,Bioinfo;Single-cell,marker_discovery;feature_selection,library,R,https://github.com/genecell/COSGR,,BSD-3-Clause,scRNA-seq;marker-genes;R
418,GeneSCF,Command line tool for gene set clustering based on functional annotation,"A tool for clustering gene sets using functional annotations, aiding in functional enrichment analysis.",Bioinfo;Genomics,functional_enrichment;clustering,solver,Perl,https://github.com/genescf/GeneSCF,,None,gene-set-clustering;functional-annotation;enrichment
419,scClassifR,Automated cell type classification for scRNA-seq data,"An R package to automatically classify cell types in single-cell RNA-seq datasets, supporting Seurat and SingleCellExperiment objects.",Bioinfo;Single-cell,cell_type_classification;annotation,library,R,https://github.com/grisslab/scClassifR,,NOASSERTION,scRNA-seq;classification;cell-types
420,geocalc,Library for calculating Earth distances and bearings,A Java library providing helper classes for geodesic calculations such as distances and bearings on the Earth's surface.,Earth Science;Geography,geodesy;spatial_calculation,library,Java,https://github.com/grumlimited/geocalc,,BSD-3-Clause,geodesy;distance-calculation;gis
421,CytoTRACE,Predicts differentiation state from scRNA-seq data,A computational method that predicts the differentiation state (developmental potential) of cells from single-cell RNA-sequencing data based on gene counts.,Bioinfo;Single-cell,trajectory_inference;differentiation_analysis,library,R,https://github.com/gunsagargulati/CytoTRACE,,NOASSERTION,scRNA-seq;differentiation;developmental-biology
422,ASWMS-Q,Seismological data functional method with anisotropy and attenuation,"A Matlab implementation of the Generalized Seismological Data Functionals (GSDF) method, extended to include azimuthal anisotropy and attenuation for geophysics research.",Geophysics;Seismology,seismic_analysis;anisotropy_modeling,solver,Fortran,https://github.com/jbrussell/ASWMS-Q,,None,seismology;anisotropy;attenuation;matlab
423,YOLO-SCSA,Attention-enhanced YOLO model for skin lesion detection,An integration of the SCSA attention module into the YOLOv8 architecture specifically optimized for the detection of skin lesions in medical images.,Medical Imaging;Bioinfo,medical_object_detection;diagnosis_support,solver,Python,https://github.com/jinyoonok2/YOLO-SCSA,,None,skin-lesion;medical-imaging;yolo;attention-mechanism
424,PyHRTFSweeper,HRTF audio sweeper implementation,"A Python-based implementation for Head-Related Transfer Function (HRTF) processing that sweeps an audio file around the azimuth, used in acoustics and psychoacoustics research.",Physics;Acoustics,signal_processing;simulation,library,Python,https://github.com/joe-habel/PyHRTFSweeper,,None,hrtf;acoustics;audio-processing
425,PyMeso,Azimuthal shear calculation and vortex wind field creation,"A tool for calculating azimuthal shear using the linear least squares derivative method and creating ideal vortex wind fields, used in meteorology for mesocyclone detection.",Meteorology;Earth Science,weather_analysis;vortex_detection,library,Jupyter Notebook,https://github.com/jordanbrook/PyMeso,,NOASSERTION,meteorology;mesocyclone;wind-field;shear-calculation
426,gnssSNR,"Tool for extracting SNR, azimuth, and elevation data from GNSS RINEX files","A Fortran-based tool designed to strip Signal-to-Noise Ratio (SNR) data along with satellite azimuth and elevation angles from RINEX files, primarily used in geodetic and reflectometry research.",Geodesy;Earth Science,data_processing;signal_extraction,solver,Fortran,https://github.com/kristinemlarson/gnssSNR,,MIT,gnss;rinex;gps;geodesy
427,aidata,Image and annotation data pipeline for marine biology workflows,"A Python utility from MBARI for extracting, transforming, loading, and augmenting images and annotations, designed to support detection, clustering, and classification workflows in marine research.",Oceanography;Marine Biology;Computer Vision,data_processing;annotation_management,workflow,Python,https://github.com/mbari-org/aidata,,None,marine-biology;image-processing;annotation
428,CRISP,Drug response prediction using transfer learning with foundation models,"A computational tool for predicting drug responses in unseen cell types by leveraging transfer learning and foundation models, published in Nature Computational Science.",Bioinfo;Pharmacogenomics,drug_response_prediction;transfer_learning,model,Jupyter Notebook,https://github.com/ml4bio/CRISP,,MIT,drug-response;single-cell;foundation-models
429,EnformerCelltyping,Predicting histone marks across cell types using DNA interactions,A TensorFlow-based model utilizing multi-headed attention to incorporate distal DNA interaction effects for predicting histone marks across diverse cell types.,Bioinfo;Genomics;Epigenomics,property_prediction;histone_mark_prediction,model,Jupyter Notebook,https://github.com/neurogenomics/EnformerCelltyping,,MIT,deep-learning;histone-marks;genomics
430,SCANVIS,"Toolkit for scoring, annotating, and visualizing splice junctions","A toolkit developed by NYGenome for the analysis of splice junctions in RNA-seq data, providing functionality for scoring, annotation, and visualization.",Bioinfo;Genomics;Transcriptomics,annotation;visualization;splicing_analysis,solver,R,https://github.com/nygenome/SCANVIS,,NOASSERTION,splice-junctions;rna-seq;visualization
431,task_perturbation_prediction,Benchmark for predicting small molecule perturbation effects on gene expression,A benchmark suite from the OpenProblems project for evaluating methods that predict how small molecules change gene expression across different cell types.,Bioinfo;B3,benchmarking;perturbation_prediction,workflow,Python,https://github.com/openproblems-bio/task_perturbation_prediction,https://openproblems.bio,MIT,benchmark;perturbation;single-cell
432,retreat,Real-time Tremor Analysis Tool for seismic array data,"A Python tool for performing f-k analysis on real-time or archived seismic array data to calculate back azimuth and slowness, aiding in the location of volcanic tremor signals.",Geophysics;Seismology,data_analysis;source_location,solver,Python,https://github.com/paddy-seismic/retreat,,EUPL-1.2,seismology;volcanology;array-processing
433,ccAF,Cell cycle classifier for scRNA-seq data,"A classifier designed to assign cell cycle phases to single-cell RNA-seq data, developed by the Plaisier Lab.",Bioinfo;B3;B3-04,cell_cycle_classification;annotation,solver,Python,https://github.com/plaisier-lab/ccAF,,GPL-3.0,scRNA-seq;cell-cycle;classification
434,ELeFHAnt,Ensemble Learning for Harmonization and Annotation of Single Cells,"An R package that uses an ensemble of machine learning classifiers (RF, SVM, LR) to annotate single-cell clusters, harmonize labels across datasets, and infer cell type relationships.",Bioinfo;B3;B3-04,cell_type_annotation;label_harmonization,library,R,https://github.com/praneet1988/ELeFHAnt,,GPL-3.0,single-cell;annotation;ensemble-learning
435,scRNA_cell_deconv_benchmark,Benchmark of cell type annotation R packages for scRNA-seq data,A comprehensive evaluation and benchmarking of various R packages designed for cell type annotation in single-cell RNA sequencing data.,Bioinfo;B3;B3-04,benchmarking;cell_type_annotation,workflow,R,https://github.com/qianhuiSenn/scRNA_cell_deconv_benchmark,,None,benchmark;scRNA-seq;annotation
436,cell-annotator,Tool for consistent automatic cell type annotation across samples,"A Python tool developed by QuadBio to automatically annotate cell types in single-cell data, ensuring consistency across different samples.",Bioinfo;B3;B3-04,cell_type_annotation,solver,Python,https://github.com/quadbio/cell-annotator,,MIT,single-cell;annotation;automation
437,cellmapper,k-NN-based mapping for label and embedding transfer in single-cell data,"A tool for mapping cells across representations using k-Nearest Neighbors to transfer labels, embeddings, and expression values, facilitating data integration and annotation.",Bioinfo;B3;B3-04,label_transfer;embedding_transfer,solver,Python,https://github.com/quadbio/cellmapper,,MIT,single-cell;knn;label-transfer
438,OrbWeaver,CNN for predicting chromatin accessibility from DNA sequence,"A convolutional neural network model designed to predict chromatin accessibility across multiple cell types directly from DNA sequences, aiding in the understanding of gene regulation.",B3;Genomics,property_prediction;chromatin_accessibility,solver,Python,https://github.com/rajanil/OrbWeaver,,MIT,deep-learning;genomics;chromatin
439,fisheye,R package for log-azimuthal map projections,"A tool to transform base maps using log-azimuthal projection, useful for specific cartographic visualizations and geospatial analysis.",Geography;Cartography,visualization;data_processing,library,R,https://github.com/riatelab/fisheye,,None,maps;projection;geospatial
440,SolarNOAA,Library for solar position and time calculations,"A Swift implementation of NOAA's procedure to calculate local times of sunrise, sunset, solar noon, azimuth, and elevation.",Astronomy;Physics,calculation;astrometry,library,Swift,https://github.com/rlxone/SolarNOAA,,MIT,astronomy;solar;calculation
441,active_gp_hyperlearning,Active learning of Gaussian Process hyperparameters,"MATLAB implementation for active learning of linear embeddings for Gaussian Processes, facilitating efficient model selection and hyperparameter tuning in scientific modeling.",Machine Learning;Statistics,modeling;optimization,library,MATLAB,https://github.com/rmgarnett/active_gp_hyperlearning,,MIT,gaussian-processes;active-learning;matlab
442,mgp,Implementation of Marginal Gaussian Processes,"A MATLAB library implementing the Marginal Gaussian Process (MGP) model, useful for regression and active learning tasks in scientific data analysis.",Machine Learning;Statistics,modeling;inference,library,MATLAB,https://github.com/rmgarnett/mgp,,MIT,gaussian-processes;regression;matlab
443,spatial_LDA,Image-based Latent Dirichlet Allocation for spatial analysis,"An implementation of an image-based LDA model using CNN features to group unlabeled images into topics, aiding in the semi-automation of image annotation and curation.",B3;Computer Vision,image_analysis;clustering,library,Python,https://github.com/rmsander/spatial_LDA,,None,lda;cnn;image-analysis
444,NetTIME,Predicting cell type-specific TF binding sites,A multitask learning framework designed to predict transcription factor binding sites with base-pair resolution in a cell type-specific manner.,B3;Genomics,sequence_analysis;inference,solver,Python,https://github.com/ryi06/NetTIME,,GPL-3.0,transcription-factors;deep-learning;genomics
445,fheatmap,High-quality heatmap generation in R,"An R function wrapper around ggplot2 to create elegant, high-quality heatmaps with advanced annotation capabilities for rows and columns.",B3;Bioinformatics,visualization,library,R,https://github.com/sentisci/fheatmap,,None,heatmap;visualization;r
446,CelestialUtil,Library for celestial body position calculations,"An Objective-C library to calculate declination, azimuth, altitude, and geocentric distance of the Sun and Moon based on location and time.",Astronomy,calculation;astrometry,library,Objective-C,https://github.com/shukob/CelestialUtil,,None,astronomy;celestial-mechanics
447,pyFAI,Fast Azimuthal Integration for X-ray scattering,"A Python library for fast azimuthal integration of 2D X-ray scattering data, converting diffraction images into 1D powder diffraction patterns.",Physics;Materials Science,data_processing;image_analysis,library,Python,https://github.com/silx-kit/pyFAI,http://www.silx.org/doc/pyFAI/dev/,NOASSERTION,x-ray;diffraction;scattering
448,Census,Automated scRNA-seq cell-type annotation,"A tool for accurate, deep, fast, and fully-automated cell-type annotation of single-cell RNA-seq data.",B3;B3-04,annotation;classification,solver,R,https://github.com/sjdlabgroup/Census,,None,single-cell;annotation;rna-seq
449,VoPo,Automated cell-population discovery for mass cytometry,"A scalable, downsampling-free tool for automated cell-population discovery, feature engineering, classification, and visualization, primarily for mass cytometry data.",B3;Immunology,clustering;visualization,workflow,R,https://github.com/stanleyn/VoPo,,None,mass-cytometry;clustering;single-cell
450,ScInfeR,Graph-based cell type annotation toolkit,"A graph-based toolkit for cell type annotation applicable to single-cell RNA-seq, ATAC-seq, and spatial omics data.",B3;B3-04,annotation;inference,library,R,https://github.com/swainasish/ScInfeR,,None,single-cell;annotation;graph-neural-network
451,earth-ae,Earth wind visualization with Azimuthal Equidistant view,"A visualization tool based on earth.nullschool.net, modified to provide an Azimuthal Equidistant view for global wind and weather data.",Earth Science;Meteorology,visualization,platform,JavaScript,https://github.com/systemsplanet-zz/earth-ae,,MIT,visualization;weather;earth
452,Vincenty-Excel,Vincenty's geodesic formulae for Excel,"VBA implementation of Thaddeus Vincenty's Direct and Inverse formulae for accurate geodesic calculations (distance, azimuth, coordinates) within Excel.",Geodesy;Earth Science,calculation,library,VBA,https://github.com/tdjastrzebski/Vincenty-Excel,,MIT,geodesy;excel;calculation
453,MapQC,Metric for evaluating single-cell query-to-reference mappings,"A tool providing metrics to evaluate the quality of single-cell query-to-reference mappings, helping to assess the reliability of transferred annotations.",B3;B3-04,quality_control;evaluation,library,Python,https://github.com/theislab/mapqc,,MIT,single-cell;quality-control;mapping
454,Human Endometrial Cell Atlas (HECA),Integrated single-cell reference atlas of the human endometrium,"A comprehensive single-cell reference atlas for the human endometrium, integrating transcriptomic data to characterize cell types and states. It serves as a reference dataset for cell type annotation and mapping in reproductive biology research.",Bioinfo;B3;B3-04,reference_mapping;cell_type_annotation;data_integration,dataset,Jupyter Notebook,https://github.com/ventolab/Human-Endometrial-Cell-Atlas_HECA,,None,single-cell;reference-atlas;endometrium;transcriptomics
455,Opfi,Tool for discovery and annotation of gene clusters in genomics,"A Python package designed for the discovery, annotation, and analysis of gene clusters (operons) in genomics or metagenomics datasets. It facilitates the identification of functionally related gene groups.",Bioinfo;Genomics,gene_cluster_discovery;annotation;genomic_analysis,library,Python,https://github.com/wilkelab/Opfi,,MIT,genomics;gene-clusters;annotation;metagenomics
456,Melon,Metagenomic long-read taxonomic identification using marker genes,A tool for taxonomic identification and quantification in metagenomic long-read data. It utilizes marker genes to provide accurate classification of microbial communities from sequencing data.,Bioinfo;Metagenomics,taxonomic_identification;quantification;marker_gene_analysis,solver,Python,https://github.com/xinehc/melon,,MIT,metagenomics;long-read;taxonomy;marker-genes
457,MUSE,Deep learning method for characterizing tissue composition in spatial transcriptomics,MUSE (Morphology and transcriptional heterogeneity Unification via Spatial Estimation) is a deep learning approach that characterizes tissue composition by combining morphological and transcriptional information from spatially resolved transcriptomics data.,Bioinfo;B3;B3-05,spatial_domain_identification;multimodal_integration,solver,Jupyter Notebook,https://github.com/AltschulerWu-Lab/MUSE,,MIT,spatial-transcriptomics;deep-learning;tissue-architecture
458,cell2location,Comprehensive mapping of tissue cell architecture via spatial transcriptomics,"cell2location is a Bayesian model for integrating single-cell RNA-seq and spatial transcriptomics data. It maps cell types to spatial locations with high sensitivity and resolution, enabling the study of tissue architecture.",Bioinfo;B3;B3-05,deconvolution;cell_mapping,library,Python,https://github.com/BayraktarLab/cell2location,https://cell2location.readthedocs.io,Apache-2.0,spatial-transcriptomics;bayesian-inference;single-cell
459,SINFONIA,Scalable identification of spatially variable genes and domains,SINFONIA is a tool for the scalable identification of spatially variable genes and the deciphering of spatial domains in spatial transcriptomics data. It is developed by the BioX Lab at Nankai University.,Bioinfo;B3;B3-05,spatial_domain_identification;svg_detection,library,Python,https://github.com/BioX-NKU/SINFONIA,,MIT,spatial-transcriptomics;spatial-domains;gene-expression
460,dataset-histology-landmarks,Dataset of landmarks for histology image registration,"A dataset containing landmarks specifically designed for the registration of histology images, facilitating the development and benchmarking of image registration algorithms in pathology.",Bioinfo;Imaging,image_registration;benchmarking,dataset,Python,https://github.com/Borda/dataset-histology-landmarks,,BSD-3-Clause,histology;image-registration;landmarks
461,cellcharter,Identification and characterization of spatial clusters from omics data,"CellCharter is a Python package for the identification, characterization, and comparison of spatial clusters (niches) from spatial omics data, enabling the analysis of tissue organization.",Bioinfo;B3;B3-05,spatial_clustering;niche_identification,library,Python,https://github.com/CSOgroup/cellcharter,,BSD-3-Clause,spatial-omics;clustering;tissue-organization
462,HealthGPT,Medical Large Vision-Language Model for healthcare tasks,HealthGPT is a Medical Large Vision-Language Model designed to unify comprehension and generation tasks in healthcare via heterogeneous knowledge adaptation. It serves as a foundation model for medical AI applications.,Medicine;AI4S,medical_inference;report_generation,solver,Python,https://github.com/DCDmllm/HealthGPT,,Apache-2.0,medical-llm;vlm;healthcare
463,segger_dev,GNN-based cell segmentation model for spatial omics,A cutting-edge cell segmentation model specifically designed for single-molecule resolved spatial omics datasets. It leverages Graph Neural Networks (GNNs) to accurately segment individual cells in complex imaging datasets.,Bioinfo;B3;Imaging,cell_segmentation;image_processing,solver,HTML,https://github.com/EliHei2/segger_dev,,MIT,segmentation;gnn;spatial-omics
464,spatialGE,Visualization and analysis of spatially-resolved gene expression,"spatialGE is an R package providing methods for the visualization and analysis of spatially-resolved gene expression data, facilitating the exploration of tissue heterogeneity.",Bioinfo;B3,visualization;spatial_analysis,library,R,https://github.com/FridleyLab/spatialGE,,NOASSERTION,spatial-transcriptomics;visualization;gene-expression
