id,name,one_line_profile,detailed_description,domains,subtask_category,application_level,primary_language,repo_url,help_website,license,tags
630,HyPhy,Hypothesis testing using Phylogenies,"HyPhy (Hypothesis Testing using Phylogenies) is a software package for the analysis of genetic sequences using techniques from phylogenetics, molecular evolution, and machine learning. It is widely used for detecting natural selection and evolutionary modeling.",AI4;Bio,phylogenetics;hypothesis_testing;evolutionary_analysis,solver,HyPhy,https://github.com/veg/hyphy,http://hyphy.org/,NOASSERTION,bioinformatics;phylogenetics;evolution;hypothesis-testing
631,RC-FIAP,Platform for seismic vulnerability evaluation of reinforced concrete frames,"RC-FIAP is an open virtual platform for evaluating the seismic vulnerability of reinforced concrete frames. Built on OpenSeesPy, it facilitates performance-based earthquake engineering, risk assessment, and fragility analysis of structural archetypes.",AI4;CivilEng,simulation;risk_assessment;structural_analysis,platform,Python,https://github.com/vfceball/RC-FIAP,,MIT,seismic-analysis;civil-engineering;opensees;simulation
632,PyUMLS_Similarity,Similarity metrics for UMLS concepts,PyUMLS_Similarity is a package that computes various similarity metrics between concepts in the Unified Medical Language System (UMLS). It serves as an interface to UMLS and supports biomedical informatics research.,AI4;Bio,similarity_calculation;metrics;biomedical_informatics,library,Perl,https://github.com/victormurcia/PyUMLS_Similarity,,MIT,umls;similarity-metrics;biomedical;perl
633,marginaleffects,"R package for model predictions, comparisons, and hypothesis tests","marginaleffects is an R package to compute and plot predictions, slopes, marginal means, and comparisons for over 100 classes of statistical and ML models. It supports linear and non-linear hypothesis tests and uncertainty estimation.",AI4;AI4-02,statistical_analysis;hypothesis_testing;inference,library,R,https://github.com/vincentarelbundock/marginaleffects,https://vincentarelbundock.github.io/marginaleffects/,NOASSERTION,statistics;r-package;hypothesis-testing;marginal-effects
634,MagnetLoss-PyTorch,PyTorch implementation of Magnet Loss for deep metric learning,"A PyTorch implementation of Magnet Loss, a deep metric learning technique. This repository provides a reusable component for training models with advanced metric learning objectives.",AI4;AI4-02,metric_learning;loss_function,library,Python,https://github.com/vithursant/MagnetLoss-PyTorch,,MIT,pytorch;metric-learning;loss-function;deep-learning
635,Hemm,Holistic evaluation library for multi-modal generative models,Hemm is a library for the holistic evaluation of multi-modal generative models. It integrates with Weave to provide comprehensive metrics and tracking for generative AI research.,AI4;AI4-02,evaluation;metrics;multimodal_ai,library,Python,https://github.com/wandb/Hemm,,Apache-2.0,evaluation;generative-ai;multimodal;metrics
636,pretty-print-confusion-matrix,Utility for plotting confusion matrices in Python,"A Python utility to plot aesthetically pleasing confusion matrices using seaborn and matplotlib, similar to Matlab's style. It aids in the visualization of classification model performance metrics.",AI4;AI4-02,visualization;metrics_visualization,library,Python,https://github.com/wcipriano/pretty-print-confusion-matrix,,Apache-2.0,confusion-matrix;visualization;python;matplotlib
637,statannot,Statistical annotations for seaborn boxplots,Statannot is a Python package that adds statistical significance annotations (p-values) to existing boxplots generated by seaborn. It helps in visualizing the results of statistical tests directly on data plots.,AI4;AI4-02,visualization;statistical_test,library,Jupyter Notebook,https://github.com/webermarcolivier/statannot,,MIT,statistics;visualization;seaborn;p-value
638,LangKit,Open-source toolkit for monitoring and evaluating Large Language Models (LLMs),"A comprehensive toolkit designed for monitoring LLMs by extracting signals from prompts and responses. It provides metrics for text quality, relevance, sentiment analysis, and safety, ensuring the security and reliability of LLM applications.",AI4;AI4-02,monitoring;text_quality_metrics;sentiment_analysis,library,Jupyter Notebook,https://github.com/whylabs/langkit,,Apache-2.0,llm;observability;nlp;metrics
639,neleval,Evaluation and error analysis tool for Named Entity Linking (NEL) systems,A tool designed to evaluate entity disambiguation and named entity linking systems. It facilitates error analysis and provides standard metrics to assess the performance of NEL models.,AI4;AI4-02,entity_linking;evaluation;error_analysis,library,Python,https://github.com/wikilinks/neleval,,Apache-2.0,nel;nlp;evaluation;disambiguation
640,wmt-format-tools,Tools for formatting WMT hypothesis and test sets,A collection of utilities for processing and formatting data for the Workshop on Machine Translation (WMT). It handles XML conversion and standardization of hypothesis and test sets for translation benchmarks.,AI4;AI4-01,data_formatting;benchmark_preparation,workflow,Hare,https://github.com/wmt-conference/wmt-format-tools,,Apache-2.0,wmt;machine-translation;xml;formatting
641,bm25s,Fast Python implementation of BM25 algorithm for lexical search,"A high-performance implementation of the BM25 ranking function using Numpy, Numba, and Scipy. It is designed for fast lexical search and information retrieval tasks in Python.",AI4;AI4-02,information_retrieval;ranking;search,library,Python,https://github.com/xhluca/bm25s,,MIT,bm25;search;ranking;numba
642,AB3DMOT,3D Multi-Object Tracking baseline and evaluation metrics,An official implementation providing a baseline for 3D Multi-Object Tracking (MOT) along with new evaluation metrics. It serves as a standard benchmark tool for autonomous driving perception tasks.,AI4;AI4-02,object_tracking;benchmark;evaluation,solver,Python,https://github.com/xinshuoweng/AB3DMOT,,NOASSERTION,3d-tracking;autonomous-driving;metrics;benchmark
643,MLmetrics,Collection of Machine Learning evaluation metrics for R,"An R package that provides a comprehensive set of standard evaluation metrics for machine learning tasks, including classification and regression performance indicators.",AI4;AI4-02,model_evaluation;metrics,library,R,https://github.com/yanyachen/MLmetrics,,GPL-2.0,r;machine-learning;evaluation;metrics
644,summary-reward-no-reference,Reference-free metric for measuring text summary quality,"A Python implementation of a reference-free metric for evaluating the quality of text summaries. The metric is learned from human ratings, allowing for quality assessment without ground truth references.",AI4;AI4-02,text_summarization;evaluation_metric,library,Python,https://github.com/yg211/summary-reward-no-reference,,Apache-2.0,nlp;summarization;metrics;reference-free
645,AlignScore,Metric for factual consistency evaluation in text generation,"An implementation of AlignScore, a metric designed to evaluate the factual consistency of generated text against source information, addressing hallucination issues in NLP models.",AI4;AI4-02,factual_consistency;evaluation_metric;hallucination_detection,library,Python,https://github.com/yuh-zha/AlignScore,,MIT,nlp;consistency;metrics;hallucination
646,ashpy,TensorFlow 2.0 library for distributed training and evaluation,"A library built on TensorFlow 2.0 that facilitates distributed training, evaluation, model selection, and fast prototyping of deep learning models.",AI4;AI4-02,model_training;evaluation;model_selection,library,Python,https://github.com/zurutech/ashpy,,Apache-2.0,tensorflow;training;evaluation;deep-learning
647,GraphRAG Agent Framework,"Integrated framework for GraphRAG construction, search, and custom evaluation","A comprehensive framework integrating GraphRAG, LightRAG, and Neo4j for knowledge graph construction and search, featuring a custom evaluation framework for assessing GraphRAG performance.",AI4;AI4-03,evaluation;rag_framework,framework,Python,https://github.com/1517005260/graph-rag-agent,,MIT,rag;graph-rag;evaluation-framework
648,lm-evaluation,Evaluation suite for large-scale language models,"A suite of tools and metrics for evaluating the performance of large-scale language models, developed by AI21 Labs.",AI4;AI4-03,model_evaluation;nlp_metrics,library,Python,https://github.com/AI21Labs/lm-evaluation,,Apache-2.0,llm;evaluation;nlp
649,AutoQuant,"Automation framework for ML, forecasting, and model evaluation","An R framework for automating machine learning tasks, time series forecasting, model evaluation, and interpretation.",AI4;AI4-03,automl;forecasting;model_evaluation,framework,R,https://github.com/AdrianAntico/AutoQuant,,AGPL-3.0,automl;forecasting;evaluation
650,Agenta,Open-source LLMOps platform for prompt management and evaluation,"A platform for LLM operations that includes features for prompt playground, management, LLM evaluation, and observability.",AI4;AI4-03,llmops;model_evaluation;prompt_engineering,platform,Python,https://github.com/Agenta-AI/agenta,https://agenta.ai,NOASSERTION,llmops;evaluation;observability
651,Bjontegaard Metric,Calculation tool for Bjontegaard metric (BD-PSNR and BD-rate),"A Python implementation for calculating the Bjontegaard metric, including BD-PSNR and BD-rate, commonly used for evaluating video compression performance.",AI4;AI4-03,metric_calculation;video_compression_eval,library,Python,https://github.com/Anserw/Bjontegaard_metric,,None,video-coding;metrics;bd-rate
652,cell-eval,Evaluation suite for perturbation prediction models,"A comprehensive suite for evaluating models designed to predict cellular perturbations, developed by Arc Institute.",AI4;AI4-03,bioinformatics_eval;perturbation_prediction,library,Python,https://github.com/ArcInstitute/cell-eval,,MIT,biology;perturbation;evaluation
653,BigDataBench MicroBenchmark,Micro-benchmark suite for Big Data systems,A micro-benchmark suite from BigDataBench V5.0 for evaluating the performance of big data systems and components.,AI4;AI4-03,benchmarking;system_evaluation,solver,Java,https://github.com/BenchCouncil/BigDataBench_V5.0_BigData_MicroBenchmark,http://www.benchcouncil.org/,Apache-2.0,big-data;benchmark;microbenchmark
654,Ethereum Economic Model,Dynamical-systems model of Ethereum validator economics,A modular dynamical-systems model for simulating and analyzing the economics of Ethereum validators.,AI4;AI4-03,economic_simulation;system_modeling,solver,Jupyter Notebook,https://github.com/CADLabs/ethereum-economic-model,,GPL-3.0,ethereum;economics;simulation
655,Gadget,Benchmark harness for streaming state stores,A benchmark harness designed for the systematic and robust evaluation of streaming state stores in data systems.,AI4;AI4-03,benchmarking;streaming_systems,solver,C++,https://github.com/CASP-Systems-BU/Gadget,,Apache-2.0,streaming;benchmark;state-store
656,CS-Eval,Evaluation suite for cybersecurity models,A comprehensive evaluation suite for assessing the cybersecurity capabilities of fundamental models or large language models.,AI4;AI4-03,model_evaluation;cybersecurity_eval,framework,,https://github.com/CS-EVAL/CS-Eval,,MIT,cybersecurity;llm;evaluation
657,Matcha (VariationAnalysis),Framework for training and evaluating genomic variation models,"The Matcha framework, part of the VariationAnalysis project, used to train and evaluate deep learning models for calling genomic variations.",AI4;AI4-03,genomics_eval;model_training,framework,Java,https://github.com/CampagneLaboratory/variationanalysis,,NOASSERTION,genomics;deep-learning;variation-calling
658,SURE,Library for assessing synthetic tabular data utility and privacy,An open-source Python library for evaluating the utility and privacy performance of tabular synthetic datasets.,AI4;AI4-03,data_evaluation;synthetic_data,library,Python,https://github.com/Clearbox-AI/SURE,,Apache-2.0,synthetic-data;evaluation;privacy
659,AI Agents Reality Check,Mathematical benchmark for AI agent performance,A benchmark suite that exposes the performance gap between real agents and LLM wrappers through rigorous multi-dimensional evaluation and statistical validation.,AI4;AI4-03,agent_evaluation;benchmarking,solver,Python,https://github.com/Cre4T3Tiv3/ai-agents-reality-check,,Apache-2.0,ai-agents;benchmark;evaluation
660,DMind Benchmark,Benchmark for LLMs on blockchain and Web3 knowledge,"A comprehensive framework for evaluating large language models on their knowledge of blockchain, cryptocurrency, and Web3 domains.",AI4;AI4-03,domain_evaluation;llm_benchmark,framework,Python,https://github.com/DMindAI/DMind-Benchmark,,None,blockchain;llm;benchmark
661,Benchmarking Big Streams Systems,Benchmark suite for big streaming systems,An extension of Yahoo!'s benchmarking suite designed for evaluating the performance of big streaming data systems.,AI4;AI4-03,benchmarking;streaming_systems,solver,Java,https://github.com/DataSystemsGroupUT/Benchmarking-Big-Streams-Systems,,Apache-2.0,streaming;benchmark;big-data
662,DreamLayer,Benchmarking and evaluation automation tool for diffusion models,"A tool designed to benchmark diffusion models faster by automating evaluations, seed management, and metric calculation to ensure reproducible results.",AI4;AI4-03,model_evaluation;benchmarking;reproducibility,solver,Python,https://github.com/DreamLayer-AI/DreamLayer,,GPL-3.0,diffusion-models;benchmarking;evaluation-harness
663,E3SM,Energy Exascale Earth System Model,The Energy Exascale Earth System Model (E3SM) is a state-of-the-art earth system modeling project designed to simulate the earth's climate system at high resolution.,AI4;Earth Science,climate_modeling;simulation,solver,Fortran,https://github.com/E3SM-Project/E3SM,https://e3sm.org/,NOASSERTION,earth-system-model;climate-simulation;exascale
664,lm-evaluation-harness,Few-shot evaluation framework for language models,"A framework for few-shot evaluation of language models, providing a unified interface to benchmark models on a wide variety of tasks.",AI4;AI4-03,model_evaluation;benchmarking,library,Python,https://github.com/EleutherAI/lm-evaluation-harness,,MIT,llm;evaluation;few-shot;nlp
665,fdsvismap,Visibility verification tool for fire safety assessment,"A tool for waypoint-based verification of visibility within the scope of performance-based fire safety assessment, likely interfacing with Fire Dynamics Simulator (FDS) data.",AI4;Physics,safety_assessment;simulation_analysis,solver,Python,https://github.com/FireDynamics/fdsvismap,,MIT,fire-dynamics;safety-engineering;visibility-analysis
666,llm-benchmarker-suite,Leaderboard and benchmarking suite for LLM evaluations,"A suite designed for benchmarking Large Language Models, providing tools to run evaluations and generate leaderboard rankings.",AI4;AI4-03,model_evaluation;benchmarking,solver,Python,https://github.com/FormulaMonks/llm-benchmarker-suite,,MIT,llm;leaderboard;benchmarking
667,LLMZoo,"Data, models, and evaluation benchmarks for LLMs","A project providing a collection of data, models, and evaluation benchmarks specifically for Large Language Models, facilitating comparative analysis.",AI4;AI4-03,model_evaluation;dataset_management,dataset,Python,https://github.com/FreedomIntelligence/LLMZoo,,Apache-2.0,llm;benchmark;model-zoo
668,gee_landcover_metrics,Land cover metrics calculation for Google Earth Engine,"A tool for calculating landscape metrics on land cover data within the Google Earth Engine platform, supporting spatial analysis in earth sciences.",AI4;Earth Science,spatial_analysis;metrics_calculation,library,JavaScript,https://github.com/Helmholtz-UFZ/gee_landcover_metrics,,MIT,google-earth-engine;land-cover;landscape-metrics
669,UHGEval,Evaluation framework for hallucination in LLMs,"A user-friendly evaluation framework and benchmark suite (including HaluEval, HalluQA) designed to assess hallucination generation in Large Language Models.",AI4;AI4-03,hallucination_detection;model_evaluation,solver,Python,https://github.com/IAAR-Shanghai/UHGEval,,Apache-2.0,hallucination;llm-evaluation;benchmark
670,GraFiTe,Platform for tracking domain-specific model issues,A platform to track and manage domain-specific model issues for continuous evaluation of Large Language Models.,AI4;AI4-03,issue_tracking;continuous_evaluation,platform,TypeScript,https://github.com/IBM/grafite,,Apache-2.0,llm-evaluation;model-governance;issue-tracking
671,FakeFinder,Framework for evaluating deepfake detection models,"A modular framework for evaluating various deepfake detection models, providing tools to assess model performance against manipulated media.",AI4;AI4-03,deepfake_detection;model_evaluation,solver,Python,https://github.com/IQTLabs/FakeFinder,,Apache-2.0,deepfake;evaluation-framework;media-forensics
672,CGM_Performance_Assessment,Statistical performance assessment for CGM systems,"A collection of software packages for the statistical performance assessment of Continuous Glucose Monitoring (CGM) systems, used in medical data analysis.",AI4;Life Science,statistical_analysis;performance_assessment,library,Python,https://github.com/IfDTUlm/CGM_Performance_Assessment,,MIT,cgm;diabetes-technology;statistical-analysis
673,Deepmark,Testing environment for LLM assessment,A testing environment enabling the assessment of language models (LLMs) on task-specific metrics and custom data for predictable performance.,AI4;AI4-03,model_evaluation;performance_testing,platform,PHP,https://github.com/IngestAI/deepmark,,AGPL-3.0,llm-testing;metrics;evaluation
674,Factorio Learning Environment,Environment for evaluating LLMs in Factorio,"A non-saturating, open-ended environment designed for evaluating Large Language Models and Reinforcement Learning agents within the Factorio game simulation.",AI4;AI4-03,rl_environment;agent_evaluation,solver,Python,https://github.com/JackHopkins/factorio-learning-environment,,NOASSERTION,reinforcement-learning;factorio;benchmark-environment
675,ModelMetrics,R package for rapid calculation of model metrics,An R library designed to facilitate the rapid calculation of various statistical model performance metrics.,AI4;Statistics,statistical_analysis;metrics_calculation,library,R,https://github.com/JackStat/ModelMetrics,,None,r-package;statistics;model-evaluation
676,DetectionMetrics,Evaluation tool for perception models,A tool designed to unify and streamline the evaluation of perception (object detection) models across different frameworks and datasets.,AI4;Computer Vision,object_detection;model_evaluation,solver,Python,https://github.com/JdeRobot/DetectionMetrics,,GPL-3.0,computer-vision;object-detection;metrics
677,MixEval,Evaluation suite for MixEval benchmark,"The official evaluation suite and dynamic data release for the MixEval benchmark, designed for assessing language model performance.",AI4;AI4-03,model_evaluation;benchmarking,solver,Python,https://github.com/JinjieNi/MixEval,,None,llm;benchmark;evaluation-suite
678,LLM-Writing-Assessment-Psychometric-Framework,Psychometric framework for evaluating LLMs as raters,"A repository and framework for evaluating large language models when used as raters in large-scale writing assessments, focusing on reliability and validity from a psychometric perspective.",AI4;Social Science,psychometrics;model_evaluation;reliability_analysis,solver,Python,https://github.com/John-Wang-0809/LLM-Writing-Assessment-Psychometric-Framework,,MIT,psychometrics;llm-evaluation;automated-scoring
679,multihop-edit-eval,Fine-grained evaluation framework for multi-hop knowledge editing in LLMs,A specialized evaluation framework designed to assess the performance of Large Language Models in multi-hop knowledge editing tasks. It provides metrics and datasets to measure how well models can update their knowledge base across connected facts.,AI4;AI4-03,model_evaluation;knowledge_editing_assessment,solver,Python,https://github.com/KUNLP/multihop-edit-eval,,None,llm-evaluation;knowledge-editing;multi-hop-reasoning
680,q-evaluation-harness,Evaluation framework for LLMs on Q/kdb+ code generation tasks,An open-source framework developed by KX Systems to evaluate the performance of Large Language Models specifically on generating Q/kdb+ code. It serves as a domain-specific benchmark harness for financial time-series database languages.,AI4;AI4-03,code_generation_evaluation;llm_benchmark,solver,Python,https://github.com/KxSystems/q-evaluation-harness,,MIT,q;kdb+;llm-evaluation;code-generation
681,aac-metrics,Metrics library for evaluating Automated Audio Captioning systems,A Python library designed for PyTorch that implements various metrics for evaluating Automated Audio Captioning (AAC) systems. It provides a standardized way to measure the quality of generated audio captions against reference annotations.,AI4;AI4-03,audio_captioning_evaluation;metrics_calculation,library,Python,https://github.com/Labbeti/aac-metrics,,MIT,audio-captioning;evaluation-metrics;pytorch
682,eurybia,Model drift monitoring and data validation library,A Python library designed to monitor machine learning model drift over time and secure model deployment through rigorous data validation. It helps in maintaining the reliability of AI systems in production environments.,AI4;AI4-03,model_monitoring;drift_detection;data_validation,library,Jupyter Notebook,https://github.com/MAIF/eurybia,https://eurybia.readthedocs.io/,Apache-2.0,model-drift;data-validation;mlops
683,VideoEval,Benchmark suite for evaluation of Video Foundation Models,A comprehensive benchmark suite designed for the low-cost and efficient evaluation of Video Foundation Models. It provides a set of tasks and metrics to assess the capabilities of video understanding and generation models.,AI4;AI4-03,video_model_evaluation;benchmark_suite,solver,Python,https://github.com/MCG-NJU/VideoEval,,None,video-understanding;foundation-models;benchmark
684,MHKiT-MATLAB,Marine and Hydrokinetic Toolkit (MATLAB),"A MATLAB toolkit providing standardized data processing, visualization, quality control, and resource assessment tools for the marine renewable energy community. It supports wave, tidal, and river energy research.",AI4;AI4-03,data_processing;resource_assessment;quality_control,library,MATLAB,https://github.com/MHKiT-Software/MHKiT-MATLAB,https://mhkit-software.github.io/MHKiT/,BSD-3-Clause,marine-energy;hydrokinetic;data-analysis
685,MHKiT-Python,Marine and Hydrokinetic Toolkit (Python),"A Python toolkit providing standardized data processing, visualization, quality control, and resource assessment tools for the marine renewable energy community. It serves as the Python counterpart to MHKiT-MATLAB.",AI4;AI4-03,data_processing;resource_assessment;quality_control,library,Python,https://github.com/MHKiT-Software/MHKiT-Python,https://mhkit-software.github.io/MHKiT/,BSD-3-Clause,marine-energy;hydrokinetic;data-analysis
686,AutoRAG,AutoML-style framework for RAG evaluation and optimization,An open-source framework designed to evaluate and optimize Retrieval-Augmented Generation (RAG) pipelines. It applies AutoML principles to automatically find the best RAG configuration for a given dataset and use case.,AI4;AI4-03,rag_evaluation;pipeline_optimization;automl,framework,Python,https://github.com/Marker-Inc-Korea/AutoRAG,https://docs.autorag.io/,Apache-2.0,rag;evaluation;automl;optimization
687,ContainerInception (Gerber),Generalized Easy Reproducible Bioinformatics Environment wRapper,A tool developed during NCBI Hackathons to facilitate reproducible bioinformatics research by wrapping environments in containers. It aims to simplify the creation and sharing of reproducible scientific workflows.,AI4;AI4-03,reproducibility;workflow_management;containerization,workflow,Python,https://github.com/NCBI-Hackathons/ContainerInception,,MIT,bioinformatics;reproducibility;docker
688,OpenOA,Framework for assessing wind plant performance,An open-source framework developed by NREL for assessing wind plant performance using operational assessment (OA) methodologies. It provides data structures and analysis methods for processing time-series data from wind plants.,AI4;AI4-03,performance_assessment;data_analysis;wind_energy,framework,Jupyter Notebook,https://github.com/NREL/OpenOA,https://openoa.readthedocs.io/,BSD-3-Clause,wind-energy;operational-assessment;nrel
689,compute-eval,Evaluation framework for LLM-based CUDA code generation,A framework by NVIDIA designed to generate and evaluate CUDA code produced by Large Language Models. It provides tools to assess the correctness and performance of AI-generated GPU kernels.,AI4;AI4-03,code_generation_evaluation;cuda_benchmarking,solver,Python,https://github.com/NVIDIA/compute-eval,,NOASSERTION,cuda;llm;code-generation;evaluation
690,atropos,LLM Reinforcement Learning Environments framework,A framework for collecting and evaluating Large Language Model (LLM) trajectories through diverse environments. It serves as a testbed for Reinforcement Learning with LLMs.,AI4;AI4-03,rlhf_evaluation;trajectory_collection;environment_simulation,framework,Python,https://github.com/NousResearch/atropos,,MIT,llm;reinforcement-learning;evaluation-environment
691,gptables,Tool for writing consistently formatted statistical tables,"A Python wrapper around XlsxWriter developed by the Office for National Statistics (ONS) to produce consistently formatted statistical tables in Excel, ensuring data reporting standards.",AI4;AI4-03,data_reporting;statistical_formatting,library,Python,https://github.com/ONSdigital/gptables,https://gptables.readthedocs.io/,NOASSERTION,statistics;reporting;excel;ons
