id,name,one_line_profile,detailed_description,domains,subtask_category,application_level,primary_language,repo_url,help_website,license,tags
316,torchdistill,Reproducible deep learning framework for knowledge distillation,"torchdistill is a coding-free framework built on PyTorch designed to facilitate reproducible deep learning studies, specifically focusing on knowledge distillation. It offers implementations of numerous state-of-the-art distillation methods and provides configurations to ensure consistent benchmarking and experimental reproduction.",AI4;AI4-01,model_optimization;reproducibility,library,Python,https://github.com/yoshitomo-matsubara/torchdistill,https://torchdistill.readthedocs.io/,MIT,knowledge-distillation;pytorch;reproducibility;deep-learning
317,EasyLM,"One-stop solution for pre-training, finetuning, and serving LLMs using JAX/Flax","EasyLM is a comprehensive library for Large Language Models (LLMs) built on JAX and Flax. It simplifies the process of pre-training, fine-tuning, evaluating, and serving LLMs, providing a scalable and efficient toolchain for AI model development.",AI4;AI4-01,model_training;inference,library,Python,https://github.com/young-geng/EasyLM,,Apache-2.0,llm;jax;flax;model-serving
318,MT-Consistency,Benchmark for evaluating acquiescence bias and consistency in LLMs,MT-Consistency is a research framework and benchmark designed to investigate and mitigate acquiescence bias in Large Language Models during sequential QA interactions. It includes datasets and evaluation scripts to assess the robustness and conversational consistency of AI models.,AI4;AI4-01,model_evaluation;bias_analysis,library,Python,https://github.com/yubol-bobo/MT-Consistency,,MIT,llm;bias;consistency;benchmark
319,fret,Framework for Reproducible ExperimenTs in scientific computing,"fret is a lightweight framework designed to simplify the management and reproduction of scientific experiments. It provides tools to configure, run, and track experiments, ensuring that research results are reproducible and manageable.",AI4;AI4-01,experiment_management;reproducibility,workflow,Python,https://github.com/yxonic/fret,https://fret.readthedocs.io/,MIT,reproducibility;experiment-tracking;workflow
320,MedSegBench,Standardized benchmark collection for medical image segmentation,MedSegBench is a comprehensive benchmarking library that provides access to standardized medical segmentation datasets across various modalities. It facilitates the evaluation and comparison of medical image segmentation models by offering a unified interface for data loading and processing.,AI4;AI4-01,image_segmentation;benchmarking,library,Python,https://github.com/zekikus/MedSegBench,,Apache-2.0,medical-imaging;segmentation;benchmark;datasets
321,dabestr,Data analysis tool using bootstrap estimation for robust statistical inference,"A package for Data Analysis with Bootstrap-coupled ESTimation (DABEST). It provides a user-friendly interface to calculate and visualize effect sizes and their confidence intervals using bootstrap methods, moving away from traditional significance testing.",AI4;AI4-02,statistical_analysis;estimation;visualization,library,R,https://github.com/ACCLAB/dabestr,,Apache-2.0,statistics;bootstrap;estimation-plots;r-package
322,continual_rl,Baselines and metrics library for continual reinforcement learning,"A repository containing baselines, experiment specifications, and common metrics for continual reinforcement learning. It is designed to be easily extensible for new methods and facilitates reproducible research in continual RL.",AI4;AI4-02,reinforcement_learning;benchmarking;metrics,library,Python,https://github.com/AGI-Labs/continual_rl,,MIT,reinforcement-learning;continual-learning;benchmarks;metrics
323,MTT,Bayesian multi-target tracking algorithms and evaluation metrics,"Implementation of several Bayesian multi-target tracking algorithms, including Poisson multi-Bernoulli mixture filters. It specifically includes implementations of GOSPA and T-GOSPA metrics for evaluating tracking performance.",AI4;AI4-02,object_tracking;evaluation_metrics;bayesian_filtering,library,MATLAB,https://github.com/Agarciafernandez/MTT,,BSD-2-Clause,multi-target-tracking;bayesian-methods;gospa;metrics
324,eval4imagecaption,Evaluation metrics toolkit for image captioning tasks,"A collection of evaluation tools for image captioning, implementing standard metrics including BLEU, ROUGE-L, CIDEr, METEOR, and SPICE scores to assess the quality of generated captions.",AI4;AI4-02,image_captioning;evaluation_metrics;nlp_metrics,library,Python,https://github.com/Aldenhovel/bleu-rouge-meteor-cider-spice-eval4imagecaption,,MIT,image-captioning;bleu;rouge;cider;meteor
325,GuardBench,Evaluation library for guardrail models in AI safety,"A Python library designed for the evaluation of guardrail models, facilitating the assessment of safety and compliance mechanisms in AI systems.",AI4;AI4-02,model_evaluation;ai_safety;benchmarking,library,Python,https://github.com/AmenRa/GuardBench,,EUPL-1.2,guardrails;evaluation;ai-safety;benchmarking
326,ttest,JavaScript library for performing Student's t hypothesis tests,"A lightweight JavaScript library to perform the Student's t hypothesis test, enabling statistical analysis directly within JavaScript environments.",AI4;AI4-02,statistical_testing;hypothesis_testing,library,JavaScript,https://github.com/AndreasMadsen/ttest,,MIT,statistics;t-test;hypothesis-testing;javascript
327,rexmex,General purpose recommender systems metrics library,"A general-purpose library for evaluating recommender systems, providing a comprehensive set of metrics to ensure fair and standardized evaluation of recommendation algorithms.",AI4;AI4-02,recommender_systems;evaluation_metrics,library,Python,https://github.com/AstraZeneca/rexmex,,None,recommender-systems;metrics;evaluation;data-science
328,SORDI-AI-Evaluation-GUI,GUI tool for evaluating computer vision models on SORDI datasets,"A graphical user interface tool developed by BMW Innovation Lab to evaluate trained computer vision models, specifically designed to work with the SORDI dataset ecosystem, providing general information and evaluation metrics.",AI4;AI4-02,model_evaluation;computer_vision;metrics_visualization,solver,Python,https://github.com/BMW-InnovationLab/SORDI-AI-Evaluation-GUI,,Apache-2.0,computer-vision;evaluation;gui;sordi
329,scikit-llm,Integration of Large Language Models into scikit-learn framework,"A library that seamlessly integrates Large Language Models (LLMs) into the scikit-learn framework, allowing users to utilize LLMs for text analysis tasks (like classification and embedding) using the familiar sklearn API.",AI4,text_analysis;modeling;nlp,library,Python,https://github.com/BeastByteAI/scikit-llm,,MIT,scikit-learn;llm;nlp;text-classification
330,madmom,Python audio and music signal processing library,"A comprehensive Python library for audio and music signal processing. It includes tools for feature extraction, beat tracking, onset detection, and other music information retrieval (MIR) tasks.",AI4,signal_processing;audio_analysis;feature_extraction,library,Python,https://github.com/CPJKU/madmom,,NOASSERTION,audio-processing;music-information-retrieval;signal-processing;mir
331,mAP,Evaluation code for object detection neural networks,A widely used tool to calculate the mean Average Precision (mAP) for object detection models. It provides a standardized way to evaluate the performance of neural networks on detection tasks.,AI4;AI4-02,object_detection;evaluation_metrics;performance_analysis,solver,Python,https://github.com/Cartucho/mAP,,Apache-2.0,computer-vision;object-detection;map;metrics
332,pymar,Markov Switching Models extension for Statsmodels,"A Python library that implements Markov Switching Models, designed to work with and extend the capabilities of the Statsmodels library for time series analysis.",AI4;AI4-02,time_series_analysis;statistical_modeling;markov_models,library,Python,https://github.com/ChadFulton/pymar,,None,statsmodels;time-series;markov-switching;statistics
333,metric-learning-divide-and-conquer,Implementation of Divide and Conquer the Embedding Space for Metric Learning,"A PyTorch implementation of the 'Divide and Conquer the Embedding Space for Metric Learning' (CVPR 2019) approach, providing a solver for deep metric learning tasks by partitioning the embedding space.",AI4;AI4-01,metric_learning;embedding_learning,solver,Python,https://github.com/CompVis/metric-learning-divide-and-conquer,,LGPL-3.0,metric-learning;computer-vision;embedding
334,Deep-Metric-Learning-Baselines,PyTorch implementation for Deep Metric Learning pipelines and baselines,"A comprehensive library providing implementations of various deep metric learning algorithms and baselines in PyTorch, facilitating benchmarking and reproduction of metric learning experiments.",AI4;AI4-01,metric_learning;benchmarking,library,Python,https://github.com/Confusezius/Deep-Metric-Learning-Baselines,,Apache-2.0,deep-metric-learning;pytorch;benchmark
335,Revisiting_Deep_Metric_Learning_PyTorch,Code for benchmarking training strategies in Deep Metric Learning,"The official repository for the ICML 2020 paper 'Revisiting Training Strategies and Generalization Performance in Deep Metric Learning', providing a framework for consistent research and evaluation in deep metric learning.",AI4;AI4-01,metric_learning;evaluation,solver,Python,https://github.com/Confusezius/Revisiting_Deep_Metric_Learning_PyTorch,https://arxiv.org/abs/2002.08473,MIT,metric-learning;generalization;icml-2020
336,Avalanche,End-to-End Library for Continual Learning based on PyTorch,"A comprehensive library for Continual Learning (CL) research, providing benchmarks, metrics, and evaluation protocols to assess the performance of CL algorithms.",AI4;AI4-02,continual_learning;evaluation_metrics,library,Python,https://github.com/ContinualAI/avalanche,https://avalanche.continualai.org,MIT,continual-learning;pytorch;benchmarks
337,Yellowbrick,Visual analysis and diagnostic tools for machine learning model selection,"A suite of visual analysis and diagnostic tools designed to facilitate machine learning model selection, enabling data scientists to steer the model selection process.",AI4;AI4-02,model_visualization;model_selection;diagnostics,library,Python,https://github.com/DistrictDataLabs/yellowbrick,https://www.scikit-yb.org,Apache-2.0,visualization;machine-learning;model-selection
338,ESMValTool,Community diagnostic and performance metrics tool for Earth system models,"A community diagnostic and performance metrics tool for routine evaluation of Earth system models in CMIP, facilitating the analysis of climate data and model performance.",AI4;AI4-02,climate_model_evaluation;diagnostics;earth_system_modeling,platform,NCL,https://github.com/ESMValGroup/ESMValTool,https://esmvaltool.org,Apache-2.0,climate-science;cmip;model-evaluation
339,BlonDe,Automatic Evaluation Metric for Document-level Machine Translation,"Official implementation of BlonDe, an automatic evaluation metric designed for document-level machine translation, focusing on discourse-related phenomena.",AI4;AI4-02,machine_translation_evaluation;nlp_metrics,library,Python,https://github.com/EleanorJiang/BlonDe,,MIT,nlp;metrics;machine-translation
340,TPOT,Automated Machine Learning tool using genetic programming,"A Python Automated Machine Learning (AutoML) tool that optimizes machine learning pipelines using genetic programming to automate the process of feature selection, model selection, and parameter tuning.",AI4;AI4-01,automl;pipeline_optimization,solver,Python,https://github.com/EpistasisLab/tpot,http://epistasislab.github.io/tpot/,LGPL-3.0,automl;genetic-programming;machine-learning
341,LanguageGuidance_for_DML,Integrating Language Guidance into Vision-based Deep Metric Learning,"Implementation of a method for integrating language guidance into vision-based deep metric learning, as presented in CVPR 2022.",AI4;AI4-01,metric_learning;multimodal_learning,solver,Python,https://github.com/ExplainableML/LanguageGuidance_for_DML,,Apache-2.0,deep-metric-learning;vision-language;cvpr-2022
342,Dolmen,"Library to parse, typecheck, and evaluate automated deduction languages","A library and binary tool to parse, typecheck, and evaluate various languages used in automated deduction and formal verification.",AI4;AI4-01,automated_deduction;parsing;formal_methods,library,OCaml,https://github.com/Gbury/dolmen,,BSD-2-Clause,automated-deduction;parsing;logic
343,PixTrack,Object Tracking using NeRF templates and feature-metric alignment,A Computer Vision method for Object Tracking which uses NeRF templates and feature-metric alignment to robustly track the 6DoF pose of a known object.,AI4;AI4-01,object_tracking;nerf;pose_estimation,solver,Jupyter Notebook,https://github.com/GiantAI/pixtrack,,NOASSERTION,computer-vision;nerf;tracking
344,TextDescriptives,Library for calculating a large variety of metrics from text,"A Python library for calculating a wide range of text metrics, including readability, complexity, and other linguistic features, useful for NLP analysis.",AI4;AI4-02,text_metrics;nlp_analysis;readability,library,Python,https://github.com/HLasse/TextDescriptives,,Apache-2.0,nlp;metrics;text-analysis
345,MM-SHAP,Metric for Measuring Multimodal Contributions in Vision and Language Models,"Official implementation of MM-SHAP, a performance-agnostic metric for measuring multimodal contributions in vision and language models and tasks.",AI4;AI4-02,model_interpretability;multimodal_metrics,library,Python,https://github.com/Heidelberg-NLP/MM-SHAP,,MIT,shap;multimodal;interpretability
346,Few-shot-via-ensembling-Transformer-with-Mahalanobis-distance,Few-Shot Bearing Fault Diagnosis via Ensembling Transformer and Mahalanobis Distance,Implementation of a few-shot bearing fault diagnosis method using an ensembling Transformer-based model with Mahalanobis distance metric learning.,AI4;AI4-01,fault_diagnosis;metric_learning;few_shot_learning,solver,Python,https://github.com/HungVu307/Few-shot-via-ensembling-Transformer-with-Mahalanobis-distance,,None,fault-diagnosis;transformer;metric-learning
347,MUTIS,Analysis of correlations of light curves and their statistical significance,A Python package developed by IAA-CSIC for the analysis of correlations of light curves and their statistical significance in astrophysical data.,AI4;AI4-02,time_series_analysis;correlation_analysis;astrophysics,library,Python,https://github.com/IAA-CSIC/MUTIS,,BSD-3-Clause,astronomy;statistics;light-curves
348,transition-amr-parser,AMR parsing with word-node alignments and Smatch metrics,"State-of-the-Art Abstract Meaning Representation (AMR) parsing tool with word-node alignments, including tools for statistical significance testing using Smatch.",AI4;AI4-02,amr_parsing;nlp_evaluation;smatch_metric,solver,Python,https://github.com/IBM/transition-amr-parser,,Apache-2.0,nlp;amr;parsing
349,ImagePy,Image processing framework based on plugins,"An image processing framework based on a plugin architecture (similar to ImageJ), designed to easily integrate with Scipy, Scikit-image, OpenCV, and other Numpy-based libraries for scientific image analysis.",AI4;AI4-01,image_processing;scientific_imaging,platform,Python,https://github.com/Image-Py/imagepy,,BSD-4-Clause,image-processing;microscopy;scientific-imaging
350,TrackEval,Evaluation metrics library for Multi-Object Tracking (MOT),"A Python library providing implementations of various evaluation metrics for Multi-Object Tracking (MOT), including HOTA, CLEAR, and Identity metrics.",AI4;AI4-02,model_evaluation;metrics_calculation,library,Python,https://github.com/JonathonLuiten/TrackEval,,MIT,mot;evaluation-metrics;computer-vision
351,Distances.jl,Julia package for evaluating distances and metrics between vectors,"A Julia package that provides a collection of distance metrics and divergence measures for evaluating the similarity or dissimilarity between vectors, essential for statistical analysis and machine learning.",AI4;AI4-02,metrics_calculation;statistical_analysis,library,Julia,https://github.com/JuliaStats/Distances.jl,,NOASSERTION,julia;distance-metrics;statistics
352,HypothesisTests.jl,Hypothesis testing library for Julia,"A comprehensive Julia package for conducting various statistical hypothesis tests, including t-tests, chi-squared tests, and non-parametric tests.",AI4;AI4-02,statistical_testing;hypothesis_testing,library,Julia,https://github.com/JuliaStats/HypothesisTests.jl,,MIT,julia;statistics;hypothesis-testing
353,StatsModels.jl,Statistical model specification and fitting in Julia,"A Julia package for specifying, fitting, and evaluating statistical models using a formula-based interface similar to R, facilitating statistical analysis and inference.",AI4;AI4-02,statistical_modeling;model_evaluation,library,Julia,https://github.com/JuliaStats/StatsModels.jl,,None,julia;statistical-modeling;data-analysis
354,common_metrics_on_video_quality,Video quality evaluation metrics calculator,"A Python toolkit to calculate common video quality metrics such as FVD, PSNR, SSIM, and LPIPS for evaluating generated or predicted videos.",AI4;AI4-02,quality_control;metrics_calculation,library,Python,https://github.com/JunyaoHu/common_metrics_on_video_quality,,None,video-quality;fvd;psnr;ssim
355,deep-significance,Statistical significance testing for deep neural networks,"A Python tool designed to facilitate statistical significance testing specifically for comparing deep neural network models, ensuring robust performance evaluation.",AI4;AI4-02,statistical_testing;model_evaluation,library,Python,https://github.com/Kaleidophon/deep-significance,,GPL-3.0,deep-learning;significance-testing;statistics
356,DocumentFeatureSelection,Metrics for feature selection from text data,"A Python library providing a set of metrics and methods for selecting features from text data, aiding in NLP model optimization and analysis.",AI4;AI4-02,feature_selection;metrics_calculation,library,Python,https://github.com/Kensuke-Mitsuzawa/DocumentFeatureSelection,,NOASSERTION,nlp;feature-selection;text-mining
357,pytorch-metric-learning,Deep metric learning library for PyTorch,"A comprehensive and modular PyTorch library for deep metric learning, providing loss functions, miners, and trainers to learn distance metrics for various applications.",AI4;AI4-01;AI4-02,metric_learning;model_training,library,Python,https://github.com/KevinMusgrave/pytorch-metric-learning,,MIT,pytorch;metric-learning;deep-learning
358,YACHT,Hypothesis test for organism presence in metagenomes,"A mathematically characterized hypothesis testing tool for determining the presence or absence of organisms in metagenomic samples, enabling scalable and accurate metagenome profiling.",AI4;AI4-02,hypothesis_testing;metagenomics,solver,C++,https://github.com/KoslickiLab/YACHT,,MIT,bioinformatics;metagenomics;hypothesis-testing
359,FPChecker,Floating-point error detection for HPC applications,A dynamic analysis tool developed by LLNL to detect floating-point errors and instabilities in High-Performance Computing (HPC) applications.,AI4;AI4-02,quality_control;numerical_analysis,solver,Python,https://github.com/LLNL/FPChecker,,Apache-2.0,hpc;floating-point;debugging
360,torchmetrics,Machine learning metrics for PyTorch,"A collection of machine learning metrics for distributed, scalable PyTorch applications, offering implementations of common metrics for classification, regression, and more.",AI4;AI4-02,metrics_calculation;model_evaluation,library,Python,https://github.com/Lightning-AI/torchmetrics,,Apache-2.0,pytorch;metrics;machine-learning
361,MAC-VO,Metrics-aware Covariance for Stereo Visual Odometry,A learning-based Stereo Visual Odometry solver that incorporates metrics-aware covariance estimation to improve trajectory accuracy and reliability.,AI4;AI4-01;AI4-02,visual_odometry;state_estimation,solver,Python,https://github.com/MAC-VO/MAC-VO,,MIT,visual-odometry;robotics;covariance-estimation
362,SparseOcc,Sparse 3D Occupancy Prediction and Evaluation,A fully sparse 3D occupancy prediction method that includes the RayIoU evaluation metric for assessing geometric accuracy in 3D vision tasks.,AI4;AI4-01;AI4-02,occupancy_prediction;model_evaluation,solver,Python,https://github.com/MCG-NJU/SparseOcc,,Apache-2.0,3d-vision;occupancy-prediction;evaluation-metric
363,opinionated,Clean stylesheets for scientific plotting,"A Python library providing opinionated, clean stylesheets for matplotlib and seaborn to create publication-quality scientific plots.",AI4;AI4-02,visualization;plotting,library,Jupyter Notebook,https://github.com/MNoichl/opinionated,,MIT,visualization;matplotlib;seaborn
364,dcurves,Decision Curve Analysis for prediction models,"A Python package for performing Decision Curve Analysis (DCA), a method to evaluate prediction models and diagnostic tests by calculating net benefit.",AI4;AI4-02,model_evaluation;decision_analysis,library,Python,https://github.com/MSKCC-Epi-Bio/dcurves,,Apache-2.0,decision-curve-analysis;statistics;medical-statistics
365,pcr,Analysis and statistical testing of qPCR data,"An R package for quality assessment, analysis, and statistical significance testing of real-time quantitative PCR (qPCR) data.",AI4;AI4-02,statistical_analysis;bioinformatics,library,R,https://github.com/MahShaaban/pcr,,GPL-3.0,qpcr;bioinformatics;statistics
366,nlg-eval,Evaluation metrics for Natural Language Generation,A Python library containing code for various unsupervised automated metrics for evaluating Natural Language Generation (NLG) systems.,AI4;AI4-02,model_evaluation;metrics_calculation,library,Python,https://github.com/Maluuba/nlg-eval,,NOASSERTION,nlg;evaluation-metrics;nlp
367,nervaluate,Named Entity Recognition evaluation metrics,"A Python library for full named-entity evaluation metrics based on SemEval-2013 standards, allowing for detailed performance analysis of NER models.",AI4;AI4-02,model_evaluation;metrics_calculation,library,Python,https://github.com/MantisAI/nervaluate,,MIT,ner;evaluation-metrics;nlp
368,localization_evaluation_toolkit,Toolkit for localization evaluation in robotics,"A toolkit for evaluating localization algorithms, supporting CSV and ROS 2 bag formats, and providing error analysis and NDT performance metrics.",AI4;AI4-02,model_evaluation;robotics_localization,library,Python,https://github.com/MapIV/localization_evaluation_toolkit,,None,localization;robotics;evaluation
369,volkscv,Computer vision research toolbox,"A Python toolbox designed to facilitate computer vision research and projects, providing common utilities and implementations.",AI4;AI4-01;AI4-02,image_processing;model_evaluation,library,Python,https://github.com/Media-Smart/volkscv,,Apache-2.0,computer-vision;toolbox;research
370,evo,Evaluation package for odometry and SLAM,"A Python package for the evaluation of odometry and SLAM trajectories, providing tools for trajectory alignment, error calculation, and visualization.",AI4;AI4-02,model_evaluation;slam_evaluation,library,Python,https://github.com/MichaelGrupp/evo,,GPL-3.0,slam;odometry;evaluation
371,PySR,High-performance symbolic regression,"A high-performance symbolic regression library for Python and Julia, used to discover mathematical expressions that best describe a dataset.",AI4;AI4-01,symbolic_regression;scientific_discovery,solver,Python,https://github.com/MilesCranmer/PySR,,Apache-2.0,symbolic-regression;scientific-discovery;machine-learning
372,IOHMM,Input Output Hidden Markov Models,"A Python library for Input Output Hidden Markov Models (IOHMM), enabling statistical modeling of sequential data with inputs.",AI4;AI4-01,statistical_modeling;sequence_analysis,library,Python,https://github.com/Mogeng/IOHMM,,BSD-3-Clause,hmm;statistical-modeling;sequence-analysis
373,Model_Log,Lightweight ML/DL training metrics visualization,"A lightweight Python tool for logging and visualizing machine learning and deep learning model training metrics such as loss, accuracy, precision, and F1 score.",AI4;AI4-02,visualization;experiment_tracking,library,Python,https://github.com/NLP-LOVE/Model_Log,,Apache-2.0,visualization;metrics;experiment-tracking
374,NVIDIA-NeMo/Evaluator,Scalable and reproducible evaluation library for AI models and benchmarks,"A library designed for the evaluation of AI models, particularly in the domains of Large Language Models (LLMs), Automatic Speech Recognition (ASR), and Text-to-Speech (TTS). It provides tools for running benchmarks and computing metrics.",AI4;AI4-02,model_evaluation;benchmarking;metrics_calculation,library,Python,https://github.com/NVIDIA-NeMo/Evaluator,,Apache-2.0,evaluation;benchmarks;llm;asr;tts
375,ggforestplot,R package for creating forest plots with confidence intervals,"An R package designed to visualize measures of effects and their confidence intervals using forest plots, commonly used in medical and statistical research.",AI4;AI4-02,statistical_visualization;confidence_intervals,library,R,https://github.com/NightingaleHealth/ggforestplot,,MIT,visualization;forestplot;confidence-intervals;r-package
376,Open Metric Learning,Library for metric learning pipelines and models,"A library providing pipelines, models, and a model zoo for metric learning and retrieval tasks. It facilitates the training and evaluation of models designed to learn distance metrics.",AI4;AI4-02,metric_learning;image_retrieval;model_training,library,Python,https://github.com/OML-Team/open-metric-learning,https://oml-team.github.io/open-metric-learning/,Apache-2.0,metric-learning;retrieval;pytorch
