id,name,one_line_profile,detailed_description,domains,subtask_category,application_level,primary_language,repo_url,help_website,license,tags
871,FHIRFLARE-IG-Toolkit,Toolkit for managing FHIR Implementation Guides,"A comprehensive web app for managing FHIR Implementation Guides (IGs), including import, validation, processing, and conversion features for medical informatics.",AI4;AI4-01,data_processing;standardization,platform,HTML,https://github.com/Sudo-JHare/FHIRFLARE-IG-Toolkit,,NOASSERTION,fhir;medical-informatics;healthcare-data;interoperability
872,SwanLab,AI training tracking and visualization tool,An open-source AI training tracking and visualization tool that integrates with popular frameworks like PyTorch and Transformers to monitor experiments.,AI4;AI4-04,experiment_tracking;visualization,platform,Python,https://github.com/SwanHubX/SwanLab,,Apache-2.0,experiment-tracking;visualization;mlops;training-monitoring
873,FedScale,Federated Learning benchmarking platform,A scalable and extensible open-source platform for benchmarking and deploying federated learning (FL) algorithms and systems.,AI4;AI4-04,benchmarking;federated_learning,platform,Python,https://github.com/SymbioticLab/FedScale,,Apache-2.0,federated-learning;benchmark;distributed-systems
874,tensorboard_logger,Library to log TensorBoard events without TensorFlow dependency,"A Python library that allows users to log metrics, images, and histograms to TensorBoard event files without needing to install the full TensorFlow framework. It is useful for lightweight experiment tracking in PyTorch or other non-TF environments.",AI4;AI4-04,experiment_tracking;visualization,library,Python,https://github.com/TeamHG-Memex/tensorboard_logger,,MIT,tensorboard;logging;visualization
875,AI-Infra-Guard,Comprehensive AI Red Teaming and safety evaluation platform,"A platform developed by Tencent Zhuque Lab for AI Red Teaming, focusing on evaluating the safety, security, and robustness of AI models through adversarial testing and vulnerability scanning.",AI4;AI4-04,model_evaluation;red_teaming;safety_testing,platform,Python,https://github.com/Tencent/AI-Infra-Guard,,NOASSERTION,red-teaming;ai-safety;security
876,GFPGAN,Practical algorithm for real-world face restoration,A blind face restoration algorithm that leverages a Generative Facial Prior (GFP) to restore low-quality face images. It is widely used for image enhancement and preprocessing in computer vision research.,Computer Vision;Image Processing,image_restoration;face_enhancement,solver,Python,https://github.com/TencentARC/GFPGAN,,NOASSERTION,gan;face-restoration;super-resolution
877,LLMstudio,Framework and UI for LLM fine-tuning and prompt engineering,"A framework designed to manage the lifecycle of Large Language Model (LLM) applications, offering tools for prompt engineering, fine-tuning, and evaluating models, bridging the gap between experimentation and production.",AI4;AI4-04,llm_finetuning;prompt_engineering,platform,Python,https://github.com/TensorOpsAI/LLMstudio,,MPL-2.0,llm;finetuning;mlops
878,Local-LLM-Comparison-Colab-UI,WebUI for benchmarking and comparing local LLMs,"A Colab-compatible WebUI tool designed to run and compare the performance and outputs of various Large Language Models (LLMs) on consumer hardware, facilitating model evaluation and selection.",AI4;AI4-04,model_benchmarking;model_comparison,workflow,Jupyter Notebook,https://github.com/Troyanovsky/Local-LLM-Comparison-Colab-UI,,None,llm;benchmarking;colab
879,CPM-1-Generate,Inference code for Chinese Pre-Trained Language Models (CPM-LM),"Provides the generation code and model interface for CPM-1, a large-scale Chinese pre-trained language model, enabling researchers to perform text generation and downstream NLP tasks.",NLP;AI Models,text_generation;language_modeling,solver,Python,https://github.com/TsinghuaAI/CPM-1-Generate,,MIT,nlp;chinese-llm;text-generation
880,ModelDB,Open source system for ML model versioning and experiment management,"A system to manage machine learning models, including versioning models, tracking metadata, and managing experiments. It helps researchers ensure reproducibility and track the history of model development.",AI4;AI4-04,experiment_management;model_versioning,platform,Java,https://github.com/VertaAI/modeldb,https://www.verta.ai/,Apache-2.0,mlops;experiment-tracking;model-registry
881,VevestaX,Lightweight library for tracking ML experiments and EDA,"A Python library designed to track machine learning experiments and exploratory data analysis (EDA) with minimal code changes, automatically logging features, parameters, and performance metrics.",AI4;AI4-04,experiment_tracking;eda_logging,library,Jupyter Notebook,https://github.com/Vevesta/VevestaX,,Apache-2.0,experiment-tracking;eda;mlops
882,NeuroNLP2,Deep neural models library for core NLP tasks,"A PyTorch-based library implementing deep neural network models for various core Natural Language Processing tasks, serving as a toolkit for NLP research and experimentation.",NLP,nlp_modeling;sequence_labeling,library,Python,https://github.com/XuezheMax/NeuroNLP2,,GPL-3.0,nlp;pytorch;neural-networks
883,Xwin-LM,Models and methods for LLM alignment and reproducibility,"Provides a suite of Large Language Models and alignment methodologies (like RLHF) focused on stability and reproducibility, serving as a resource for research into LLM alignment techniques.",AI4;AI Models,llm_alignment;rlhf,solver,Python,https://github.com/Xwin-LM/Xwin-LM,,None,llm;alignment;rlhf
884,Geochemistrypi,Automated machine learning framework for geochemistry,"An open-source Python framework designed for data-driven discovery in geochemistry. It automates the machine learning pipeline for analyzing geochemical data, supporting tasks like classification, regression, and clustering in geological contexts.",AI4S;Geochemistry,geochemical_analysis;scientific_discovery,framework,Python,https://github.com/ZJUEarthData/Geochemistrypi,,MIT,geochemistry;automl;ai4science
885,ACTS,Toolkit for charged particle track reconstruction in high energy physics,"An experiment-independent toolkit for track reconstruction in high energy physics experiments. It provides modern, thread-safe implementations of tracking algorithms and geometry handling for particle physics research.",Physics;High Energy Physics,track_reconstruction;particle_physics_simulation,library,C++,https://github.com/acts-project/acts,https://acts.readthedocs.io/,MPL-2.0,physics;tracking;cern
886,OlliePy,Library for ML experiment evaluation and data exploration,A Python package that assists data scientists in exploring data and evaluating machine learning experiments by generating web-based reports and dashboards for analysis.,AI4;AI4-04,experiment_evaluation;eda,library,Python,https://github.com/ahmed-mohamed-sn/olliePy,,MIT,data-science;visualization;evaluation
887,Aim,Open-source experiment tracker for machine learning metadata,"Aim is an easy-to-use and supercharged open-source experiment tracker that logs training runs, hyperparameters, and metrics, providing a UI for comparison and visualization of ML experiments.",AI4;AI4-04,experiment_tracking;metrics_logging;visualization,platform,Python,https://github.com/aimhubio/aim,https://aimstack.io/,Apache-2.0,experiment-tracking;mlops;visualization;metadata
888,aimlflow,Integration tool to sync MLflow runs with Aim,"A synchronization tool that allows users to track and visualize MLflow experiments using the Aim UI, bridging the gap between the two experiment tracking ecosystems.",AI4;AI4-04,experiment_tracking;interoperability,library,Python,https://github.com/aimhubio/aimlflow,,Apache-2.0,mlflow;aim;integration;experiment-tracking
889,Mandala,Experiment tracking framework with integrated persistence logic,"Mandala is a framework that integrates experiment tracking directly with Python's persistence logic, enabling automatic memoization and queryable storage of computational graph results for data science projects.",AI4;AI4-04,experiment_tracking;data_persistence;reproducibility,library,Python,https://github.com/amakelov/mandala,https://amakelov.github.io/mandala/,Apache-2.0,experiment-tracking;memoization;data-management
890,MLflow Export Import,Tools to export and import MLflow experiments and models,"A utility set for copying MLflow objects (experiments, runs, registered models) from one MLflow tracking server to another, facilitating data migration and backup in research workflows.",AI4;AI4-04,experiment_management;data_migration,library,Python,https://github.com/amesar/mlflow-export-import,,Apache-2.0,mlflow;migration;experiment-management
891,Grand,Scalable and interoperable Python graph library,"Grand allows using familiar Python graph APIs (like NetworkX) on scalable backends (SQL, graph databases), enabling analysis of large-scale scientific network data that exceeds memory limits.",AI4;Data Science,graph_analysis;data_processing,library,Python,https://github.com/aplbrain/grand,https://grand.readthedocs.io/,Apache-2.0,graph-theory;network-analysis;scalability
892,Labwatch,Hyperparameter optimization extension for Sacred,"Labwatch connects the Sacred experiment tracking tool with various hyperparameter optimization libraries, enabling automated search and logging of optimal parameters in ML experiments.",AI4;AI4-04,hyperparameter_optimization;experiment_tracking,library,Python,https://github.com/automl/labwatch,,MIT,hpo;sacred;optimization
893,Ogama,OpenGazeAndMouseAnalyzer for eye and mouse tracking data,"Ogama is a software application for recording and analyzing eye- and mouse-tracking data from experimental setups, providing features for fixation detection, heatmaps, and statistical analysis.",Neuroscience;HCI,data_analysis;behavioral_tracking;visualization,solver,C#,https://github.com/avosskuehler/ogama,http://www.ogama.net/,GPL-3.0,eye-tracking;data-analysis;experiment-control
894,SageMaker Entrypoint Utilities,Utilities for SageMaker training entrypoints,"A library providing logging handlers, progress bar management, and hyperparameter parsing utilities to simplify the creation of robust training entrypoint scripts for scientific ML workflows on SageMaker.",AI4;AI4-04,workflow_utility;logging,library,Python,https://github.com/aws-samples/amazon-sagemaker-entrypoint-utilities,,MIT-0,sagemaker;utilities;logging
895,Foundation Model Benchmarking Tool,Benchmarking tool for foundation models on AWS,"A tool to benchmark the performance (latency, throughput, cost) of foundation models across various instance types and serving stacks, facilitating model selection for research and production.",AI4;AI4-04,benchmarking;performance_evaluation,solver,Jupyter Notebook,https://github.com/aws-samples/foundation-model-benchmarking-tool,,MIT-0,benchmarking;foundation-models;llm
896,ML Lineage Helper,Wrapper for SageMaker ML Lineage Tracking,"A helper library that extends SageMaker's lineage tracking capabilities to cover end-to-end ML lifecycles, including feature store groups and artifact queries, ensuring reproducibility and auditability.",AI4;AI4-04,lineage_tracking;provenance,library,Python,https://github.com/aws-samples/ml-lineage-helper,,Apache-2.0,lineage;sagemaker;reproducibility
897,AWS SDK for pandas,Pandas integration for AWS data services,"An open-source Python library (formerly AWS Wrangler) that extends Pandas to easily connect with AWS data services like Athena, Glue, and Redshift, facilitating data processing for scientific workflows.",AI4;Data Science,data_processing;data_integration,library,Python,https://github.com/aws/aws-sdk-pandas,https://aws-sdk-pandas.readthedocs.io/,Apache-2.0,pandas;etl;data-engineering
898,Graph Notebook,Jupyter notebook extension for graph databases,"A library extending Jupyter notebooks to integrate with graph databases (Gremlin, SPARQL, openCypher), providing visualization and query capabilities for graph data analysis.",AI4;Data Science,visualization;data_analysis;graph_querying,library,Jupyter Notebook,https://github.com/aws/graph-notebook,https://graph-notebook.readthedocs.io/,Apache-2.0,graph-visualization;jupyter;sparql
899,SageMaker Experiments,Experiment tracking SDK for Amazon SageMaker,"A Python SDK for tracking, organizing, and comparing machine learning experiments, runs, and metrics within the Amazon SageMaker environment.",AI4;AI4-04,experiment_tracking;metrics_logging,library,Python,https://github.com/aws/sagemaker-experiments,https://sagemaker-experiments.readthedocs.io/,Apache-2.0,experiment-tracking;sagemaker;mlops
900,MXBoard,Logging MXNet data for visualization in TensorBoard,"A Python package that provides APIs for logging MXNet data for visualization in TensorBoard, enabling monitoring of training metrics and model performance.",AI4;AI4-04,visualization;experiment_tracking,library,Python,https://github.com/awslabs/mxboard,,Apache-2.0,mxnet;tensorboard;visualization;logging
901,Cloud Detection Model,Cloud Detection Model for Sentinel-2 Imagery,"A semantic segmentation model and tool for detecting clouds in Sentinel-2 satellite imagery, supporting earth observation data processing.",AI4;AI4-01,image_segmentation;remote_sensing;data_processing,solver,Python,https://github.com/azavea/cloud-model,,MIT,sentinel-2;cloud-detection;remote-sensing;satellite-imagery
902,ml_board,Machine learning dashboard for hyperparameter and log visualization,"A machine learning dashboard that displays hyperparameter settings alongside visualizations and logs, designed to track the scientist's thoughts and experiment progress.",AI4;AI4-04,experiment_tracking;visualization;dashboard,platform,Python,https://github.com/bbli/ml_board,,MIT,dashboard;machine-learning;visualization;experiment-tracking
903,calkit,Project management and reproducibility tool for research,"A tool for simplified version control, environment management, and single-button reproducible pipelines specifically designed for research projects.",AI4;AI4-04,reproducibility;version_control;pipeline_management,workflow,Python,https://github.com/calkit/calkit,,MIT,research-ops;reproducibility;version-control;pipeline
904,Neptune,Trajectory planning framework for multiple robots,"A trajectory planning framework for multiple robots, supporting scientific modeling and control theory applications in robotics.",AI4;AI4-01,trajectory_planning;robotics;control_theory,solver,C++,https://github.com/caomuqing/neptune,,BSD-3-Clause,robotics;trajectory-planning;multi-agent
905,Anserini,Lucene toolkit for reproducible information retrieval research,"A Lucene-based toolkit built to support reproducible information retrieval research, providing standard indexing and retrieval capabilities for scientific evaluation.",AI4;AI4-04,information_retrieval;indexing;evaluation,library,Java,https://github.com/castorini/anserini,http://anserini.io/,Apache-2.0,information-retrieval;lucene;reproducibility;search
906,Pyserini,Python toolkit for reproducible information retrieval research,"A Python toolkit for reproducible information retrieval research that supports sparse and dense representations, serving as a Python interface to Anserini.",AI4;AI4-04,information_retrieval;dense_retrieval;evaluation,library,Python,https://github.com/castorini/pyserini,,Apache-2.0,information-retrieval;python;search;bm25
907,Catalyst,Accelerated deep learning R&D framework,"A PyTorch framework for accelerated deep learning research and development, focusing on reproducibility, rapid experimentation, and codebase reuse.",AI4;AI4-04,model_training;experiment_management;deep_learning,workflow,Python,https://github.com/catalyst-team/catalyst,https://catalyst-team.github.io/catalyst/,Apache-2.0,pytorch;deep-learning;framework;reproducibility
908,chaiNNer,Node-based image processing GUI for chaining tasks,"A node-based image processing GUI aimed at making chaining image processing tasks easy and customizable, supporting AI upscaling and programmatic image manipulation workflows.",AI4;AI4-01,image_processing;workflow_automation;upscaling,workflow,Python,https://github.com/chaiNNer-org/chaiNNer,,GPL-3.0,image-processing;gui;node-based;workflow
909,jupyterlab_tensorboard,Tensorboard extension for JupyterLab,"A JupyterLab extension that facilitates the integration of TensorBoard, allowing for seamless visualization of machine learning experiments within the Jupyter environment.",AI4;AI4-04,visualization;experiment_tracking;ide_extension,platform,TypeScript,https://github.com/chesterli29/jupyterlab_tensorboard,,MIT,jupyterlab;tensorboard;visualization;extension
910,Sacredboard,Dashboard for Sacred experiment tracking,"A web-based dashboard for Sacred, enabling users to monitor, access, and analyze past machine learning experiments and their configurations.",AI4;AI4-04,experiment_tracking;visualization;dashboard,platform,Python,https://github.com/chovanecm/sacredboard,,MIT,sacred;dashboard;experiment-tracking;machine-learning
911,Beholder,TensorBoard plugin for visualizing arbitrary tensors,"A TensorBoard plugin that allows for the visualization of arbitrary tensors as video overlays during network training, aiding in model debugging and interpretation.",AI4;AI4-04,visualization;model_debugging;tensorboard_plugin,library,Python,https://github.com/chrisranderson/beholder,,NOASSERTION,tensorboard;visualization;deep-learning;plugin
912,ClearML,MLOps platform for experiment management and orchestration,"An integrated MLOps platform that provides experiment management, data management, pipeline orchestration, and model serving to streamline AI workflows.",AI4;AI4-04,experiment_tracking;mlops;orchestration;data_management,platform,Python,https://github.com/clearml/clearml,https://clear.ml/docs/,Apache-2.0,mlops;experiment-tracking;orchestration;reproducibility
913,ClearML Agent,Orchestration agent for ClearML,"The agent component for ClearML that handles the execution, scheduling, and orchestration of machine learning experiments and pipelines.",AI4;AI4-04,orchestration;scheduling;mlops,service,Python,https://github.com/clearml/clearml-agent,https://clear.ml/docs/,Apache-2.0,mlops;agent;orchestration;scheduler
914,ClearML Server,Backend infrastructure for the ClearML MLOps and experiment tracking platform,"ClearML Server is the backend service for the ClearML platform, providing experiment tracking, model management, and orchestration capabilities. It serves as the central repository for logging metrics, artifacts, and execution details of machine learning experiments.",AI4;AI4-04,experiment_tracking;model_management;mlops,platform,Python,https://github.com/clearml/clearml-server,https://clear.ml/docs,NOASSERTION,experiment-tracking;mlops;model-management
915,benchmark_VAE,Unified PyTorch implementation and benchmarking framework for Variational Autoencoders,A comprehensive library for implementing and benchmarking various Variational Autoencoder (VAE) models. It provides a unified interface to reproduce results and compare performance across different VAE architectures on standard datasets.,AI4;AI4-04,model_benchmarking;reproducibility;generative_models,library,Python,https://github.com/clementchadebec/benchmark_VAE,https://github.com/clementchadebec/benchmark_VAE,Apache-2.0,vae;benchmarking;pytorch;generative-ai
916,Codabench,Flexible and reproducible benchmarking platform for AI competitions and tasks,"Codabench is a framework for creating and hosting benchmarks and competitions. It allows researchers to define tasks, metrics, and datasets to evaluate algorithms in a reproducible manner, supporting the organization of scientific challenges.",AI4;AI4-04,benchmarking_platform;competition_hosting;evaluation,platform,Python,https://github.com/codalab/codabench,https://github.com/codalab/codabench/wiki,Apache-2.0,benchmarking;competitions;reproducibility
917,WA-Testing-Tool,Evaluation and testing scripts for Watson Assistant models,A set of tools to perform K-fold validation and blind testing on Watson Assistant workspaces. It generates precision curves and other metrics to evaluate the performance of NLU models.,AI4;AI4-04,model_evaluation;validation;metrics_calculation,solver,Jupyter Notebook,https://github.com/cognitive-catalyst/WA-Testing-Tool,,Apache-2.0,nlp;evaluation;watson-assistant;metrics
918,sna-js,JavaScript library for egocentric social network analysis metrics,A library to visualize and calculate relevant metrics for egocentric social network analysis (SNA) using adjacency matrices. It supports the computation of network statistics useful in social science research.,AI4;AI4-04,network_analysis;metrics_calculation,library,JavaScript,https://github.com/craigtutterow/sna-js,,GPL-2.0,social-network-analysis;metrics;visualization
919,CK-Crowdtuning,Crowdsourcing extension for Collective Knowledge benchmarking workflows,"An extension for the Collective Knowledge (CK) framework that enables crowdsourcing of experiments, such as performance benchmarking and auto-tuning of machine learning models across diverse hardware platforms.",AI4;AI4-04,benchmarking;auto_tuning;crowdsourcing,workflow,Python,https://github.com/ctuning/ck-crowdtuning,http://cKnowledge.org,BSD-3-Clause,benchmarking;crowdsourcing;collective-knowledge;optimization
920,The Omega Project,Constraint-based tools for compiler dependence analysis and transformation,"A collection of tools and libraries (Omega Library, Omega Calculator, Omega Test) for manipulating sets of affine constraints and performing dependence analysis. These tools are fundamental for research in compiler optimization and polyhedral models.",AI4;AI4-04,dependence_analysis;constraint_solving;compiler_optimization,solver,C,https://github.com/davewathaverford/the-omega-project,,BSD-2-Clause,compiler;dependence-analysis;polyhedral-model;constraints
921,gtsummary,R package for creating presentation-ready data summary and analytic tables,"An R package designed to create publication-ready analytical and summary tables. It automates the reporting of regression models, descriptive statistics, and other scientific data analysis results.",AI4;AI4-04,reporting;statistical_summary;visualization,library,R,https://github.com/ddsjoberg/gtsummary,http://www.danieldsjoberg.com/gtsummary/,NOASSERTION,r;statistics;reporting;tables
922,Determined,Deep learning training platform with integrated experiment tracking,"Determined is an open-source deep learning training platform that handles distributed training, hyperparameter tuning, experiment tracking, and resource management. It enables researchers to track and reproduce experiments efficiently.",AI4;AI4-04,experiment_tracking;hyperparameter_tuning;resource_management,platform,Go,https://github.com/determined-ai/determined,https://docs.determined.ai/,Apache-2.0,deep-learning;experiment-tracking;distributed-training
923,machine-learning-interactive-visualization,Interactive visualization tools for ML model evaluation metrics,"A collection of notebooks and tools for interactively visualizing machine learning evaluation metrics (like ROC curves, precision-recall, etc.) to aid in model analysis and understanding.",AI4;AI4-04,visualization;metrics_evaluation,library,Jupyter Notebook,https://github.com/dhaitz/machine-learning-interactive-visualization,,NOASSERTION,visualization;metrics;machine-learning
924,NLG-Metricverse,End-to-end library for evaluating Natural Language Generation,"A comprehensive library for evaluating Natural Language Generation (NLG) models. It provides a unified interface to access a wide range of evaluation metrics, facilitating the comparison and benchmarking of NLG systems.",AI4;AI4-04,nlg_evaluation;metrics_calculation;benchmarking,library,Python,https://github.com/disi-unibo-nlp/nlg-metricverse,https://nlg-metricverse.readthedocs.io/,MIT,nlg;evaluation;metrics;nlp
925,PromptSite,Version control and tracking system for LLM prompts,"PromptSite is a lightweight package for managing, versioning, and tracking LLM prompts. It helps researchers experiment with and debug prompts by maintaining a history of changes and their effects.",AI4;AI4-04,prompt_tracking;version_control;experiment_management,library,Python,https://github.com/dkuang1980/promptsite,,Apache-2.0,prompt-engineering;version-control;llm
926,TensorBoard,Visualization toolkit for machine learning experimentation,"A suite of visualization tools to understand and debug machine learning models, enabling tracking of metrics like loss and accuracy, visualizing the model graph, and projecting embeddings.",AI4;AI4-04,experiment_tracking;visualization,platform,Python,https://github.com/dmlc/tensorboard,https://www.tensorflow.org/tensorboard,Apache-2.0,visualization;deep-learning;experiment-tracking
927,Open LLM Leaderboard Report,Visualization report generator for Open LLM Leaderboard,"A tool to generate weekly visualization reports of Open LLM model performance based on various metrics, aiding in the tracking and comparison of large language models.",AI4;AI4-04,leaderboard_visualization;performance_tracking,workflow,Python,https://github.com/dsdanielpark/open-llm-leaderboard-report,,MIT,llm;leaderboard;visualization
928,MET (Model Evaluation Tools),Verification and validation tools for meteorological models,"A suite of tools for evaluating the performance of meteorological models, providing state-of-the-art verification methods and metrics.",AI4;AI4-04,model_evaluation;meteorology,solver,C++,https://github.com/dtcenter/MET,https://dtcenter.org/community-code/model-evaluation-tools-met,Apache-2.0,meteorology;verification;model-evaluation
929,mltraq,Experiment tracking and collaboration tool for ML,"A library to track and collaborate on Machine Learning and AI experiments, supporting logging of parameters, metrics, and artifacts.",AI4;AI4-04,experiment_tracking;collaboration,library,Jupyter Notebook,https://github.com/elehcimd/mltraq,,BSD-3-Clause,experiment-tracking;mlops;logging
