id,name,one_line_profile,detailed_description,domains,subtask_category,application_level,primary_language,repo_url,help_website,license,tags
279,snap,Simulation and Network Analysis Productivity layer,"The Blue Brain Pythonic Simulation and Network Analysis Productivity layer (SNAP), providing high-level interfaces for analyzing neural simulations and network properties.",N1;N1-02,network_analysis;simulation_analysis,library,Python,https://github.com/BlueBrain/snap,,LGPL-3.0,network-analysis;simulation;blue-brain
280,findr,Flow-field Inference from Neural Data using Recurrent networks,"A tool for inferring flow fields and dynamics from neural data using deep recurrent neural networks, enabling the modeling of neural population dynamics.",N1;N1-02,dynamics_inference;neural_modeling,solver,Jupyter Notebook,https://github.com/Brody-Lab/findr,,Apache-2.0,neural-dynamics;rnn;inference;flow-fields
281,CAVEclient,Client for Connectome Annotation Versioning Engine (CAVE),"A Python client for accessing and interacting with the REST APIs of the Connectome Annotation Versioning Engine (CAVE), facilitating connectomics data management.",N1;N1-02,data_access;annotation_management,library,Python,https://github.com/CAVEconnectome/CAVEclient,,MIT,connectomics;api-client;annotation;cave
282,PyChunkedGraph,Backend for fast proofreading of connectomics segmentation,"A data backend designed for fast, interactive proofreading and editing of cell segmentations in large-scale connectomics datasets.",N1;N1-02,segmentation_proofreading;graph_backend,library,Python,https://github.com/CAVEconnectome/PyChunkedGraph,,MPL-2.0,connectomics;segmentation;proofreading;graph-database
283,CM-graph,Toolbox for multichannel EEG-EMG connectivity analysis,"A Python toolbox extending MNE-Python for multichannel EEG-EMG connectivity analysis, focusing on graph and network theory applications for clinical markers.",N1;N1-02,connectivity_analysis;eeg_emg,library,Jupyter Notebook,https://github.com/CM-connectivity/CM-graph,,MIT,eeg;emg;connectivity;graph-theory
284,ActflowToolbox,Brain Activity Flow (Actflow) analysis toolbox,"A toolbox to quantify the relationship between brain connectivity and task activity through network simulations and machine learning prediction, helping determine causal contributions of connections.",N1;N1-02,activity_flow_mapping;connectivity_prediction,library,Python,https://github.com/ColeLab/ActflowToolbox,,MIT,actflow;functional-connectivity;brain-mapping;simulation
285,ColeAnticevicNetPartition,Cole-Anticevic Brain-wide Network Partition (CAB-NP),"The public release of the Cole-Anticevic Brain-wide Network Partition (CAB-NP), providing a whole-brain functional network atlas and associated data.",N1;N1-02,parcellation;network_atlas,dataset,C,https://github.com/ColeLab/ColeAnticevicNetPartition,,NOASSERTION,atlas;parcellation;brain-network;fmri
286,STREAM-4D,Surface to Tractography Real-time EEG Activation Mapping,A pipeline for 4D visualization and mapping of EEG activation onto brain surface and tractography in real-time or offline modes.,N1;N1-02,visualization;eeg_mapping,workflow,Python,https://github.com/ComaRecoveryLab/STREAM-4D,,None,eeg;tractography;visualization;brain-mapping
287,RegressionDynamicCausalModeling.jl,Directed connectivity estimation in whole-brain networks,A Julia package for estimating directed functional connectivity in whole-brain networks using regression-based Dynamic Causal Modeling (rDCM).,N1;N1-02,effective_connectivity;causal_modeling,library,Julia,https://github.com/ComputationalPsychiatry/RegressionDynamicCausalModeling.jl,,MIT,dcm;connectivity;julia;causal-inference
288,UNRAVEL,Tractography-based microstructure analysis tool,A Python tool implementing the UNRAVEL method (UtiliziNg tRActography to uncoVEr muLti-fixel microstructure) for analyzing microstructural properties along white matter tracts.,N1;N1-02,microstructure_analysis;tractography,solver,Python,https://github.com/DelinteNicolas/UNRAVEL,,GPL-3.0,tractography;microstructure;dwi;fixel
289,UTracto,Tracking of sub-cortical U-Fibers,A Python package specifically designed to facilitate the tractography and tracking of short-range sub-cortical U-fibers in the brain.,N1;N1-02,tractography;u-fibers,library,Python,https://github.com/DelinteNicolas/UTracto,,GPL-3.0,tractography;u-fibers;neuroimaging
290,kglab,Abstraction layer for Graph Data Science and Knowledge Graphs,"A Python library providing an abstraction layer for building and analyzing knowledge graphs, integrating various graph libraries (NetworkX, RDFlib, etc.) for scientific graph data science.",N1;N1-02,graph_analysis;knowledge_graph,library,Jupyter Notebook,https://github.com/DerwenAI/kglab,https://derwen.ai/docs/kgl/,MIT,knowledge-graph;graph-data-science;rdf;networkx
291,karawun,Convert tractography to DICOM for navigation,"A tool to convert tractography files (from MRtrix etc.) into DICOM format, enabling their use in neurosurgical navigation software.",N1;N1-02,format_conversion;neuronavigation,solver,Python,https://github.com/DevelopmentalImagingMCRI/karawun,,Apache-2.0,tractography;dicom;neuronavigation;mrtrix
292,nitools,Basic Neuroimaging utility functions extending nibabel and nilearn,"A collection of basic neuroimaging functions and utilities that are missing from standard libraries like nibabel and nilearn, developed by the Diedrichsen Lab.",N1;N1-02,image_processing;data_manipulation,library,Python,https://github.com/DiedrichsenLab/nitools,,MIT,neuroimaging;utility;nifti
293,DMRITool,"Toolbox for reconstruction, processing and visualization of diffusion MRI data","An open source C++ toolbox designed for the reconstruction, processing, and visualization of diffusion MRI data, including DWI, tensor, ODF, EAP, and fiber tracking.",N1;N1-02,reconstruction;visualization;tractography,solver,C++,https://github.com/DiffusionMRITool/dmritool,,NOASSERTION,diffusion-mri;dti;tractography;visualization
294,OpenMuse,Python interface for recording and streaming Muse S Athena EEG signals,"A Python tool to record and stream EEG signals from Muse S Athena devices, facilitating data acquisition for neuroscience research.",N1,data_acquisition;signal_processing,library,Python,https://github.com/DominiqueMakowski/OpenMuse,,None,eeg;muse;data-streaming
295,spectral_connectivity,Frequency domain connectivity analysis tools for electrophysiological data,"A Python package for multitaper spectral estimation and computation of functional and directed connectivity measures (coherence, Granger causality) in the frequency domain.",N1;N1-02,connectivity_analysis;spectral_analysis,library,Python,https://github.com/Eden-Kramer-Lab/spectral_connectivity,,GPL-3.0,electrophysiology;connectivity;spectral-analysis;granger-causality
296,ERP_Connectivity_EMG_Analysis,MATLAB Toolbox for motor cortex signal processing and connectivity,"A MATLAB toolbox implementing methods for ERP estimation, Cortical Functional Connectivity analysis, and EMG quantification for investigating the human motor cortex.",N1;N1-02,signal_processing;connectivity_analysis,library,MATLAB,https://github.com/EsiSeraj/ERP_Connectivity_EMG_Analysis,,GPL-3.0,eeg;emg;erp;connectivity
297,HCP-Tractography,Pipeline for tractography reconstruction from Human Connectome Project data,A Dipy-based pipeline designed for the reconstruction and tracking of tractography specifically for the Human Connectome Project (HCP) dataset.,N1;N1-02,tractography;pipeline,workflow,Python,https://github.com/FBK-NILab/HCP-Tractography,,BSD-3-Clause,tractography;hcp;dipy;pipeline
298,tractome,Interactive 3D tool for exploration and segmentation of tractography data,"An interactive 3D visualization and segmentation tool for tractography data, allowing users to explore brain connections.",N1;N1-02,visualization;segmentation,solver,Python,https://github.com/FBK-NILab/tractome,,NOASSERTION,tractography;visualization;3d
299,dFCwalk,Toolbox for dynamic Functional Connectivity analyses using random walks,A MATLAB toolbox for performing dynamic Functional Connectivity (dFC) analyses based on random walk descriptions.,N1;N1-02,connectivity_analysis;dynamics_modeling,library,MATLAB,https://github.com/FunDyn/dFCwalk,,CC0-1.0,functional-connectivity;random-walk;fmri
300,PyCartool,Python I/O interface for Cartool neuroimaging software,An open-source Python package facilitating data input/output operations between the Cartool software and Python environments.,N1,data_io;interoperability,library,Python,https://github.com/Functional-Brain-Mapping-Laboratory/PyCartool,,BSD-3-Clause,cartool;io;neuroimaging
301,cdlib,Comprehensive library for community discovery in complex networks,"A powerful Python library dedicated to community detection in graphs, widely used in connectomics and network neuroscience for analyzing brain modularity.",N1;N1-02,graph_analysis;community_detection,library,Python,https://github.com/GiulioRossetti/cdlib,https://cdlib.readthedocs.io/,BSD-2-Clause,graph-theory;community-detection;network-analysis
302,ndlib,Library for modeling diffusion dynamics on networks,"A Python library for simulating diffusion models (e.g., epidemics, opinion dynamics) on networks, applicable to modeling signal propagation in brain networks.",N1;N1-02,simulation;network_dynamics,library,Python,https://github.com/GiulioRossetti/ndlib,https://ndlib.readthedocs.io/,BSD-2-Clause,network-diffusion;simulation;dynamics
303,FusionNet-Pytorch,Deep residual CNN implementation for connectomics image segmentation,"A PyTorch implementation of FusionNet, a deep fully residual convolutional neural network designed for high-accuracy image segmentation in connectomics (EM data).",N1;N1-02,segmentation;deep_learning,solver,Python,https://github.com/GunhoChoi/FusionNet-Pytorch,,None,connectomics;segmentation;deep-learning;em-images
304,MULAN,Systematic framework for functional connectivity measures,A MATLAB framework designed to evaluate and apply various functional connectivity measures to neuroimaging data.,N1;N1-02,connectivity_analysis;methodology_evaluation,library,MATLAB,https://github.com/HuifangWang/MULAN,,None,functional-connectivity;network-analysis;fmri
305,Janelia Workstation,Integrated software platform for managing and visualizing large-scale neuro data,"A comprehensive workstation software developed by Janelia Research Campus for the management, visualization, and analysis of large-scale neuroscience data.",N1,data_management;visualization;analysis_platform,platform,Java,https://github.com/JaneliaSciComp/workstation,,NOASSERTION,neuroscience;visualization;data-management
306,SNN,Library for Spiking Neural Network models and synapses,"A repository implementing various neuron models, synapses, and Spiking Neural Networks (SNN), serving as a library for computational neuroscience modeling.",N1,modeling;simulation,library,Python,https://github.com/Jumaruba/SNN,,None,snn;spiking-neural-networks;computational-neuroscience
307,benchmark_rsfMRI_prediction,Benchmarking scripts for resting-state fMRI predictive modeling,"A set of reusable scripts and benchmarks for performing predictive modeling on resting-state fMRI datasets, facilitating method comparison.",N1;N1-02,benchmarking;predictive_modeling,workflow,Python,https://github.com/KamalakerDadi/benchmark_rsfMRI_prediction,,None,rsfmri;benchmarking;prediction;machine-learning
308,Slicer-DTI-ALPS,3D Slicer module for DTI-ALPS analysis,A 3D Slicer extension module to calculate the Diffusion Tensor Image Analysis along the Perivascular Space (DTI-ALPS) index.,N1;N1-02,image_analysis;biomarker_calculation,solver,Python,https://github.com/LOAMRI/Slicer-DTI-ALPS,,MIT,slicer-extension;dti;alps-index;neuroimaging
309,esinet,EEG inverse solution solver using artificial neural networks,"A Python package that implements artificial neural networks for solving the EEG inverse problem (source localization). It is designed to integrate seamlessly with MNE-Python data structures, allowing researchers to apply deep learning methods to electromagnetic source imaging.",N1;N1-01,source_localization;inverse_problem;eeg_analysis,library,Jupyter Notebook,https://github.com/LukeTheHecker/esinet,,MIT,eeg;inverse-problem;neural-networks;mne-python
310,BrainSpace,Toolbox for gradient analysis of neuroimaging and connectomics data,"A comprehensive toolbox for the identification and analysis of macroscale gradients in neuroimaging and connectomics datasets. It supports surface data visualization and gradient estimation, available for both Python and MATLAB environments.",N1;N1-02,gradient_analysis;connectomics;visualization,library,Python,https://github.com/MICA-MNI/BrainSpace,,BSD-3-Clause,neuroimaging;gradients;connectomics;brain-mapping
311,ENIGMA Toolbox,Toolbox for accessing and analyzing ENIGMA consortium data,An open-source repository facilitating access to over 100 ENIGMA statistical maps. It provides tools for visualizing cortical and subcortical surface data and relating neuroimaging findings to micro- and macroscale brain organization.,N1;N1-01,data_access;visualization;statistical_analysis,library,Jupyter Notebook,https://github.com/MICA-MNI/ENIGMA,,BSD-3-Clause,enigma;neuroimaging;meta-analysis;visualization
312,micaopen,Processing pipelines and scripts from MICA Lab,A collection of open scripts and processing pipelines developed by the Multimodal Imaging and Connectome Analysis (MICA) Lab. It includes workflows for multimodal imaging processing and connectome construction.,N1;N1-02,pipeline;preprocessing;connectomics,workflow,Jupyter Notebook,https://github.com/MICA-MNI/micaopen,,GPL-3.0,neuroimaging;pipeline;connectome;scripts
313,SMRD,Robust MRI reconstruction using diffusion models,"An implementation of SURE-based Robust MRI Reconstruction with Diffusion Models. It leverages generative diffusion models to perform high-quality reconstruction of MRI images, serving as a solver for inverse problems in medical imaging.",N1;N1-01,mri_reconstruction;image_restoration;generative_modeling,solver,Python,https://github.com/NVlabs/SMRD,,NOASSERTION,mri-reconstruction;diffusion-models;medical-imaging;deep-learning
314,FLUX,Pipeline for MEG data analysis using MNE-Python,A structured pipeline for the analysis of Magnetoencephalography (MEG) data. It is built on top of MNE-Python and provides a standardized workflow for processing and analyzing neuronal oscillation data.,N1;N1-01,meg_analysis;pipeline;preprocessing,workflow,HTML,https://github.com/Neuronal-Oscillations/FLUX,,BSD-3-Clause,meg;mne-python;pipeline;neuroscience
315,SpectraVis,Interactive visualization for functional brain networks,A web-based interactive tool for analyzing and visualizing task-related functional networks in the brain over time and frequency domains. It aids in the exploration of dynamic connectivity patterns.,N1;N1-02,visualization;functional_connectivity;network_analysis,solver,JavaScript,https://github.com/NeurophysVis/SpectraVis,,GPL-2.0,visualization;functional-connectivity;neuroscience;web-tool
316,OpenMAP-T1,Whole brain segmentation and parcellation tool for T1 MRI,A Python-based tool for whole-brain segmentation and parcellation using the OpenMAP-T1 method on 3D T1-weighted MRI scans. It facilitates structural analysis of brain anatomy.,N1;N1-01,segmentation;parcellation;structural_mri,solver,Python,https://github.com/OishiLab/OpenMAP-T1,,NOASSERTION,mri;segmentation;parcellation;brain-mapping
317,PyTorch Connectomics,Deep learning toolbox for EM connectomics segmentation,A PyTorch-based toolbox designed for semantic and instance segmentation in Electron Microscopy (EM) connectomics. It provides scalable and flexible implementations for processing large-scale nanometer-resolution neural data.,N1;N1-02,segmentation;connectomics;em_analysis;deep_learning,library,Python,https://github.com/PytorchConnectomics/pytorch_connectomics,https://zudi-lin.github.io/pytorch_connectomics,MIT,connectomics;electron-microscopy;segmentation;pytorch
318,NIAK,Neuroimaging analysis kit for fMRI connectivity,A library for Octave (and MATLAB) focused on the preprocessing and analysis of functional MRI data. It is particularly tailored for connectivity analysis in large fMRI datasets.,N1;N1-02,fmri_analysis;connectivity_analysis;preprocessing,library,MATLAB,https://github.com/SIMEXP/niak,http://niak.simexp-lab.org/,NOASSERTION,fmri;connectivity;octave;neuroimaging
319,Spyker,High-performance Spiking Neural Networks (SNN) library,"A high-performance library for simulating Spiking Neural Networks, written from scratch with C++ core and Python interfaces, designed for computational neuroscience modeling.",N1;Computational Neuroscience,modeling;simulation,library,C++,https://github.com/ShahriarRezghi/Spyker,,BSD-3-Clause,snn;spiking-neural-networks;simulation
320,Brain-Midline-Detection,Deep learning model for brain midline delineation,Implementation of a Context-Aware Refinement Network incorporating structural connectivity priors for precise brain midline delineation in neuroimaging data.,N1;Medical Imaging,segmentation;image_processing,solver,Python,https://github.com/ShawnBIT/Brain-Midline-Detection,,None,midline-detection;deep-learning;mri
321,3D Slicer,Comprehensive platform for medical image visualization and analysis,"A multi-platform, free open-source software platform for visualization, processing, and analysis of medical computing and image data, supporting a vast ecosystem of extensions.",N1;Medical Imaging,visualization;image_processing;reconstruction,platform,C++,https://github.com/Slicer/Slicer,https://www.slicer.org/,BSD-style,medical-imaging;visualization;dicom
322,DFC (Deep Fiber Clustering),Deep learning framework for tractography parcellation,An anatomically informed fiber clustering tool using self-supervised deep learning for fast and effective parcellation of white matter tractography.,N1;N1-02,tractography;clustering;parcellation,solver,Python,https://github.com/SlicerDMRI/DFC,,None,fiber-clustering;tractography;deep-learning
323,SlicerDMRI,Diffusion MRI analysis extension for 3D Slicer,"A comprehensive extension for 3D Slicer providing tools for diffusion MRI analysis, tractography, and visualization of white matter connections.",N1;N1-02,diffusion_mri_analysis;tractography;visualization,platform,C++,https://github.com/SlicerDMRI/SlicerDMRI,http://dmri.slicer.org,BSD-style,dmri;tractography;slicer-extension
324,SupWMA,Superficial White Matter Analysis tool,A point-cloud-based deep learning framework with supervised contrastive learning for consistent tractography parcellation of superficial white matter across populations.,N1;N1-02,tractography;parcellation;white_matter_analysis,solver,Python,https://github.com/SlicerDMRI/SupWMA,,MIT,white-matter;deep-learning;point-cloud
325,TractCloud,Registration-free tractography parcellation tool,A tool for registration-free tractography parcellation utilizing a novel local-global streamline point cloud representation.,N1;N1-02,tractography;parcellation,solver,Python,https://github.com/SlicerDMRI/TractCloud,,MIT,tractography;point-cloud;parcellation
326,WhiteMatterAnalysis,White matter tractography clustering and analysis library,"A Python library for white matter tractography clustering, atlas creation, and groupwise analysis of diffusion MRI data.",N1;N1-02,clustering;tractography_analysis,library,Python,https://github.com/SlicerDMRI/whitematteranalysis,http://dmri.slicer.org/whitematteranalysis,BSD-style,white-matter;clustering;dmri
327,SyConn,Toolkit for volume EM synaptic connectome analysis,"A toolkit for the generation and analysis of volume electron microscopy-based synaptic connectomes of brain tissue, handling large-scale dense reconstruction data.",N1;N1-02,connectome_generation;image_analysis;synapse_detection,workflow,Python,https://github.com/StructuralNeurobiologyLab/SyConn,https://syconn.readthedocs.io,GPL-2.0,connectomics;electron-microscopy;synapse
328,Tractify,Tractography pipeline for preprocessed DWIs,"A streamlined tractography pipeline designed to work with preprocessed diffusion weighted images (DWIs), facilitating connectome generation.",N1;N1-02,tractography;pipeline,workflow,Python,https://github.com/TIGRLab/tractify,,MIT,tractography;pipeline;dwi
329,Weighted-SC-Networks,Brain connectivity analysis and MRI processing package,"A package for brain connectivity analysis coupled with a multi-modal MRI processing pipeline, focusing on weighted structural connectivity networks.",N1;N1-02,connectivity_analysis;mri_processing,library,MATLAB,https://github.com/TardifLab/Weighted-SC-Networks,,GPL-3.0,structural-connectivity;mri;network-analysis
330,ScaffoldGraph,Cheminformatics library for scaffold network analysis,An open-source cheminformatics library built on RDKit and NetworkX for generating and analyzing scaffold networks and trees from chemical datasets.,Chemistry;Drug Discovery,molecular_analysis;scaffold_generation,library,Python,https://github.com/UCLCheminformatics/ScaffoldGraph,https://scaffoldgraph.readthedocs.io/,MIT,cheminformatics;rdkit;scaffold-networks
331,NeuroGNN,Graph Neural Network framework for seizure detection,"A framework employing dynamic Graph Neural Networks (GNNs) to capture spatial, temporal, and semantic correlations in EEG data for precise seizure detection and classification.",N1;N1-02,seizure_detection;classification;eeg_analysis,solver,Python,https://github.com/USC-InfoLab/NeuroGNN,,MIT,gnn;eeg;seizure-detection
332,SLAVV (Vectorization-Public),Software for vectorization and analysis,"Public repository for SLAVV software, providing tools for vectorization and analysis of scientific data (specifics implied by lab context).",N1,data_analysis;vectorization,solver,MATLAB,https://github.com/UTFOIL/Vectorization-Public,,GPL-3.0,vectorization;analysis
333,Compresso,Efficient compression for connectomics segmentation data,"A C++ library and tool for efficient compression of large-scale segmentation data, specifically optimized for connectomics datasets.",N1;N1-02,data_compression;data_management,library,C++,https://github.com/VCG/compresso,,MIT,compression;connectomics;segmentation
334,HCP Pipelines,Standard processing pipelines for Human Connectome Project data,"The official set of processing pipelines for the Human Connectome Project (HCP), including structural, functional, and diffusion MRI preprocessing and analysis.",N1;N1-02,preprocessing;pipeline;mri_analysis,workflow,Shell,https://github.com/Washington-University/HCPpipelines,https://github.com/Washington-University/HCPpipelines/wiki,Other,hcp;neuroimaging;pipeline
335,PyVis,Interactive network graph visualization library,"A Python library for creating and visualizing interactive network graphs, widely used for exploring connectivity data in scientific research.",General Science;Network Science,visualization;graph_plotting,library,Python,https://github.com/WestHealth/pyvis,https://pyvis.readthedocs.io/,BSD-3-Clause,visualization;network-graph;interactive
336,Node-Parcellation,Individualized state-specific brain parcellation tool,"Code to generate individualized, state-specific node-level parcellations of the human brain, accounting for state-dependent functional organization.",N1;N1-02,parcellation;functional_connectivity,solver,Jupyter Notebook,https://github.com/YaleMRRC/Node-Parcellation,,None,parcellation;fmri;individualized-analysis
337,Feabas,Finite-Element Assisted Brain Assembly System,"A system for stitching and aligning connectomics data using finite-element methods, designed for large-scale brain assembly.",N1;N1-02,image_stitching;alignment;connectomics,workflow,Python,https://github.com/YuelongWu/feabas,,MIT,connectomics;alignment;finite-element
338,nx_altair,Interactive NetworkX graph plotting with Altair,"A library that enables drawing interactive NetworkX graphs using the Altair visualization library, facilitating data exploration.",General Science;Network Science,visualization;graph_plotting,library,Python,https://github.com/Zsailer/nx_altair,,MIT,visualization;networkx;altair
339,Neurite,Neural networks toolbox for medical image analysis,"A neural networks toolbox focused on medical image analysis, providing layers and utilities for registration, segmentation, and synthesis.",N1;Medical Imaging,image_analysis;registration;segmentation,library,Python,https://github.com/adalca/neurite,,Apache-2.0,medical-imaging;deep-learning;registration
340,bctpy,Brain Connectivity Toolbox for Python,"A Python implementation of the Brain Connectivity Toolbox (BCT), providing complex network measures for characterizing brain connectivity datasets.",N1;N1-02,graph_analysis;network_measures,library,Python,https://github.com/aestrivex/bctpy,,GPL-3.0,graph-theory;brain-connectivity;network-analysis
341,Predictive Forward-Forward,Implementation of predictive forward-forward algorithm,A simulation and implementation of the predictive forward-forward credit assignment algorithm for training neurobiologically-plausible recurrent neural network models.,N1;Computational Neuroscience,modeling;simulation;learning_algorithms,solver,Python,https://github.com/ago109/predictive-forward-forward,,MIT,forward-forward;rnn;neuroscience
342,NetRep,Metrics for comparing network representations,"A library providing methods for comparing network representations, useful in deep learning and neuroscience for analyzing neural population codes.",N1;Computational Neuroscience,representation_analysis;network_comparison,library,Python,https://github.com/ahwillia/netrep,,MIT,neural-representations;metrics;neuroscience
