id,name,one_line_profile,detailed_description,domains,subtask_category,application_level,primary_language,repo_url,help_website,license,tags
532,SPM12,Statistical Parametric Mapping software (Version 12),"The official release repository for SPM12, providing standard algorithms for the analysis of neuroimaging data, including GLM, DCM, and random field theory inference.",N1;N1-03,statistical_analysis;inference;modeling,library,MATLAB,https://github.com/spm/spm12,https://www.fil.ion.ucl.ac.uk/spm/doc/,NOASSERTION,spm12;fmri;meg
533,SPM8,Statistical Parametric Mapping software (Version 8),Legacy release of the SPM software package (SPM8) for neuroimaging data analysis.,N1;N1-03,statistical_analysis,library,MATLAB,https://github.com/spm/spm8,https://www.fil.ion.ucl.ac.uk/spm/software/spm8/,NOASSERTION,spm8;legacy;neuroimaging
534,MVPA-Light,MATLAB toolbox for Multi-Voxel Pattern Analysis (MVPA),"A lightweight MATLAB toolbox for classification and regression of multi-dimensional data, specifically designed for MVPA in neuroimaging.",N1;N1-03,mvpa;classification;regression,library,MATLAB,https://github.com/treder/MVPA-Light,https://github.com/treder/MVPA-Light,MIT,mvpa;decoding;machine-learning
535,TFCE_mediation,Tool for mediation analysis with TFCE correction,"A Python package for performing fast regression and mediation analysis on vertex or voxel MRI data, utilizing Threshold-Free Cluster Enhancement (TFCE) for statistical inference.",N1;N1-03,mediation_analysis;statistical_inference;tfce,library,Python,https://github.com/trislett/TFCE_mediation,,GPL-3.0,mediation;tfce;statistics
536,repsim,PyTorch library for Representational Similarity Analysis,"A PyTorch-based library for measuring representational similarity between neural networks or brain data, supporting various metrics like CKA and RSA.",N1;N1-03,rsa;representation_learning;similarity_metrics,library,Python,https://github.com/wrongu/repsim,,MIT,pytorch;rsa;cka
537,DINOv2-3D-Med,3D implementation of DINOv2 for self-supervised pretraining on volumetric medical images,"A library providing a 3D implementation of the DINOv2 self-supervised learning method, specifically adapted for volumetric medical imaging data. It integrates with Lightly, MONAI, and PyTorch Lightning to facilitate pretraining on 3D datasets.",N1;N1-04,model_training;pretraining;representation_learning,library,Python,https://github.com/AIM-Harvard/DINOv2-3D-Med,,Apache-2.0,self-supervised-learning;3d-medical-imaging;foundation-model;monai
538,3D-TransUNet,Vision Transformers for 3D medical image segmentation,"Implementation of the 3D TransUNet architecture, which combines Vision Transformers with U-Net for medical image segmentation tasks. It serves as a strong baseline and reusable model for volumetric segmentation.",N1;N1-04,segmentation;model_training,solver,Python,https://github.com/Beckschen/3D-TransUNet,,Apache-2.0,transformer;medical-image-segmentation;deep-learning
539,BiTr-Unet,CNN-Transformer Combined Network for MRI Brain Tumor Segmentation,"Source code for BiTr-Unet, a hybrid architecture combining CNNs and Transformers for efficient and accurate brain tumor segmentation in MRI images.",N1;N1-04,segmentation;tumor_detection,solver,Python,https://github.com/BruceResearch/BiTr-Unet,,Apache-2.0,brain-tumor;segmentation;transformer;cnn
540,HD-BM,Automated deep-learning based segmentation of brain metastases,"A specialized deep learning tool for the automatic segmentation of brain metastases in MRI scans, developed by the CCI Bonn group.",N1;N1-04,segmentation;metastasis_detection,solver,Python,https://github.com/CCI-Bonn/HD-BM,,Apache-2.0,brain-metastases;segmentation;mri
541,HD-GLIO,Automated deep-learning based brain tumor segmentation,"A deep learning tool specifically designed for the segmentation of glioblastomas in MRI data, providing automated contouring for neuro-oncology applications.",N1;N1-04,segmentation;tumor_detection,solver,Python,https://github.com/CCI-Bonn/HD-GLIO,,Apache-2.0,glioblastoma;segmentation;neuro-oncology
542,adell-mri,Deep learning library for radiology data analysis,"A PyTorch-based library for segmentation, classification, object detection, and self-supervised learning specifically tailored for radiology and MRI data.",N1;N1-04,segmentation;classification;self_supervised_learning,library,Python,https://github.com/CCIG-Champalimaud/adell-mri,,NOASSERTION,radiology;mri;deep-learning-library
543,bfm,General-Purpose Brain Foundation Models for Time-Series Neuroimaging,"Implementation of general-purpose foundation models designed for analyzing time-series neuroimaging data (such as fMRI), enabling various downstream tasks.",N1;N1-04,modeling;time_series_analysis;foundation_model,solver,Python,https://github.com/CERC-AAI/bfm,,None,foundation-model;fmri;time-series
544,SlicerAutomatedDentalTools,3D Slicer extension for automated dental and craniofacial analysis,"A 3D Slicer extension that provides automated tools for dental and craniofacial image analysis, including segmentation and landmarking.",N1;N1-04,segmentation;visualization;image_analysis,platform,Python,https://github.com/DCBIA-OrthoLab/SlicerAutomatedDentalTools,,NOASSERTION,3d-slicer;dental-imaging;medical-image-analysis
545,TotalSegmentator-AIDE,TotalSegmentator packaged as a MONAI AIDE Application,"A deployment of the TotalSegmentator tool packaged according to the MONAI Application Package (MAP) standard, facilitating integration into clinical AI deployment environments (AIDE).",N1;N1-04,segmentation;deployment,workflow,Python,https://github.com/GSTT-CSC/TotalSegmentator-AIDE,,NOASSERTION,monai;aide;segmentation;deployment
546,LDAE,Latent Diffusion Autoencoders for medical imaging,"A framework for unsupervised representation learning in 3D medical imaging using Latent Diffusion Autoencoders, enabling efficient semantic control and generation.",N1;N1-04,representation_learning;generative_modeling,solver,Jupyter Notebook,https://github.com/GabrieleLozupone/LDAE,,NOASSERTION,diffusion-models;medical-imaging;unsupervised-learning
547,TFF,End-to-end transformer framework for analyzing 4D fMRI time-series data,"A Python framework designed for the analysis of fMRI time-series data using Transformer architectures. It provides an end-to-end pipeline for processing 4D neuroimaging data, enabling researchers to apply attention-based deep learning models to functional magnetic resonance imaging tasks.",N1;N1-04,time_series_analysis;classification,framework,Python,https://github.com/GonyRosenman/TFF,,None,fmri;transformers;time-series;neuroimaging
548,LViT,Language-Vision Transformer for medical image segmentation,"The official implementation of the LViT (Language meets Vision Transformer) model for medical image segmentation. It integrates text information with visual features to improve segmentation performance, specifically targeting semi-supervised learning scenarios in medical imaging.",N1;N1-04,segmentation;multimodal_learning,solver,Python,https://github.com/HUANGLIZI/LViT,,MIT,medical-image-segmentation;vision-transformer;multimodal
549,IBGNN,Interpretable Graph Neural Networks for connectome-based brain disorder analysis,Implementation of an interpretable Graph Neural Network (GNN) framework for analyzing brain connectomes. It is designed to classify brain disorders while providing interpretability regarding the underlying brain network connections.,N1;N1-04,classification;graph_learning;connectomics,solver,Python,https://github.com/HennyJie/IBGNN,,None,gnn;brain-network;connectome;interpretability
550,EKAID,Expert Knowledge-Aware Image Difference Graph Representation Learning,"Code for a difference-aware medical visual question answering (VQA) system. It utilizes expert knowledge and graph representation learning to analyze differences in medical images, aiding in diagnostic interpretation.",N1;N1-04,visual_question_answering;representation_learning,solver,Python,https://github.com/Holipori/EKAID,,None,vqa;medical-imaging;graph-neural-networks
551,lstm_multi_modal_UNet,LSTM multi-modal U-Net for brain tumor segmentation,Implementation of a deep learning model combining LSTM and U-Net architectures for segmenting brain tumors from multi-modal MRI data. It captures spatial and sequence information to improve segmentation accuracy.,N1;N1-04,segmentation,solver,Python,https://github.com/HowieMa/lstm_multi_modal_UNet,,None,brain-tumor-segmentation;lstm;u-net;mri
552,MEW-UNet,Multi-axis representation learning in frequency domain for segmentation,"Official implementation of MEW-UNet, a medical image segmentation model that leverages multi-axis representation learning in the frequency domain to capture global and local features effectively.",N1;N1-04,segmentation;representation_learning,solver,Python,https://github.com/JCruan519/MEW-UNet,,Apache-2.0,medical-segmentation;frequency-domain;u-net
553,VS_Seg,Automatic Segmentation of Vestibular Schwannoma with MONAI,"A specialized tool for the automatic segmentation of Vestibular Schwannoma from MRI scans, built using the MONAI framework. Developed by KCL-BMEIS, it provides a robust pipeline for this specific clinical application.",N1;N1-04,segmentation,solver,Python,https://github.com/KCL-BMEIS/VS_Seg,,Apache-2.0,monai;vestibular-schwannoma;mri-segmentation
554,ITKPOCUS,Library for streaming and preprocessing point-of-care ultrasound video,"An open-source library developed by Kitware for handling point-of-care ultrasound (POCUS) video data. It supports streaming, preprocessing, and integration with ITK, facilitating the development of AI applications for ultrasound.",N1-04,preprocessing;video_processing,library,Jupyter Notebook,https://github.com/KitwareMedical/ITKPOCUS,,NOASSERTION,ultrasound;itk;pocus;video-streaming
555,MEDIAR,Data-Centric and Model-Centric framework for Multi-Modality Microscopy,"The winning solution for the NeurIPS 2022 CellSeg Challenge. It provides a robust framework for cell segmentation in multi-modality microscopy images, combining data-centric and model-centric approaches.",N1-04,segmentation;microscopy,solver,Python,https://github.com/Lee-Gihun/MEDIAR,,MIT,cell-segmentation;microscopy;neurips-challenge
556,3DUNet-BraTS-PyTorch,PyTorch 3D U-Net implementation for BraTS 2021,A robust PyTorch implementation of the 3D U-Net architecture specifically optimized for the Multimodal Brain Tumor Segmentation (BraTS) 2021 challenge. It serves as a baseline and tool for brain tumor segmentation tasks.,N1;N1-04,segmentation,solver,Python,https://github.com/LightersWang/3DUNet-BraTS-PyTorch,,None,brats;3d-unet;pytorch;segmentation
557,fastMONAI,High-level wrapper for MONAI to simplify medical deep learning,A library that simplifies the use of MONAI (Medical Open Network for AI) by providing a high-level API similar to fastai. It facilitates rapid development and training of deep learning models for medical imaging.,N1;N1-04,training_framework;image_processing,library,Jupyter Notebook,https://github.com/MMIV-ML/fastMONAI,https://fastmonai.no,Apache-2.0,monai;fastai;medical-imaging;deep-learning
558,mindGlide,Brain Segmentation with MONAI and Dynamic Unet,A tool for brain segmentation leveraging MONAI and Dynamic U-Net architectures. It provides a streamlined approach for segmenting brain structures from MRI data.,N1;N1-04,segmentation,solver,Python,https://github.com/MS-PINPOINT/mindGlide,,MIT,monai;brain-segmentation;dynamic-unet
559,Pytorch-Medical-Segmentation,Collection of PyTorch implementations for medical image segmentation,A comprehensive repository containing implementations of various state-of-the-art deep learning models for medical image segmentation in both 2D and 3D. It serves as a library/reference for applying these models to new datasets.,N1;N1-04,segmentation;model_library,library,Python,https://github.com/MontaEllis/Pytorch-Medical-Segmentation,,MIT,pytorch;medical-segmentation;3d-unet;vnet
560,monai-cloud-api,Client library for MONAI Cloud API,"The official client library and development tools for the MONAI Cloud API, enabling integration of MONAI's intelligent imaging and learning tools into cloud-based workflows and services.",N1;N1-04,cloud_computing;api_client,service,Jupyter Notebook,https://github.com/NVIDIA/monai-cloud-api,,Apache-2.0,monai;cloud-api;nvidia;medical-imaging
561,CNN_design_for_AD,Deep learning model for early Alzheimers disease detection,"Code for a generalizable deep learning model designed for the early detection of Alzheimers disease from structural MRI scans. Developed by NYU MedML, it provides a robust solver for this diagnostic task.",N1;N1-04,classification;diagnosis,solver,Jupyter Notebook,https://github.com/NYUMedML/CNN_design_for_AD,,AGPL-3.0,alzheimers;deep-learning;mri;classification
562,MobileUNETR,Lightweight hybrid Vision Transformer for medical image segmentation,"A lightweight end-to-end hybrid Vision Transformer (ViT) designed for efficient medical image segmentation, offering a balance between performance and computational cost.",N1;N1-04,segmentation;medical_imaging,solver,Python,https://github.com/OSUPCVLab/MobileUNETR,,None,transformer;segmentation;medical-imaging
563,MedViT,Robust Vision Transformer for generalized medical image classification,"A robust Vision Transformer architecture tailored for medical image classification tasks, addressing generalization challenges in healthcare imaging data.",N1;N1-04,classification;medical_imaging,solver,Python,https://github.com/Omid-Nejati/MedViT,,MIT,vision-transformer;classification;medical-imaging
564,MONAI Generative Models,Generative models framework for medical imaging,"A library within the MONAI ecosystem dedicated to training, evaluating, and deploying generative models (GANs, Diffusion Models) for medical imaging applications.",N1;N1-04,image_synthesis;generative_modeling,library,Jupyter Notebook,https://github.com/Project-MONAI/GenerativeModels,https://monai.io/,Apache-2.0,generative-ai;diffusion-models;medical-imaging
565,MONAI,AI Toolkit for Healthcare Imaging,"A comprehensive, community-supported, PyTorch-based framework for deep learning in healthcare imaging, providing domain-optimized foundational capabilities for data loading, preprocessing, and model training.",N1;N1-04,deep_learning_framework;image_processing,platform,Python,https://github.com/Project-MONAI/MONAI,https://monai.io/;https://docs.monai.io/,Apache-2.0,deep-learning;healthcare;medical-imaging
566,MONAI Label,Intelligent open source image labeling and learning tool,"A server-client system that facilitates AI-assisted annotation of medical imaging data, integrating with viewers like 3D Slicer and OHIF to accelerate dataset creation.",N1;N1-04,annotation;active_learning,application,Python,https://github.com/Project-MONAI/MONAILabel,https://monai.io/label.html,Apache-2.0,annotation;segmentation;active-learning
567,SlicerMONAIViz,3D Slicer extension for MONAI model visualization,A 3D Slicer extension that enables visualization and interaction with MONAI models and their outputs directly within the Slicer environment.,N1;N1-04,visualization;integration,solver,Python,https://github.com/Project-MONAI/SlicerMONAIViz,,Apache-2.0,3d-slicer;visualization;plugin
568,VISTA,Versatile Imaging Segmentation and Annotation foundation model,"A foundation model framework for versatile medical image segmentation and annotation, designed to handle diverse segmentation tasks across different modalities.",N1;N1-04,segmentation;foundation_model,solver,Python,https://github.com/Project-MONAI/VISTA,,Apache-2.0,foundation-model;segmentation;annotation
569,MONAI Deploy,Framework for deploying medical AI applications,"A framework designed to become the standard for developing, packaging, testing, and running medical AI applications in clinical production environments.",N1;N1-04,deployment;clinical_workflow,workflow,Shell,https://github.com/Project-MONAI/monai-deploy,https://monai.io/deploy.html,Apache-2.0,deployment;clinical-ai;workflow
570,MONAI Deploy App SDK,SDK for developing AI-driven healthcare imaging applications,"A software development kit providing tools and interfaces to design, develop, and verify AI applications (MAPs) for healthcare imaging.",N1;N1-04,application_development;deployment,library,Jupyter Notebook,https://github.com/Project-MONAI/monai-deploy-app-sdk,,Apache-2.0,sdk;deployment;healthcare
571,MONAI Deploy Informatics Gateway,DICOM integration and data ingestion service,"A service that facilitates integration with DICOM systems, enabling ingestion of imaging data and triggering of AI workflows in clinical settings.",N1;N1-04,data_ingestion;dicom_integration,service,C#,https://github.com/Project-MONAI/monai-deploy-informatics-gateway,,Apache-2.0,dicom;integration;pacs
572,DeepNeuro,Deep learning python package for neuroimaging data,"A Python package providing deep learning tools specifically for neuroimaging data analysis, including preprocessing and segmentation utilities.",N1;N1-04,neuroimaging_analysis;segmentation,library,Jupyter Notebook,https://github.com/QTIM-Lab/DeepNeuro,,MIT,neuroimaging;deep-learning;python
573,PRIOR,Prototype Representation Joint Learning from Medical Images and Reports,"Implementation of a method for joint learning from medical images and reports using prototype representations, useful for multi-modal medical AI research.",N1;N1-04,multi_modal_learning;representation_learning,solver,Python,https://github.com/QtacierP/PRIOR,,Apache-2.0,multi-modal;medical-reports;representation-learning
574,RAUNet,Residual Attention U-Net for tumor segmentation,Implementation of a Residual Attention U-Net architecture specifically designed for tumor segmentation in liver and brain MRI images.,N1;N1-04,segmentation;tumor_detection,solver,Python,https://github.com/RanSuLab/RAUNet-tumor-segmentation,,None,unet;attention-mechanism;segmentation
575,EViT-Unet,Efficient Vision Transformer for medical image segmentation,"A U-Net like Efficient Vision Transformer model designed for medical image segmentation, optimized for mobile and edge devices.",N1;N1-04,segmentation;edge_computing,solver,Python,https://github.com/Retinal-Research/EVIT-UNET,,MIT,vision-transformer;segmentation;efficient-ai
576,TorchIO,Medical imaging processing for AI applications,"A Python library for efficient loading, preprocessing, augmentation, and patch-based sampling of 3D medical images for deep learning.",N1;N1-04,data_augmentation;image_preprocessing,library,Python,https://github.com/TorchIO-project/torchio,https://torchio.readthedocs.io/,Apache-2.0,augmentation;preprocessing;3d-imaging
577,SwiFT,Swin 4D fMRI Transformer,"Implementation of a Swin Transformer-based model for analyzing 4D fMRI data, enabling advanced functional connectivity studies.",N1;N1-04,fmri_analysis;spatiotemporal_modeling,solver,Python,https://github.com/Transconnectome/SwiFT,,Apache-2.0,fmri;transformer;4d-analysis
578,Generative Brain ControlNet,ControlNet training on Brain data using MONAI,A repository providing implementations for training ControlNet models on brain MRI data (UK Biobank) using the MONAI Generative Models framework.,N1;N1-04,image_synthesis;generative_modeling,solver,Python,https://github.com/Warvito/generative_brain_controlnet,,Apache-2.0,controlnet;brain-mri;generative-ai
579,Generative Chest X-ray,Latent Diffusion Models for Chest X-ray,"A repository for training Latent Diffusion Models on Chest X-ray data using MONAI, serving as a reference implementation for medical image generation.",N1;N1-04,image_synthesis;generative_modeling,solver,Python,https://github.com/Warvito/generative_chestxray,,Apache-2.0,diffusion-models;chest-xray;generative-ai
580,Generative MONAI,Generative AI extension for the MONAI medical imaging framework,"A dedicated extension of the MONAI framework focused on generative models for medical imaging, enabling tasks such as image synthesis, translation, and augmentation using state-of-the-art diffusion and GAN-based approaches.",N1;N1-04,synthesis;augmentation;image_generation,library,Python,https://github.com/Warvito/generative_monai,,None,medical-imaging;generative-ai;diffusion-models;monai
581,FLARE22 Champion Solution,Efficient 3D medical image segmentation solution based on nnU-Net,"The champion solution for the MICCAI FLARE22 challenge, providing a highly optimized and efficient implementation of nnU-Net for 3D abdominal organ segmentation, serving as a strong baseline and solver for similar volumetric segmentation tasks.",N1;N1-04,segmentation;image_processing,solver,Python,https://github.com/Ziyan-Huang/FLARE22,,Apache-2.0,segmentation;nnunet;medical-imaging;miccai
582,im2im-uq,Image-to-image regression with distribution-free uncertainty quantification,"A PyTorch library for performing image-to-image regression tasks with rigorous, distribution-free uncertainty quantification, applicable to scientific imaging tasks like reconstruction and denoising where reliability is critical.",N1;N1-04,uncertainty_quantification;image_regression;reconstruction,library,Python,https://github.com/aangelopoulos/im2im-uq,,MIT,uncertainty-quantification;pytorch;image-regression;conformal-prediction
583,BrainDiVE,Brain diffusion model for cortical discovery and visual exploration,"A generative model framework leveraging diffusion models to explore and visualize cortical patterns, enabling the discovery of brain surface features and synthesis of neuroimaging data.",N1;N1-04,synthesis;structure_prediction;visualization,solver,Python,https://github.com/aluo-x/BrainDiVE,,Apache-2.0,diffusion-models;neuroimaging;cortical-surface;generative-ai
584,ClinicaDL,Framework for reproducible deep learning processing of neuroimaging data,"An open-source software framework for reproducible clinical neuroimaging analysis using deep learning, providing workflows for data preprocessing, classification, reconstruction, and interpretation of MRI and PET data.",N1;N1-04,workflow_management;classification;reconstruction;preprocessing,workflow,Python,https://github.com/aramis-lab/clinicadl,https://clinicadl.readthedocs.io,MIT,neuroimaging;deep-learning;reproducibility;alzheimers-disease
585,Context-Aware SSL,Graph-based self-supervised representation learning for medical images,"A PyTorch implementation of a context-aware self-supervised learning framework that utilizes graph structures to learn robust representations from medical images, improving downstream analysis tasks.",N1;N1-04,representation_learning;image_analysis,solver,Python,https://github.com/batmanlab/Context_Aware_SSL,,MIT,self-supervised-learning;medical-imaging;graph-neural-networks;representation-learning
586,Synthetic Sleep EEG Diffusion,Latent diffusion models for synthetic sleep EEG signal generation,"A deep learning tool utilizing latent diffusion models to generate high-fidelity synthetic sleep EEG signals, aiding in data augmentation and model training for sleep analysis.",N1;N1-04,synthesis;data_generation;augmentation,solver,Python,https://github.com/bruAristimunha/Synthetic-Sleep-EEG-Signal-Generation-using-Latent-Diffusion-Models,,BSD-3-Clause,eeg;diffusion-models;synthetic-data;sleep-analysis
587,DNNWSP,Deep neural network with weight sparsity control for brain connectivity classification,"A deep learning solver implementing L1-norm regularization (weight sparsity) to improve classification performance on whole-brain resting-state functional connectivity patterns, specifically for schizophrenia diagnosis.",N1;N1-04,classification;biomarker_identification;analysis,solver,Jupyter Notebook,https://github.com/bsplku/dnnwsp,,None,fmri;schizophrenia;deep-learning;connectivity
588,Self-Supervised MRI Reconstruction,Parallel network training framework for self-supervised MRI reconstruction,A self-supervised learning framework for MRI reconstruction that employs a parallel network training strategy to achieve high-quality image reconstruction without fully sampled ground truth.,N1;N1-04,reconstruction;image_processing,solver,Python,https://github.com/chenhu96/Self-Supervised-MRI-Reconstruction,,MIT,mri-reconstruction;self-supervised-learning;medical-imaging
589,ViT-AE++,Improved Vision Transformer Autoencoder for medical image representation learning,An advanced Vision Transformer Autoencoder (ViT-AE) architecture designed to learn robust and transferable self-supervised representations from medical images.,N1;N1-04,representation_learning;image_analysis,solver,Python,https://github.com/chinmay5/vit_ae_plus_plus,,CC0-1.0,vision-transformer;self-supervised-learning;medical-imaging;autoencoder
590,ASCENT,Toolbox for cardiac ultrasound segmentation and color-Doppler dealiasing,"A comprehensive toolbox for cardiac ultrasound analysis, providing tools for segmentation and color-Doppler dealiasing, supporting advanced cardiovascular imaging research.",N1;N1-04,segmentation;denoising;image_processing,library,Python,https://github.com/creatis-myriad/ASCENT,,Apache-2.0,ultrasound;cardiac-imaging;segmentation;dealiasing
591,C2FViT,Affine medical image registration using Coarse-to-Fine Vision Transformer,A deep learning solver for affine medical image registration that utilizes a Coarse-to-Fine Vision Transformer architecture to achieve robust and accurate alignment of 3D medical images.,N1;N1-04,registration;alignment;image_processing,solver,Python,https://github.com/cwmok/C2FViT,,MIT,image-registration;vision-transformer;medical-imaging;affine-registration
592,SlicerTorchIO,3D Slicer module for TorchIO medical image processing,"A 3D Slicer extension that integrates TorchIO, enabling advanced medical image augmentation and preprocessing directly within the Slicer environment.",N1;N1-04,data_processing;augmentation,solver,Python,https://github.com/fepegar/SlicerTorchIO,,NOASSERTION,3d-slicer;torchio;augmentation;medical-imaging
