id,name,one_line_profile,detailed_description,domains,subtask_category,application_level,primary_language,repo_url,help_website,license,tags
874,Adaptive,Parallel active learning of mathematical functions,"Adaptive is a library for parallel active learning of mathematical functions. It provides tools to sample functions intelligently, focusing on areas of interest to minimize the number of evaluations required, which is particularly useful for expensive simulations.",R2;R2-03,active_learning;sampling;function_approximation,library,Python,https://github.com/python-adaptive/adaptive,https://adaptive.readthedocs.io/,BSD-3-Clause,active-learning;sampling;parallel-computing
875,CUTEst,Testing environment for optimization software,"CUTEst (Constrained and Unconstrained Testing Environment with safe threads) is a versatile testing environment for optimization software, providing a large collection of test problems for evaluating optimization algorithms.",R2;R2-03,benchmarking;optimization_testing,dataset,Fortran,https://github.com/ralna/CUTEst,https://github.com/ralna/CUTEst/wiki,NOASSERTION,optimization;benchmarking;test-problems
876,autolgbm,AutoML tool for LightGBM with Optuna tuning,autolgbm is an AutoML tool that automates the training and hyperparameter tuning of LightGBM models using Optuna. It streamlines the process of building gradient boosting models from CSV data.,R2;R2-03,automl;hyperparameter_optimization;model_training,solver,Python,https://github.com/rishiraj/autolgbm,,Apache-2.0,automl;lightgbm;optuna
877,GENO,Solver for non-linear constrained and unconstrained optimization problems,GENO (GENeric Optimization) is a solver for non-linear optimization problems that can handle both constrained and unconstrained scenarios. It automatically generates a solver instance for the specified optimization problem.,R2;R2-03,optimization;non_linear_optimization,solver,Python,https://github.com/slaue/genosolver,http://www.genosolver.org,AGPL-3.0,optimization;solver;non-linear
878,LAMP,Deep learning-based surrogate model for optimizing computational cost via remeshing,"LAMP is a deep learning-based surrogate model that jointly learns the evolution model of a physical system and optimizes the computational cost via remeshing, useful for accelerating expensive simulations.",R2;R2-03,surrogate_modeling;simulation_acceleration,solver,Python,https://github.com/snap-stanford/lamp,,MIT,surrogate-model;deep-learning;physics-simulation
879,BayesianInference,Wolfram Language application for Bayesian inference and Gaussian process regression,"A Mathematica application designed to perform Bayesian inference and Gaussian process regression, facilitating statistical analysis and modeling.",R2;R2-03,bayesian_inference;gaussian_process,library,Mathematica,https://github.com/ssmit1986/BayesianInference,,MIT,bayesian-inference;gaussian-process;mathematica
880,NLopt,Library for nonlinear optimization wrapping many algorithms,"NLopt is a library for nonlinear optimization, providing a common interface for various global and local optimization algorithms, including constrained and unconstrained methods.",R2;R2-03,optimization;non_linear_optimization,library,C,https://github.com/stevengj/nlopt,https://nlopt.readthedocs.io,LGPL-2.1,optimization;nonlinear;solver-collection
881,STK,Small Toolbox for Kriging (Gaussian Processes) in MATLAB,"The STK is a MATLAB toolbox focused on Kriging (Gaussian Process regression), providing tools for interpolation, regression, and covariance function modeling.",R2;R2-03,gaussian_process;kriging;regression,library,MATLAB,https://github.com/stk-kriging/stk,http://kriging.sourceforge.net/,GPL-3.0,kriging;gaussian-process;matlab
882,robustgp,Robust Gaussian Process with Iterative Trimming,"A library implementing Robust Gaussian Processes using iterative trimming to handle outliers in data, developed by SYRTE.",R2;R2-03,gaussian_process;regression;robust_statistics,library,Jupyter Notebook,https://github.com/syrte/robustgp,,MIT,gaussian-process;robust-regression;outlier-detection
883,Tea-Lang,DSL for experimental design and statistical analysis,"Tea is a domain-specific language that automates the selection of statistical tests and experimental designs, helping researchers conduct valid statistical analysis.",R2;R2-03,experimental_design;statistical_analysis,library,Python,https://github.com/tea-lang-org/tea-lang,http://tea-lang.org/,Apache-2.0,dsl;statistics;experimental-design
884,LLAMBO,Large Language Models to Enhance Bayesian Optimization,"LLAMBO is a framework that leverages Large Language Models to improve the efficiency and performance of Bayesian Optimization tasks, particularly for black-box functions.",R2;R2-03,bayesian_optimization;llm_agent,solver,Python,https://github.com/tennisonliu/LLAMBO,,MIT,bayesian-optimization;llm;hpo
885,iterate,Benchmarking and hyper-parameter optimization tool using TerraTorch,"A tool for benchmarking and hyperparameter optimization that integrates MLFlow, Optuna, and Ray, designed to streamline the experimental iteration process.",R2;R2-03,hyperparameter_optimization;benchmarking,workflow,Jupyter Notebook,https://github.com/terrastackai/iterate,,Apache-2.0,hpo;benchmarking;optuna
886,sparseGP_powerEP,Sparse approximations for Gaussian process regression using Power EP,A Python implementation of unified sparse approximations for Gaussian process regression and classification using Power Expectation Propagation.,R2;R2-03,gaussian_process;regression;approximation,solver,Python,https://github.com/thangbui/sparseGP_powerEP,,GPL-3.0,gaussian-process;sparse-approximation;expectation-propagation
887,IterativeLQR.jl,Julia package for constrained iterative LQR (iLQR),"A Julia package implementing the constrained iterative Linear Quadratic Regulator (iLQR) algorithm, used for optimal control and trajectory optimization.",R2;R2-03,optimal_control;optimization,library,Julia,https://github.com/thowell/IterativeLQR.jl,,MIT,control-theory;ilqr;julia
888,Test_Functions_for_Multi-objective_Optimization,Collection of test functions for multi-objective optimization,A MATLAB repository providing standard test functions for benchmarking multi-objective optimization algorithms.,R2;R2-03,optimization;benchmarking,library,MATLAB,https://github.com/tomtkg/Test_Functions_for_Multi-objective_Optimization,,MIT,multi-objective-optimization;benchmark;test-functions
889,cspy,Algorithms for Constrained Shortest Path problems,"A library providing algorithms to solve the Resource Constrained Shortest Path problem, applicable in network optimization and operations research.",R2;R2-03,optimization;graph_optimization,library,C++,https://github.com/torressa/cspy,https://cspy.readthedocs.io,MIT,shortest-path;optimization;graph-theory
890,mystic,Constrained nonlinear optimization framework for scientific ML and UQ,"A framework for highly constrained non-convex optimization and uncertainty quantification, capable of handling complex constraints in scientific machine learning problems.",R2;Scientific_ML,constrained_optimization;uncertainty_quantification,library,Python,https://github.com/uqfoundation/mystic,https://mystic.readthedocs.io,NOASSERTION,optimization;uncertainty-quantification;sciml
891,DeepBedMap,Super-resolution deep neural network for Antarctica bed elevation mapping,"A deep learning model and data repository for generating high-resolution bed elevation maps of Antarctica, going beyond BEDMAP2.",Earth_Science;Geophysics,data_generation;super_resolution,dataset,Jupyter Notebook,https://github.com/weiji14/deepbedmap,,LGPL-3.0,antarctica;topography;deep-learning
892,pytorch-lattice,Constrained optimization and modeling with Lattice models in PyTorch,"A PyTorch library for training lattice models, which enforce monotonic constraints and are interpretable, useful for scientific modeling with prior knowledge.",R2;Scientific_ML,constrained_modeling;interpretable_ml,library,Python,https://github.com/willbakst/pytorch-lattice,,MIT,pytorch;lattice-models;constrained-optimization
893,optuna-distributed,Distributed execution extension for Optuna hyperparameter optimization,"A wrapper to facilitate distributed hyperparameter optimization using Optuna, enabling scaling of optimization tasks.",R2,hyperparameter_optimization;distributed_computing,library,Python,https://github.com/xadrianzetx/optuna-distributed,,MIT,optuna;distributed;optimization
894,ConvertChanceConstraint-ccc,MATLAB toolbox for Chance-constrained Optimization,"A toolbox for handling chance constraints in optimization problems, useful for robust design and control under uncertainty.",R2;Control,chance_constrained_optimization;robust_optimization,library,MATLAB,https://github.com/xb00dx/ConvertChanceConstraint-ccc,,GPL-3.0,optimization;chance-constraints;matlab
895,GraphDot,GPU-accelerated Marginalized Graph Kernel and GPR library,"A library for GPU-accelerated graph kernels and Gaussian process regression, suitable for chemoinformatics and materials science applications involving molecular graphs.",R2;Chemoinformatics,graph_kernel;gaussian_process_regression,library,Python,https://github.com/yhtang/GraphDot,https://graphdot.readthedocs.io,NOASSERTION,graph-kernels;gpu;gaussian-processes
896,Multi-Objective District Energy Optimization,Optimization solver for operation planning of district energy systems,"A Python-based tool for multi-objective optimization of district energy system operation planning. It aims to minimize operating costs and emissions under uncertainties, serving as a specialized solver for energy systems engineering.",R2-03;Energy Systems,multi_objective_optimization;energy_planning;cost_minimization,solver,Python,https://github.com/zahraghh/multi_objective_optimization,,GPL-3.0,energy-systems;multi-objective-optimization;sustainability
897,Medical Segmentation PyTorch,PyTorch library for medical image semantic segmentation models,"A comprehensive PyTorch implementation of various medical semantic segmentation architectures (UNet, UNet++, DUCKNet, etc.). It supports advanced features like knowledge distillation, distributed training, and hyperparameter optimization via Optuna, specifically tailored for medical imaging tasks.",Medical Imaging;Computer Vision,semantic_segmentation;medical_image_analysis;hyperparameter_optimization,library,Python,https://github.com/zh320/medical-segmentation-pytorch,,Apache-2.0,medical-imaging;segmentation;pytorch;optuna
898,Realtime Segmentation PyTorch,High-performance library for realtime semantic segmentation models,"A PyTorch library implementing over 30 realtime semantic segmentation models (BiSeNet, DDRNet, etc.). While general-purpose, it provides essential infrastructure for computer vision tasks in scientific monitoring and robotics, including support for distributed training and Optuna-based optimization.",Computer Vision;Robotics,semantic_segmentation;realtime_inference;hyperparameter_optimization,library,Python,https://github.com/zh320/realtime-semantic-segmentation-pytorch,,Apache-2.0,semantic-segmentation;realtime;pytorch;computer-vision
899,Bayesian Optimization Algorithms (MATLAB),Collection of Bayesian optimization algorithms for various problem settings,"A MATLAB library providing a suite of Bayesian optimization algorithms, covering standard, high-dimensional, parallel, constrained, and multi-objective formulations. It serves as a toolkit for researchers needing diverse BO strategies.",R2;R2-03,bayesian_optimization;multi_objective_optimization;constrained_optimization,library,MATLAB,https://github.com/zhandawei/Bayesian_Optimization_Algorithms,,None,bayesian-optimization;matlab;multi-objective
900,Max-value Entropy Search (MES),Implementation of Max-value Entropy Search for efficient Bayesian Optimization,"A MATLAB implementation of the Max-value Entropy Search (MES) acquisition function. It is designed for efficient Bayesian optimization, particularly useful in scenarios where evaluating the objective function is expensive.",R2;R2-03,bayesian_optimization;acquisition_function,solver,MATLAB,https://github.com/zi-w/Max-value-Entropy-Search,,MIT,bayesian-optimization;entropy-search;matlab
901,REMBO,Bayesian optimization for high-dimensional problems via random embedding,"A MATLAB implementation of REMBO (Random EMbedding Bayesian Optimization), a technique designed to scale Bayesian optimization to high-dimensional parameter spaces by leveraging low-dimensional effective subspaces.",R2;R2-03,bayesian_optimization;high_dimensional_optimization;dimensionality_reduction,solver,MATLAB,https://github.com/ziyuw/rembo,,None,bayesian-optimization;high-dimensional;matlab
902,5G-ERA Middleware,Middleware for orchestration and lifecycle management of cloud-native robotic applications,"A middleware solution developed as part of the 5G-ERA project to facilitate the orchestration, lifecycle management, and integration of cloud-native robotic applications, enabling seamless communication between robots and cloud services.",R2-04;Robotics,robot_orchestration;cloud_robotics,platform,C#,https://github.com/5G-ERA/middleware,,Apache-2.0,robotics;middleware;cloud-native;orchestration
903,ARES OS,Research software for closed-loop autonomous experimentation systems,"ARES OS is a software framework designed by AFRL to streamline the creation and management of systems for closed-loop, autonomous experimentation, facilitating the integration of hardware and AI algorithms for scientific discovery.",R2;R2-04,autonomous_experimentation;closed_loop_control,platform,C#,https://github.com/AFRL-ARES/ARES_OS,,NOASSERTION,autonomous-experimentation;closed-loop;lab-automation
904,CL-DiffPhyCon,Closed-loop diffusion control for physical systems,"Implementation of a closed-loop diffusion control method for physical systems, achieving significant speedup in sampling efficiency for scientific control tasks.",R2;Physics,physical_control;diffusion_model;simulation,solver,Python,https://github.com/AI4Science-WestlakeU/CL_DiffPhyCon,,MIT,diffusion-models;control-systems;physics-ai
905,Nokia Bell Labs-MIT ROS Mapping Platform,Middleware for mapping ROS sensor data to non-ROS robotic systems,A middleware platform developed in collaboration between MIT Manipal and Nokia Bell Labs to enable the mapping and integration of ROS sensor data with non-ROS sensor data in robotic systems.,R2-04;Robotics,sensor_integration;data_mapping,library,C#,https://github.com/AdityaPradhan1/Nokia_Bell_Labs-MIT_Manipal-ROS_Mapping_Platform,,MIT,ros;middleware;sensor-fusion;robotics
906,Autodesk Machine Control Framework,Middleware for integrating CAD/CAM with machine hardware,"A middleware framework designed to integrate CAD/CAM software with machine hardware systems, enabling the creation of production-ready, cohesive closed-loop manufacturing and control systems.",R2-04;Manufacturing,machine_control;closed_loop_manufacturing,platform,C++,https://github.com/Autodesk/AutodeskMachineControlFramework,,NOASSERTION,machine-control;cad-cam;closed-loop;middleware
907,AtvK4200Lpt,Python control module for Keithley 4200 SCS,"A Python module providing an interface to control the Keithley 4200 Semiconductor Characterization System (SCS) instrument functions, enabling automated electrical testing and measurement.",R2-04;Electronics,instrument_control;measurement,library,C++,https://github.com/AutomatisierungsTechnik-Voigt-GmbH/AtvK4200Lpt,,NOASSERTION,keithley;instrument-control;semiconductor-testing
908,aiida-gromacs,GROMACS plugin for AiiDA workflow engine,"A plugin that interfaces GROMACS molecular dynamics software with the AiiDA workflow management system, enabling automated and reproducible biomolecular simulations.",R2;Molecular_Dynamics,workflow_automation;molecular_simulation,library,Python,https://github.com/CCPBioSim/aiida-gromacs,,MIT,aiida;gromacs;molecular-dynamics;workflow
909,WeightWatcher,Diagnostic tool for analyzing Deep Neural Networks using statistical physics,"A tool that applies ideas from statistical mechanics (Random Matrix Theory) to analyze the weight matrices of Deep Neural Networks, providing diagnostics for model accuracy and generalization capability without needing test data.",R2;AI_Theory,model_analysis;quality_control,solver,Python,https://github.com/CalculatedContent/WeightWatcher,https://weightwatcher.ai,Apache-2.0,random-matrix-theory;model-diagnostics;statistical-mechanics
910,concore,Framework for closed-loop peripheral neuromodulation control,"A framework designed for building closed-loop control systems for peripheral neuromodulation, facilitating real-time interaction with neural interfaces.",R2-04;Neuroscience,neuromodulation;closed_loop_control,platform,SWIG,https://github.com/ControlCore-Project/concore,,LGPL-2.1,neuromodulation;closed-loop;bio-interface
911,hyperion,Unattended data collection system using BlueSky/Ophyd,"A system for unattended data collection at Diamond Light Source, utilizing the BlueSky and Ophyd frameworks to automate synchrotron experiments.",R2-04;Synchrotron_Science,data_collection;experiment_automation,workflow,Python,https://github.com/DiamondLightSource/hyperion,,BSD-3-Clause,bluesky;ophyd;synchrotron;automation
912,Plateo,"Python library for planning, simulating, and reporting laboratory automation experiments","A library designed to assist in the automation of biological laboratories. It provides functionalities for parsing plate data, generating reports, and simulating liquid handling picklists, facilitating the workflow between experimental design and robotic execution.",R2;R2-04;Biology,lab_automation;experiment_simulation;data_parsing,library,Python,https://github.com/Edinburgh-Genome-Foundry/Plateo,,MIT,lab-automation;biology;liquid-handling
913,gpudrive,High-performance multi-agent driving simulator for reinforcement learning,"A GPU-accelerated driving simulator capable of running over 1 million FPS. It is designed for multi-agent reinforcement learning research in autonomous driving, enabling rapid training and evaluation of driving policies.",R2;R2-04;Robotics,simulation;reinforcement_learning,solver,Jupyter Notebook,https://github.com/Emerge-Lab/gpudrive,,MIT,simulator;autonomous-driving;multi-agent-rl
914,neural-processes,PyTorch implementation of Neural Processes for function approximation and uncertainty estimation,"An implementation of Neural Processes, a class of neural networks that combine the benefits of Gaussian Processes (uncertainty estimation) and deep learning (computational efficiency). Useful for meta-learning and modeling scientific data with uncertainty.",Machine Learning;Scientific Modeling,modeling;uncertainty_estimation,library,Jupyter Notebook,https://github.com/EmilienDupont/neural-processes,,MIT,neural-processes;pytorch;meta-learning
915,adaptive_motion_control,ROS middleware for adaptive motion control of industrial robots,"A middleware enabling fast switching between collision-free motion planning (MoveIt), cartesian/joint jogging, and pose tracking for industrial robots. It bridges high-level planning with low-level robot drivers.",R2;R2-04;Robotics,motion_control;path_planning,library,C++,https://github.com/FAU-FAPS/adaptive_motion_control,,Apache-2.0,ros;robotics;motion-control
916,gea-PRISM,Software framework for autonomous experimentation,"Codebase for the PRISM Autonomous Experimentation Group, likely containing algorithms and control logic for self-driving laboratories and automated experimental loops.",R2;R2-04;Autonomous Experimentation,autonomous_experimentation;experimental_control,platform,C++,https://github.com/FreeJaus/gea-PRISM,,GPL-3.0,autonomous-labs;experimentation;automation
917,LLMatDesign,Autonomous materials discovery framework using Large Language Models,A framework that leverages Large Language Models (LLMs) to autonomously design and discover new materials. It integrates LLM reasoning with domain-specific knowledge for materials science tasks.,Materials Science;AI4S,materials_discovery;generative_design,solver,Python,https://github.com/Fung-Lab/LLMatDesign,,MIT,llm;materials-science;discovery
918,NetBridgeForSwarm,Network communication middleware for ROS1 swarm robotics,"A middleware designed for ROS1 environments to facilitate remote transmission of services, topics, and images among swarm robots. It simplifies the construction of complex communication networks for cluster robotics research.",R2;R2-04;Robotics,robot_communication;swarm_robotics,library,C++,https://github.com/Gaiwqqq/NetBridgeForSwarm,,BSD-3-Clause,ros;swarm-robotics;middleware
919,Deploy-an-RL-policy-on-the-Unitree-Go2-robot,Sim2Real framework for deploying RL policies to Unitree Go2 robots,"A framework for low-level control of the Unitree Go2 legged robot using ROS 2. It supports validating control policies in MuJoCo simulation and deploying them to the real robot, facilitating Sim2Real research.",R2;R2-04;Robotics,sim2real;robot_control;reinforcement_learning,workflow,C++,https://github.com/Glowing-Torch/Deploy-an-RL-policy-on-the-Unitree-Go2-robot,,MIT,robotics;reinforcement-learning;sim2real
920,ASER,Large-scale weighted eventuality knowledge graph for commonsense reasoning,"A large-scale knowledge graph focusing on activities, states, events, and their relations. It provides data and tools for commonsense reasoning and event understanding in AI research.",AI Research;Knowledge Graphs,knowledge_representation;reasoning,dataset,Python,https://github.com/HKUST-KnowComp/ASER,,MIT,knowledge-graph;commonsense-reasoning;nlp
921,mujoco_sim,ROS interface for the MuJoCo physics simulator,"A ROS package that provides an interface to the MuJoCo simulator, allowing roboticists to use MuJoCo for physics-based simulation within the ROS ecosystem.",R2;R2-04;Robotics,simulation;robot_interface,library,C++,https://github.com/HoangGiang93/mujoco_sim,,MIT,ros;mujoco;simulation
922,ado,Framework for executing benchmarks and computational experiments at scale,"An extendible framework designed to manage and execute large-scale computational experiments and benchmarks, facilitating reproducible research and performance evaluation.",R2;Computational Science,experiment_management;benchmarking,workflow,Python,https://github.com/IBM/ado,,MIT,benchmarking;experiment-management;hpc
923,Zelig,Statistical framework for estimating causal effects and modeling,"A statistical framework in R that provides a unified interface to a wide range of statistical models, simplifying the process of estimating, interpreting, and presenting results, particularly for causal inference.",Statistics;Data Science,statistical_modeling;causal_inference,library,R,https://github.com/IQSS/Zelig,,None,statistics;r;causal-inference
924,cable_robot,Control software for custom cable-driven robots,"A repository containing the code to control and operate a custom cable-driven robot, supporting research in robotics kinematics and control.",R2;R2-04;Robotics,robot_control;kinematics,solver,C++,https://github.com/IRMA-LAB/cable_robot,,GPL-3.0,robotics;cable-robot;control
925,Chemosensitivity,Tool for predicting chemosensitivity from gene expression data,"A research tool implemented in R for predicting the sensitivity of cells to chemical compounds based on gene expression profiles, useful in pharmacogenomics and cancer research.",Bioinformatics;Pharmacology,drug_response_prediction;gene_expression_analysis,library,R,https://github.com/JWellsBio/Chemosensitivity,,None,bioinformatics;chemosensitivity;gene-expression
926,SoftwareDefinedRadio4JUCE,Framework for building Software Defined Radio applications with JUCE,A framework that provides a hardware abstraction layer and DSP classes for creating Software Defined Radio (SDR) applications using the JUCE framework. Applicable in radio astronomy and signal processing research.,Signal Processing;Physics,signal_processing;data_acquisition,framework,C++,https://github.com/JanosGit/SoftwareDefinedRadio4JUCE,,GPL-3.0,sdr;dsp;juce
927,aiida-fleur,AiiDA plugin for the FLEUR DFT code,A plugin for the AiiDA workflow engine that interfaces with the FLEUR code (a FLAPW DFT implementation). It enables high-throughput electronic structure calculations and automated workflows in materials science.,Materials Science;R2,workflow_automation;electronic_structure_calculation,library,Python,https://github.com/JuDFTteam/aiida-fleur,,NOASSERTION,aiida;dft;materials-science
928,aiida-kkr,AiiDA plugin for the JuKKR DFT code,A plugin for the AiiDA workflow engine that interfaces with the JuKKR code (KKR Green function method). It supports high-throughput density functional theory calculations for materials science.,Materials Science;R2,workflow_automation;electronic_structure_calculation,library,Python,https://github.com/JuDFTteam/aiida-kkr,,MIT,aiida;dft;kkr
929,ClosedLoopReachability.jl,Reachability analysis tool for closed-loop control systems,A Julia library for performing reachability analysis on closed-loop control systems. It is used in formal verification and control theory to guarantee system safety and performance.,Control Theory;Mathematics,reachability_analysis;formal_verification,library,Polar,https://github.com/JuliaReach/ClosedLoopReachability.jl,,MIT,julia;control-theory;reachability
930,icVision,Computer vision framework for the iCub humanoid robot,"A modular framework for performing computer vision tasks such as object recognition and localisation in 3D space, specifically designed for the iCub humanoid robot to support cognitive robotics research.",R2;R2-04;Robotics,computer_vision;robot_perception,framework,C++,https://github.com/Juxi/icVision,,None,robotics;computer-vision;icub
