id,name,one_line_profile,detailed_description,domains,subtask_category,application_level,primary_language,repo_url,help_website,license,tags
555,BayesianOptimization.jl (jbrea),Bayesian optimization library for Julia,"A flexible Julia package for performing Bayesian Optimization, supporting various acquisition functions and surrogate models.",R2;R2-01,bayesian_optimization,library,Julia,https://github.com/jbrea/BayesianOptimization.jl,,NOASSERTION,julia;bayesian-optimization
556,lipo,"Global, derivative-free optimization for hyperparameter tuning","A Python implementation of the LIPO (Lipschitz Optimization) algorithm for global, derivative-free optimization, particularly useful for hyperparameter tuning.",R2;R2-01,global_optimization;derivative_free_optimization,library,Jupyter Notebook,https://github.com/jdb78/lipo,,MIT,optimization;lipo;hyperparameter-tuning
557,Jenetics,Genetic Algorithm and Evolutionary Algorithm library for Java,"An advanced Genetic Algorithm, Genetic Programming, and Evolutionary Algorithm library written in Java, supporting multi-objective optimization.",R2;R2-01,evolutionary_algorithms;genetic_algorithm;multi_objective_optimization,library,Java,https://github.com/jenetics/jenetics,https://jenetics.io/,Apache-2.0,genetic-algorithm;evolutionary-computing;java
558,mmopp,Multi-objective A* algorithm for path planning optimization,Implementation of a Multi-objective A* algorithm designed for multimodal multi-objective path planning optimization problems.,R2;R2-01,path_planning;multi_objective_optimization,solver,C++,https://github.com/jinboszu/mmopp,,GPL-3.0,path-planning;multi-objective;a-star
559,BlackBoxOptimizationBenchmarking.jl,Julia interface for Black-Box Optimization Benchmarking (BBOB),"A Julia package providing interfaces and utilities for the Black-Box Optimization Benchmarking (BBOB) suite, enabling performance evaluation of optimization algorithms.",R2;R2-01,benchmarking;black_box_optimization,library,Julia,https://github.com/jonathanBieler/BlackBoxOptimizationBenchmarking.jl,,NOASSERTION,benchmarking;optimization;julia
560,GLOnet,Global optimization based on generative neural networks for nanophotonics,"A global optimization framework using generative neural networks, specifically applied to the design and optimization of nanophotonic devices.",R2;R2-01;Nanophotonics;Physics,global_optimization;generative_design;inverse_design,solver,Python,https://github.com/jonfanlab/GLOnet,,MIT,nanophotonics;optimization;generative-models
561,pyGPGO,Bayesian optimization for Python,"A simple and modular Python library for Bayesian Optimization, supporting various surrogate models (GP, t-Student process) and acquisition functions.",R2;R2-01,bayesian_optimization;hyperparameter_tuning,library,Python,https://github.com/josejimenezluna/pyGPGO,https://pygpgo.readthedocs.io/,MIT,bayesian-optimization;python;gaussian-processes
562,mso,Multi-Objective Molecular Optimization in Continuous Latent Space,"A tool for efficient multi-objective molecular optimization using continuous latent spaces, aiding in drug discovery and materials design.",R2;R2-01;Chemistry;Drug Discovery,molecular_optimization;multi_objective_optimization,solver,Python,https://github.com/jrwnter/mso,,MIT,molecular-optimization;drug-discovery;multi-objective
563,MultiObjectiveAlgorithms.jl,Julia package for solving multi-objective optimization problems,"A Julia package providing algorithms for multi-objective optimization, designed to work with the JuMP modeling ecosystem.",R2;R2-01,multi_objective_optimization;mathematical_programming,library,Julia,https://github.com/jump-dev/MultiObjectiveAlgorithms.jl,,NOASSERTION,julia;multi-objective;optimization
564,bayeso,Simple but essential Bayesian optimization package,"A Python package for Bayesian optimization focusing on simplicity and essential features, suitable for hyperparameter tuning and experimental design.",R2;R2-01,bayesian_optimization;experimental_design,library,Python,https://github.com/jungtaekkim/bayeso,https://bayeso.readthedocs.io/,MIT,bayesian-optimization;python;hyperparameter-tuning
565,Dragonfly (Legacy),Python library for large-scale climate and urban heat island modeling,"A legacy plugin and library from Ladybug Tools designed for modeling large-scale climate phenomena and urban heat islands, often used in environmental design and building physics simulations.",Environmental Science;Building Physics,climate_modeling;urban_heat_island_simulation,library,Python,https://github.com/ladybug-tools/dragonfly-legacy,https://www.ladybug.tools/dragonfly/,NOASSERTION,climate-modeling;urban-heat-island;simulation;ladybug-tools
566,BBOPlace-Bench,Benchmark suite for Black-Box Optimization in Chip Placement,A benchmarking tool designed to evaluate black-box optimization algorithms specifically for the task of chip placement in electronic design automation (EDA).,R2;EDA,benchmarking;black_box_optimization;chip_placement,dataset,Python,https://github.com/lamda-bbo/BBOPlace-Bench,,None,bbo;benchmark;eda;chip-placement
567,WireMask-BBO,Wire-Mask-Guided Black-Box Optimization for Macro Placement,"An optimization solver implementation for macro placement in chip design, utilizing a wire-mask-guided black-box optimization strategy.",R2;EDA,macro_placement;black_box_optimization,solver,Perl,https://github.com/lamda-bbo/WireMask-BBO,,MIT,bbo;macro-placement;optimization;eda
568,Alpine.jl,Global Optimization Solver for Non-convex Programs in Julia,"A global optimization solver built on Julia and JuMP, designed to solve non-convex mathematical programs with a focus on reliability and performance in scientific computing contexts.",R2;Optimization,global_optimization;non_convex_optimization,solver,Julia,https://github.com/lanl-ansi/Alpine.jl,https://github.com/lanl-ansi/Alpine.jl,NOASSERTION,julia;global-optimization;minlp;solver
569,ALF,Active Learning Framework for Interatomic Potentials,"A Python framework designed to perform active learning for training machine-learned interatomic potentials, facilitating efficient data acquisition in materials science simulations.",R2;Materials Science,active_learning;interatomic_potentials;molecular_dynamics,workflow,Python,https://github.com/lanl/ALF,,NOASSERTION,active-learning;materials-science;interatomic-potentials;machine-learning-potentials
570,pyHarmonySearch,Python implementation of Harmony Search global optimization,A pure Python library implementing the Harmony Search (HS) metaheuristic algorithm for global optimization problems.,R2;Optimization,global_optimization;metaheuristic_optimization,library,Python,https://github.com/lanl/pyHarmonySearch,https://github.com/lanl/pyHarmonySearch,BSD-3-Clause,harmony-search;global-optimization;python
571,pallas-solver,C++ library for global optimization algorithms,"A collection of global optimization algorithms implemented in C++, designed for high-performance solving of optimization problems.",R2;Optimization,global_optimization;optimization_solver,library,C++,https://github.com/latture/pallas-solver,,BSD-2-Clause,optimization;cpp;global-optimization;solver
572,Visual_Driven_Mesh_Repair,Visual Driven Global Optimization for Mesh Repair,A tool for repairing man-made 3D meshes using visual driven global optimization techniques to ensure minimal intrusion and geometric consistency.,Computer Graphics;Geometry Processing,mesh_repair;global_optimization;geometry_processing,solver,C++,https://github.com/lei65537/Visual_Driven_Mesh_Repair,,None,mesh-repair;optimization;geometry-processing
573,Gauche,Gaussian Process Library for Chemistry,"A library specifically designed for applying Gaussian Processes to chemical data, including molecular representations and kernels tailored for chemistry applications.",R2;Chemistry,gaussian_processes;molecular_modeling;uncertainty_quantification,library,Jupyter Notebook,https://github.com/leojklarner/gauche,https://gauche.readthedocs.io/,MIT,gaussian-processes;chemistry;molecular-machine-learning;uncertainty
574,NSGA-III,Implementation of NSGA-III for Multi-objective Optimization,A C implementation of the NSGA-III and related evolutionary algorithms for solving multi-objective and many-objective optimization problems with constraints.,R2;Optimization,multi_objective_optimization;evolutionary_algorithm,solver,C,https://github.com/lfarizav/NSGA-III,,None,nsga-iii;multi-objective-optimization;evolutionary-algorithms
575,PyPSeis,Passive seismic forward modelling and event detection package,"A Python and C++ package for passive seismic forward modelling, event detection, and source location, supporting microseismic acquisition design and synthetic seismogram generation.",Geophysics;Seismology,seismic_modeling;event_detection;forward_modeling,library,C++,https://github.com/lpk-py/PyPSeis,,MIT,seismology;forward-modeling;geophysics;microseismic
576,HyperMapper,Black-box Optimizer based on Bayesian Optimization,"A multi-objective black-box optimization tool based on Bayesian Optimization, capable of handling hybrid search spaces and unknown constraints.",R2;Optimization,bayesian_optimization;black_box_optimization;multi_objective_optimization,workflow,C++,https://github.com/luinardi/hypermapper,https://hypermapper.readthedocs.io/,MIT,bayesian-optimization;hyperparameter-tuning;black-box-optimization
577,BOA,Bayesian Optimization for Anything framework,"A high-level Bayesian optimization framework that wraps Ax and BoTorch, providing an easy-to-use interface for optimizing scientific models and experiments.",R2;Optimization,bayesian_optimization;experiment_design;model_wrapping,workflow,Python,https://github.com/madeline-scyphers/boa,https://boa-paper.readthedocs.io/,MIT,bayesian-optimization;ax;botorch;experimentation
578,pyGPs,Object-oriented Python library for Gaussian Processes,"A comprehensive Python library for Gaussian Process regression and classification, offering an object-oriented interface for kernel definition and inference.",R2;Machine Learning,gaussian_processes;regression;classification,library,Python,https://github.com/marionmari/pyGPs,http://www-ai.cs.uni-dortmund.de/weblab/static/api_docs/pyGPs/,NOASSERTION,gaussian-processes;machine-learning;regression
579,EvolvePro,Protein activity evolution model using few-shot active learning,"A model for in silico directed evolution of protein activities using few-shot active learning, enabling efficient protein engineering with minimal data.",R2;Biology,active_learning;protein_engineering;directed_evolution,solver,Python,https://github.com/mat10d/EvolvePro,,NOASSERTION,protein-engineering;active-learning;evolutionary-algorithm
580,hyper-engine,Bayesian hyper-parameter optimization library,"A Python library designed for Bayesian hyper-parameter optimization of machine learning models, facilitating automated model tuning.",R2;R2-01,bayesian_optimization;hyperparameter_tuning,library,Python,https://github.com/maxim5/hyper-engine,,Apache-2.0,bayesian-optimization;hyperparameter-tuning;automl
581,libgp,Gaussian process library for machine learning,"A C++ library for Gaussian process regression, providing the core mathematical foundation for Bayesian optimization and probabilistic modeling.",R2;R2-01,gaussian_processes;regression;modeling,library,C++,https://github.com/mblum/libgp,,BSD-3-Clause,gaussian-processes;machine-learning;cpp
582,BoTorch,Bayesian optimization in PyTorch,"A modular and modern library for Bayesian Optimization built on PyTorch, providing state-of-the-art acquisition functions and model fitting for experimental design.",R2;R2-01,bayesian_optimization;experimental_design,library,Python,https://github.com/meta-pytorch/botorch,https://botorch.org,MIT,bayesian-optimization;pytorch;active-learning
583,CoMOLA,Constrained Multi-objective Optimization of Land use Allocation,"A tool for optimizing land use allocation considering ecosystem services and biodiversity, using constrained multi-objective optimization techniques.",R2;Environmental Science,multi_objective_optimization;spatial_planning,solver,Python,https://github.com/michstrauch/CoMOLA,,GPL-3.0,land-use;optimization;ecology
584,humpday,Elo ratings for black box optimizers,A library and benchmarking system for evaluating and selecting global black-box derivative-free optimizers based on Elo ratings.,R2;R2-01,optimization_benchmarking;optimizer_selection,library,Python,https://github.com/microprediction/humpday,,MIT,benchmarking;optimization;black-box
585,AI4FluidSimulations,Surrogate models for fluid dynamics simulations,"Tools to train large-scale surrogate models for CO2 flow in porous media and 3D Navier-Stokes equations, accelerating fluid dynamics simulations.",R2;Physics,surrogate_modeling;fluid_dynamics;simulation,solver,C++,https://github.com/microsoft/AI4FluidSimulations,,MIT,fluid-dynamics;surrogate-model;pde
586,aerial_wildlife_detection,Active learning for aerial wildlife detection,A toolkit for detecting wildlife in aerial imagery using active learning to efficiently label data and train models.,R2;Ecology,active_learning;object_detection;ecology,workflow,Python,https://github.com/microsoft/aerial_wildlife_detection,,MIT,active-learning;wildlife;aerial-imagery
587,grAdapt,Sequential model-based optimization toolbox,A modular toolbox for sequential model-based optimization (SMBO) designed to optimize black-box functions efficiently.,R2;R2-01,bayesian_optimization;smbo,library,Python,https://github.com/mkduong-ai/grAdapt,,Apache-2.0,optimization;smbo;black-box
588,ParamHelpers,Parameter helpers for optimization and ML,"A utility library for defining and managing parameters in black-box optimization, tuning, and machine learning tasks within the R ecosystem.",R2;R2-01,parameter_management;optimization_utility,library,R,https://github.com/mlr-org/ParamHelpers,,NOASSERTION,r;optimization;parameters
589,bbotk,Black-box optimization framework for R,"A comprehensive framework for black-box optimization in R, providing common data structures and interfaces for optimization algorithms.",R2;R2-01,black_box_optimization;framework,platform,R,https://github.com/mlr-org/bbotk,,LGPL-3.0,r;optimization;black-box
590,mlrMBO,Model-Based Optimization toolbox for R,A flexible and comprehensive R toolbox for Bayesian Optimization and Model-Based Optimization (MBO) of expensive black-box functions.,R2;R2-01,bayesian_optimization;model_based_optimization,library,R,https://github.com/mlr-org/mlrMBO,https://mb706.github.io/mlrMBO/,NOASSERTION,r;bayesian-optimization;mbo
591,modAL,Modular active learning framework for Python,"A modular active learning framework for Python, compatible with scikit-learn, designed to streamline the development of active learning pipelines.",R2;R2-01,active_learning;query_strategies,library,Python,https://github.com/modAL-python/modAL,https://modal-python.readthedocs.io/,MIT,active-learning;python;scikit-learn
592,moead-framework,MOEA/D algorithm framework,"A general-purpose framework for the Multi-Objective Evolutionary Algorithm based on Decomposition (MOEA/D), facilitating multi-objective optimization.",R2;R2-01,multi_objective_optimization;evolutionary_algorithm,library,Python,https://github.com/moead-framework/framework,,GPL-3.0,moea-d;multi-objective;optimization
593,BayesBoost,Bayesian Optimization using XGBoost,"A library implementing Bayesian Optimization using XGBoost as the surrogate model, compatible with the scikit-learn API.",R2;R2-01,bayesian_optimization;xgboost,library,Python,https://github.com/mpearmain/BayesBoost,,Apache-2.0,bayesian-optimization;xgboost;sklearn
594,Optimo,Multi-objective Optimization for Dynamo,"A multi-objective optimization tool designed for Dynamo, enabling parametric optimization in architectural and engineering design workflows.",R2;Engineering,multi_objective_optimization;parametric_design,solver,C#,https://github.com/mrahmaniasl/Optimo,,LGPL-3.0,dynamo;optimization;genetic-algorithm
595,pymop,Multi-Objective Optimization Test Problems,"A library providing a collection of standard single- and multi-objective optimization test problems (ZDT, DTLZ, etc.) for benchmarking algorithms.",R2;R2-01,optimization_benchmarking;test_problems,dataset,Python,https://github.com/msu-coinlab/pymop,,Apache-2.0,benchmarking;multi-objective;optimization
596,moocore,Core Mathematical Functions for Multi-Objective Optimization,A C library providing core mathematical functions and utilities specifically for multi-objective optimization algorithms.,R2;R2-01,multi_objective_optimization;math_utility,library,C,https://github.com/multi-objective/moocore,,LGPL-2.1,c;optimization;multi-objective
597,pybo,Modular Bayesian optimization package,"A Python package for modular Bayesian optimization, allowing flexible configuration of acquisition functions and surrogate models.",R2;R2-01,bayesian_optimization;modular_optimization,library,Python,https://github.com/mwhoffman/pybo,,BSD-2-Clause,bayesian-optimization;python;modular
598,UQPCE,Uncertainty Quantification using Polynomial Chaos Expansion,A NASA-developed Python code for uncertainty quantification using non-intrusive polynomial chaos expansion surrogate modeling.,R2;Physics,uncertainty_quantification;surrogate_modeling,solver,Python,https://github.com/nasa/UQPCE,,NOASSERTION,uncertainty-quantification;nasa;polynomial-chaos
599,landscapes,Standardized optimization test functions,A dependency-free Python library containing a collection of standardized optimization test functions for evaluating optimization algorithms.,R2;R2-01,optimization_benchmarking;test_functions,library,Python,https://github.com/nathanrooy/landscapes,,MIT,optimization;benchmarking;test-functions
600,NEXT,Cloud-based active learning system,"A machine learning system that runs in the cloud to facilitate the development, evaluation, and deployment of active learning experiments.",R2;R2-01,active_learning;experiment_management,platform,Python,https://github.com/nextml/NEXT,http://nextml.org,Apache-2.0,active-learning;cloud;experimentation
601,Bandit-BO,Bayesian Optimization library for mixed categorical and continuous inputs,"A Python implementation of Bayesian Optimization specifically designed to handle mixed search spaces containing both categorical and continuous variables, suitable for hyperparameter tuning and experimental design.",R2;R2-01,optimization;hyperparameter_tuning,library,Python,https://github.com/nphdang/Bandit-BO,,None,bayesian-optimization;bandit;categorical-optimization
602,libact,Pool-based active learning library for Python,A Python library designed to make active learning easier for real-world users. It provides a pool-based active learning framework with various query strategies to improve data efficiency in machine learning tasks.,R2;R2-01,active_learning;data_selection,library,Python,https://github.com/ntucllab/libact,https://libact.readthedocs.io,BSD-2-Clause,active-learning;machine-learning;python
603,COCO,Platform for comparing continuous optimizers in a black-box setting,"The COCO (COmparing Continuous Optimizers) framework provides a platform for benchmarking and comparing numerical black-box optimization algorithms. It includes test suites, post-processing facilities, and data formats for rigorous performance evaluation.",R2;R2-01,benchmarking;optimization,platform,C,https://github.com/numbbo/coco,https://coco.gforge.inria.fr/,NOASSERTION,benchmarking;black-box-optimization;numerical-optimization
604,VLMEvalKit,Open-source evaluation toolkit for large multi-modality models,"A comprehensive toolkit for evaluating Large Multi-modality Models (LMMs). It supports over 220 models and 80 benchmarks, facilitating the assessment of model performance across various multimodal tasks.",R1;R1-03,model_evaluation;benchmarking,library,Python,https://github.com/open-compass/VLMEvalKit,,Apache-2.0,evaluation;multimodal;llm;benchmark
605,OptFrame,C++ Optimization Framework for metaheuristics and hyperheuristics,"A C++ framework for single and multi-objective optimization problems. It implements classic metaheuristics (GA, SA, Tabu Search, NSGA-II) and supports hyperheuristics, providing a flexible structure for solving combinatorial optimization problems.",R2;R2-01,optimization;metaheuristics,library,C++,https://github.com/optframe/optframe,https://optframe.github.io/,MIT,metaheuristics;optimization;cpp;evolutionary-algorithms
606,kurobako,A black-box optimization benchmark tool,"A command-line tool and library for benchmarking black-box optimization algorithms. It allows users to define problems and solvers and measure their performance, facilitating the development and comparison of optimization strategies.",R2;R2-01,benchmarking;optimization,solver,Rust,https://github.com/optuna/kurobako,,MIT,benchmarking;black-box-optimization;rust
607,yabox,Lightweight black-box optimization library for Python,"A Python library for black-box optimization, focusing on simplicity and ease of use. It implements algorithms like Differential Evolution and is designed to optimize expensive or noisy functions without gradient information.",R2;R2-01,optimization;black_box_optimization,library,Jupyter Notebook,https://github.com/pablormier/yabox,,Apache-2.0,optimization;differential-evolution;python
608,blackbox,Python module for parallel optimization of expensive black-box functions,A lightweight Python module designed for optimizing expensive black-box functions. It supports parallel execution and provides a simple interface for users to minimize functions where evaluations are costly.,R2;R2-01,optimization;parallel_computing,library,Python,https://github.com/paulknysh/blackbox,,MIT,optimization;black-box;parallel
609,ncpol2sdpa,Sparse semidefinite programming relaxations for polynomial optimization,A library to solve global polynomial optimization problems (commutative or noncommutative) by converting them into semidefinite programming (SDP) relaxations. It helps in analyzing quantum correlations and other physics problems.,R2;R2-01,optimization;polynomial_optimization,library,Python,https://github.com/peterwittek/ncpol2sdpa,https://ncpol2sdpa.readthedocs.io/,GPL-3.0,optimization;sdp;polynomials;quantum-physics
610,MOBOpt,Multi-objective Bayesian optimization library,A Python library for performing Multi-Objective Bayesian Optimization. It enables the optimization of multiple conflicting objectives simultaneously using Gaussian Processes and various acquisition functions.,R2;R2-01,optimization;multi_objective_optimization,library,Python,https://github.com/ppgaluzio/MOBOpt,,MIT,bayesian-optimization;multi-objective;python
611,BOPP,Bayesian Optimization for Probabilistic Programs,"A Clojure library for Bayesian Optimization applied to probabilistic programs. It allows for the optimization of parameters within probabilistic models, integrating with the probabilistic programming ecosystem.",R2;R2-01,optimization;probabilistic_programming,library,Clojure,https://github.com/probprog/bopp,,NOASSERTION,bayesian-optimization;clojure;probabilistic-programming
612,adaptive,Parallel active learning of mathematical functions,"A Python library for adaptive sampling of mathematical functions. It uses active learning techniques to recommend the next points to evaluate, optimizing the sampling process for plotting, integration, or other analysis of expensive functions.",R2;R2-01,active_learning;sampling,library,Python,https://github.com/python-adaptive/adaptive,https://adaptive.readthedocs.io/,BSD-3-Clause,active-learning;sampling;scientific-computing
613,btrack,Bayesian multi-object tracking library,"A Python library for Bayesian multi-object tracking, widely used in cell biology and microscopy to track cells over time. It uses Kalman filters and optimization to link detections into trajectories.",R2;R2-01,tracking;image_analysis,library,Python,https://github.com/quantumjot/btrack,https://btrack.readthedocs.io/,MIT,tracking;bayesian;microscopy;bioimage-analysis
614,rsopt,Framework for executing large black-box optimization problems,"A Python framework developed by RadiaSoft for configuring and executing large-scale black-box optimization problems, particularly for scientific simulations (e.g., particle accelerators). It interfaces with various simulation codes and optimization libraries.",R2;R2-01,optimization;workflow_management,workflow,Python,https://github.com/radiasoft/rsopt,https://rsopt.readthedocs.io/,Apache-2.0,optimization;simulation;hpc
615,egobox,Efficient global optimization toolbox in Rust,"A Rust-based toolbox for efficient global optimization (EGO). It implements Bayesian optimization using Gaussian Processes and Mixture of Gaussian Processes, providing high-performance optimization for expensive black-box functions.",R2;R2-01,optimization;surrogate_modeling,library,Rust,https://github.com/relf/egobox,https://docs.rs/egobox/,Apache-2.0,optimization;rust;bayesian-optimization;gaussian-processes
616,bocoel,Bayesian Optimization as a Coverage Tool for Evaluating LLMs,"A library that leverages Bayesian Optimization to efficiently evaluate Large Language Models (LLMs) by optimizing the coverage of the evaluation space, offering a modular and faster benchmarking approach.",R2;R2-01,model_evaluation;bayesian_optimization,library,Python,https://github.com/rentruewang/bocoel,,BSD-3-Clause,bayesian-optimization;llm-evaluation;benchmarking
617,limbo,Lightweight framework for Gaussian processes and Bayesian optimization,"A C++11 library designed for Gaussian processes and Bayesian optimization of black-box functions, emphasizing lightweight implementation and flexibility for robotics and optimization tasks.",R2;R2-01,bayesian_optimization;gaussian_processes,library,C++,https://github.com/resibots/limbo,,NOASSERTION,bayesian-optimization;gaussian-processes;black-box-optimization
